gastLabel,episodeLabel,date,anzahl
Robin Alexander,Markus Lanz 16.03.2017,2017-03-16T00:00:00Z,54
Robin Alexander,Markus Lanz 21.03.2017,2017-03-21T00:00:00Z,54
Robin Alexander,Markus Lanz 03.05.2017,2017-05-03T00:00:00Z,54
Robin Alexander,Markus Lanz 05.07.2017,2017-07-05T00:00:00Z,54
Robin Alexander,Markus Lanz 07.09.2017,2017-09-07T00:00:00Z,54
Robin Alexander,Markus Lanz 03.10.2017,2017-10-03T00:00:00Z,54
Robin Alexander,Markus Lanz 01.11.2017,2017-11-01T00:00:00Z,54
Robin Alexander,Markus Lanz 23.11.2017,2017-11-23T00:00:00Z,54
Robin Alexander,Markus Lanz 18.01.2018,2018-01-18T00:00:00Z,54
Robin Alexander,Markus Lanz 27.02.2018,2018-02-27T00:00:00Z,54
Robin Alexander,Markus Lanz 02.05.2018,2018-05-02T00:00:00Z,54
Robin Alexander,Markus Lanz 19.06.2018,2018-06-19T00:00:00Z,54
Robin Alexander,Markus Lanz 21.08.2018,2018-08-21T00:00:00Z,54
Robin Alexander,Markus Lanz 19.09.2018,2018-09-19T00:00:00Z,54
Robin Alexander,Markus Lanz 06.12.2018,2018-12-06T00:00:00Z,54
Robin Alexander,Markus Lanz 17.01.2019,2019-01-17T00:00:00Z,54
Robin Alexander,Markus Lanz 03.04.2019,2019-04-03T00:00:00Z,54
Robin Alexander,Markus Lanz 12.06.2019,2019-06-12T00:00:00Z,54
Robin Alexander,Markus Lanz 06.08.2019,2019-08-06T00:00:00Z,54
Robin Alexander,Markus Lanz 04.09.2019,2019-09-04T00:00:00Z,54
Robin Alexander,Markus Lanz 23.10.2019,2019-10-23T00:00:00Z,54
Robin Alexander,Markus Lanz 21.11.2019,2019-11-21T00:00:00Z,54
Robin Alexander,Markus Lanz 16.04.2020,2020-04-16T00:00:00Z,54
Robin Alexander,Markus Lanz 07.05.2020,2020-05-07T00:00:00Z,54
Robin Alexander,Markus Lanz 24.06.2020,2020-06-24T00:00:00Z,54
Robin Alexander,Markus Lanz 16.09.2020,2020-09-16T00:00:00Z,54
Robin Alexander,Markus Lanz 29.10.2020,2020-10-29T00:00:00Z,54
Robin Alexander,Markus Lanz 03.03.2021,2021-03-03T00:00:00Z,54
Robin Alexander,Markus Lanz 26.05.2021,2021-05-26T00:00:00Z,54
Robin Alexander,Markus Lanz 22.06.2021,2021-06-22T00:00:00Z,54
Robin Alexander,Markus Lanz 25.08.2021,2021-08-25T00:00:00Z,54
Robin Alexander,Markus Lanz 23.09.2021,2021-09-23T00:00:00Z,54
Robin Alexander,Markus Lanz 28.09.2021,2021-09-28T00:00:00Z,54
Robin Alexander,Markus Lanz 25.11.2021,2021-11-25T00:00:00Z,54
Robin Alexander,Markus Lanz 22.02.2022,2022-02-22T00:00:00Z,54
Robin Alexander,Markus Lanz 08.03.2022,2022-03-08T00:00:00Z,54
Robin Alexander,Markus Lanz 22.03.2022,2022-03-22T00:00:00Z,54
Robin Alexander,Markus Lanz 05.04.2022,2022-04-05T00:00:00Z,54
Robin Alexander,Markus Lanz 03.05.2022,2022-05-03T00:00:00Z,54
Robin Alexander,Markus Lanz 21.06.2022,2022-06-21T00:00:00Z,54
Robin Alexander,Markus Lanz 17.08.2022,2022-08-17T00:00:00Z,54
Robin Alexander,Markus Lanz 13.09.2022,2022-09-13T00:00:00Z,54
Robin Alexander,Markus Lanz 29.09.2022,2022-09-29T00:00:00Z,54
Robin Alexander,Markus Lanz 08.12.2022,2022-12-08T00:00:00Z,54
Robin Alexander,Markus Lanz 18.01.2023,2023-01-18T00:00:00Z,54
Robin Alexander,Markus Lanz 07.06.2023,2023-06-07T00:00:00Z,54
Robin Alexander,Markus Lanz 12.07.2023,2023-07-12T00:00:00Z,54
Robin Alexander,Markus Lanz 06.09.2023,2023-09-06T00:00:00Z,54
Robin Alexander,Markus Lanz 12.10.2023,2023-10-12T00:00:00Z,54
Robin Alexander,Markus Lanz 22.11.2023,2023-11-22T00:00:00Z,54
Robin Alexander,Markus Lanz 17.01.2024,2024-01-17T00:00:00Z,54
Robin Alexander,Markus Lanz 02.07.2024,2024-07-02T00:00:00Z,54
Robin Alexander,Markus Lanz 03.10.2024,2024-10-03T00:00:00Z,54
Robin Alexander,Markus Lanz 28.11.2024,2024-11-28T00:00:00Z,54
Karl Lauterbach,Markus Lanz 21.10.2009,2009-10-21T00:00:00Z,38
Karl Lauterbach,Markus Lanz 25.07.2013,2013-07-25T00:00:00Z,38
Karl Lauterbach,Markus Lanz 08.10.2013,2013-10-08T00:00:00Z,38
Karl Lauterbach,Markus Lanz 27.08.2015,2015-08-27T00:00:00Z,38
Karl Lauterbach,Markus Lanz 27.06.2017,2017-06-27T00:00:00Z,38
Karl Lauterbach,Markus Lanz 18.01.2018,2018-01-18T00:00:00Z,38
Karl Lauterbach,Markus Lanz 06.03.2018,2018-03-06T00:00:00Z,38
Karl Lauterbach,Markus Lanz 23.10.2018,2018-10-23T00:00:00Z,38
Karl Lauterbach,Markus Lanz 21.02.2019,2019-02-21T00:00:00Z,38
Karl Lauterbach,Markus Lanz 02.10.2019,2019-10-02T00:00:00Z,38
Karl Lauterbach,Markus Lanz 05.03.2020,2020-03-05T00:00:00Z,38
Karl Lauterbach,Markus Lanz 24.03.2020,2020-03-24T00:00:00Z,38
Karl Lauterbach,Markus Lanz 01.04.2020,2020-04-01T00:00:00Z,38
Karl Lauterbach,Markus Lanz 08.04.2020,2020-04-08T00:00:00Z,38
Karl Lauterbach,Markus Lanz 15.04.2020,2020-04-15T00:00:00Z,38
Karl Lauterbach,Markus Lanz 23.04.2020,2020-04-23T00:00:00Z,38
Karl Lauterbach,Markus Lanz 29.04.2020,2020-04-29T00:00:00Z,38
Karl Lauterbach,Markus Lanz 05.05.2020,2020-05-05T00:00:00Z,38
Karl Lauterbach,Markus Lanz 04.06.2020,2020-06-04T00:00:00Z,38
Karl Lauterbach,Markus Lanz 09.06.2020,2020-06-09T00:00:00Z,38
Karl Lauterbach,Markus Lanz 01.07.2020,2020-07-01T00:00:00Z,38
Karl Lauterbach,Markus Lanz 13.08.2020,2020-08-13T00:00:00Z,38
Karl Lauterbach,Markus Lanz 24.09.2020,2020-09-24T00:00:00Z,38
Karl Lauterbach,Markus Lanz - Das Jahr 2021,2021-12-15T00:00:00Z,38
Karl Lauterbach,Markus Lanz 19.01.2022,2022-01-19T00:00:00Z,38
Karl Lauterbach,Markus Lanz 05.04.2022,2022-04-05T00:00:00Z,38
Karl Lauterbach,Markus Lanz 25.05.2022,2022-05-25T00:00:00Z,38
Karl Lauterbach,Markus Lanz 01.09.2022,2022-09-01T00:00:00Z,38
Karl Lauterbach,Markus Lanz 01.11.2022,2022-11-01T00:00:00Z,38
Karl Lauterbach,Markus Lanz - Das Jahr 2022,2022-12-15T00:00:00Z,38
Karl Lauterbach,Markus Lanz 09.02.2023,2023-02-09T00:00:00Z,38
Karl Lauterbach,Markus Lanz 27.04.2023,2023-04-27T00:00:00Z,38
Karl Lauterbach,Markus Lanz 22.06.2023,2023-06-22T00:00:00Z,38
Karl Lauterbach,Markus Lanz 02.11.2023,2023-11-02T00:00:00Z,38
Karl Lauterbach,Markus Lanz 08.02.2024,2024-02-08T00:00:00Z,38
Karl Lauterbach,Markus Lanz 15.05.2024,2024-05-15T00:00:00Z,38
Karl Lauterbach,Markus Lanz 08.10.2024,2024-10-08T00:00:00Z,38
Karl Lauterbach,Markus Lanz 20.11.2024,2024-11-20T00:00:00Z,38
Eva Quadbeck,Markus Lanz 20.11.2018,2018-11-20T00:00:00Z,33
Eva Quadbeck,Markus Lanz 15.01.2019,2019-01-15T00:00:00Z,33
Eva Quadbeck,Markus Lanz 08.08.2019,2019-08-08T00:00:00Z,33
Eva Quadbeck,Markus Lanz 05.11.2019,2019-11-05T00:00:00Z,33
Eva Quadbeck,Markus Lanz 22.01.2020,2020-01-22T00:00:00Z,33
Eva Quadbeck,Markus Lanz 11.02.2020,2020-02-11T00:00:00Z,33
Eva Quadbeck,Markus Lanz 18.02.2020,2020-02-18T00:00:00Z,33
Eva Quadbeck,Markus Lanz 26.08.2020,2020-08-26T00:00:00Z,33
Eva Quadbeck,Markus Lanz 08.12.2020,2020-12-08T00:00:00Z,33
Eva Quadbeck,Markus Lanz 13.01.2021,2021-01-13T00:00:00Z,33
Eva Quadbeck,Markus Lanz 10.02.2021,2021-02-10T00:00:00Z,33
Eva Quadbeck,Markus Lanz 25.03.2021,2021-03-25T00:00:00Z,33
Eva Quadbeck,Markus Lanz 31.08.2021,2021-08-31T00:00:00Z,33
Eva Quadbeck,Markus Lanz 24.11.2021,2021-11-24T00:00:00Z,33
Eva Quadbeck,Markus Lanz 06.01.2022,2022-01-06T00:00:00Z,33
Eva Quadbeck,Markus Lanz 24.02.2022,2022-02-24T00:00:00Z,33
Eva Quadbeck,Markus Lanz 09.06.2022,2022-06-09T00:00:00Z,33
Eva Quadbeck,Markus Lanz 25.08.2022,2022-08-25T00:00:00Z,33
Eva Quadbeck,Markus Lanz 29.11.2022,2022-11-29T00:00:00Z,33
Eva Quadbeck,Markus Lanz 10.01.2023,2023-01-10T00:00:00Z,33
Eva Quadbeck,Markus Lanz 04.05.2023,2023-05-04T00:00:00Z,33
Eva Quadbeck,Markus Lanz 14.06.2023,2023-06-14T00:00:00Z,33
Eva Quadbeck,Markus Lanz 31.08.2023,2023-08-31T00:00:00Z,33
Eva Quadbeck,Markus Lanz 10.10.2023,2023-10-10T00:00:00Z,33
Eva Quadbeck,Markus Lanz 30.11.2023,2023-11-30T00:00:00Z,33
Eva Quadbeck,Markus Lanz 25.01.2024,2024-01-25T00:00:00Z,33
Eva Quadbeck,Markus Lanz 07.03.2024,2024-03-07T00:00:00Z,33
Eva Quadbeck,Markus Lanz 18.04.2024,2024-04-18T00:00:00Z,33
Eva Quadbeck,Markus Lanz 08.05.2024,2024-05-08T00:00:00Z,33
Eva Quadbeck,Markus Lanz 11.06.2024,2024-06-11T00:00:00Z,33
Eva Quadbeck,Markus Lanz 10.07.2024,2024-07-10T00:00:00Z,33
Eva Quadbeck,Markus Lanz 15.10.2024,2024-10-15T00:00:00Z,33
Eva Quadbeck,Markus Lanz 17.12.2024,2024-12-17T00:00:00Z,33
Kristina Dunz,Markus Lanz 15.03.2018,2018-03-15T00:00:00Z,32
Kristina Dunz,Markus Lanz 26.04.2018,2018-04-26T00:00:00Z,32
Kristina Dunz,Markus Lanz 03.07.2018,2018-07-03T00:00:00Z,32
Kristina Dunz,Markus Lanz 18.09.2018,2018-09-18T00:00:00Z,32
Kristina Dunz,Markus Lanz 31.10.2018,2018-10-31T00:00:00Z,32
Kristina Dunz,Markus Lanz 19.03.2019,2019-03-19T00:00:00Z,32
Kristina Dunz,Markus Lanz 30.05.2019,2019-05-30T00:00:00Z,32
Kristina Dunz,Markus Lanz 20.08.2019,2019-08-20T00:00:00Z,32
Kristina Dunz,Markus Lanz 29.10.2019,2019-10-29T00:00:00Z,32
Kristina Dunz,Markus Lanz 26.02.2020,2020-02-26T00:00:00Z,32
Kristina Dunz,Markus Lanz 19.05.2020,2020-05-19T00:00:00Z,32
Kristina Dunz,Markus Lanz 08.09.2020,2020-09-08T00:00:00Z,32
Kristina Dunz,Markus Lanz 26.11.2020,2020-11-26T00:00:00Z,32
Kristina Dunz,Markus Lanz 04.03.2021,2021-03-04T00:00:00Z,32
Kristina Dunz,Markus Lanz 20.04.2021,2021-04-20T00:00:00Z,32
Kristina Dunz,Markus Lanz 03.08.2021,2021-08-03T00:00:00Z,32
Kristina Dunz,Markus Lanz 02.09.2021,2021-09-02T00:00:00Z,32
Kristina Dunz,Markus Lanz 19.10.2021,2021-10-19T00:00:00Z,32
Kristina Dunz,Markus Lanz 20.01.2022,2022-01-20T00:00:00Z,32
Kristina Dunz,Markus Lanz 03.02.2022,2022-02-03T00:00:00Z,32
Kristina Dunz,Markus Lanz 26.04.2022,2022-04-26T00:00:00Z,32
Kristina Dunz,Markus Lanz 18.05.2022,2022-05-18T00:00:00Z,32
Kristina Dunz,Markus Lanz 06.04.2023,2023-04-06T00:00:00Z,32
Kristina Dunz,Markus Lanz 02.05.2023,2023-05-02T00:00:00Z,32
Kristina Dunz,Markus Lanz 31.05.2023,2023-05-31T00:00:00Z,32
Kristina Dunz,Markus Lanz 24.08.2023,2023-08-24T00:00:00Z,32
Kristina Dunz,Markus Lanz 24.10.2023,2023-10-24T00:00:00Z,32
Kristina Dunz,Markus Lanz 01.02.2024,2024-02-01T00:00:00Z,32
Kristina Dunz,Markus Lanz 14.05.2024,2024-05-14T00:00:00Z,32
Kristina Dunz,Markus Lanz 27.06.2024,2024-06-27T00:00:00Z,32
Kristina Dunz,Markus Lanz 28.08.2024,2024-08-28T00:00:00Z,32
Kristina Dunz,Markus Lanz 29.10.2024,2024-10-29T00:00:00Z,32
Michael Spreng,Markus Lanz 22.07.2009,2009-07-22T00:00:00Z,31
Michael Spreng,Markus Lanz 19.08.2009,2009-08-19T00:00:00Z,31
Michael Spreng,Markus Lanz 23.02.2011,2011-02-23T00:00:00Z,31
Michael Spreng,Markus Lanz 10.01.2012,2012-01-10T00:00:00Z,31
Michael Spreng,Markus Lanz 09.02.2012,2012-02-09T00:00:00Z,31
Michael Spreng,Markus Lanz 25.04.2012,2012-04-25T00:00:00Z,31
Michael Spreng,Markus Lanz 22.05.2012,2012-05-22T00:00:00Z,31
Michael Spreng,Markus Lanz 17.01.2013,2013-01-17T00:00:00Z,31
Michael Spreng,Markus Lanz 26.06.2013,2013-06-26T00:00:00Z,31
Michael Spreng,Markus Lanz 12.09.2013,2013-09-12T00:00:00Z,31
Michael Spreng,Markus Lanz 28.11.2013,2013-11-28T00:00:00Z,31
Michael Spreng,Markus Lanz 18.02.2014,2014-02-18T00:00:00Z,31
Michael Spreng,Markus Lanz 27.05.2014,2014-05-27T00:00:00Z,31
Michael Spreng,Markus Lanz 17.02.2015,2015-02-17T00:00:00Z,31
Michael Spreng,Markus Lanz 13.05.2015,2015-05-13T00:00:00Z,31
Michael Spreng,Markus Lanz 23.06.2015,2015-06-23T00:00:00Z,31
Michael Spreng,Markus Lanz 02.02.2016,2016-02-02T00:00:00Z,31
Michael Spreng,Markus Lanz 09.06.2016,2016-06-09T00:00:00Z,31
Michael Spreng,Markus Lanz 30.08.2016,2016-08-30T00:00:00Z,31
Michael Spreng,Markus Lanz 14.02.2017,2017-02-14T00:00:00Z,31
Michael Spreng,Markus Lanz 25.05.2017,2017-05-25T00:00:00Z,31
Michael Spreng,Markus Lanz 27.06.2017,2017-06-27T00:00:00Z,31
Michael Spreng,Markus Lanz 05.09.2017,2017-09-05T00:00:00Z,31
Michael Spreng,Markus Lanz 19.10.2017,2017-10-19T00:00:00Z,31
Michael Spreng,Markus Lanz 07.11.2017,2017-11-07T00:00:00Z,31
Michael Spreng,Markus Lanz 14.12.2017,2017-12-14T00:00:00Z,31
Michael Spreng,Markus Lanz 13.02.2018,2018-02-13T00:00:00Z,31
Michael Spreng,Markus Lanz 12.07.2018,2018-07-12T00:00:00Z,31
Michael Spreng,Markus Lanz 27.09.2018,2018-09-27T00:00:00Z,31
Michael Spreng,Markus Lanz 16.10.2018,2018-10-16T00:00:00Z,31
Michael Spreng,Markus Lanz 13.12.2018,2018-12-13T00:00:00Z,31
Kevin Kühnert,Markus Lanz 23.01.2018,2018-01-23T00:00:00Z,29
Kevin Kühnert,Markus Lanz 14.02.2018,2018-02-14T00:00:00Z,29
Kevin Kühnert,Markus Lanz 06.03.2018,2018-03-06T00:00:00Z,29
Kevin Kühnert,Markus Lanz 31.10.2018,2018-10-31T00:00:00Z,29
Kevin Kühnert,Markus Lanz 09.04.2019,2019-04-09T00:00:00Z,29
Kevin Kühnert,Markus Lanz 17.09.2019,2019-09-17T00:00:00Z,29
Kevin Kühnert,Markus Lanz 17.03.2020,2020-03-17T00:00:00Z,29
Kevin Kühnert,Markus Lanz 16.06.2020,2020-06-16T00:00:00Z,29
Kevin Kühnert,Markus Lanz 03.12.2020,2020-12-03T00:00:00Z,29
Kevin Kühnert,Markus Lanz 19.05.2021,2021-05-19T00:00:00Z,29
Kevin Kühnert,Markus Lanz 21.09.2021,2021-09-21T00:00:00Z,29
Kevin Kühnert,Markus Lanz 14.10.2021,2021-10-14T00:00:00Z,29
Kevin Kühnert,Markus Lanz 14.12.2021,2021-12-14T00:00:00Z,29
Kevin Kühnert,Markus Lanz 22.02.2022,2022-02-22T00:00:00Z,29
Kevin Kühnert,Markus Lanz 03.05.2022,2022-05-03T00:00:00Z,29
Kevin Kühnert,Markus Lanz 16.08.2022,2022-08-16T00:00:00Z,29
Kevin Kühnert,Markus Lanz 04.10.2022,2022-10-04T00:00:00Z,29
Kevin Kühnert,Markus Lanz 25.10.2022,2022-10-25T00:00:00Z,29
Kevin Kühnert,Markus Lanz 12.01.2023,2023-01-12T00:00:00Z,29
Kevin Kühnert,Markus Lanz 21.02.2023,2023-02-21T00:00:00Z,29
Kevin Kühnert,Markus Lanz 29.03.2023,2023-03-29T00:00:00Z,29
Kevin Kühnert,Markus Lanz 15.06.2023,2023-06-15T00:00:00Z,29
Kevin Kühnert,Markus Lanz 06.09.2023,2023-09-06T00:00:00Z,29
Kevin Kühnert,Markus Lanz 10.10.2023,2023-10-10T00:00:00Z,29
Kevin Kühnert,Markus Lanz 07.02.2024,2024-02-07T00:00:00Z,29
Kevin Kühnert,Markus Lanz 29.05.2024,2024-05-29T00:00:00Z,29
Kevin Kühnert,Markus Lanz 02.07.2024,2024-07-02T00:00:00Z,29
Kevin Kühnert,Markus Lanz 28.08.2024,2024-08-28T00:00:00Z,29
Kevin Kühnert,Markus Lanz 03.10.2024,2024-10-03T00:00:00Z,29
Hajo Schumacher,Markus Lanz 16.03.2010,2010-03-16T00:00:00Z,28
Hajo Schumacher,Markus Lanz 22.09.2011,2011-09-22T00:00:00Z,28
Hajo Schumacher,Markus Lanz 06.12.2011,2011-12-06T00:00:00Z,28
Hajo Schumacher,Markus Lanz 31.01.2012,2012-01-31T00:00:00Z,28
Hajo Schumacher,Markus Lanz 21.02.2012,2012-02-21T00:00:00Z,28
Wolfgang Kubicki,Markus Lanz 01.03.2012,2012-03-01T00:00:00Z,28
Wolfgang Kubicki,Markus Lanz 08.05.2012,2012-05-08T00:00:00Z,28
Hajo Schumacher,Markus Lanz 17.05.2012,2012-05-17T00:00:00Z,28
Wolfgang Kubicki,Markus Lanz 05.09.2012,2012-09-05T00:00:00Z,28
Hajo Schumacher,Markus Lanz 16.01.2013,2013-01-16T00:00:00Z,28
Wolfgang Kubicki,Markus Lanz 22.01.2013,2013-01-22T00:00:00Z,28
Wolfgang Kubicki,Markus Lanz 14.03.2013,2013-03-14T00:00:00Z,28
Wolfgang Kubicki,Markus Lanz 23.04.2013,2013-04-23T00:00:00Z,28
Wolfgang Kubicki,Markus Lanz 25.06.2013,2013-06-25T00:00:00Z,28
Wolfgang Kubicki,Markus Lanz 24.09.2013,2013-09-24T00:00:00Z,28
Hajo Schumacher,Markus Lanz 01.10.2013,2013-10-01T00:00:00Z,28
Hajo Schumacher,Markus Lanz 11.12.2013,2013-12-11T00:00:00Z,28
Wolfgang Kubicki,Markus Lanz 12.03.2014,2014-03-12T00:00:00Z,28
Wolfgang Kubicki,Markus Lanz 16.09.2014,2014-09-16T00:00:00Z,28
Hajo Schumacher,Markus Lanz 01.10.2014,2014-10-01T00:00:00Z,28
Hajo Schumacher,Markus Lanz 03.06.2015,2015-06-03T00:00:00Z,28
Wolfgang Kubicki,Markus Lanz 18.08.2015,2015-08-18T00:00:00Z,28
Hajo Schumacher,Markus Lanz 08.10.2015,2015-10-08T00:00:00Z,28
Wolfgang Kubicki,Markus Lanz 13.01.2016,2016-01-13T00:00:00Z,28
Hajo Schumacher,Markus Lanz 21.01.2016,2016-01-21T00:00:00Z,28
Hajo Schumacher,Markus Lanz 10.03.2016,2016-03-10T00:00:00Z,28
Wolfgang Kubicki,Markus Lanz 05.04.2016,2016-04-05T00:00:00Z,28
Wolfgang Kubicki,Markus Lanz 22.09.2016,2016-09-22T00:00:00Z,28
Hajo Schumacher,Markus Lanz 15.12.2016,2016-12-15T00:00:00Z,28
Hajo Schumacher,Markus Lanz 26.04.2017,2017-04-26T00:00:00Z,28
Hajo Schumacher,Markus Lanz 08.06.2017,2017-06-08T00:00:00Z,28
Wolfgang Kubicki,Markus Lanz 04.07.2017,2017-07-04T00:00:00Z,28
Hajo Schumacher,Markus Lanz 13.07.2017,2017-07-13T00:00:00Z,28
Wolfgang Kubicki,Markus Lanz 26.09.2017,2017-09-26T00:00:00Z,28
Hajo Schumacher,Markus Lanz 28.09.2017,2017-09-28T00:00:00Z,28
Wolfgang Kubicki,Markus Lanz 23.11.2017,2017-11-23T00:00:00Z,28
Wolfgang Kubicki,Markus Lanz 02.05.2018,2018-05-02T00:00:00Z,28
Hajo Schumacher,Markus Lanz 30.08.2018,2018-08-30T00:00:00Z,28
Wolfgang Kubicki,Markus Lanz 30.08.2018,2018-08-30T00:00:00Z,28
Hajo Schumacher,Markus Lanz 26.09.2018,2018-09-26T00:00:00Z,28
Wolfgang Kubicki,Markus Lanz 08.01.2019,2019-01-08T00:00:00Z,28
Hajo Schumacher,Markus Lanz 24.01.2019,2019-01-24T00:00:00Z,28
Hajo Schumacher,Markus Lanz 16.05.2019,2019-05-16T00:00:00Z,28
Wolfgang Kubicki,Markus Lanz 29.05.2019,2019-05-29T00:00:00Z,28
Wolfgang Kubicki,Markus Lanz 11.09.2019,2019-09-11T00:00:00Z,28
Wolfgang Kubicki,Markus Lanz 15.04.2020,2020-04-15T00:00:00Z,28
Wolfgang Kubicki,Markus Lanz 03.06.2020,2020-06-03T00:00:00Z,28
Hajo Schumacher,Markus Lanz 25.06.2020,2020-06-25T00:00:00Z,28
Wolfgang Kubicki,Markus Lanz 04.02.2021,2021-02-04T00:00:00Z,28
Wolfgang Kubicki,Markus Lanz 01.04.2021,2021-04-01T00:00:00Z,28
Wolfgang Kubicki,Markus Lanz 04.08.2021,2021-08-04T00:00:00Z,28
Hajo Schumacher,Markus Lanz 21.10.2021,2021-10-21T00:00:00Z,28
Hajo Schumacher,Markus Lanz 22.09.2022,2022-09-22T00:00:00Z,28
Wolfgang Kubicki,Markus Lanz 16.05.2023,2023-05-16T00:00:00Z,28
Hajo Schumacher,Markus Lanz 01.06.2023,2023-06-01T00:00:00Z,28
Hajo Schumacher,Markus Lanz 25.06.2024,2024-06-25T00:00:00Z,28
Wolfram Weimer,Markus Lanz 15.03.2016,2016-03-15T00:00:00Z,27
Wolfram Weimer,Markus Lanz 08.09.2016,2016-09-08T00:00:00Z,27
Wolfram Weimer,Markus Lanz 03.11.2016,2016-11-03T00:00:00Z,27
Wolfram Weimer,Markus Lanz 15.12.2016,2016-12-15T00:00:00Z,27
Wolfram Weimer,Markus Lanz 07.03.2017,2017-03-07T00:00:00Z,27
Wolfram Weimer,Markus Lanz 09.05.2017,2017-05-09T00:00:00Z,27
Wolfram Weimer,Markus Lanz 26.09.2017,2017-09-26T00:00:00Z,27
Wolfram Weimer,Markus Lanz 10.10.2017,2017-10-10T00:00:00Z,27
Wolfram Weimer,Markus Lanz 22.11.2017,2017-11-22T00:00:00Z,27
Wolfram Weimer,Markus Lanz 07.02.2018,2018-02-07T00:00:00Z,27
Wolfram Weimer,Markus Lanz 28.03.2018,2018-03-28T00:00:00Z,27
Wolfram Weimer,Markus Lanz 15.08.2018,2018-08-15T00:00:00Z,27
Wolfram Weimer,Markus Lanz 18.10.2018,2018-10-18T00:00:00Z,27
Wolfram Weimer,Markus Lanz 04.12.2018,2018-12-04T00:00:00Z,27
Wolfram Weimer,Markus Lanz 12.02.2019,2019-02-12T00:00:00Z,27
Wolfram Weimer,Markus Lanz 21.03.2019,2019-03-21T00:00:00Z,27
Wolfram Weimer,Markus Lanz 28.05.2019,2019-05-28T00:00:00Z,27
Wolfram Weimer,Markus Lanz 27.06.2019,2019-06-27T00:00:00Z,27
Wolfram Weimer,Markus Lanz 27.08.2019,2019-08-27T00:00:00Z,27
Wolfram Weimer,Markus Lanz 24.09.2019,2019-09-24T00:00:00Z,27
Wolfram Weimer,Markus Lanz 27.02.2020,2020-02-27T00:00:00Z,27
Wolfram Weimer,Markus Lanz 07.07.2020,2020-07-07T00:00:00Z,27
Wolfram Weimer,Markus Lanz 20.04.2021,2021-04-20T00:00:00Z,27
Wolfram Weimer,Markus Lanz 08.09.2021,2021-09-08T00:00:00Z,27
Kerstin Münstermann,Markus Lanz 27.10.2021,2021-10-27T00:00:00Z,27
Kerstin Münstermann,Markus Lanz 23.11.2021,2021-11-23T00:00:00Z,27
Kerstin Münstermann,Markus Lanz 13.01.2022,2022-01-13T00:00:00Z,27
Kerstin Münstermann,Markus Lanz 17.02.2022,2022-02-17T00:00:00Z,27
Kerstin Münstermann,Markus Lanz 19.04.2022,2022-04-19T00:00:00Z,27
Wolfram Weimer,Markus Lanz 28.04.2022,2022-04-28T00:00:00Z,27
Kerstin Münstermann,Markus Lanz 17.05.2022,2022-05-17T00:00:00Z,27
Kerstin Münstermann,Markus Lanz 14.06.2022,2022-06-14T00:00:00Z,27
Wolfram Weimer,Markus Lanz 22.06.2022,2022-06-22T00:00:00Z,27
Kerstin Münstermann,Markus Lanz 16.08.2022,2022-08-16T00:00:00Z,27
Kerstin Münstermann,Markus Lanz 20.09.2022,2022-09-20T00:00:00Z,27
Kerstin Münstermann,Markus Lanz 01.11.2022,2022-11-01T00:00:00Z,27
Kerstin Münstermann,Markus Lanz 12.01.2023,2023-01-12T00:00:00Z,27
Kerstin Münstermann,Markus Lanz 25.04.2023,2023-04-25T00:00:00Z,27
Wolfram Weimer,Markus Lanz 11.05.2023,2023-05-11T00:00:00Z,27
Kerstin Münstermann,Markus Lanz 17.05.2023,2023-05-17T00:00:00Z,27
Kerstin Münstermann,Markus Lanz 21.06.2023,2023-06-21T00:00:00Z,27
Kerstin Münstermann,Markus Lanz 22.08.2023,2023-08-22T00:00:00Z,27
Kerstin Münstermann,Markus Lanz 12.09.2023,2023-09-12T00:00:00Z,27
Kerstin Münstermann,Markus Lanz 07.11.2023,2023-11-07T00:00:00Z,27
Kerstin Münstermann,Markus Lanz 12.12.2023,2023-12-12T00:00:00Z,27
Kerstin Münstermann,Markus Lanz 18.01.2024,2024-01-18T00:00:00Z,27
Kerstin Münstermann,Markus Lanz 29.02.2024,2024-02-29T00:00:00Z,27
Kerstin Münstermann,Markus Lanz 23.04.2024,2024-04-23T00:00:00Z,27
Kerstin Münstermann,Markus Lanz 29.05.2024,2024-05-29T00:00:00Z,27
Kerstin Münstermann,Markus Lanz 26.06.2024,2024-06-26T00:00:00Z,27
Kerstin Münstermann,Markus Lanz 03.09.2024,2024-09-03T00:00:00Z,27
Kerstin Münstermann,Markus Lanz 09.10.2024,2024-10-09T00:00:00Z,27
Kerstin Münstermann,Markus Lanz 14.11.2024,2024-11-14T00:00:00Z,27
Kerstin Münstermann,Markus Lanz 05.12.2024,2024-12-05T00:00:00Z,27
Elmar Theveßen,Markus Lanz 11.08.2009,2009-08-11T00:00:00Z,25
Elmar Theveßen,Markus Lanz 02.07.2013,2013-07-02T00:00:00Z,25
Ralf Stegner,Markus Lanz 25.09.2013,2013-09-25T00:00:00Z,25
Ralf Stegner,Markus Lanz 12.11.2013,2013-11-12T00:00:00Z,25
Ralf Stegner,Markus Lanz 14.01.2014,2014-01-14T00:00:00Z,25
Elmar Theveßen,Markus Lanz 28.05.2014,2014-05-28T00:00:00Z,25
Elmar Theveßen,Markus Lanz 20.01.2015,2015-01-20T00:00:00Z,25
Elmar Theveßen,Markus Lanz 18.06.2015,2015-06-18T00:00:00Z,25
Elmar Theveßen,Markus Lanz 08.09.2015,2015-09-08T00:00:00Z,25
Elmar Theveßen,Markus Lanz 31.08.2016,2016-08-31T00:00:00Z,25
Elmar Theveßen,Markus Lanz 13.10.2016,2016-10-13T00:00:00Z,25
Elmar Theveßen,Markus Lanz - Spezial 21.12.2016,2016-12-21T00:00:00Z,25
Elmar Theveßen,Markus Lanz 11.01.2017,2017-01-11T00:00:00Z,25
Ralf Stegner,Markus Lanz 25.01.2017,2017-01-25T00:00:00Z,25
Elmar Theveßen,Markus Lanz 16.02.2017,2017-02-16T00:00:00Z,25
Elmar Theveßen,Markus Lanz 13.04.2017,2017-04-13T00:00:00Z,25
Ralf Stegner,Markus Lanz 01.06.2017,2017-06-01T00:00:00Z,25
Elmar Theveßen,Markus Lanz 22.08.2017,2017-08-22T00:00:00Z,25
Ralf Stegner,Markus Lanz 28.11.2017,2017-11-28T00:00:00Z,25
Elmar Theveßen,Markus Lanz 12.12.2017,2017-12-12T00:00:00Z,25
Ralf Stegner,Markus Lanz 01.03.2018,2018-03-01T00:00:00Z,25
Ralf Stegner,Markus Lanz 20.06.2018,2018-06-20T00:00:00Z,25
Elmar Theveßen,Markus Lanz 28.08.2018,2018-08-28T00:00:00Z,25
Elmar Theveßen,Markus Lanz 06.11.2018,2018-11-06T00:00:00Z,25
Ralf Stegner,Markus Lanz 28.05.2019,2019-05-28T00:00:00Z,25
Elmar Theveßen,Markus Lanz 22.08.2019,2019-08-22T00:00:00Z,25
Ralf Stegner,Markus Lanz 03.12.2019,2019-12-03T00:00:00Z,25
Elmar Theveßen,Markus Lanz 11.12.2019,2019-12-11T00:00:00Z,25
Elmar Theveßen,Markus Lanz 18.02.2020,2020-02-18T00:00:00Z,25
Ralf Stegner,Markus Lanz 26.05.2020,2020-05-26T00:00:00Z,25
Elmar Theveßen,Markus Lanz 05.05.2021,2021-05-05T00:00:00Z,25
Ralf Stegner,Markus Lanz 08.09.2021,2021-09-08T00:00:00Z,25
Ralf Stegner,Markus Lanz 24.11.2021,2021-11-24T00:00:00Z,25
Ralf Stegner,Markus Lanz 13.01.2022,2022-01-13T00:00:00Z,25
Ralf Stegner,Markus Lanz 02.03.2022,2022-03-02T00:00:00Z,25
Ralf Stegner,Markus Lanz 20.04.2022,2022-04-20T00:00:00Z,25
Ralf Stegner,Markus Lanz 28.06.2022,2022-06-28T00:00:00Z,25
Ralf Stegner,Markus Lanz 15.09.2022,2022-09-15T00:00:00Z,25
Elmar Theveßen,Markus Lanz 01.11.2022,2022-11-01T00:00:00Z,25
Elmar Theveßen,Markus Lanz 15.02.2023,2023-02-15T00:00:00Z,25
Ralf Stegner,Markus Lanz 16.02.2023,2023-02-16T00:00:00Z,25
Elmar Theveßen,Markus Lanz 30.08.2023,2023-08-30T00:00:00Z,25
Ralf Stegner,Markus Lanz 12.09.2023,2023-09-12T00:00:00Z,25
Elmar Theveßen,Markus Lanz 14.12.2023,2023-12-14T00:00:00Z,25
Ralf Stegner,Markus Lanz 10.01.2024,2024-01-10T00:00:00Z,25
Ralf Stegner,Markus Lanz 28.02.2024,2024-02-28T00:00:00Z,25
Ralf Stegner,Markus Lanz 02.05.2024,2024-05-02T00:00:00Z,25
Ralf Stegner,Markus Lanz 09.07.2024,2024-07-09T00:00:00Z,25
Ralf Stegner,Markus Lanz 13.11.2024,2024-11-13T00:00:00Z,25
Elmar Theveßen,Markus Lanz 19.11.2024,2024-11-19T00:00:00Z,25
Dirk Steffens,Markus Lanz 07.07.2009,2009-07-07T00:00:00Z,24
Dirk Steffens,Markus Lanz 19.11.2009,2009-11-19T00:00:00Z,24
Wolfgang Bosbach,Markus Lanz 13.01.2010,2010-01-13T00:00:00Z,24
Wolfgang Bosbach,Markus Lanz 04.03.2010,2010-03-04T00:00:00Z,24
Dirk Steffens,Markus Lanz 09.03.2010,2010-03-09T00:00:00Z,24
Wolfgang Bosbach,Markus Lanz 03.06.2010,2010-06-03T00:00:00Z,24
Dirk Steffens,Markus Lanz 09.06.2010,2010-06-09T00:00:00Z,24
Dirk Steffens,Markus Lanz 15.03.2011,2011-03-15T00:00:00Z,24
Dirk Steffens,Markus Lanz 01.06.2011,2011-06-01T00:00:00Z,24
Wolfgang Bosbach,Markus Lanz 13.10.2011,2011-10-13T00:00:00Z,24
Dirk Steffens,Markus Lanz 25.01.2012,2012-01-25T00:00:00Z,24
Wolfgang Bosbach,Markus Lanz 13.03.2012,2012-03-13T00:00:00Z,24
Wolfgang Bosbach,Markus Lanz 22.05.2012,2012-05-22T00:00:00Z,24
Wolfgang Bosbach,Markus Lanz 14.06.2012,2012-06-14T00:00:00Z,24
Wolfgang Bosbach,Markus Lanz 15.01.2013,2013-01-15T00:00:00Z,24
Dirk Steffens,Markus Lanz 30.01.2013,2013-01-30T00:00:00Z,24
Wolfgang Bosbach,Markus Lanz 27.06.2013,2013-06-27T00:00:00Z,24
Dirk Steffens,Markus Lanz 25.07.2013,2013-07-25T00:00:00Z,24
Wolfgang Bosbach,Markus Lanz 26.09.2013,2013-09-26T00:00:00Z,24
Wolfgang Bosbach,Markus Lanz 04.03.2014,2014-03-04T00:00:00Z,24
Wolfgang Bosbach,Markus Lanz 03.06.2014,2014-06-03T00:00:00Z,24
Dirk Steffens,Markus Lanz 24.07.2014,2014-07-24T00:00:00Z,24
Dirk Steffens,Markus Lanz 24.09.2014,2014-09-24T00:00:00Z,24
Wolfgang Bosbach,Markus Lanz 02.10.2014,2014-10-02T00:00:00Z,24
Wolfgang Bosbach,Markus Lanz 18.08.2015,2015-08-18T00:00:00Z,24
Dirk Steffens,Markus Lanz 19.08.2015,2015-08-19T00:00:00Z,24
Wolfgang Bosbach,Markus Lanz 12.01.2016,2016-01-12T00:00:00Z,24
Dirk Steffens,Markus Lanz 20.01.2016,2016-01-20T00:00:00Z,24
Wolfgang Bosbach,Markus Lanz 22.03.2016,2016-03-22T00:00:00Z,24
Dirk Steffens,Markus Lanz 31.08.2016,2016-08-31T00:00:00Z,24
Wolfgang Bosbach,Markus Lanz 25.10.2016,2016-10-25T00:00:00Z,24
Wolfgang Bosbach,Markus Lanz 10.01.2017,2017-01-10T00:00:00Z,24
Dirk Steffens,Markus Lanz 21.02.2017,2017-02-21T00:00:00Z,24
Wolfgang Bosbach,Markus Lanz 18.05.2017,2017-05-18T00:00:00Z,24
Dirk Steffens,Markus Lanz 04.07.2017,2017-07-04T00:00:00Z,24
Dirk Steffens,Markus Lanz 07.12.2017,2017-12-07T00:00:00Z,24
Wolfgang Bosbach,Markus Lanz 06.02.2018,2018-02-06T00:00:00Z,24
Dirk Steffens,Markus Lanz 21.02.2018,2018-02-21T00:00:00Z,24
Wolfgang Bosbach,Markus Lanz 11.07.2018,2018-07-11T00:00:00Z,24
Dirk Steffens,Markus Lanz 11.09.2018,2018-09-11T00:00:00Z,24
Wolfgang Bosbach,Markus Lanz 27.11.2018,2018-11-27T00:00:00Z,24
Wolfgang Bosbach,Markus Lanz 23.01.2019,2019-01-23T00:00:00Z,24
Dirk Steffens,Markus Lanz 05.02.2019,2019-02-05T00:00:00Z,24
Dirk Steffens,Markus Lanz 08.05.2019,2019-05-08T00:00:00Z,24
Dirk Steffens,Markus Lanz 25.02.2020,2020-02-25T00:00:00Z,24
Dirk Steffens,Markus Lanz 13.05.2020,2020-05-13T00:00:00Z,24
Dirk Steffens,Markus Lanz 09.06.2020,2020-06-09T00:00:00Z,24
Wolfgang Bosbach,Markus Lanz 17.06.2020,2020-06-17T00:00:00Z,24
Melanie Amann,Markus Lanz 15.03.2016,2016-03-15T00:00:00Z,23
Melanie Amann,Markus Lanz 04.05.2016,2016-05-04T00:00:00Z,23
Melanie Amann,Markus Lanz 24.01.2017,2017-01-24T00:00:00Z,23
Melanie Amann,Markus Lanz 01.03.2017,2017-03-01T00:00:00Z,23
Melanie Amann,Markus Lanz 21.09.2017,2017-09-21T00:00:00Z,23
Claudia Kade,Markus Lanz 08.02.2018,2018-02-08T00:00:00Z,23
Melanie Amann,Markus Lanz 20.02.2018,2018-02-20T00:00:00Z,23
Claudia Kade,Markus Lanz 12.04.2018,2018-04-12T00:00:00Z,23
Melanie Amann,Markus Lanz 31.05.2018,2018-05-31T00:00:00Z,23
Claudia Kade,Markus Lanz 20.06.2018,2018-06-20T00:00:00Z,23
Claudia Kade,Markus Lanz 14.08.2018,2018-08-14T00:00:00Z,23
Melanie Amann,Markus Lanz 24.10.2018,2018-10-24T00:00:00Z,23
Claudia Kade,Markus Lanz 14.11.2018,2018-11-14T00:00:00Z,23
Melanie Amann,Markus Lanz 12.12.2018,2018-12-12T00:00:00Z,23
Claudia Kade,Markus Lanz 08.01.2019,2019-01-08T00:00:00Z,23
Claudia Kade,Markus Lanz 28.02.2019,2019-02-28T00:00:00Z,23
Melanie Amann,Markus Lanz 10.04.2019,2019-04-10T00:00:00Z,23
Claudia Kade,Markus Lanz 18.04.2019,2019-04-18T00:00:00Z,23
Claudia Kade,Markus Lanz 05.06.2019,2019-06-05T00:00:00Z,23
Melanie Amann,Markus Lanz 25.06.2019,2019-06-25T00:00:00Z,23
Melanie Amann,Markus Lanz 07.08.2019,2019-08-07T00:00:00Z,23
Claudia Kade,Markus Lanz 17.09.2019,2019-09-17T00:00:00Z,23
Claudia Kade,Markus Lanz 14.11.2019,2019-11-14T00:00:00Z,23
Claudia Kade,Markus Lanz 03.12.2019,2019-12-03T00:00:00Z,23
Melanie Amann,Markus Lanz 04.12.2019,2019-12-04T00:00:00Z,23
Claudia Kade,Markus Lanz 16.01.2020,2020-01-16T00:00:00Z,23
Helene Bubrowski,Markus Lanz 23.01.2020,2020-01-23T00:00:00Z,23
Michael Bröcker,Markus Lanz 29.01.2020,2020-01-29T00:00:00Z,23
Claudia Kade,Markus Lanz 13.02.2020,2020-02-13T00:00:00Z,23
Helene Bubrowski,Markus Lanz 04.03.2020,2020-03-04T00:00:00Z,23
Claudia Kade,Markus Lanz 12.05.2020,2020-05-12T00:00:00Z,23
Claudia Kade,Markus Lanz 17.09.2020,2020-09-17T00:00:00Z,23
Claudia Kade,Markus Lanz 05.01.2021,2021-01-05T00:00:00Z,23
Helene Bubrowski,Markus Lanz 30.03.2021,2021-03-30T00:00:00Z,23
Melanie Amann,Markus Lanz 07.04.2021,2021-04-07T00:00:00Z,23
Helene Bubrowski,Markus Lanz 14.04.2021,2021-04-14T00:00:00Z,23
Helene Bubrowski,Markus Lanz 14.07.2021,2021-07-14T00:00:00Z,23
Michael Bröcker,Markus Lanz 09.09.2021,2021-09-09T00:00:00Z,23
Helene Bubrowski,Markus Lanz 30.09.2021,2021-09-30T00:00:00Z,23
Helene Bubrowski,Markus Lanz 14.10.2021,2021-10-14T00:00:00Z,23
Melanie Amann,Markus Lanz 21.10.2021,2021-10-21T00:00:00Z,23
Claudia Kade,Markus Lanz 09.11.2021,2021-11-09T00:00:00Z,23
Michael Bröcker,Markus Lanz 10.11.2021,2021-11-10T00:00:00Z,23
Helene Bubrowski,Markus Lanz 01.02.2022,2022-02-01T00:00:00Z,23
Claudia Kade,Markus Lanz 08.02.2022,2022-02-08T00:00:00Z,23
Michael Bröcker,Markus Lanz 15.02.2022,2022-02-15T00:00:00Z,23
Claudia Kade,Markus Lanz 25.02.2022,2022-02-25T00:00:00Z,23
Helene Bubrowski,Markus Lanz 03.03.2022,2022-03-03T00:00:00Z,23
Helene Bubrowski,Markus Lanz 12.04.2022,2022-04-12T00:00:00Z,23
Claudia Kade,Markus Lanz 27.04.2022,2022-04-27T00:00:00Z,23
Michael Bröcker,Markus Lanz 10.05.2022,2022-05-10T00:00:00Z,23
Helene Bubrowski,Markus Lanz 11.05.2022,2022-05-11T00:00:00Z,23
Michael Bröcker,Markus Lanz 08.06.2022,2022-06-08T00:00:00Z,23
Claudia Kade,Markus Lanz 15.06.2022,2022-06-15T00:00:00Z,23
Michael Bröcker,Markus Lanz 31.08.2022,2022-08-31T00:00:00Z,23
Helene Bubrowski,Markus Lanz 01.09.2022,2022-09-01T00:00:00Z,23
Melanie Amann,Markus Lanz 29.09.2022,2022-09-29T00:00:00Z,23
Claudia Kade,Markus Lanz 04.10.2022,2022-10-04T00:00:00Z,23
Michael Bröcker,Markus Lanz 06.10.2022,2022-10-06T00:00:00Z,23
Helene Bubrowski,Markus Lanz 03.11.2022,2022-11-03T00:00:00Z,23
Michael Bröcker,Markus Lanz 15.11.2022,2022-11-15T00:00:00Z,23
Michael Bröcker,Markus Lanz 06.12.2022,2022-12-06T00:00:00Z,23
Melanie Amann,Markus Lanz 07.12.2022,2022-12-07T00:00:00Z,23
Helene Bubrowski,Markus Lanz 13.12.2022,2022-12-13T00:00:00Z,23
Helene Bubrowski,Markus Lanz 08.02.2023,2023-02-08T00:00:00Z,23
Michael Bröcker,Markus Lanz 29.03.2023,2023-03-29T00:00:00Z,23
Michael Bröcker,Markus Lanz 13.04.2023,2023-04-13T00:00:00Z,23
Helene Bubrowski,Markus Lanz 20.04.2023,2023-04-20T00:00:00Z,23
Helene Bubrowski,Markus Lanz 16.05.2023,2023-05-16T00:00:00Z,23
Michael Bröcker,Markus Lanz 24.05.2023,2023-05-24T00:00:00Z,23
Melanie Amann,Markus Lanz 25.05.2023,2023-05-25T00:00:00Z,23
Helene Bubrowski,Markus Lanz 08.06.2023,2023-06-08T00:00:00Z,23
Michael Bröcker,Markus Lanz 11.07.2023,2023-07-11T00:00:00Z,23
Melanie Amann,Markus Lanz 29.08.2023,2023-08-29T00:00:00Z,23
Helene Bubrowski,Markus Lanz 30.08.2023,2023-08-30T00:00:00Z,23
Michael Bröcker,Markus Lanz 07.09.2023,2023-09-07T00:00:00Z,23
Michael Bröcker,Markus Lanz 23.11.2023,2023-11-23T00:00:00Z,23
Melanie Amann,Markus Lanz 08.02.2024,2024-02-08T00:00:00Z,23
Michael Bröcker,Markus Lanz 15.02.2024,2024-02-15T00:00:00Z,23
Helene Bubrowski,Markus Lanz 22.02.2024,2024-02-22T00:00:00Z,23
Michael Bröcker,Markus Lanz 03.04.2024,2024-04-03T00:00:00Z,23
Michael Bröcker,Markus Lanz 30.04.2024,2024-04-30T00:00:00Z,23
Melanie Amann,Markus Lanz 28.05.2024,2024-05-28T00:00:00Z,23
Helene Bubrowski,Markus Lanz 06.06.2024,2024-06-06T00:00:00Z,23
Michael Bröcker,Markus Lanz 13.06.2024,2024-06-13T00:00:00Z,23
Michael Bröcker,Markus Lanz 12.09.2024,2024-09-12T00:00:00Z,23
Melanie Amann,Markus Lanz 19.09.2024,2024-09-19T00:00:00Z,23
Michael Bröcker,Markus Lanz 10.10.2024,2024-10-10T00:00:00Z,23
Helene Bubrowski,Markus Lanz 16.10.2024,2024-10-16T00:00:00Z,23
Melanie Amann,Markus Lanz 12.11.2024,2024-11-12T00:00:00Z,23
Michael Bröcker,Markus Lanz 20.11.2024,2024-11-20T00:00:00Z,23
Helene Bubrowski,Markus Lanz 21.11.2024,2024-11-21T00:00:00Z,23
Manfred Lütz,Markus Lanz 03.12.2009,2009-12-03T00:00:00Z,22
Manfred Lütz,Markus Lanz 30.03.2010,2010-03-30T00:00:00Z,22
Manfred Lütz,Markus Lanz 28.10.2010,2010-10-28T00:00:00Z,22
Manfred Lütz,Markus Lanz 08.12.2010,2010-12-08T00:00:00Z,22
Manfred Lütz,Markus Lanz 05.05.2011,2011-05-05T00:00:00Z,22
Manfred Lütz,Markus Lanz 20.09.2011,2011-09-20T00:00:00Z,22
Gerhart Baum,Markus Lanz 26.01.2012,2012-01-26T00:00:00Z,22
Gerhart Baum,Markus Lanz 24.04.2012,2012-04-24T00:00:00Z,22
Marcel Reif,Markus Lanz 21.08.2012,2012-08-21T00:00:00Z,22
Jürgen Trittin,Markus Lanz 04.09.2012,2012-09-04T00:00:00Z,22
Gerhart Baum,Markus Lanz 01.11.2012,2012-11-01T00:00:00Z,22
Manfred Lütz,Markus Lanz 13.11.2012,2012-11-13T00:00:00Z,22
Jürgen Trittin,Markus Lanz 04.06.2013,2013-06-04T00:00:00Z,22
Manfred Lütz,Markus Lanz 03.07.2013,2013-07-03T00:00:00Z,22
Marcel Reif,Markus Lanz 24.07.2013,2013-07-24T00:00:00Z,22
Jürgen Trittin,Markus Lanz 28.11.2013,2013-11-28T00:00:00Z,22
Marcel Reif,Markus Lanz 15.04.2014,2014-04-15T00:00:00Z,22
Jürgen Trittin,Markus Lanz 18.09.2014,2014-09-18T00:00:00Z,22
Olaf Sundermeyer,Markus Lanz 28.10.2014,2014-10-28T00:00:00Z,22
Olaf Sundermeyer,Markus Lanz 16.12.2014,2014-12-16T00:00:00Z,22
Gerhart Baum,Markus Lanz 12.02.2015,2015-02-12T00:00:00Z,22
Marcel Reif,Markus Lanz 24.03.2015,2015-03-24T00:00:00Z,22
Manfred Lütz,Markus Lanz 10.11.2015,2015-11-10T00:00:00Z,22
Gerhart Baum,Markus Lanz 16.02.2016,2016-02-16T00:00:00Z,22
Marcel Reif,Markus Lanz 09.03.2016,2016-03-09T00:00:00Z,22
Marcel Reif,Markus Lanz 14.06.2016,2016-06-14T00:00:00Z,22
Olaf Sundermeyer,Markus Lanz 15.06.2016,2016-06-15T00:00:00Z,22
Marcel Reif,Markus Lanz 14.09.2016,2016-09-14T00:00:00Z,22
Manfred Lütz,Markus Lanz 18.10.2016,2016-10-18T00:00:00Z,22
Jürgen Trittin,Markus Lanz 08.02.2017,2017-02-08T00:00:00Z,22
Olaf Sundermeyer,Markus Lanz 15.02.2017,2017-02-15T00:00:00Z,22
Marcel Reif,Markus Lanz 15.03.2017,2017-03-15T00:00:00Z,22
Olaf Sundermeyer,Markus Lanz 28.03.2017,2017-03-28T00:00:00Z,22
Marcel Reif,Markus Lanz 12.04.2017,2017-04-12T00:00:00Z,22
Gerhart Baum,Markus Lanz 27.04.2017,2017-04-27T00:00:00Z,22
Olaf Sundermeyer,Markus Lanz 18.05.2017,2017-05-18T00:00:00Z,22
Jürgen Trittin,Markus Lanz 14.06.2017,2017-06-14T00:00:00Z,22
Olaf Sundermeyer,Markus Lanz 11.07.2017,2017-07-11T00:00:00Z,22
Marcel Reif,Markus Lanz 18.10.2017,2017-10-18T00:00:00Z,22
Gerhart Baum,Markus Lanz 30.11.2017,2017-11-30T00:00:00Z,22
Manfred Lütz,Markus Lanz 27.02.2018,2018-02-27T00:00:00Z,22
Marcel Reif,Markus Lanz 06.03.2018,2018-03-06T00:00:00Z,22
Olaf Sundermeyer,Markus Lanz 08.03.2018,2018-03-08T00:00:00Z,22
Marcel Reif,Markus Lanz 15.05.2018,2018-05-15T00:00:00Z,22
Manfred Lütz,Markus Lanz 07.06.2018,2018-06-07T00:00:00Z,22
Marcel Reif,Markus Lanz 13.06.2018,2018-06-13T00:00:00Z,22
Marcel Reif,Markus Lanz 03.07.2018,2018-07-03T00:00:00Z,22
Jürgen Trittin,Markus Lanz 29.08.2018,2018-08-29T00:00:00Z,22
Olaf Sundermeyer,Markus Lanz 04.09.2018,2018-09-04T00:00:00Z,22
Marcel Reif,Markus Lanz 06.09.2018,2018-09-06T00:00:00Z,22
Olaf Sundermeyer,Markus Lanz 02.10.2018,2018-10-02T00:00:00Z,22
Olaf Sundermeyer,Markus Lanz 19.12.2018,2018-12-19T00:00:00Z,22
Marcel Reif,Markus Lanz 30.01.2019,2019-01-30T00:00:00Z,22
Olaf Sundermeyer,Markus Lanz 12.03.2019,2019-03-12T00:00:00Z,22
Manfred Lütz,Markus Lanz 20.03.2019,2019-03-20T00:00:00Z,22
Jürgen Trittin,Markus Lanz 26.03.2019,2019-03-26T00:00:00Z,22
Marcel Reif,Markus Lanz 23.05.2019,2019-05-23T00:00:00Z,22
Manfred Lütz,Markus Lanz 30.05.2019,2019-05-30T00:00:00Z,22
Olaf Sundermeyer,Markus Lanz 19.06.2019,2019-06-19T00:00:00Z,22
Gerhart Baum,Markus Lanz 10.10.2019,2019-10-10T00:00:00Z,22
Olaf Sundermeyer,Markus Lanz 10.10.2019,2019-10-10T00:00:00Z,22
Olaf Sundermeyer,Markus Lanz 17.12.2019,2019-12-17T00:00:00Z,22
Olaf Sundermeyer,Markus Lanz 16.01.2020,2020-01-16T00:00:00Z,22
Gerhart Baum,Markus Lanz 13.02.2020,2020-02-13T00:00:00Z,22
Marcel Reif,Markus Lanz 18.02.2020,2020-02-18T00:00:00Z,22
Olaf Sundermeyer,Markus Lanz 18.02.2020,2020-02-18T00:00:00Z,22
Olaf Sundermeyer,Markus Lanz 20.02.2020,2020-02-20T00:00:00Z,22
Manfred Lütz,Markus Lanz 17.03.2020,2020-03-17T00:00:00Z,22
Olaf Sundermeyer,Markus Lanz 05.05.2020,2020-05-05T00:00:00Z,22
Olaf Sundermeyer,Markus Lanz 21.05.2020,2020-05-21T00:00:00Z,22
Gerhart Baum,Markus Lanz 27.05.2020,2020-05-27T00:00:00Z,22
Olaf Sundermeyer,Markus Lanz 01.09.2020,2020-09-01T00:00:00Z,22
Manfred Lütz,Markus Lanz 17.09.2020,2020-09-17T00:00:00Z,22
Gerhart Baum,Markus Lanz 17.12.2020,2020-12-17T00:00:00Z,22
Manfred Lütz,Markus Lanz 17.12.2020,2020-12-17T00:00:00Z,22
Jürgen Trittin,Markus Lanz 18.02.2021,2021-02-18T00:00:00Z,22
Gerhart Baum,Markus Lanz 21.04.2021,2021-04-21T00:00:00Z,22
Jürgen Trittin,Markus Lanz 20.05.2021,2021-05-20T00:00:00Z,22
Marcel Reif,Markus Lanz 23.06.2021,2021-06-23T00:00:00Z,22
Marcel Reif,Markus Lanz 07.07.2021,2021-07-07T00:00:00Z,22
Gerhart Baum,Markus Lanz 07.09.2021,2021-09-07T00:00:00Z,22
Jürgen Trittin,Markus Lanz 22.09.2021,2021-09-22T00:00:00Z,22
Gerhart Baum,Markus Lanz 29.09.2021,2021-09-29T00:00:00Z,22
Jürgen Trittin,Markus Lanz 12.10.2021,2021-10-12T00:00:00Z,22
Gerhart Baum,Markus Lanz 27.10.2021,2021-10-27T00:00:00Z,22
Jürgen Trittin,Markus Lanz 24.11.2021,2021-11-24T00:00:00Z,22
Manfred Lütz,Markus Lanz 02.02.2022,2022-02-02T00:00:00Z,22
Gerhart Baum,Markus Lanz 24.02.2022,2022-02-24T00:00:00Z,22
Jürgen Trittin,Markus Lanz 25.02.2022,2022-02-25T00:00:00Z,22
Manfred Lütz,Markus Lanz 11.05.2022,2022-05-11T00:00:00Z,22
Jürgen Trittin,Markus Lanz 12.05.2022,2022-05-12T00:00:00Z,22
Gerhart Baum,Markus Lanz 30.06.2022,2022-06-30T00:00:00Z,22
Marcel Reif,Markus Lanz 19.10.2022,2022-10-19T00:00:00Z,22
Gerhart Baum,Markus Lanz 02.11.2022,2022-11-02T00:00:00Z,22
Jürgen Trittin,Markus Lanz 06.12.2022,2022-12-06T00:00:00Z,22
Olaf Sundermeyer,Markus Lanz 07.12.2022,2022-12-07T00:00:00Z,22
Gerhart Baum,Markus Lanz - Das Jahr 2022,2022-12-15T00:00:00Z,22
Jürgen Trittin,Markus Lanz 02.02.2023,2023-02-02T00:00:00Z,22
Jürgen Trittin,Markus Lanz 18.04.2023,2023-04-18T00:00:00Z,22
Jürgen Trittin,Markus Lanz 21.06.2023,2023-06-21T00:00:00Z,22
Manfred Lütz,Markus Lanz 20.07.2023,2023-07-20T00:00:00Z,22
Jürgen Trittin,Markus Lanz 30.08.2023,2023-08-30T00:00:00Z,22
Manfred Lütz,Markus Lanz 28.09.2023,2023-09-28T00:00:00Z,22
Gerhart Baum,Markus Lanz 08.11.2023,2023-11-08T00:00:00Z,22
Jürgen Trittin,Markus Lanz 30.11.2023,2023-11-30T00:00:00Z,22
Jürgen Trittin,Markus Lanz 29.02.2024,2024-02-29T00:00:00Z,22
Manfred Lütz,Markus Lanz 04.04.2024,2024-04-04T00:00:00Z,22
Gerhart Baum,Markus Lanz 23.05.2024,2024-05-23T00:00:00Z,22
Marcel Reif,Markus Lanz 19.06.2024,2024-06-19T00:00:00Z,22
Gerhart Baum,Markus Lanz 25.07.2024,2024-07-25T00:00:00Z,22
Sahra Wagenknecht,Markus Lanz 07.06.2011,2011-06-07T00:00:00Z,21
Sahra Wagenknecht,Markus Lanz 03.05.2012,2012-05-03T00:00:00Z,21
Sahra Wagenknecht,Markus Lanz 13.09.2012,2012-09-13T00:00:00Z,21
Markus Feldenkirchen,Markus Lanz 27.09.2012,2012-09-27T00:00:00Z,21
Sahra Wagenknecht,Markus Lanz 27.02.2013,2013-02-27T00:00:00Z,21
Sahra Wagenknecht,Markus Lanz 16.01.2014,2014-01-16T00:00:00Z,21
Markus Feldenkirchen,Markus Lanz 02.03.2016,2016-03-02T00:00:00Z,21
Sahra Wagenknecht,Markus Lanz 21.04.2016,2016-04-21T00:00:00Z,21
Markus Feldenkirchen,Markus Lanz 08.06.2016,2016-06-08T00:00:00Z,21
Markus Feldenkirchen,Markus Lanz 11.10.2016,2016-10-11T00:00:00Z,21
Markus Feldenkirchen,Markus Lanz 17.01.2017,2017-01-17T00:00:00Z,21
Sahra Wagenknecht,Markus Lanz 19.01.2017,2017-01-19T00:00:00Z,21
Markus Feldenkirchen,Markus Lanz 16.05.2017,2017-05-16T00:00:00Z,21
Markus Feldenkirchen,Markus Lanz 13.09.2017,2017-09-13T00:00:00Z,21
Markus Feldenkirchen,Markus Lanz 04.10.2017,2017-10-04T00:00:00Z,21
Markus Feldenkirchen,Markus Lanz 23.01.2018,2018-01-23T00:00:00Z,21
Markus Feldenkirchen,Markus Lanz 29.03.2018,2018-03-29T00:00:00Z,21
Markus Feldenkirchen,Markus Lanz 15.11.2018,2018-11-15T00:00:00Z,21
Markus Feldenkirchen,Markus Lanz 09.01.2019,2019-01-09T00:00:00Z,21
Markus Feldenkirchen,Markus Lanz 06.03.2019,2019-03-06T00:00:00Z,21
Sahra Wagenknecht,Markus Lanz 02.04.2019,2019-04-02T00:00:00Z,21
Markus Feldenkirchen,Markus Lanz 06.06.2019,2019-06-06T00:00:00Z,21
Markus Feldenkirchen,Markus Lanz 29.08.2019,2019-08-29T00:00:00Z,21
Sahra Wagenknecht,Markus Lanz 12.09.2019,2019-09-12T00:00:00Z,21
Markus Feldenkirchen,Markus Lanz 29.10.2019,2019-10-29T00:00:00Z,21
Markus Feldenkirchen,Markus Lanz 19.11.2019,2019-11-19T00:00:00Z,21
Markus Feldenkirchen,Markus Lanz 02.06.2020,2020-06-02T00:00:00Z,21
Sahra Wagenknecht,Markus Lanz 02.07.2020,2020-07-02T00:00:00Z,21
Sahra Wagenknecht,Markus Lanz 08.10.2020,2020-10-08T00:00:00Z,21
Markus Feldenkirchen,Markus Lanz 21.01.2021,2021-01-21T00:00:00Z,21
Markus Feldenkirchen,Markus Lanz 17.02.2021,2021-02-17T00:00:00Z,21
Sahra Wagenknecht,Markus Lanz 13.07.2021,2021-07-13T00:00:00Z,21
Sahra Wagenknecht,Markus Lanz 05.10.2021,2021-10-05T00:00:00Z,21
Markus Feldenkirchen,Markus Lanz 06.10.2021,2021-10-06T00:00:00Z,21
Sahra Wagenknecht,Markus Lanz 03.02.2022,2022-02-03T00:00:00Z,21
Sahra Wagenknecht,Markus Lanz 19.05.2022,2022-05-19T00:00:00Z,21
Sahra Wagenknecht,Markus Lanz 20.09.2022,2022-09-20T00:00:00Z,21
Sahra Wagenknecht,Markus Lanz 21.02.2023,2023-02-21T00:00:00Z,21
Sahra Wagenknecht,Markus Lanz 19.09.2023,2023-09-19T00:00:00Z,21
Sahra Wagenknecht,Markus Lanz 17.01.2024,2024-01-17T00:00:00Z,21
Sahra Wagenknecht,Markus Lanz 27.06.2024,2024-06-27T00:00:00Z,21
Sahra Wagenknecht,Markus Lanz 25.09.2024,2024-09-25T00:00:00Z,21
Andreas Englisch,Markus Lanz 12.08.2008,2008-08-12T00:00:00Z,20
Andreas Englisch,Markus Lanz 15.10.2009,2009-10-15T00:00:00Z,20
Andreas Englisch,Markus Lanz 05.05.2011,2011-05-05T00:00:00Z,20
Andreas Englisch,Markus Lanz 18.10.2011,2011-10-18T00:00:00Z,20
Andreas Englisch,Markus Lanz 14.02.2013,2013-02-14T00:00:00Z,20
Andreas Englisch,Markus Lanz 20.03.2013,2013-03-20T00:00:00Z,20
Andreas Englisch,Markus Lanz 19.06.2013,2013-06-19T00:00:00Z,20
Andreas Englisch,Markus Lanz 26.03.2014,2014-03-26T00:00:00Z,20
Andreas Englisch,Markus Lanz 14.10.2014,2014-10-14T00:00:00Z,20
Andreas Englisch,Markus Lanz 19.03.2015,2015-03-19T00:00:00Z,20
Andreas Englisch,Markus Lanz 15.10.2015,2015-10-15T00:00:00Z,20
Andreas Englisch,Markus Lanz 03.11.2015,2015-11-03T00:00:00Z,20
Andreas Englisch,Markus Lanz 23.02.2016,2016-02-23T00:00:00Z,20
Andreas Englisch,Markus Lanz 05.05.2016,2016-05-05T00:00:00Z,20
Andreas Englisch,Markus Lanz 10.11.2016,2016-11-10T00:00:00Z,20
Andreas Englisch,Markus Lanz 13.12.2016,2016-12-13T00:00:00Z,20
Andreas Englisch,Markus Lanz 26.04.2017,2017-04-26T00:00:00Z,20
Andreas Englisch,Markus Lanz 24.08.2017,2017-08-24T00:00:00Z,20
Andreas Englisch,Markus Lanz 05.12.2017,2017-12-05T00:00:00Z,20
Lars Klingbeil,Markus Lanz 14.08.2018,2018-08-14T00:00:00Z,20
Andreas Englisch,Markus Lanz 22.11.2018,2018-11-22T00:00:00Z,20
Stephan Weil,Markus Lanz 29.11.2018,2018-11-29T00:00:00Z,20
Lars Klingbeil,Markus Lanz 06.06.2019,2019-06-06T00:00:00Z,20
Lars Klingbeil,Markus Lanz 06.11.2019,2019-11-06T00:00:00Z,20
Stephan Weil,Markus Lanz 16.01.2020,2020-01-16T00:00:00Z,20
Lars Klingbeil,Markus Lanz 11.02.2020,2020-02-11T00:00:00Z,20
Stephan Weil,Markus Lanz 07.04.2020,2020-04-07T00:00:00Z,20
Stephan Weil,Markus Lanz 21.04.2020,2020-04-21T00:00:00Z,20
Stephan Weil,Markus Lanz 21.05.2020,2020-05-21T00:00:00Z,20
Stephan Weil,Markus Lanz 19.08.2020,2020-08-19T00:00:00Z,20
Lars Klingbeil,Markus Lanz 16.09.2020,2020-09-16T00:00:00Z,20
Stephan Weil,Markus Lanz 20.10.2020,2020-10-20T00:00:00Z,20
Stephan Weil,Markus Lanz 26.11.2020,2020-11-26T00:00:00Z,20
Stephan Weil,Markus Lanz 21.01.2021,2021-01-21T00:00:00Z,20
Stephan Weil,Markus Lanz 05.05.2021,2021-05-05T00:00:00Z,20
Lars Klingbeil,Markus Lanz 11.05.2021,2021-05-11T00:00:00Z,20
Lars Klingbeil,Markus Lanz 09.06.2021,2021-06-09T00:00:00Z,20
Lars Klingbeil,Markus Lanz 22.07.2021,2021-07-22T00:00:00Z,20
Stephan Weil,Markus Lanz 24.08.2021,2021-08-24T00:00:00Z,20
Lars Klingbeil,Markus Lanz 15.09.2021,2021-09-15T00:00:00Z,20
Lars Klingbeil,Markus Lanz 28.09.2021,2021-09-28T00:00:00Z,20
Stephan Weil,Markus Lanz 10.11.2021,2021-11-10T00:00:00Z,20
Stephan Weil,Markus Lanz 01.12.2021,2021-12-01T00:00:00Z,20
Lars Klingbeil,Markus Lanz 08.02.2022,2022-02-08T00:00:00Z,20
Lars Klingbeil,Markus Lanz 06.04.2022,2022-04-06T00:00:00Z,20
Lars Klingbeil,Markus Lanz 17.05.2022,2022-05-17T00:00:00Z,20
Stephan Weil,Markus Lanz 21.06.2022,2022-06-21T00:00:00Z,20
Stephan Weil,Markus Lanz 12.10.2022,2022-10-12T00:00:00Z,20
Lars Klingbeil,Markus Lanz 13.10.2022,2022-10-13T00:00:00Z,20
Stephan Weil,Markus Lanz 24.11.2022,2022-11-24T00:00:00Z,20
Lars Klingbeil,Markus Lanz 13.12.2022,2022-12-13T00:00:00Z,20
Stephan Weil,Markus Lanz 20.04.2023,2023-04-20T00:00:00Z,20
Lars Klingbeil,Markus Lanz 24.05.2023,2023-05-24T00:00:00Z,20
Lars Klingbeil,Markus Lanz 22.08.2023,2023-08-22T00:00:00Z,20
Stephan Weil,Markus Lanz 18.01.2024,2024-01-18T00:00:00Z,20
Lars Klingbeil,Markus Lanz 23.01.2024,2024-01-23T00:00:00Z,20
Stephan Weil,Markus Lanz 09.05.2024,2024-05-09T00:00:00Z,20
Lars Klingbeil,Markus Lanz 17.09.2024,2024-09-17T00:00:00Z,20
Stephan Weil,Markus Lanz 30.10.2024,2024-10-30T00:00:00Z,20
Lars Klingbeil,Markus Lanz 05.12.2024,2024-12-05T00:00:00Z,20
Florian Schroeder,Markus Lanz 18.06.2008,2008-06-18T00:00:00Z,19
Florian Schroeder,Markus Lanz 05.08.2008,2008-08-05T00:00:00Z,19
Florian Schroeder,Markus Lanz 09.07.2009,2009-07-09T00:00:00Z,19
Florian Schroeder,Markus Lanz 04.08.2009,2009-08-04T00:00:00Z,19
Florian Schroeder,Markus Lanz 07.10.2009,2009-10-07T00:00:00Z,19
Florian Schroeder,Markus Lanz 10.12.2009,2009-12-10T00:00:00Z,19
Florian Schroeder,Markus Lanz 16.03.2010,2010-03-16T00:00:00Z,19
Florian Schroeder,Markus Lanz 07.07.2011,2011-07-07T00:00:00Z,19
Florian Schroeder,Markus Lanz 08.12.2011,2011-12-08T00:00:00Z,19
Florian Schroeder,Markus Lanz 09.02.2012,2012-02-09T00:00:00Z,19
Florian Schroeder,Markus Lanz 17.04.2012,2012-04-17T00:00:00Z,19
Florian Schroeder,Markus Lanz 03.07.2012,2012-07-03T00:00:00Z,19
Florian Schroeder,Markus Lanz 31.01.2013,2013-01-31T00:00:00Z,19
Florian Schroeder,Markus Lanz 26.09.2013,2013-09-26T00:00:00Z,19
Florian Schroeder,Markus Lanz 13.11.2014,2014-11-13T00:00:00Z,19
Jens Spahn,Markus Lanz 18.06.2015,2015-06-18T00:00:00Z,19
Jens Spahn,Markus Lanz 01.12.2015,2015-12-01T00:00:00Z,19
Florian Schroeder,Markus Lanz 15.03.2016,2016-03-15T00:00:00Z,19
Jens Spahn,Markus Lanz 13.10.2016,2016-10-13T00:00:00Z,19
Florian Schroeder,Markus Lanz 25.05.2017,2017-05-25T00:00:00Z,19
Jens Spahn,Markus Lanz 07.06.2017,2017-06-07T00:00:00Z,19
Jens Spahn,Markus Lanz 28.11.2017,2017-11-28T00:00:00Z,19
Jens Spahn,Markus Lanz 13.02.2018,2018-02-13T00:00:00Z,19
Jens Spahn,Markus Lanz 13.12.2018,2018-12-13T00:00:00Z,19
Florian Schroeder,Markus Lanz 01.05.2019,2019-05-01T00:00:00Z,19
Jens Spahn,Markus Lanz 30.05.2019,2019-05-30T00:00:00Z,19
Florian Schroeder,Markus Lanz 04.06.2019,2019-06-04T00:00:00Z,19
Jens Spahn,Markus Lanz 20.08.2020,2020-08-20T00:00:00Z,19
Jens Spahn,Markus Lanz 18.05.2022,2022-05-18T00:00:00Z,19
Jens Spahn,Markus Lanz 26.01.2023,2023-01-26T00:00:00Z,19
Jens Spahn,Markus Lanz 11.05.2023,2023-05-11T00:00:00Z,19
Jens Spahn,Markus Lanz 27.06.2023,2023-06-27T00:00:00Z,19
Jens Spahn,Markus Lanz 09.11.2023,2023-11-09T00:00:00Z,19
Jens Spahn,Markus Lanz 11.01.2024,2024-01-11T00:00:00Z,19
Jens Spahn,Markus Lanz 25.04.2024,2024-04-25T00:00:00Z,19
Jens Spahn,Markus Lanz 27.08.2024,2024-08-27T00:00:00Z,19
Jens Spahn,Markus Lanz 01.10.2024,2024-10-01T00:00:00Z,19
Jens Spahn,Markus Lanz 19.11.2024,2024-11-19T00:00:00Z,19
Richard David Precht,Markus Lanz 22.07.2008,2008-07-22T00:00:00Z,18
Gisela Friedrichsen,Markus Lanz 14.10.2009,2009-10-14T00:00:00Z,18
Gisela Friedrichsen,Markus Lanz 28.10.2009,2009-10-28T00:00:00Z,18
Gisela Friedrichsen,Markus Lanz 25.05.2010,2010-05-25T00:00:00Z,18
Gisela Friedrichsen,Markus Lanz 08.06.2010,2010-06-08T00:00:00Z,18
Gisela Friedrichsen,Markus Lanz 12.01.2011,2011-01-12T00:00:00Z,18
Gisela Friedrichsen,Markus Lanz 18.05.2011,2011-05-18T00:00:00Z,18
Gisela Friedrichsen,Markus Lanz 25.05.2011,2011-05-25T00:00:00Z,18
Gisela Friedrichsen,Markus Lanz 31.05.2011,2011-05-31T00:00:00Z,18
Richard David Precht,Markus Lanz 24.11.2011,2011-11-24T00:00:00Z,18
Gisela Friedrichsen,Markus Lanz 09.05.2013,2013-05-09T00:00:00Z,18
Richard David Precht,Markus Lanz 13.06.2013,2013-06-13T00:00:00Z,18
Gisela Friedrichsen,Markus Lanz 28.01.2014,2014-01-28T00:00:00Z,18
Gisela Friedrichsen,Markus Lanz 11.03.2014,2014-03-11T00:00:00Z,18
Gisela Friedrichsen,Markus Lanz 14.05.2014,2014-05-14T00:00:00Z,18
Gisela Friedrichsen,Markus Lanz 26.02.2015,2015-02-26T00:00:00Z,18
Richard David Precht,Markus Lanz 14.01.2016,2016-01-14T00:00:00Z,18
Gisela Friedrichsen,Markus Lanz 11.05.2016,2016-05-11T00:00:00Z,18
Gisela Friedrichsen,Markus Lanz 30.06.2016,2016-06-30T00:00:00Z,18
Richard David Precht,Markus Lanz 12.10.2016,2016-10-12T00:00:00Z,18
Richard David Precht,Markus Lanz 09.03.2017,2017-03-09T00:00:00Z,18
Gisela Friedrichsen,Markus Lanz 01.06.2017,2017-06-01T00:00:00Z,18
Richard David Precht,Markus Lanz 31.08.2017,2017-08-31T00:00:00Z,18
Richard David Precht,Markus Lanz 10.10.2017,2017-10-10T00:00:00Z,18
Gisela Friedrichsen,Markus Lanz 31.01.2018,2018-01-31T00:00:00Z,18
Richard David Precht,Markus Lanz 24.04.2018,2018-04-24T00:00:00Z,18
Gerald Knaus,Markus Lanz 08.05.2018,2018-05-08T00:00:00Z,18
Gerald Knaus,Markus Lanz 04.07.2018,2018-07-04T00:00:00Z,18
Gisela Friedrichsen,Markus Lanz 03.07.2019,2019-07-03T00:00:00Z,18
Richard David Precht,Markus Lanz 16.10.2019,2019-10-16T00:00:00Z,18
Gerald Knaus,Markus Lanz 03.03.2020,2020-03-03T00:00:00Z,18
Richard David Precht,Markus Lanz 14.04.2020,2020-04-14T00:00:00Z,18
Richard David Precht,Markus Lanz 18.06.2020,2020-06-18T00:00:00Z,18
Gerald Knaus,Markus Lanz 14.10.2020,2020-10-14T00:00:00Z,18
Richard David Precht,Markus Lanz 21.10.2020,2020-10-21T00:00:00Z,18
Richard David Precht,Markus Lanz 25.03.2021,2021-03-25T00:00:00Z,18
Gerald Knaus,Markus Lanz 26.08.2021,2021-08-26T00:00:00Z,18
Gerald Knaus,Markus Lanz 27.10.2021,2021-10-27T00:00:00Z,18
Gerald Knaus,Markus Lanz 25.02.2022,2022-02-25T00:00:00Z,18
Gerald Knaus,Markus Lanz 17.03.2022,2022-03-17T00:00:00Z,18
Gerald Knaus,Markus Lanz 07.04.2022,2022-04-07T00:00:00Z,18
Richard David Precht,Markus Lanz 14.04.2022,2022-04-14T00:00:00Z,18
Gerald Knaus,Markus Lanz 24.05.2022,2022-05-24T00:00:00Z,18
Richard David Precht,Markus Lanz 12.07.2022,2022-07-12T00:00:00Z,18
Richard David Precht,Markus Lanz 29.09.2022,2022-09-29T00:00:00Z,18
Gerald Knaus,Markus Lanz 29.11.2022,2022-11-29T00:00:00Z,18
Gerald Knaus,Markus Lanz 16.02.2023,2023-02-16T00:00:00Z,18
Gerald Knaus,Markus Lanz 11.05.2023,2023-05-11T00:00:00Z,18
Gerald Knaus,Markus Lanz 24.10.2023,2023-10-24T00:00:00Z,18
Gerald Knaus,Markus Lanz 26.03.2024,2024-03-26T00:00:00Z,18
Gerald Knaus,Markus Lanz 04.06.2024,2024-06-04T00:00:00Z,18
Richard David Precht,Markus Lanz 28.08.2024,2024-08-28T00:00:00Z,18
Gerald Knaus,Markus Lanz 26.09.2024,2024-09-26T00:00:00Z,18
Gerald Knaus,Markus Lanz 10.12.2024,2024-12-10T00:00:00Z,18
Cem Özdemir,Markus Lanz 21.09.2010,2010-09-21T00:00:00Z,17
Markus Söder,Markus Lanz 20.10.2011,2011-10-20T00:00:00Z,17
Cem Özdemir,Markus Lanz 08.11.2012,2012-11-08T00:00:00Z,17
Markus Söder,Markus Lanz 04.07.2013,2013-07-04T00:00:00Z,17
Markus Söder,Markus Lanz 25.02.2014,2014-02-25T00:00:00Z,17
Markus Söder,Markus Lanz 11.09.2014,2014-09-11T00:00:00Z,17
Markus Söder,Markus Lanz 11.06.2015,2015-06-11T00:00:00Z,17
Markus Söder,Markus Lanz 09.02.2017,2017-02-09T00:00:00Z,17
Cem Özdemir,Markus Lanz 23.05.2017,2017-05-23T00:00:00Z,17
Markus Söder,Markus Lanz 22.06.2017,2017-06-22T00:00:00Z,17
Cem Özdemir,Markus Lanz 04.10.2017,2017-10-04T00:00:00Z,17
Cem Özdemir,Markus Lanz 22.11.2017,2017-11-22T00:00:00Z,17
Markus Söder,Markus Lanz 14.12.2017,2017-12-14T00:00:00Z,17
Cem Özdemir,Markus Lanz 16.01.2018,2018-01-16T00:00:00Z,17
Markus Söder,Markus Lanz 31.05.2018,2018-05-31T00:00:00Z,17
Cem Özdemir,Markus Lanz 27.06.2018,2018-06-27T00:00:00Z,17
Cem Özdemir,Markus Lanz 26.09.2018,2018-09-26T00:00:00Z,17
Cem Özdemir,Markus Lanz 30.10.2018,2018-10-30T00:00:00Z,17
Markus Söder,Markus Lanz 22.11.2018,2018-11-22T00:00:00Z,17
Markus Söder,Markus Lanz 28.03.2019,2019-03-28T00:00:00Z,17
Cem Özdemir,Markus Lanz 06.08.2019,2019-08-06T00:00:00Z,17
Cem Özdemir,Markus Lanz 12.12.2019,2019-12-12T00:00:00Z,17
Cem Özdemir,Markus Lanz 01.09.2020,2020-09-01T00:00:00Z,17
Cem Özdemir,Markus Lanz 20.04.2021,2021-04-20T00:00:00Z,17
Cem Özdemir,Markus Lanz 10.06.2021,2021-06-10T00:00:00Z,17
Cem Özdemir,Markus Lanz 09.09.2021,2021-09-09T00:00:00Z,17
Cem Özdemir,Markus Lanz 02.02.2022,2022-02-02T00:00:00Z,17
Markus Söder,Markus Lanz 15.03.2022,2022-03-15T00:00:00Z,17
Markus Söder,Markus Lanz 17.11.2022,2022-11-17T00:00:00Z,17
Markus Söder,Markus Lanz - Das Jahr 2022,2022-12-15T00:00:00Z,17
Markus Söder,Markus Lanz 02.05.2023,2023-05-02T00:00:00Z,17
Cem Özdemir,Markus Lanz 06.06.2023,2023-06-06T00:00:00Z,17
Markus Söder,Markus Lanz 22.11.2023,2023-11-22T00:00:00Z,17
Markus Söder,Markus Lanz 19.06.2024,2024-06-19T00:00:00Z,17
Tim Mälzer,Markus Lanz 04.09.2008,2008-09-04T00:00:00Z,16
Tim Mälzer,Markus Lanz 10.02.2010,2010-02-10T00:00:00Z,16
Tim Mälzer,Markus Lanz 09.12.2010,2010-12-09T00:00:00Z,16
Tim Mälzer,Markus Lanz 12.10.2011,2011-10-12T00:00:00Z,16
Tim Mälzer,Markus Lanz 23.05.2012,2012-05-23T00:00:00Z,16
Tim Mälzer,Markus Lanz 01.11.2012,2012-11-01T00:00:00Z,16
Tim Mälzer,Markus Lanz 20.11.2013,2013-11-20T00:00:00Z,16
Tim Mälzer,Markus Lanz 24.06.2014,2014-06-24T00:00:00Z,16
Tim Mälzer,Markus Lanz 08.10.2014,2014-10-08T00:00:00Z,16
Tim Mälzer,Markus Lanz 10.02.2015,2015-02-10T00:00:00Z,16
Tim Mälzer,Markus Lanz 03.03.2016,2016-03-03T00:00:00Z,16
Tim Mälzer,Markus Lanz 15.12.2016,2016-12-15T00:00:00Z,16
Tim Mälzer,Markus Lanz 10.10.2018,2018-10-10T00:00:00Z,16
Tim Mälzer,Markus Lanz 05.12.2019,2019-12-05T00:00:00Z,16
Tim Mälzer,Markus Lanz 05.05.2020,2020-05-05T00:00:00Z,16
Tim Mälzer,Markus Lanz 20.10.2020,2020-10-20T00:00:00Z,16
Nikolaus Blome,Markus Lanz 15.05.2012,2012-05-15T00:00:00Z,15
Nikolaus Blome,Markus Lanz 23.05.2013,2013-05-23T00:00:00Z,15
Ewald Lienen,Markus Lanz 02.10.2013,2013-10-02T00:00:00Z,15
Nikolaus Blome,Markus Lanz 29.05.2014,2014-05-29T00:00:00Z,15
Ewald Lienen,Markus Lanz 24.06.2014,2014-06-24T00:00:00Z,15
Ewald Lienen,Markus Lanz 26.05.2015,2015-05-26T00:00:00Z,15
Nikolaus Blome,Markus Lanz 17.06.2015,2015-06-17T00:00:00Z,15
Ewald Lienen,Markus Lanz 21.10.2015,2015-10-21T00:00:00Z,15
Boris Palmer,Markus Lanz 27.10.2015,2015-10-27T00:00:00Z,15
Nikolaus Blome,Markus Lanz 14.01.2016,2016-01-14T00:00:00Z,15
Nikolaus Blome,Markus Lanz 23.02.2016,2016-02-23T00:00:00Z,15
Boris Palmer,Markus Lanz 30.08.2016,2016-08-30T00:00:00Z,15
Nikolaus Blome,Markus Lanz 12.10.2016,2016-10-12T00:00:00Z,15
Nikolaus Blome,Markus Lanz 01.06.2017,2017-06-01T00:00:00Z,15
Ewald Lienen,Markus Lanz 23.08.2017,2017-08-23T00:00:00Z,15
Ewald Lienen,Markus Lanz 01.11.2017,2017-11-01T00:00:00Z,15
Boris Palmer,Markus Lanz 16.11.2017,2017-11-16T00:00:00Z,15
Nikolaus Blome,Markus Lanz 05.12.2017,2017-12-05T00:00:00Z,15
Nikolaus Blome,Markus Lanz 01.02.2018,2018-02-01T00:00:00Z,15
Ewald Lienen,Markus Lanz 03.04.2018,2018-04-03T00:00:00Z,15
Ewald Lienen,Markus Lanz 06.09.2018,2018-09-06T00:00:00Z,15
Nikolaus Blome,Markus Lanz 13.03.2019,2019-03-13T00:00:00Z,15
Ewald Lienen,Markus Lanz 27.03.2019,2019-03-27T00:00:00Z,15
Boris Palmer,Markus Lanz 18.04.2019,2019-04-18T00:00:00Z,15
Boris Palmer,Markus Lanz 26.09.2019,2019-09-26T00:00:00Z,15
Omid Nouripour,Markus Lanz 14.01.2020,2020-01-14T00:00:00Z,15
Omid Nouripour,Markus Lanz 20.02.2020,2020-02-20T00:00:00Z,15
Omid Nouripour,Markus Lanz 27.05.2020,2020-05-27T00:00:00Z,15
Boris Palmer,Markus Lanz 26.08.2020,2020-08-26T00:00:00Z,15
Boris Palmer,Markus Lanz 11.11.2020,2020-11-11T00:00:00Z,15
Boris Palmer,Markus Lanz 30.03.2021,2021-03-30T00:00:00Z,15
Boris Palmer,Markus Lanz 27.04.2021,2021-04-27T00:00:00Z,15
Omid Nouripour,Markus Lanz 19.05.2021,2021-05-19T00:00:00Z,15
Ewald Lienen,Markus Lanz 15.06.2021,2021-06-15T00:00:00Z,15
Ewald Lienen,Markus Lanz 17.06.2021,2021-06-17T00:00:00Z,15
Ewald Lienen,Markus Lanz 23.06.2021,2021-06-23T00:00:00Z,15
Ewald Lienen,Markus Lanz 07.07.2021,2021-07-07T00:00:00Z,15
Omid Nouripour,Markus Lanz 24.08.2021,2021-08-24T00:00:00Z,15
Omid Nouripour,Markus Lanz 29.09.2021,2021-09-29T00:00:00Z,15
Ewald Lienen,Markus Lanz 03.11.2021,2021-11-03T00:00:00Z,15
Omid Nouripour,Markus Lanz 02.12.2021,2021-12-02T00:00:00Z,15
Omid Nouripour,Markus Lanz 01.02.2022,2022-02-01T00:00:00Z,15
Omid Nouripour,Markus Lanz 03.03.2022,2022-03-03T00:00:00Z,15
Omid Nouripour,Markus Lanz 27.04.2022,2022-04-27T00:00:00Z,15
Omid Nouripour,Markus Lanz 09.06.2022,2022-06-09T00:00:00Z,15
Boris Palmer,Markus Lanz 06.09.2022,2022-09-06T00:00:00Z,15
Boris Palmer,Markus Lanz 10.11.2022,2022-11-10T00:00:00Z,15
Nikolaus Blome,Markus Lanz 17.01.2023,2023-01-17T00:00:00Z,15
Omid Nouripour,Markus Lanz 25.01.2023,2023-01-25T00:00:00Z,15
Boris Palmer,Markus Lanz 16.02.2023,2023-02-16T00:00:00Z,15
Boris Palmer,Markus Lanz 31.08.2023,2023-08-31T00:00:00Z,15
Omid Nouripour,Markus Lanz 07.11.2023,2023-11-07T00:00:00Z,15
Nikolaus Blome,Markus Lanz 05.12.2023,2023-12-05T00:00:00Z,15
Omid Nouripour,Markus Lanz 14.03.2024,2024-03-14T00:00:00Z,15
Nikolaus Blome,Markus Lanz 09.04.2024,2024-04-09T00:00:00Z,15
Boris Palmer,Markus Lanz 23.04.2024,2024-04-23T00:00:00Z,15
Omid Nouripour,Markus Lanz 06.06.2024,2024-06-06T00:00:00Z,15
Ewald Lienen,Markus Lanz 25.06.2024,2024-06-25T00:00:00Z,15
Boris Palmer,Markus Lanz 15.10.2024,2024-10-15T00:00:00Z,15
Nikolaus Blome,Markus Lanz 10.12.2024,2024-12-10T00:00:00Z,15
Interview Markus Lanz,Markus Lanz 03.06.2008,2008-06-03T00:00:00Z,14
Ulrich Wickert,Markus Lanz 02.07.2009,2009-07-02T00:00:00Z,14
Ranga Yogeshwar,Markus Lanz 14.07.2009,2009-07-14T00:00:00Z,14
Interview Markus Lanz,Markus Lanz 22.07.2009,2009-07-22T00:00:00Z,14
Ulrich Wickert,Markus Lanz 04.08.2009,2009-08-04T00:00:00Z,14
Jochen Busse,Markus Lanz 13.08.2009,2009-08-13T00:00:00Z,14
Atze Schröder,Markus Lanz 25.08.2009,2009-08-25T00:00:00Z,14
Ranga Yogeshwar,Markus Lanz 07.10.2009,2009-10-07T00:00:00Z,14
Atze Schröder,Markus Lanz 11.11.2009,2009-11-11T00:00:00Z,14
Interview Markus Lanz,Markus Lanz 19.11.2009,2009-11-19T00:00:00Z,14
Ulrich Wickert,Markus Lanz 11.05.2010,2010-05-11T00:00:00Z,14
Atze Schröder,Markus Lanz 18.05.2010,2010-05-18T00:00:00Z,14
Ulrich Wickert,Markus Lanz 02.09.2010,2010-09-02T00:00:00Z,14
Interview Markus Lanz,Markus Lanz 14.10.2010,2010-10-14T00:00:00Z,14
Jochen Busse,Markus Lanz 14.10.2010,2010-10-14T00:00:00Z,14
Interview Markus Lanz,Markus Lanz 20.10.2010,2010-10-20T00:00:00Z,14
Atze Schröder,Markus Lanz 23.11.2010,2010-11-23T00:00:00Z,14
Ranga Yogeshwar,Markus Lanz 09.12.2010,2010-12-09T00:00:00Z,14
Atze Schröder,Markus Lanz 02.02.2011,2011-02-02T00:00:00Z,14
Jochen Busse,Markus Lanz 10.03.2011,2011-03-10T00:00:00Z,14
Interview Markus Lanz,Markus Lanz 18.08.2011,2011-08-18T00:00:00Z,14
Jochen Busse,Markus Lanz 18.08.2011,2011-08-18T00:00:00Z,14
Atze Schröder,Markus Lanz 04.10.2011,2011-10-04T00:00:00Z,14
Ulrich Wickert,Markus Lanz 27.10.2011,2011-10-27T00:00:00Z,14
Norbert Röttgen,Markus Lanz 30.11.2011,2011-11-30T00:00:00Z,14
Atze Schröder,Markus Lanz 15.12.2011,2011-12-15T00:00:00Z,14
Interview Markus Lanz,Markus Lanz 01.07.2012,2012-07-01T00:00:00Z,14
Jochen Busse,Markus Lanz 19.07.2012,2012-07-19T00:00:00Z,14
Ulrich Wickert,Markus Lanz 17.10.2012,2012-10-17T00:00:00Z,14
Jochen Busse,Markus Lanz 15.11.2012,2012-11-15T00:00:00Z,14
Atze Schröder,Markus Lanz 15.01.2013,2013-01-15T00:00:00Z,14
Jochen Busse,Markus Lanz 05.02.2013,2013-02-05T00:00:00Z,14
Interview Markus Lanz,Markus Lanz 06.03.2013,2013-03-06T00:00:00Z,14
Interview Markus Lanz,Markus Lanz 28.03.2013,2013-03-28T00:00:00Z,14
Interview Markus Lanz,Markus Lanz 24.04.2013,2013-04-24T00:00:00Z,14
Jochen Busse,Markus Lanz 02.07.2013,2013-07-02T00:00:00Z,14
Atze Schröder,Markus Lanz 17.09.2013,2013-09-17T00:00:00Z,14
Ulrich Wickert,Markus Lanz 17.09.2013,2013-09-17T00:00:00Z,14
Interview Markus Lanz,Markus Lanz 08.10.2013,2013-10-08T00:00:00Z,14
Sascha Lobo,Markus Lanz 29.10.2013,2013-10-29T00:00:00Z,14
Jochen Busse,Markus Lanz 19.11.2013,2013-11-19T00:00:00Z,14
Interview Markus Lanz,Markus Lanz 16.01.2014,2014-01-16T00:00:00Z,14
Ranga Yogeshwar,Markus Lanz 27.03.2014,2014-03-27T00:00:00Z,14
Interview Markus Lanz,Markus Lanz 22.05.2014,2014-05-22T00:00:00Z,14
Ton Interview Markus Lanz,Markus Lanz 29.05.2014,2014-05-29T00:00:00Z,14
Ulrich Wickert,Markus Lanz 29.05.2014,2014-05-29T00:00:00Z,14
Ton Interview Markus Lanz,Markus Lanz 24.07.2014,2014-07-24T00:00:00Z,14
Anton Hofreiter,Markus Lanz 20.11.2014,2014-11-20T00:00:00Z,14
Atze Schröder,Markus Lanz 20.11.2014,2014-11-20T00:00:00Z,14
Ton Interview Markus Lanz,Markus Lanz 25.11.2014,2014-11-25T00:00:00Z,14
Jochen Busse,Markus Lanz 28.01.2015,2015-01-28T00:00:00Z,14
Ulrich Wickert,Markus Lanz 15.09.2015,2015-09-15T00:00:00Z,14
Jochen Busse,Markus Lanz 26.11.2015,2015-11-26T00:00:00Z,14
Atze Schröder,Markus Lanz 01.12.2015,2015-12-01T00:00:00Z,14
Jochen Busse,Markus Lanz 03.02.2016,2016-02-03T00:00:00Z,14
Sascha Lobo,Markus Lanz 04.02.2016,2016-02-04T00:00:00Z,14
Jochen Busse,Markus Lanz 30.08.2016,2016-08-30T00:00:00Z,14
Ranga Yogeshwar,Markus Lanz 08.09.2016,2016-09-08T00:00:00Z,14
Atze Schröder,Markus Lanz 26.10.2016,2016-10-26T00:00:00Z,14
Anton Hofreiter,Markus Lanz 15.11.2016,2016-11-15T00:00:00Z,14
Ranga Yogeshwar,Markus Lanz 26.01.2017,2017-01-26T00:00:00Z,14
Ulrich Wickert,Markus Lanz 09.05.2017,2017-05-09T00:00:00Z,14
Jochen Busse,Markus Lanz 30.05.2017,2017-05-30T00:00:00Z,14
Ulrich Wickert,Markus Lanz 20.06.2017,2017-06-20T00:00:00Z,14
Atze Schröder,Markus Lanz 03.10.2017,2017-10-03T00:00:00Z,14
Ranga Yogeshwar,Markus Lanz 17.10.2017,2017-10-17T00:00:00Z,14
Ulrich Wickert,Markus Lanz 23.01.2018,2018-01-23T00:00:00Z,14
Anton Hofreiter,Markus Lanz 30.01.2018,2018-01-30T00:00:00Z,14
Norbert Röttgen,Markus Lanz 21.02.2018,2018-02-21T00:00:00Z,14
Ranga Yogeshwar,Markus Lanz 28.02.2018,2018-02-28T00:00:00Z,14
Ranga Yogeshwar,Markus Lanz 21.03.2018,2018-03-21T00:00:00Z,14
Ton Interview Markus Lanz,Markus Lanz 27.09.2018,2018-09-27T00:00:00Z,14
Anton Hofreiter,Markus Lanz 28.11.2018,2018-11-28T00:00:00Z,14
Marcel Fratzscher,Markus Lanz 16.01.2019,2019-01-16T00:00:00Z,14
Norbert Röttgen,Markus Lanz 27.02.2019,2019-02-27T00:00:00Z,14
Ulrich Wickert,Markus Lanz 16.04.2019,2019-04-16T00:00:00Z,14
Ranga Yogeshwar,Markus Lanz 16.05.2019,2019-05-16T00:00:00Z,14
Sascha Lobo,Markus Lanz 11.06.2019,2019-06-11T00:00:00Z,14
Ulrich Wickert,Markus Lanz 05.09.2019,2019-09-05T00:00:00Z,14
Sascha Lobo,Markus Lanz 10.09.2019,2019-09-10T00:00:00Z,14
Marcel Fratzscher,Markus Lanz 17.09.2019,2019-09-17T00:00:00Z,14
Ton Interview Markus Lanz,Markus Lanz 14.11.2019,2019-11-14T00:00:00Z,14
Sascha Lobo,Markus Lanz 28.11.2019,2019-11-28T00:00:00Z,14
Ranga Yogeshwar,Markus Lanz 23.01.2020,2020-01-23T00:00:00Z,14
Ton Interview Markus Lanz,Markus Lanz 04.02.2020,2020-02-04T00:00:00Z,14
Atze Schröder,Markus Lanz 06.02.2020,2020-02-06T00:00:00Z,14
Marcel Fratzscher,Markus Lanz 12.02.2020,2020-02-12T00:00:00Z,14
Marcel Fratzscher,Markus Lanz 18.03.2020,2020-03-18T00:00:00Z,14
Sascha Lobo,Markus Lanz 26.03.2020,2020-03-26T00:00:00Z,14
Marcel Fratzscher,Markus Lanz 31.03.2020,2020-03-31T00:00:00Z,14
Marcel Fratzscher,Markus Lanz 06.05.2020,2020-05-06T00:00:00Z,14
Ranga Yogeshwar,Markus Lanz 06.05.2020,2020-05-06T00:00:00Z,14
Norbert Röttgen,Markus Lanz 20.05.2020,2020-05-20T00:00:00Z,14
Ton Interview Markus Lanz,Markus Lanz 04.06.2020,2020-06-04T00:00:00Z,14
Ton Interview Markus Lanz,Markus Lanz 10.06.2020,2020-06-10T00:00:00Z,14
Anton Hofreiter,Markus Lanz 23.06.2020,2020-06-23T00:00:00Z,14
Ton Interview Markus Lanz,Markus Lanz 09.07.2020,2020-07-09T00:00:00Z,14
Ton Interview Markus Lanz,Markus Lanz 01.09.2020,2020-09-01T00:00:00Z,14
Ton Interview Markus Lanz,Markus Lanz 02.09.2020,2020-09-02T00:00:00Z,14
Interview Markus Lanz,Markus Lanz 19.11.2020,2020-11-19T00:00:00Z,14
Sascha Lobo,Markus Lanz 09.03.2021,2021-03-09T00:00:00Z,14
Agnes Strack-Zimmermann,Markus Lanz 09.06.2021,2021-06-09T00:00:00Z,14
Sascha Lobo,Markus Lanz 30.06.2021,2021-06-30T00:00:00Z,14
Agnes Strack-Zimmermann,Markus Lanz 26.08.2021,2021-08-26T00:00:00Z,14
Marcel Fratzscher,Markus Lanz 16.09.2021,2021-09-16T00:00:00Z,14
Agnes Strack-Zimmermann,Markus Lanz 28.09.2021,2021-09-28T00:00:00Z,14
Agnes Strack-Zimmermann,Markus Lanz 20.10.2021,2021-10-20T00:00:00Z,14
Marcel Fratzscher,Markus Lanz 04.11.2021,2021-11-04T00:00:00Z,14
Ton Interview Markus Lanz,Markus Lanz - Das Jahr 2021,2021-12-15T00:00:00Z,14
Agnes Strack-Zimmermann,Markus Lanz 03.02.2022,2022-02-03T00:00:00Z,14
Norbert Röttgen,Markus Lanz 17.02.2022,2022-02-17T00:00:00Z,14
Norbert Röttgen,Markus Lanz 24.02.2022,2022-02-24T00:00:00Z,14
Agnes Strack-Zimmermann,Markus Lanz 08.03.2022,2022-03-08T00:00:00Z,14
Marcel Fratzscher,Markus Lanz 15.03.2022,2022-03-15T00:00:00Z,14
Anton Hofreiter,Markus Lanz 07.04.2022,2022-04-07T00:00:00Z,14
Agnes Strack-Zimmermann,Markus Lanz 19.04.2022,2022-04-19T00:00:00Z,14
Norbert Röttgen,Markus Lanz 04.05.2022,2022-05-04T00:00:00Z,14
Anton Hofreiter,Markus Lanz 10.05.2022,2022-05-10T00:00:00Z,14
Sascha Lobo,Markus Lanz 26.05.2022,2022-05-26T00:00:00Z,14
Marcel Fratzscher,Markus Lanz 31.05.2022,2022-05-31T00:00:00Z,14
Norbert Röttgen,Markus Lanz 31.05.2022,2022-05-31T00:00:00Z,14
Agnes Strack-Zimmermann,Markus Lanz 02.06.2022,2022-06-02T00:00:00Z,14
Agnes Strack-Zimmermann,Markus Lanz 17.08.2022,2022-08-17T00:00:00Z,14
Anton Hofreiter,Markus Lanz 25.08.2022,2022-08-25T00:00:00Z,14
Ranga Yogeshwar,Markus Lanz 06.09.2022,2022-09-06T00:00:00Z,14
Agnes Strack-Zimmermann,Markus Lanz 27.09.2022,2022-09-27T00:00:00Z,14
Agnes Strack-Zimmermann,Markus Lanz 08.11.2022,2022-11-08T00:00:00Z,14
Sascha Lobo,Markus Lanz 16.11.2022,2022-11-16T00:00:00Z,14
Norbert Röttgen,Markus Lanz 23.11.2022,2022-11-23T00:00:00Z,14
Agnes Strack-Zimmermann,Markus Lanz - Das Jahr 2022,2022-12-15T00:00:00Z,14
Marcel Fratzscher,Markus Lanz 10.01.2023,2023-01-10T00:00:00Z,14
Agnes Strack-Zimmermann,Markus Lanz 17.01.2023,2023-01-17T00:00:00Z,14
Anton Hofreiter,Markus Lanz 18.01.2023,2023-01-18T00:00:00Z,14
Norbert Röttgen,Markus Lanz 23.02.2023,2023-02-23T00:00:00Z,14
Sascha Lobo,Markus Lanz 09.03.2023,2023-03-09T00:00:00Z,14
Anton Hofreiter,Markus Lanz 21.03.2023,2023-03-21T00:00:00Z,14
Ranga Yogeshwar,Markus Lanz 19.04.2023,2023-04-19T00:00:00Z,14
Marcel Fratzscher,Markus Lanz 02.05.2023,2023-05-02T00:00:00Z,14
Norbert Röttgen,Markus Lanz 09.05.2023,2023-05-09T00:00:00Z,14
Anton Hofreiter,Markus Lanz 23.08.2023,2023-08-23T00:00:00Z,14
Sascha Lobo,Markus Lanz 03.10.2023,2023-10-03T00:00:00Z,14
Norbert Röttgen,Markus Lanz 05.10.2023,2023-10-05T00:00:00Z,14
Marcel Fratzscher,Markus Lanz 07.12.2023,2023-12-07T00:00:00Z,14
Anton Hofreiter,Markus Lanz 09.01.2024,2024-01-09T00:00:00Z,14
Norbert Röttgen,Markus Lanz 31.01.2024,2024-01-31T00:00:00Z,14
Sascha Lobo,Markus Lanz 11.04.2024,2024-04-11T00:00:00Z,14
Marcel Fratzscher,Markus Lanz 25.04.2024,2024-04-25T00:00:00Z,14
Anton Hofreiter,Markus Lanz 11.06.2024,2024-06-11T00:00:00Z,14
Sascha Lobo,Markus Lanz 18.06.2024,2024-06-18T00:00:00Z,14
Agnes Strack-Zimmermann,Markus Lanz 26.06.2024,2024-06-26T00:00:00Z,14
Anton Hofreiter,Markus Lanz 19.09.2024,2024-09-19T00:00:00Z,14
Norbert Röttgen,Markus Lanz 17.10.2024,2024-10-17T00:00:00Z,14
Ton Interview Markus Lanz,Markus Lanz 29.10.2024,2024-10-29T00:00:00Z,14
Ton Interview Markus Lanz,Markus Lanz 27.11.2024,2024-11-27T00:00:00Z,14
Steffen Henssler,Markus Lanz 19.08.2008,2008-08-19T00:00:00Z,13
Reinhold Beckmann,Markus Lanz 03.09.2008,2008-09-03T00:00:00Z,13
Steffen Henssler,Markus Lanz 18.06.2009,2009-06-18T00:00:00Z,13
Michael Roth,Markus Lanz 14.07.2009,2009-07-14T00:00:00Z,13
Til Schweiger,Markus Lanz 20.08.2009,2009-08-20T00:00:00Z,13
Steffen Henssler,Markus Lanz 21.10.2009,2009-10-21T00:00:00Z,13
Michael Roth,Markus Lanz 22.10.2009,2009-10-22T00:00:00Z,13
Waldemar Hartmann,Markus Lanz 05.11.2009,2009-11-05T00:00:00Z,13
Til Schweiger,Markus Lanz 10.12.2009,2009-12-10T00:00:00Z,13
Steffen Henssler,Markus Lanz 27.01.2010,2010-01-27T00:00:00Z,13
Steffen Henssler,Markus Lanz 09.03.2010,2010-03-09T00:00:00Z,13
Micky Beisenherz,Markus Lanz 18.05.2010,2010-05-18T00:00:00Z,13
Ferdinand Von,Markus Lanz 04.08.2010,2010-08-04T00:00:00Z,13
Steffen Henssler,Markus Lanz 12.08.2010,2010-08-12T00:00:00Z,13
Til Schweiger,Markus Lanz 01.02.2011,2011-02-01T00:00:00Z,13
Til Schweiger,Markus Lanz 16.03.2011,2011-03-16T00:00:00Z,13
Steffen Henssler,Markus Lanz 22.03.2011,2011-03-22T00:00:00Z,13
Ulrich Kienzle,Markus Lanz 23.03.2011,2011-03-23T00:00:00Z,13
Oliver Pocher,Markus Lanz 12.05.2011,2011-05-12T00:00:00Z,13
Gregor Gysi,Markus Lanz 06.10.2011,2011-10-06T00:00:00Z,13
Ulrich Kienzle,Markus Lanz 09.11.2011,2011-11-09T00:00:00Z,13
Oliver Pocher,Markus Lanz 24.01.2012,2012-01-24T00:00:00Z,13
Micky Beisenherz,Markus Lanz 01.02.2012,2012-02-01T00:00:00Z,13
Steffen Henssler,Markus Lanz 15.02.2012,2012-02-15T00:00:00Z,13
Waldemar Hartmann,Markus Lanz 29.02.2012,2012-02-29T00:00:00Z,13
Andrea Kaiser,Markus Lanz 20.03.2012,2012-03-20T00:00:00Z,13
Andrea Kaiser,Markus Lanz 13.06.2012,2012-06-13T00:00:00Z,13
Oliver Pocher,Markus Lanz 13.06.2012,2012-06-13T00:00:00Z,13
Andrea Kaiser,Markus Lanz 19.06.2012,2012-06-19T00:00:00Z,13
Andrea Kaiser,Markus Lanz 01.07.2012,2012-07-01T00:00:00Z,13
Gregor Gysi,Markus Lanz 17.07.2012,2012-07-17T00:00:00Z,13
Micky Beisenherz,Markus Lanz 04.09.2012,2012-09-04T00:00:00Z,13
Andrea Kaiser,Markus Lanz 03.10.2012,2012-10-03T00:00:00Z,13
Andrea Kaiser,Markus Lanz 07.11.2012,2012-11-07T00:00:00Z,13
Oliver Pocher,Markus Lanz 14.11.2012,2012-11-14T00:00:00Z,13
Oliver Pocher,Markus Lanz 16.01.2013,2013-01-16T00:00:00Z,13
Micky Beisenherz,Markus Lanz 12.02.2013,2013-02-12T00:00:00Z,13
Til Schweiger,Markus Lanz 12.02.2013,2013-02-12T00:00:00Z,13
Steffen Henssler,Markus Lanz 26.02.2013,2013-02-26T00:00:00Z,13
Waldemar Hartmann,Markus Lanz 13.03.2013,2013-03-13T00:00:00Z,13
Andrea Kaiser,Markus Lanz 03.04.2013,2013-04-03T00:00:00Z,13
Oliver Pocher,Markus Lanz 03.04.2013,2013-04-03T00:00:00Z,13
Micky Beisenherz,Markus Lanz 10.04.2013,2013-04-10T00:00:00Z,13
Ulrich Kienzle,Markus Lanz 15.05.2013,2013-05-15T00:00:00Z,13
Gregor Gysi,Markus Lanz 06.06.2013,2013-06-06T00:00:00Z,13
Ulrich Kienzle,Markus Lanz 18.06.2013,2013-06-18T00:00:00Z,13
Til Schweiger,Markus Lanz 19.09.2013,2013-09-19T00:00:00Z,13
Ferdinand Von,Markus Lanz 29.10.2013,2013-10-29T00:00:00Z,13
Waldemar Hartmann,Markus Lanz 26.11.2013,2013-11-26T00:00:00Z,13
Oliver Pocher,Markus Lanz 05.12.2013,2013-12-05T00:00:00Z,13
Micky Beisenherz,Markus Lanz 05.02.2014,2014-02-05T00:00:00Z,13
Reinhold Beckmann,Markus Lanz 01.04.2014,2014-04-01T00:00:00Z,13
Andrea Kaiser,Markus Lanz 08.04.2014,2014-04-08T00:00:00Z,13
Micky Beisenherz,Markus Lanz 29.04.2014,2014-04-29T00:00:00Z,13
Ulrich Kienzle,Markus Lanz 03.07.2014,2014-07-03T00:00:00Z,13
Ferdinand Von,Markus Lanz 26.08.2014,2014-08-26T00:00:00Z,13
Ulrich Kienzle,Markus Lanz 26.08.2014,2014-08-26T00:00:00Z,13
Michael Roth,Markus Lanz 28.10.2014,2014-10-28T00:00:00Z,13
Gregor Gysi,Markus Lanz 09.12.2014,2014-12-09T00:00:00Z,13
Steffen Henssler,Markus Lanz 14.01.2015,2015-01-14T00:00:00Z,13
Til Schweiger,Markus Lanz 15.01.2015,2015-01-15T00:00:00Z,13
Micky Beisenherz,Markus Lanz 05.02.2015,2015-02-05T00:00:00Z,13
Waldemar Hartmann,Markus Lanz 12.02.2015,2015-02-12T00:00:00Z,13
Reinhold Beckmann,Markus Lanz 19.02.2015,2015-02-19T00:00:00Z,13
Andrea Kaiser,Markus Lanz 11.03.2015,2015-03-11T00:00:00Z,13
Til Schweiger,Markus Lanz 17.03.2015,2015-03-17T00:00:00Z,13
Oliver Pocher,Markus Lanz 21.04.2015,2015-04-21T00:00:00Z,13
Micky Beisenherz,Markus Lanz 02.06.2015,2015-06-02T00:00:00Z,13
Oliver Pocher,Markus Lanz 11.06.2015,2015-06-11T00:00:00Z,13
Micky Beisenherz,Markus Lanz 20.08.2015,2015-08-20T00:00:00Z,13
Reinhold Beckmann,Markus Lanz 26.08.2015,2015-08-26T00:00:00Z,13
Steffen Henssler,Markus Lanz 01.10.2015,2015-10-01T00:00:00Z,13
Reinhold Beckmann,Markus Lanz 03.11.2015,2015-11-03T00:00:00Z,13
Oliver Pocher,Markus Lanz 10.11.2015,2015-11-10T00:00:00Z,13
Reinhold Beckmann,Markus Lanz 10.11.2015,2015-11-10T00:00:00Z,13
Ulrich Kienzle,Markus Lanz 19.11.2015,2015-11-19T00:00:00Z,13
Andrea Kaiser,Markus Lanz 25.11.2015,2015-11-25T00:00:00Z,13
Oliver Pocher,Markus Lanz 25.11.2015,2015-11-25T00:00:00Z,13
Gregor Gysi,Markus Lanz 26.11.2015,2015-11-26T00:00:00Z,13
Ferdinand Von,Markus Lanz 10.12.2015,2015-12-10T00:00:00Z,13
Steffen Henssler,Markus Lanz 14.01.2016,2016-01-14T00:00:00Z,13
Sebastian Fiedler,Markus Lanz 27.01.2016,2016-01-27T00:00:00Z,13
Reinhold Beckmann,Markus Lanz 28.01.2016,2016-01-28T00:00:00Z,13
Til Schweiger,Markus Lanz 04.02.2016,2016-02-04T00:00:00Z,13
Ulrich Kienzle,Markus Lanz 10.02.2016,2016-02-10T00:00:00Z,13
Waldemar Hartmann,Markus Lanz 24.02.2016,2016-02-24T00:00:00Z,13
Micky Beisenherz,Markus Lanz 25.02.2016,2016-02-25T00:00:00Z,13
Waldemar Hartmann,Markus Lanz 03.05.2016,2016-05-03T00:00:00Z,13
Ulrich Kienzle,Markus Lanz 10.05.2016,2016-05-10T00:00:00Z,13
Andrea Kaiser,Markus Lanz 17.05.2016,2016-05-17T00:00:00Z,13
Oliver Pocher,Markus Lanz 15.06.2016,2016-06-15T00:00:00Z,13
Waldemar Hartmann,Markus Lanz 16.06.2016,2016-06-16T00:00:00Z,13
Andrea Kaiser,Markus Lanz 07.07.2016,2016-07-07T00:00:00Z,13
Waldemar Hartmann,Markus Lanz 07.07.2016,2016-07-07T00:00:00Z,13
Sebastian Fiedler,Markus Lanz 11.10.2016,2016-10-11T00:00:00Z,13
Gregor Gysi,Markus Lanz 31.01.2017,2017-01-31T00:00:00Z,13
Waldemar Hartmann,Markus Lanz 15.02.2017,2017-02-15T00:00:00Z,13
Ulrich Kienzle,Markus Lanz 13.04.2017,2017-04-13T00:00:00Z,13
Til Schweiger,Markus Lanz 18.04.2017,2017-04-18T00:00:00Z,13
Ulrich Kienzle,Markus Lanz 11.05.2017,2017-05-11T00:00:00Z,13
Reinhold Beckmann,Markus Lanz 06.06.2017,2017-06-06T00:00:00Z,13
Gregor Gysi,Markus Lanz 06.07.2017,2017-07-06T00:00:00Z,13
Waldemar Hartmann,Markus Lanz 13.09.2017,2017-09-13T00:00:00Z,13
Andrea Kaiser,Markus Lanz 18.10.2017,2017-10-18T00:00:00Z,13
Steffen Henssler,Markus Lanz 01.11.2017,2017-11-01T00:00:00Z,13
Ulrich Kienzle,Markus Lanz 07.11.2017,2017-11-07T00:00:00Z,13
Gregor Gysi,Markus Lanz 25.01.2018,2018-01-25T00:00:00Z,13
Til Schweiger,Markus Lanz 31.01.2018,2018-01-31T00:00:00Z,13
Micky Beisenherz,Markus Lanz 20.02.2018,2018-02-20T00:00:00Z,13
Ferdinand Von,Markus Lanz 07.03.2018,2018-03-07T00:00:00Z,13
Reinhold Beckmann,Markus Lanz 07.03.2018,2018-03-07T00:00:00Z,13
Waldemar Hartmann,Markus Lanz 13.03.2018,2018-03-13T00:00:00Z,13
Waldemar Hartmann,Markus Lanz 19.06.2018,2018-06-19T00:00:00Z,13
Reinhold Beckmann,Markus Lanz 20.06.2018,2018-06-20T00:00:00Z,13
Ulrich Kienzle,Markus Lanz 21.06.2018,2018-06-21T00:00:00Z,13
Reinhold Beckmann,Markus Lanz 05.09.2018,2018-09-05T00:00:00Z,13
Til Schweiger,Markus Lanz 19.09.2018,2018-09-19T00:00:00Z,13
Ferdinand Von,Markus Lanz 27.02.2019,2019-02-27T00:00:00Z,13
Micky Beisenherz,Markus Lanz 11.04.2019,2019-04-11T00:00:00Z,13
Oliver Pocher,Markus Lanz 07.05.2019,2019-05-07T00:00:00Z,13
Sebastian Fiedler,Markus Lanz 15.08.2019,2019-08-15T00:00:00Z,13
Ferdinand Von,Markus Lanz 12.09.2019,2019-09-12T00:00:00Z,13
Gregor Gysi,Markus Lanz 08.01.2020,2020-01-08T00:00:00Z,13
Til Schweiger,Markus Lanz 22.01.2020,2020-01-22T00:00:00Z,13
Anja Maier,Markus Lanz 11.02.2020,2020-02-11T00:00:00Z,13
Sebastian Fiedler,Markus Lanz 20.02.2020,2020-02-20T00:00:00Z,13
Sebastian Fiedler,Markus Lanz 25.03.2020,2020-03-25T00:00:00Z,13
Sebastian Fiedler,Markus Lanz 19.05.2020,2020-05-19T00:00:00Z,13
Ferdinand Von,Markus Lanz 28.05.2020,2020-05-28T00:00:00Z,13
Sebastian Fiedler,Markus Lanz 09.06.2020,2020-06-09T00:00:00Z,13
Anja Maier,Markus Lanz 03.09.2020,2020-09-03T00:00:00Z,13
Ferdinand Von,Markus Lanz 10.09.2020,2020-09-10T00:00:00Z,13
Sebastian Fiedler,Markus Lanz 22.09.2020,2020-09-22T00:00:00Z,13
Anja Maier,Markus Lanz 11.11.2020,2020-11-11T00:00:00Z,13
Anja Maier,Markus Lanz 14.01.2021,2021-01-14T00:00:00Z,13
Anja Maier,Markus Lanz 01.04.2021,2021-04-01T00:00:00Z,13
Ferdinand Von,Markus Lanz 14.04.2021,2021-04-14T00:00:00Z,13
Anja Maier,Markus Lanz 27.04.2021,2021-04-27T00:00:00Z,13
Ulrike Herrmann,Markus Lanz 11.05.2021,2021-05-11T00:00:00Z,13
Ferdinand Von,Markus Lanz 13.05.2021,2021-05-13T00:00:00Z,13
Anja Maier,Markus Lanz 10.06.2021,2021-06-10T00:00:00Z,13
Ulrike Herrmann,Markus Lanz 15.06.2021,2021-06-15T00:00:00Z,13
Anja Maier,Markus Lanz 13.07.2021,2021-07-13T00:00:00Z,13
Anja Maier,Markus Lanz 28.10.2021,2021-10-28T00:00:00Z,13
Anja Maier,Markus Lanz 18.11.2021,2021-11-18T00:00:00Z,13
Ulrike Herrmann,Markus Lanz 14.12.2021,2021-12-14T00:00:00Z,13
Gregor Gysi,Markus Lanz 06.01.2022,2022-01-06T00:00:00Z,13
Gregor Gysi,Markus Lanz 23.02.2022,2022-02-23T00:00:00Z,13
Sebastian Fiedler,Markus Lanz 23.03.2022,2022-03-23T00:00:00Z,13
Michael Roth,Markus Lanz 30.03.2022,2022-03-30T00:00:00Z,13
Ulrike Herrmann,Markus Lanz 21.04.2022,2022-04-21T00:00:00Z,13
Ulrike Herrmann,Markus Lanz 26.05.2022,2022-05-26T00:00:00Z,13
Anja Maier,Markus Lanz 01.06.2022,2022-06-01T00:00:00Z,13
Ulrike Herrmann,Markus Lanz 07.06.2022,2022-06-07T00:00:00Z,13
Michael Roth,Markus Lanz 23.08.2022,2022-08-23T00:00:00Z,13
Ferdinand Von,Markus Lanz 25.08.2022,2022-08-25T00:00:00Z,13
Anja Maier,Markus Lanz 30.08.2022,2022-08-30T00:00:00Z,13
Ulrike Herrmann,Markus Lanz 08.09.2022,2022-09-08T00:00:00Z,13
Anja Maier,Markus Lanz 18.10.2022,2022-10-18T00:00:00Z,13
Ulrike Herrmann,Markus Lanz 01.12.2022,2022-12-01T00:00:00Z,13
Michael Roth,Markus Lanz 24.01.2023,2023-01-24T00:00:00Z,13
Ulrike Herrmann,Markus Lanz 24.01.2023,2023-01-24T00:00:00Z,13
Sebastian Fiedler,Markus Lanz 23.03.2023,2023-03-23T00:00:00Z,13
Michael Roth,Markus Lanz 18.05.2023,2023-05-18T00:00:00Z,13
Ulrike Herrmann,Markus Lanz 23.05.2023,2023-05-23T00:00:00Z,13
Sebastian Fiedler,Markus Lanz 28.06.2023,2023-06-28T00:00:00Z,13
Michael Roth,Markus Lanz 05.07.2023,2023-07-05T00:00:00Z,13
Ferdinand Von,Markus Lanz 24.08.2023,2023-08-24T00:00:00Z,13
Reinhold Beckmann,Markus Lanz 29.08.2023,2023-08-29T00:00:00Z,13
Michael Roth,Markus Lanz 31.08.2023,2023-08-31T00:00:00Z,13
Gregor Gysi,Markus Lanz 28.09.2023,2023-09-28T00:00:00Z,13
Michael Roth,Markus Lanz 11.10.2023,2023-10-11T00:00:00Z,13
Michael Roth,Markus Lanz 14.11.2023,2023-11-14T00:00:00Z,13
Sebastian Fiedler,Markus Lanz 07.03.2024,2024-03-07T00:00:00Z,13
Gregor Gysi,Markus Lanz 19.03.2024,2024-03-19T00:00:00Z,13
Ulrike Herrmann,Markus Lanz 20.03.2024,2024-03-20T00:00:00Z,13
Sebastian Fiedler,Markus Lanz 10.04.2024,2024-04-10T00:00:00Z,13
Ulrike Herrmann,Markus Lanz 12.06.2024,2024-06-12T00:00:00Z,13
Reinhold Beckmann,Markus Lanz 09.07.2024,2024-07-09T00:00:00Z,13
Michael Roth,Markus Lanz 11.07.2024,2024-07-11T00:00:00Z,13
Ulrike Herrmann,Markus Lanz 01.10.2024,2024-10-01T00:00:00Z,13
Michael Roth,Markus Lanz 15.10.2024,2024-10-15T00:00:00Z,13
Alfons Schuhbeck,Markus Lanz 17.07.2008,2008-07-17T00:00:00Z,12
Hannes Jaenicke,Markus Lanz 12.08.2008,2008-08-12T00:00:00Z,12
Alfons Schuhbeck,Markus Lanz 19.08.2008,2008-08-19T00:00:00Z,12
Alfons Schuhbeck,Markus Lanz 12.08.2009,2009-08-12T00:00:00Z,12
Reiner Calmund,Markus Lanz 13.08.2009,2009-08-13T00:00:00Z,12
Hannes Jaenicke,Markus Lanz 25.08.2009,2009-08-25T00:00:00Z,12
Hannes Jaenicke,Markus Lanz 29.10.2009,2009-10-29T00:00:00Z,12
Alfons Schuhbeck,Markus Lanz 25.11.2009,2009-11-25T00:00:00Z,12
Alfons Schuhbeck,Markus Lanz 11.03.2010,2010-03-11T00:00:00Z,12
Hannes Jaenicke,Markus Lanz 09.09.2010,2010-09-09T00:00:00Z,12
Edmund Stoiber,Markus Lanz 15.09.2010,2010-09-15T00:00:00Z,12
Wolf Von,Markus Lanz 02.03.2011,2011-03-02T00:00:00Z,12
Hannes Jaenicke,Markus Lanz 30.03.2011,2011-03-30T00:00:00Z,12
Walter Kohl,Markus Lanz 31.03.2011,2011-03-31T00:00:00Z,12
Wolf Von,Markus Lanz 03.05.2011,2011-05-03T00:00:00Z,12
Walter Kohl,Markus Lanz 30.06.2011,2011-06-30T00:00:00Z,12
Reiner Calmund,Markus Lanz 12.10.2011,2011-10-12T00:00:00Z,12
Alfons Schuhbeck,Markus Lanz 26.10.2011,2011-10-26T00:00:00Z,12
Wolf Von,Markus Lanz 12.01.2012,2012-01-12T00:00:00Z,12
Walter Kohl,Markus Lanz 21.02.2012,2012-02-21T00:00:00Z,12
Wolf Von,Markus Lanz 02.05.2012,2012-05-02T00:00:00Z,12
Jörg Wontorra,Markus Lanz 14.06.2012,2012-06-14T00:00:00Z,12
Reiner Calmund,Markus Lanz 21.06.2012,2012-06-21T00:00:00Z,12
Edmund Stoiber,Markus Lanz 18.10.2012,2012-10-18T00:00:00Z,12
Edmund Stoiber,Markus Lanz 19.02.2013,2013-02-19T00:00:00Z,12
Alfons Schuhbeck,Markus Lanz 28.02.2013,2013-02-28T00:00:00Z,12
Walter Kohl,Markus Lanz 28.02.2013,2013-02-28T00:00:00Z,12
Walter Kohl,Markus Lanz im Interview mit Peter Kohl und Walter Kohl,2013-03-01T00:00:00Z,12
Reiner Calmund,Markus Lanz 24.04.2013,2013-04-24T00:00:00Z,12
Hannes Jaenicke,Markus Lanz 28.05.2013,2013-05-28T00:00:00Z,12
Walter Kohl,Markus Lanz 30.05.2013,2013-05-30T00:00:00Z,12
Wolf Von,Markus Lanz 19.06.2013,2013-06-19T00:00:00Z,12
Jörg Wontorra,Markus Lanz 18.09.2013,2013-09-18T00:00:00Z,12
Edmund Stoiber,Markus Lanz 06.11.2013,2013-11-06T00:00:00Z,12
Alfons Schuhbeck,Markus Lanz 14.11.2013,2013-11-14T00:00:00Z,12
Reiner Calmund,Markus Lanz 12.03.2014,2014-03-12T00:00:00Z,12
Jörg Wontorra,Markus Lanz 19.03.2014,2014-03-19T00:00:00Z,12
Wolf Von,Markus Lanz 24.04.2014,2014-04-24T00:00:00Z,12
Reiner Calmund,Markus Lanz 26.06.2014,2014-06-26T00:00:00Z,12
Reiner Calmund,Markus Lanz 27.08.2014,2014-08-27T00:00:00Z,12
Alfons Schuhbeck,Markus Lanz 17.09.2014,2014-09-17T00:00:00Z,12
Jörg Wontorra,Markus Lanz 17.09.2014,2014-09-17T00:00:00Z,12
Walter Kohl,Markus Lanz 30.09.2014,2014-09-30T00:00:00Z,12
Edmund Stoiber,Markus Lanz 13.11.2014,2014-11-13T00:00:00Z,12
Reiner Calmund,Markus Lanz 26.11.2014,2014-11-26T00:00:00Z,12
Jörg Wontorra,Markus Lanz 11.03.2015,2015-03-11T00:00:00Z,12
Reiner Calmund,Markus Lanz 18.08.2015,2015-08-18T00:00:00Z,12
Wolf Von,Markus Lanz 25.08.2015,2015-08-25T00:00:00Z,12
Edmund Stoiber,Markus Lanz 03.09.2015,2015-09-03T00:00:00Z,12
Jörg Wontorra,Markus Lanz 25.11.2015,2015-11-25T00:00:00Z,12
Wolf Von,Markus Lanz 02.03.2016,2016-03-02T00:00:00Z,12
Edmund Stoiber,Markus Lanz 23.03.2016,2016-03-23T00:00:00Z,12
Jörg Wontorra,Markus Lanz 06.04.2016,2016-04-06T00:00:00Z,12
Reiner Calmund,Markus Lanz 17.05.2016,2016-05-17T00:00:00Z,12
Alfons Schuhbeck,Markus Lanz 01.06.2016,2016-06-01T00:00:00Z,12
Reiner Calmund,Markus Lanz 14.06.2016,2016-06-14T00:00:00Z,12
Jörg Wontorra,Markus Lanz 28.06.2016,2016-06-28T00:00:00Z,12
Hannes Jaenicke,Markus Lanz 12.07.2016,2016-07-12T00:00:00Z,12
Edmund Stoiber,Markus Lanz 11.10.2016,2016-10-11T00:00:00Z,12
Reiner Calmund,Markus Lanz 02.11.2016,2016-11-02T00:00:00Z,12
Wolf Von,Markus Lanz 10.11.2016,2016-11-10T00:00:00Z,12
Wolf Von,Markus Lanz 26.01.2017,2017-01-26T00:00:00Z,12
Alfons Schuhbeck,Markus Lanz 28.02.2017,2017-02-28T00:00:00Z,12
Jörg Wontorra,Markus Lanz 19.04.2017,2017-04-19T00:00:00Z,12
Hannes Jaenicke,Markus Lanz 16.05.2017,2017-05-16T00:00:00Z,12
Wolf Von,Markus Lanz 12.07.2017,2017-07-12T00:00:00Z,12
Jörg Wontorra,Markus Lanz 23.08.2017,2017-08-23T00:00:00Z,12
Walter Kohl,Markus Lanz 29.08.2017,2017-08-29T00:00:00Z,12
Robert Habeck,Markus Lanz 19.10.2017,2017-10-19T00:00:00Z,12
Edmund Stoiber,Markus Lanz 16.01.2018,2018-01-16T00:00:00Z,12
Hannes Jaenicke,Markus Lanz 16.01.2018,2018-01-16T00:00:00Z,12
Robert Habeck,Markus Lanz 08.02.2018,2018-02-08T00:00:00Z,12
Jörg Wontorra,Markus Lanz 18.04.2018,2018-04-18T00:00:00Z,12
Jörg Wontorra,Markus Lanz 22.05.2018,2018-05-22T00:00:00Z,12
Edmund Stoiber,Markus Lanz 19.06.2018,2018-06-19T00:00:00Z,12
Robert Habeck,Markus Lanz 12.07.2018,2018-07-12T00:00:00Z,12
Hannes Jaenicke,Markus Lanz 04.10.2018,2018-10-04T00:00:00Z,12
Alfons Schuhbeck,Markus Lanz 09.10.2018,2018-10-09T00:00:00Z,12
Edmund Stoiber,Markus Lanz 24.10.2018,2018-10-24T00:00:00Z,12
Robert Habeck,Markus Lanz 14.11.2018,2018-11-14T00:00:00Z,12
Wolf Von,Markus Lanz 18.12.2018,2018-12-18T00:00:00Z,12
Robert Habeck,Markus Lanz 27.06.2019,2019-06-27T00:00:00Z,12
Hannes Jaenicke,Markus Lanz 10.09.2019,2019-09-10T00:00:00Z,12
Walter Kohl,Markus Lanz 24.10.2019,2019-10-24T00:00:00Z,12
Walter Kohl,Markus Lanz 19.02.2020,2020-02-19T00:00:00Z,12
Walter Kohl,Markus Lanz 02.04.2020,2020-04-02T00:00:00Z,12
Robert Habeck,Markus Lanz 12.05.2020,2020-05-12T00:00:00Z,12
Hannes Jaenicke,Markus Lanz 10.06.2020,2020-06-10T00:00:00Z,12
Walter Kohl,Markus Lanz 08.07.2020,2020-07-08T00:00:00Z,12
Robert Habeck,Markus Lanz 14.07.2021,2021-07-14T00:00:00Z,12
Edmund Stoiber,Markus Lanz 16.09.2021,2021-09-16T00:00:00Z,12
Robert Habeck,Markus Lanz 19.10.2021,2021-10-19T00:00:00Z,12
Robert Habeck,Markus Lanz 24.02.2022,2022-02-24T00:00:00Z,12
Christian Dürr,Markus Lanz 13.10.2022,2022-10-13T00:00:00Z,12
Christian Dürr,Markus Lanz 01.12.2022,2022-12-01T00:00:00Z,12
Christian Dürr,Markus Lanz 02.03.2023,2023-03-02T00:00:00Z,12
Christian Dürr,Markus Lanz 25.04.2023,2023-04-25T00:00:00Z,12
Robert Habeck,Markus Lanz 06.07.2023,2023-07-06T00:00:00Z,12
Christian Dürr,Markus Lanz 13.07.2023,2023-07-13T00:00:00Z,12
Christian Dürr,Markus Lanz 05.09.2023,2023-09-05T00:00:00Z,12
Christian Dürr,Markus Lanz 20.03.2024,2024-03-20T00:00:00Z,12
Robert Habeck,Markus Lanz 30.04.2024,2024-04-30T00:00:00Z,12
Christian Dürr,Markus Lanz 14.05.2024,2024-05-14T00:00:00Z,12
Christian Dürr,Markus Lanz 10.07.2024,2024-07-10T00:00:00Z,12
Christian Dürr,Markus Lanz 24.10.2024,2024-10-24T00:00:00Z,12
Robert Habeck,Markus Lanz 07.11.2024,2024-11-07T00:00:00Z,12
Christian Dürr,Markus Lanz 13.11.2024,2024-11-13T00:00:00Z,12
Christian Dürr,Markus Lanz 04.12.2024,2024-12-04T00:00:00Z,12
Michael Opoczynski,Markus Lanz 10.06.2008,2008-06-10T00:00:00Z,11
Peter Hahne,Markus Lanz 08.07.2008,2008-07-08T00:00:00Z,11
Reinhold Messner,Markus Lanz 15.07.2008,2008-07-15T00:00:00Z,11
Michael Opoczynski,Markus Lanz 17.07.2008,2008-07-17T00:00:00Z,11
Rudi Cerne,Markus Lanz 24.06.2009,2009-06-24T00:00:00Z,11
Peter Hahne,Markus Lanz 30.06.2009,2009-06-30T00:00:00Z,11
Michael Opoczynski,Markus Lanz 16.07.2009,2009-07-16T00:00:00Z,11
Michael Opoczynski,Markus Lanz 23.07.2009,2009-07-23T00:00:00Z,11
Heinz Buschkowsky,Markus Lanz 04.02.2010,2010-02-04T00:00:00Z,11
Michael Opoczynski,Markus Lanz 04.03.2010,2010-03-04T00:00:00Z,11
Rudi Cerne,Markus Lanz 19.05.2010,2010-05-19T00:00:00Z,11
Peter Hahne,Markus Lanz 03.06.2010,2010-06-03T00:00:00Z,11
Peter Hahne,Markus Lanz 18.08.2010,2010-08-18T00:00:00Z,11
Harald Lesch,Markus Lanz 01.09.2010,2010-09-01T00:00:00Z,11
Heinz Buschkowsky,Markus Lanz 09.09.2010,2010-09-09T00:00:00Z,11
Heinz Buschkowsky,Markus Lanz 21.09.2010,2010-09-21T00:00:00Z,11
Reinhold Messner,Markus Lanz 23.09.2010,2010-09-23T00:00:00Z,11
Rudi Cerne,Markus Lanz 05.10.2010,2010-10-05T00:00:00Z,11
Claus Strunz,Markus Lanz 02.03.2011,2011-03-02T00:00:00Z,11
Heinz Buschkowsky,Markus Lanz 26.04.2011,2011-04-26T00:00:00Z,11
Michael Opoczynski,Markus Lanz 28.06.2011,2011-06-28T00:00:00Z,11
Heinz Buschkowsky,Markus Lanz 27.10.2011,2011-10-27T00:00:00Z,11
Peter Hahne,Markus Lanz 23.11.2011,2011-11-23T00:00:00Z,11
Heinz Buschkowsky,Markus Lanz 02.02.2012,2012-02-02T00:00:00Z,11
Peter Hahne,Markus Lanz 15.02.2012,2012-02-15T00:00:00Z,11
Heinz Buschkowsky,Markus Lanz 16.02.2012,2012-02-16T00:00:00Z,11
Claus Strunz,Markus Lanz 22.03.2012,2012-03-22T00:00:00Z,11
Claus Strunz,Markus Lanz 08.05.2012,2012-05-08T00:00:00Z,11
Peter Hahne,Markus Lanz 23.05.2012,2012-05-23T00:00:00Z,11
Theo Waigel,Markus Lanz 05.06.2012,2012-06-05T00:00:00Z,11
Gerd Rubenbauer,Markus Lanz 21.06.2012,2012-06-21T00:00:00Z,11
Claus Strunz,Markus Lanz 27.06.2012,2012-06-27T00:00:00Z,11
Gerd Rubenbauer,Markus Lanz 01.07.2012,2012-07-01T00:00:00Z,11
Rudi Cerne,Markus Lanz 11.09.2012,2012-09-11T00:00:00Z,11
Reinhold Messner,Markus Lanz 02.10.2012,2012-10-02T00:00:00Z,11
Dirk Roßmann,Markus Lanz 09.10.2012,2012-10-09T00:00:00Z,11
Gerd Rubenbauer,Markus Lanz 07.11.2012,2012-11-07T00:00:00Z,11
Reinhold Messner,Markus Lanz 04.12.2012,2012-12-04T00:00:00Z,11
Claus Strunz,Markus Lanz 15.01.2013,2013-01-15T00:00:00Z,11
Claus Strunz,Markus Lanz 19.03.2013,2013-03-19T00:00:00Z,11
Heinz Buschkowsky,Markus Lanz 21.03.2013,2013-03-21T00:00:00Z,11
Rudi Cerne,Markus Lanz 27.03.2013,2013-03-27T00:00:00Z,11
Gerd Rubenbauer,Markus Lanz 03.04.2013,2013-04-03T00:00:00Z,11
Claus Strunz,Markus Lanz 23.04.2013,2013-04-23T00:00:00Z,11
Dirk Roßmann,Markus Lanz 23.04.2013,2013-04-23T00:00:00Z,11
Peter Hahne,Markus Lanz 18.07.2013,2013-07-18T00:00:00Z,11
Reinhold Messner,Markus Lanz 17.10.2013,2013-10-17T00:00:00Z,11
Claus Strunz,Markus Lanz 31.10.2013,2013-10-31T00:00:00Z,11
Armin Laschet,Markus Lanz 21.11.2013,2013-11-21T00:00:00Z,11
Michael Opoczynski,Markus Lanz 21.01.2014,2014-01-21T00:00:00Z,11
Dirk Roßmann,Markus Lanz 28.01.2014,2014-01-28T00:00:00Z,11
Rudi Cerne,Markus Lanz 30.01.2014,2014-01-30T00:00:00Z,11
Theo Waigel,Markus Lanz 05.02.2014,2014-02-05T00:00:00Z,11
Gerd Rubenbauer,Markus Lanz 19.02.2014,2014-02-19T00:00:00Z,11
Peter Hahne,Markus Lanz 30.04.2014,2014-04-30T00:00:00Z,11
Gerd Rubenbauer,Markus Lanz 11.06.2014,2014-06-11T00:00:00Z,11
Gerd Rubenbauer,Markus Lanz 08.07.2014,2014-07-08T00:00:00Z,11
Michael Opoczynski,Markus Lanz 23.07.2014,2014-07-23T00:00:00Z,11
Peter Hahne,Markus Lanz 28.08.2014,2014-08-28T00:00:00Z,11
Heinz Buschkowsky,Markus Lanz 08.10.2014,2014-10-08T00:00:00Z,11
Theo Waigel,Markus Lanz 18.12.2014,2014-12-18T00:00:00Z,11
Dirk Roßmann,Markus Lanz 29.01.2015,2015-01-29T00:00:00Z,11
Heinz Buschkowsky,Markus Lanz 05.02.2015,2015-02-05T00:00:00Z,11
Claus Strunz,Markus Lanz 19.03.2015,2015-03-19T00:00:00Z,11
Dirk Roßmann,Markus Lanz 01.07.2015,2015-07-01T00:00:00Z,11
Reinhold Messner,Markus Lanz 15.07.2015,2015-07-15T00:00:00Z,11
Claus Strunz,Markus Lanz 18.08.2015,2015-08-18T00:00:00Z,11
Rudi Cerne,Markus Lanz 13.10.2015,2015-10-13T00:00:00Z,11
Gerd Rubenbauer,Markus Lanz 21.10.2015,2015-10-21T00:00:00Z,11
Claus Strunz,Markus Lanz 18.11.2015,2015-11-18T00:00:00Z,11
Rudi Cerne,Markus Lanz 09.02.2016,2016-02-09T00:00:00Z,11
Dirk Roßmann,Markus Lanz 05.04.2016,2016-04-05T00:00:00Z,11
Michael Opoczynski,Markus Lanz 12.04.2016,2016-04-12T00:00:00Z,11
Gerd Rubenbauer,Markus Lanz 13.04.2016,2016-04-13T00:00:00Z,11
Armin Laschet,Markus Lanz 12.05.2016,2016-05-12T00:00:00Z,11
Michael Opoczynski,Markus Lanz 17.05.2016,2016-05-17T00:00:00Z,11
Peter Hahne,Markus Lanz 18.05.2016,2016-05-18T00:00:00Z,11
Theo Waigel,Markus Lanz 19.05.2016,2016-05-19T00:00:00Z,11
Gerd Rubenbauer,Markus Lanz 27.07.2016,2016-07-27T00:00:00Z,11
Rudi Cerne,Markus Lanz 25.08.2016,2016-08-25T00:00:00Z,11
Dirk Roßmann,Markus Lanz 06.09.2016,2016-09-06T00:00:00Z,11
Harald Lesch,Markus Lanz 29.09.2016,2016-09-29T00:00:00Z,11
Reinhold Messner,Markus Lanz 19.10.2016,2016-10-19T00:00:00Z,11
Armin Laschet,Markus Lanz 24.01.2017,2017-01-24T00:00:00Z,11
Dirk Roßmann,Markus Lanz 19.09.2017,2017-09-19T00:00:00Z,11
Armin Laschet,Markus Lanz 27.09.2017,2017-09-27T00:00:00Z,11
Reinhold Messner,Markus Lanz 11.10.2017,2017-10-11T00:00:00Z,11
Armin Laschet,Markus Lanz 01.02.2018,2018-02-01T00:00:00Z,11
Elisabeth Niejahr,Markus Lanz 14.03.2018,2018-03-14T00:00:00Z,11
Elisabeth Niejahr,Markus Lanz 26.06.2018,2018-06-26T00:00:00Z,11
Gerd Rubenbauer,Markus Lanz 27.06.2018,2018-06-27T00:00:00Z,11
Armin Laschet,Markus Lanz 28.06.2018,2018-06-28T00:00:00Z,11
Theo Waigel,Markus Lanz 05.07.2018,2018-07-05T00:00:00Z,11
Harald Lesch,Markus Lanz 14.08.2018,2018-08-14T00:00:00Z,11
Heinz Buschkowsky,Markus Lanz 04.09.2018,2018-09-04T00:00:00Z,11
Elisabeth Niejahr,Markus Lanz 11.09.2018,2018-09-11T00:00:00Z,11
Michael Opoczynski,Markus Lanz 13.09.2018,2018-09-13T00:00:00Z,11
Dirk Roßmann,Markus Lanz 09.10.2018,2018-10-09T00:00:00Z,11
Elisabeth Niejahr,Markus Lanz 17.10.2018,2018-10-17T00:00:00Z,11
Elisabeth Niejahr,Markus Lanz 01.11.2018,2018-11-01T00:00:00Z,11
Dagmar Rosenfeld,Markus Lanz 29.11.2018,2018-11-29T00:00:00Z,11
Armin Laschet,Markus Lanz 09.01.2019,2019-01-09T00:00:00Z,11
Elisabeth Niejahr,Markus Lanz 10.01.2019,2019-01-10T00:00:00Z,11
Dagmar Rosenfeld,Markus Lanz 16.01.2019,2019-01-16T00:00:00Z,11
Theo Waigel,Markus Lanz 31.01.2019,2019-01-31T00:00:00Z,11
Elisabeth Niejahr,Markus Lanz 06.02.2019,2019-02-06T00:00:00Z,11
Dagmar Rosenfeld,Markus Lanz 13.02.2019,2019-02-13T00:00:00Z,11
Rudi Cerne,Markus Lanz 14.03.2019,2019-03-14T00:00:00Z,11
Dagmar Rosenfeld,Markus Lanz 26.03.2019,2019-03-26T00:00:00Z,11
Elisabeth Niejahr,Markus Lanz 28.03.2019,2019-03-28T00:00:00Z,11
Theo Waigel,Markus Lanz 16.04.2019,2019-04-16T00:00:00Z,11
Harald Lesch,Markus Lanz 30.04.2019,2019-04-30T00:00:00Z,11
Dirk Roßmann,Markus Lanz 22.05.2019,2019-05-22T00:00:00Z,11
Dagmar Rosenfeld,Markus Lanz 04.06.2019,2019-06-04T00:00:00Z,11
Elisabeth Niejahr,Markus Lanz 26.06.2019,2019-06-26T00:00:00Z,11
Harald Lesch,Markus Lanz 27.08.2019,2019-08-27T00:00:00Z,11
Elisabeth Niejahr,Markus Lanz 11.09.2019,2019-09-11T00:00:00Z,11
Reinhold Messner,Markus Lanz 11.09.2019,2019-09-11T00:00:00Z,11
Dagmar Rosenfeld,Markus Lanz 02.10.2019,2019-10-02T00:00:00Z,11
Rudi Cerne,Markus Lanz 02.10.2019,2019-10-02T00:00:00Z,11
Harald Lesch,Markus Lanz 29.10.2019,2019-10-29T00:00:00Z,11
Armin Laschet,Markus Lanz 20.11.2019,2019-11-20T00:00:00Z,11
Elisabeth Niejahr,Markus Lanz 20.11.2019,2019-11-20T00:00:00Z,11
Dagmar Rosenfeld,Markus Lanz 28.11.2019,2019-11-28T00:00:00Z,11
Dirk Roßmann,Markus Lanz 07.01.2020,2020-01-07T00:00:00Z,11
Friedrich Merz,Markus Lanz 05.02.2020,2020-02-05T00:00:00Z,11
Harald Lesch,Markus Lanz 05.03.2020,2020-03-05T00:00:00Z,11
Hendrik Streeck,Markus Lanz 31.03.2020,2020-03-31T00:00:00Z,11
Hendrik Streeck,Markus Lanz 21.04.2020,2020-04-21T00:00:00Z,11
Dagmar Rosenfeld,Markus Lanz 06.05.2020,2020-05-06T00:00:00Z,11
Armin Laschet,Markus Lanz 07.05.2020,2020-05-07T00:00:00Z,11
Hendrik Streeck,Markus Lanz 28.05.2020,2020-05-28T00:00:00Z,11
Dagmar Rosenfeld,Markus Lanz 16.06.2020,2020-06-16T00:00:00Z,11
Hendrik Streeck,Markus Lanz 17.06.2020,2020-06-17T00:00:00Z,11
Friedrich Merz,Markus Lanz 30.06.2020,2020-06-30T00:00:00Z,11
Hendrik Streeck,Markus Lanz 01.07.2020,2020-07-01T00:00:00Z,11
Reinhold Messner,Markus Lanz 23.09.2020,2020-09-23T00:00:00Z,11
Hendrik Streeck,Markus Lanz 01.10.2020,2020-10-01T00:00:00Z,11
Friedrich Merz,Markus Lanz 14.10.2020,2020-10-14T00:00:00Z,11
Dagmar Rosenfeld,Markus Lanz 17.11.2020,2020-11-17T00:00:00Z,11
Reinhold Messner,Markus Lanz 15.12.2020,2020-12-15T00:00:00Z,11
Theo Waigel,Markus Lanz 16.12.2020,2020-12-16T00:00:00Z,11
Friedrich Merz,Markus Lanz 13.01.2021,2021-01-13T00:00:00Z,11
Armin Laschet,Markus Lanz 14.01.2021,2021-01-14T00:00:00Z,11
Dagmar Rosenfeld,Markus Lanz 28.01.2021,2021-01-28T00:00:00Z,11
Armin Laschet,Markus Lanz 30.03.2021,2021-03-30T00:00:00Z,11
Friedrich Merz,Markus Lanz 06.05.2021,2021-05-06T00:00:00Z,11
Harald Lesch,Markus Lanz 03.06.2021,2021-06-03T00:00:00Z,11
Friedrich Merz,Markus Lanz 14.09.2021,2021-09-14T00:00:00Z,11
Harald Lesch,Markus Lanz 04.11.2021,2021-11-04T00:00:00Z,11
Friedrich Merz,Markus Lanz 23.11.2021,2021-11-23T00:00:00Z,11
Hendrik Streeck,Markus Lanz 02.12.2021,2021-12-02T00:00:00Z,11
Hendrik Streeck,Markus Lanz 06.01.2022,2022-01-06T00:00:00Z,11
Hendrik Streeck,Markus Lanz 25.01.2022,2022-01-25T00:00:00Z,11
Hendrik Streeck,Markus Lanz 29.03.2022,2022-03-29T00:00:00Z,11
Friedrich Merz,Markus Lanz 07.06.2022,2022-06-07T00:00:00Z,11
Harald Lesch,Markus Lanz 17.08.2022,2022-08-17T00:00:00Z,11
Friedrich Merz,Markus Lanz 13.09.2022,2022-09-13T00:00:00Z,11
Theo Waigel,Markus Lanz 20.10.2022,2022-10-20T00:00:00Z,11
Friedrich Merz,Markus Lanz - Das Jahr 2022,2022-12-15T00:00:00Z,11
Friedrich Merz,Markus Lanz 10.01.2023,2023-01-10T00:00:00Z,11
Harald Lesch,Markus Lanz 27.09.2023,2023-09-27T00:00:00Z,11
Theo Waigel,Markus Lanz 26.10.2023,2023-10-26T00:00:00Z,11
Hendrik Streeck,Markus Lanz 09.04.2024,2024-04-09T00:00:00Z,11
Theo Waigel,Markus Lanz 11.12.2024,2024-12-11T00:00:00Z,11
Horst Lichter,Markus Lanz 04.06.2008,2008-06-04T00:00:00Z,10
Mojib Latif,Markus Lanz 07.08.2008,2008-08-07T00:00:00Z,10
Eckart Von,Markus Lanz 02.09.2008,2008-09-02T00:00:00Z,10
Dirk Müller,Markus Lanz 16.07.2009,2009-07-16T00:00:00Z,10
Mojib Latif,Markus Lanz 23.07.2009,2009-07-23T00:00:00Z,10
Dirk Müller,Markus Lanz 28.07.2009,2009-07-28T00:00:00Z,10
Horst Lichter,Markus Lanz 04.08.2009,2009-08-04T00:00:00Z,10
Horst Lichter,Markus Lanz 11.08.2009,2009-08-11T00:00:00Z,10
Horst Lichter,Markus Lanz 20.08.2009,2009-08-20T00:00:00Z,10
Paul Panzer,Markus Lanz 25.08.2009,2009-08-25T00:00:00Z,10
Ingo Appelt,Markus Lanz 08.10.2009,2009-10-08T00:00:00Z,10
Paul Panzer,Markus Lanz 11.11.2009,2009-11-11T00:00:00Z,10
Eckart Von,Markus Lanz 03.12.2009,2009-12-03T00:00:00Z,10
Dirk Müller,Markus Lanz 23.03.2010,2010-03-23T00:00:00Z,10
Ingrid Van,Markus Lanz 23.03.2010,2010-03-23T00:00:00Z,10
Kester Schlenz,Markus Lanz 06.04.2010,2010-04-06T00:00:00Z,10
Kester Schlenz,Markus Lanz 07.04.2010,2010-04-07T00:00:00Z,10
Dirk Müller,Markus Lanz 29.04.2010,2010-04-29T00:00:00Z,10
Michael Mittermeier,Markus Lanz 29.04.2010,2010-04-29T00:00:00Z,10
Ingo Appelt,Markus Lanz 11.05.2010,2010-05-11T00:00:00Z,10
Stefan Aust,Markus Lanz 19.05.2010,2010-05-19T00:00:00Z,10
Kester Schlenz,Markus Lanz 02.06.2010,2010-06-02T00:00:00Z,10
Lothar Matthäus,Markus Lanz 12.08.2010,2010-08-12T00:00:00Z,10
Ulrich Walter,Markus Lanz 19.08.2010,2010-08-19T00:00:00Z,10
Ulrich Walter,Markus Lanz 01.09.2010,2010-09-01T00:00:00Z,10
Michael Mittermeier,Markus Lanz 08.09.2010,2010-09-08T00:00:00Z,10
Rolf Töpperwien,Markus Lanz 15.09.2010,2010-09-15T00:00:00Z,10
Horst Lichter,Markus Lanz 23.09.2010,2010-09-23T00:00:00Z,10
Paul Panzer,Markus Lanz 15.12.2010,2010-12-15T00:00:00Z,10
Ingrid Van,Markus Lanz 18.01.2011,2011-01-18T00:00:00Z,10
Ingo Appelt,Markus Lanz 25.01.2011,2011-01-25T00:00:00Z,10
Kester Schlenz,Markus Lanz 08.03.2011,2011-03-08T00:00:00Z,10
Ulrich Walter,Markus Lanz 15.03.2011,2011-03-15T00:00:00Z,10
Werner Schneyder,Markus Lanz 22.03.2011,2011-03-22T00:00:00Z,10
Dirk Müller,Markus Lanz 24.03.2011,2011-03-24T00:00:00Z,10
Norbert Blüm,Markus Lanz 24.03.2011,2011-03-24T00:00:00Z,10
Ingo Appelt,Markus Lanz 05.04.2011,2011-04-05T00:00:00Z,10
Ingrid Van,Markus Lanz 07.06.2011,2011-06-07T00:00:00Z,10
Horst Lichter,Markus Lanz 14.06.2011,2011-06-14T00:00:00Z,10
Christian Lindner,Markus Lanz 23.06.2011,2011-06-23T00:00:00Z,10
Werner Schneyder,Markus Lanz 30.06.2011,2011-06-30T00:00:00Z,10
Norbert Blüm,Markus Lanz 18.08.2011,2011-08-18T00:00:00Z,10
Ingo Appelt,Markus Lanz 23.08.2011,2011-08-23T00:00:00Z,10
Ingrid Van,Markus Lanz 23.08.2011,2011-08-23T00:00:00Z,10
Dirk Müller,Markus Lanz 30.08.2011,2011-08-30T00:00:00Z,10
Dirk Müller,Markus Lanz 27.09.2011,2011-09-27T00:00:00Z,10
Michael Mittermeier,Markus Lanz 02.11.2011,2011-11-02T00:00:00Z,10
Eckart Von,Markus Lanz 08.11.2011,2011-11-08T00:00:00Z,10
Ingrid Van,Markus Lanz 18.01.2012,2012-01-18T00:00:00Z,10
Eckart Von,Markus Lanz 22.02.2012,2012-02-22T00:00:00Z,10
Ingo Appelt,Markus Lanz 08.03.2012,2012-03-08T00:00:00Z,10
Werner Schneyder,Markus Lanz 15.03.2012,2012-03-15T00:00:00Z,10
Norbert Blüm,Markus Lanz 16.05.2012,2012-05-16T00:00:00Z,10
Dirk Müller,Markus Lanz 31.05.2012,2012-05-31T00:00:00Z,10
Lothar Matthäus,Markus Lanz 22.06.2012,2012-06-22T00:00:00Z,10
Rolf Töpperwien,Markus Lanz 22.06.2012,2012-06-22T00:00:00Z,10
Eckart Von,Markus Lanz 26.06.2012,2012-06-26T00:00:00Z,10
Lothar Matthäus,Markus Lanz 27.06.2012,2012-06-27T00:00:00Z,10
Rolf Töpperwien,Markus Lanz 01.07.2012,2012-07-01T00:00:00Z,10
Thomas Oppermann,Markus Lanz 30.08.2012,2012-08-30T00:00:00Z,10
Rolf Töpperwien,Markus Lanz 03.10.2012,2012-10-03T00:00:00Z,10
Lothar Matthäus,Markus Lanz 10.10.2012,2012-10-10T00:00:00Z,10
Rolf Töpperwien,Markus Lanz 14.11.2012,2012-11-14T00:00:00Z,10
Katrin Göring-Eckardt,Markus Lanz 06.12.2012,2012-12-06T00:00:00Z,10
Kester Schlenz,Markus Lanz 06.12.2012,2012-12-06T00:00:00Z,10
Paul Panzer,Markus Lanz 06.12.2012,2012-12-06T00:00:00Z,10
Horst Lichter,Markus Lanz 12.12.2012,2012-12-12T00:00:00Z,10
Werner Schneyder,Markus Lanz 31.01.2013,2013-01-31T00:00:00Z,10
Katja Kipping,Markus Lanz 07.02.2013,2013-02-07T00:00:00Z,10
Rolf Töpperwien,Markus Lanz 13.02.2013,2013-02-13T00:00:00Z,10
Rolf Töpperwien,Markus Lanz 13.03.2013,2013-03-13T00:00:00Z,10
Michael Mittermeier,Markus Lanz 14.03.2013,2013-03-14T00:00:00Z,10
Lothar Matthäus,Markus Lanz 26.03.2013,2013-03-26T00:00:00Z,10
Christian Lindner,Markus Lanz 02.04.2013,2013-04-02T00:00:00Z,10
Lothar Matthäus,Markus Lanz 23.05.2013,2013-05-23T00:00:00Z,10
Ingrid Van,Markus Lanz 29.05.2013,2013-05-29T00:00:00Z,10
Dirk Müller,Markus Lanz 11.07.2013,2013-07-11T00:00:00Z,10
Eckart Von,Markus Lanz 02.10.2013,2013-10-02T00:00:00Z,10
Norbert Blüm,Markus Lanz 16.10.2013,2013-10-16T00:00:00Z,10
Werner Schneyder,Markus Lanz 21.11.2013,2013-11-21T00:00:00Z,10
Paul Panzer,Markus Lanz 05.12.2013,2013-12-05T00:00:00Z,10
Christian Lindner,Markus Lanz 10.12.2013,2013-12-10T00:00:00Z,10
Ingrid Van,Markus Lanz 22.01.2014,2014-01-22T00:00:00Z,10
Lothar Matthäus,Markus Lanz 19.02.2014,2014-02-19T00:00:00Z,10
Rolf Töpperwien,Markus Lanz 06.03.2014,2014-03-06T00:00:00Z,10
Werner Schneyder,Markus Lanz 18.03.2014,2014-03-18T00:00:00Z,10
Kester Schlenz,Markus Lanz 25.03.2014,2014-03-25T00:00:00Z,10
Horst Lichter,Markus Lanz 10.04.2014,2014-04-10T00:00:00Z,10
Eckart Von,Markus Lanz 27.05.2014,2014-05-27T00:00:00Z,10
Ingrid Van,Markus Lanz 18.06.2014,2014-06-18T00:00:00Z,10
Rolf Töpperwien,Markus Lanz 24.06.2014,2014-06-24T00:00:00Z,10
Christian Lindner,Markus Lanz 25.06.2014,2014-06-25T00:00:00Z,10
Horst Lichter,Markus Lanz 22.07.2014,2014-07-22T00:00:00Z,10
Lothar Matthäus,Markus Lanz 27.08.2014,2014-08-27T00:00:00Z,10
Rolf Töpperwien,Markus Lanz 01.10.2014,2014-10-01T00:00:00Z,10
Norbert Blüm,Markus Lanz 23.10.2014,2014-10-23T00:00:00Z,10
Michael Mittermeier,Markus Lanz 29.10.2014,2014-10-29T00:00:00Z,10
Thomas Oppermann,Markus Lanz 18.11.2014,2014-11-18T00:00:00Z,10
Paul Panzer,Markus Lanz 11.12.2014,2014-12-11T00:00:00Z,10
Christian Lindner,Markus Lanz 17.02.2015,2015-02-17T00:00:00Z,10
Lothar Matthäus,Markus Lanz 18.02.2015,2015-02-18T00:00:00Z,10
Horst Lichter,Markus Lanz 26.02.2015,2015-02-26T00:00:00Z,10
Werner Schneyder,Markus Lanz 03.03.2015,2015-03-03T00:00:00Z,10
Kester Schlenz,Markus Lanz 10.03.2015,2015-03-10T00:00:00Z,10
Ingo Appelt,Markus Lanz 14.04.2015,2015-04-14T00:00:00Z,10
Werner Schneyder,Markus Lanz 21.04.2015,2015-04-21T00:00:00Z,10
Ingrid Van,Markus Lanz 02.09.2015,2015-09-02T00:00:00Z,10
Thomas Oppermann,Markus Lanz 10.09.2015,2015-09-10T00:00:00Z,10
Norbert Blüm,Markus Lanz 06.10.2015,2015-10-06T00:00:00Z,10
Lothar Matthäus,Markus Lanz 21.10.2015,2015-10-21T00:00:00Z,10
Michael Mittermeier,Markus Lanz 09.12.2015,2015-12-09T00:00:00Z,10
Dirk Müller,Markus Lanz 16.02.2016,2016-02-16T00:00:00Z,10
Paul Panzer,Markus Lanz 08.03.2016,2016-03-08T00:00:00Z,10
Michael Mittermeier,Markus Lanz 16.03.2016,2016-03-16T00:00:00Z,10
Ingo Appelt,Markus Lanz 17.03.2016,2016-03-17T00:00:00Z,10
Norbert Blüm,Markus Lanz 17.03.2016,2016-03-17T00:00:00Z,10
Stefan Aust,Markus Lanz 12.05.2016,2016-05-12T00:00:00Z,10
Werner Schneyder,Markus Lanz 24.05.2016,2016-05-24T00:00:00Z,10
Michael Mittermeier,Markus Lanz 25.10.2016,2016-10-25T00:00:00Z,10
Norbert Blüm,Markus Lanz 17.11.2016,2016-11-17T00:00:00Z,10
Ulrich Walter,Markus Lanz 22.11.2016,2016-11-22T00:00:00Z,10
Paul Panzer,Markus Lanz 15.12.2016,2016-12-15T00:00:00Z,10
Eckart Von,Markus Lanz 18.01.2017,2017-01-18T00:00:00Z,10
Christian Lindner,Markus Lanz 01.02.2017,2017-02-01T00:00:00Z,10
Werner Schneyder,Markus Lanz 02.03.2017,2017-03-02T00:00:00Z,10
Kester Schlenz,Markus Lanz 14.03.2017,2017-03-14T00:00:00Z,10
Ingrid Van,Markus Lanz 21.03.2017,2017-03-21T00:00:00Z,10
Stefan Aust,Markus Lanz 27.04.2017,2017-04-27T00:00:00Z,10
Christian Lindner,Markus Lanz 16.05.2017,2017-05-16T00:00:00Z,10
Stefan Aust,Markus Lanz 23.05.2017,2017-05-23T00:00:00Z,10
Mojib Latif,Markus Lanz 06.06.2017,2017-06-06T00:00:00Z,10
Katrin Göring-Eckardt,Markus Lanz 08.06.2017,2017-06-08T00:00:00Z,10
Thomas Oppermann,Markus Lanz 15.06.2017,2017-06-15T00:00:00Z,10
Eckart Von,Markus Lanz 20.06.2017,2017-06-20T00:00:00Z,10
Stefan Aust,Markus Lanz 20.06.2017,2017-06-20T00:00:00Z,10
Ingo Appelt,Markus Lanz 21.06.2017,2017-06-21T00:00:00Z,10
Ulrich Walter,Markus Lanz 05.09.2017,2017-09-05T00:00:00Z,10
Michael Mittermeier,Markus Lanz 06.09.2017,2017-09-06T00:00:00Z,10
Stefan Aust,Markus Lanz 14.09.2017,2017-09-14T00:00:00Z,10
Katja Kipping,Markus Lanz 26.09.2017,2017-09-26T00:00:00Z,10
Thomas Oppermann,Markus Lanz 28.09.2017,2017-09-28T00:00:00Z,10
Christian Lindner,Markus Lanz 26.10.2017,2017-10-26T00:00:00Z,10
Thomas Oppermann,Markus Lanz 29.11.2017,2017-11-29T00:00:00Z,10
Paul Panzer,Markus Lanz 06.12.2017,2017-12-06T00:00:00Z,10
Ulrich Walter,Markus Lanz 13.12.2017,2017-12-13T00:00:00Z,10
Norbert Blüm,Markus Lanz 11.01.2018,2018-01-11T00:00:00Z,10
Ingo Appelt,Markus Lanz 08.02.2018,2018-02-08T00:00:00Z,10
Eckart Von,Markus Lanz 15.02.2018,2018-02-15T00:00:00Z,10
Christian Lindner,Markus Lanz 15.03.2018,2018-03-15T00:00:00Z,10
Stefan Aust,Markus Lanz 20.03.2018,2018-03-20T00:00:00Z,10
Katrin Göring-Eckardt,Markus Lanz 22.03.2018,2018-03-22T00:00:00Z,10
Michael Mittermeier,Markus Lanz 26.04.2018,2018-04-26T00:00:00Z,10
Stefan Aust,Markus Lanz 05.06.2018,2018-06-05T00:00:00Z,10
Thomas Oppermann,Markus Lanz 07.06.2018,2018-06-07T00:00:00Z,10
Stefan Aust,Markus Lanz 05.07.2018,2018-07-05T00:00:00Z,10
Ulrich Walter,Markus Lanz 10.07.2018,2018-07-10T00:00:00Z,10
Katrin Göring-Eckardt,Markus Lanz 22.08.2018,2018-08-22T00:00:00Z,10
Katja Kipping,Markus Lanz 28.08.2018,2018-08-28T00:00:00Z,10
Norbert Blüm,Markus Lanz 20.11.2018,2018-11-20T00:00:00Z,10
Ulrich Walter,Markus Lanz 18.12.2018,2018-12-18T00:00:00Z,10
Thomas Oppermann,Markus Lanz 28.02.2019,2019-02-28T00:00:00Z,10
Katrin Göring-Eckardt,Markus Lanz 07.03.2019,2019-03-07T00:00:00Z,10
Katja Kipping,Markus Lanz 19.03.2019,2019-03-19T00:00:00Z,10
Christian Lindner,Markus Lanz 04.04.2019,2019-04-04T00:00:00Z,10
Katrin Göring-Eckardt,Markus Lanz 28.05.2019,2019-05-28T00:00:00Z,10
Thomas Oppermann,Markus Lanz 25.06.2019,2019-06-25T00:00:00Z,10
Katja Kipping,Markus Lanz 26.06.2019,2019-06-26T00:00:00Z,10
Ulrich Walter,Markus Lanz 02.07.2019,2019-07-02T00:00:00Z,10
Thomas Oppermann,Markus Lanz 05.09.2019,2019-09-05T00:00:00Z,10
Kristin Helberg,Markus Lanz 23.10.2019,2019-10-23T00:00:00Z,10
Cerstin Gammelin,Markus Lanz 30.10.2019,2019-10-30T00:00:00Z,10
Stefan Aust,Markus Lanz 13.11.2019,2019-11-13T00:00:00Z,10
Ulrich Walter,Markus Lanz 18.12.2019,2019-12-18T00:00:00Z,10
Cerstin Gammelin,Markus Lanz 09.01.2020,2020-01-09T00:00:00Z,10
Kristin Helberg,Markus Lanz 14.01.2020,2020-01-14T00:00:00Z,10
Paul Panzer,Markus Lanz 14.01.2020,2020-01-14T00:00:00Z,10
Cerstin Gammelin,Markus Lanz 19.02.2020,2020-02-19T00:00:00Z,10
Katja Kipping,Markus Lanz 27.02.2020,2020-02-27T00:00:00Z,10
Kristin Helberg,Markus Lanz 12.03.2020,2020-03-12T00:00:00Z,10
Peter Tschentscher,Markus Lanz 19.03.2020,2020-03-19T00:00:00Z,10
Peter Tschentscher,Markus Lanz 19.05.2020,2020-05-19T00:00:00Z,10
Cerstin Gammelin,Markus Lanz 20.05.2020,2020-05-20T00:00:00Z,10
Serap Güler,Markus Lanz 04.06.2020,2020-06-04T00:00:00Z,10
Serap Güler,Markus Lanz 09.06.2020,2020-06-09T00:00:00Z,10
Cerstin Gammelin,Markus Lanz 01.07.2020,2020-07-01T00:00:00Z,10
Mojib Latif,Markus Lanz 13.08.2020,2020-08-13T00:00:00Z,10
Kester Schlenz,Markus Lanz 26.08.2020,2020-08-26T00:00:00Z,10
Peter Tschentscher,Markus Lanz 03.09.2020,2020-09-03T00:00:00Z,10
Cerstin Gammelin,Markus Lanz 16.09.2020,2020-09-16T00:00:00Z,10
Katrin Göring-Eckardt,Markus Lanz 17.09.2020,2020-09-17T00:00:00Z,10
Katja Kipping,Markus Lanz 23.09.2020,2020-09-23T00:00:00Z,10
Peter Tschentscher,Markus Lanz 29.10.2020,2020-10-29T00:00:00Z,10
Kester Schlenz,Markus Lanz 17.12.2020,2020-12-17T00:00:00Z,10
Cerstin Gammelin,Markus Lanz 05.01.2021,2021-01-05T00:00:00Z,10
Peter Tschentscher,Markus Lanz 05.01.2021,2021-01-05T00:00:00Z,10
Peter Tschentscher,Markus Lanz 10.02.2021,2021-02-10T00:00:00Z,10
Peter Tschentscher,Markus Lanz 27.04.2021,2021-04-27T00:00:00Z,10
Katrin Göring-Eckardt,Markus Lanz 29.04.2021,2021-04-29T00:00:00Z,10
Katja Kipping,Markus Lanz 16.06.2021,2021-06-16T00:00:00Z,10
Serap Güler,Markus Lanz 17.06.2021,2021-06-17T00:00:00Z,10
Cerstin Gammelin,Markus Lanz 15.07.2021,2021-07-15T00:00:00Z,10
Peter Tschentscher,Markus Lanz 31.08.2021,2021-08-31T00:00:00Z,10
Katja Kipping,Markus Lanz 08.09.2021,2021-09-08T00:00:00Z,10
Serap Güler,Markus Lanz 22.09.2021,2021-09-22T00:00:00Z,10
Cerstin Gammelin,Markus Lanz 05.10.2021,2021-10-05T00:00:00Z,10
Mojib Latif,Markus Lanz 10.11.2021,2021-11-10T00:00:00Z,10
Cerstin Gammelin,Markus Lanz 25.01.2022,2022-01-25T00:00:00Z,10
Rüdiger Von,Markus Lanz 17.02.2022,2022-02-17T00:00:00Z,10
Rüdiger Von,Markus Lanz 03.03.2022,2022-03-03T00:00:00Z,10
Serap Güler,Markus Lanz 17.03.2022,2022-03-17T00:00:00Z,10
Katja Kipping,Markus Lanz 22.03.2022,2022-03-22T00:00:00Z,10
Peter Tschentscher,Markus Lanz 29.03.2022,2022-03-29T00:00:00Z,10
Rüdiger Von,Markus Lanz 19.04.2022,2022-04-19T00:00:00Z,10
Mojib Latif,Markus Lanz 26.05.2022,2022-05-26T00:00:00Z,10
Rüdiger Von,Markus Lanz 07.06.2022,2022-06-07T00:00:00Z,10
Rüdiger Von,Markus Lanz 18.08.2022,2022-08-18T00:00:00Z,10
Julia Löhr,Markus Lanz 11.10.2022,2022-10-11T00:00:00Z,10
Serap Güler,Markus Lanz 12.10.2022,2022-10-12T00:00:00Z,10
Mojib Latif,Markus Lanz - Das Jahr 2022,2022-12-15T00:00:00Z,10
Julia Löhr,Markus Lanz 18.01.2023,2023-01-18T00:00:00Z,10
Serap Güler,Markus Lanz 14.02.2023,2023-02-14T00:00:00Z,10
Kristin Helberg,Markus Lanz 28.02.2023,2023-02-28T00:00:00Z,10
Kristin Helberg,Markus Lanz 07.03.2023,2023-03-07T00:00:00Z,10
Julia Löhr,Markus Lanz 16.03.2023,2023-03-16T00:00:00Z,10
Mojib Latif,Markus Lanz 16.03.2023,2023-03-16T00:00:00Z,10
Julia Löhr,Markus Lanz 26.04.2023,2023-04-26T00:00:00Z,10
Kristin Helberg,Markus Lanz 11.05.2023,2023-05-11T00:00:00Z,10
Rüdiger Von,Markus Lanz 23.05.2023,2023-05-23T00:00:00Z,10
Mojib Latif,Markus Lanz 25.05.2023,2023-05-25T00:00:00Z,10
Julia Löhr,Markus Lanz 06.06.2023,2023-06-06T00:00:00Z,10
Serap Güler,Markus Lanz 07.06.2023,2023-06-07T00:00:00Z,10
Julia Löhr,Markus Lanz 27.06.2023,2023-06-27T00:00:00Z,10
Mojib Latif,Markus Lanz 27.06.2023,2023-06-27T00:00:00Z,10
Rüdiger Von,Markus Lanz 23.08.2023,2023-08-23T00:00:00Z,10
Julia Löhr,Markus Lanz 13.09.2023,2023-09-13T00:00:00Z,10
Serap Güler,Markus Lanz 15.11.2023,2023-11-15T00:00:00Z,10
Kristin Helberg,Markus Lanz 30.11.2023,2023-11-30T00:00:00Z,10
Peter Tschentscher,Markus Lanz 27.02.2024,2024-02-27T00:00:00Z,10
Kristin Helberg,Markus Lanz 05.03.2024,2024-03-05T00:00:00Z,10
Julia Löhr,Markus Lanz 14.03.2024,2024-03-14T00:00:00Z,10
Katrin Göring-Eckardt,Markus Lanz 09.04.2024,2024-04-09T00:00:00Z,10
Rüdiger Von,Markus Lanz 13.06.2024,2024-06-13T00:00:00Z,10
Serap Güler,Markus Lanz 25.06.2024,2024-06-25T00:00:00Z,10
Julia Löhr,Markus Lanz 09.07.2024,2024-07-09T00:00:00Z,10
Rüdiger Von,Markus Lanz 11.07.2024,2024-07-11T00:00:00Z,10
Kristin Helberg,Markus Lanz 09.10.2024,2024-10-09T00:00:00Z,10
Julia Löhr,Markus Lanz 30.10.2024,2024-10-30T00:00:00Z,10
Rüdiger Von,Markus Lanz 20.11.2024,2024-11-20T00:00:00Z,10
Katrin Göring-Eckardt,Markus Lanz 28.11.2024,2024-11-28T00:00:00Z,10
Kristin Helberg,Markus Lanz 04.12.2024,2024-12-04T00:00:00Z,10
