gastLabel,episodeLabel,date
Interview Markus Lanz,Markus Lanz 03.06.2008,2008-06-03T00:00:00Z
Verona Pooth,Markus Lanz 03.06.2008,2008-06-03T00:00:00Z
Horst Lichter,Markus Lanz 04.06.2008,2008-06-04T00:00:00Z
Margret Lichter,Markus Lanz 04.06.2008,2008-06-04T00:00:00Z
Michael Bauer,Markus Lanz 04.06.2008,2008-06-04T00:00:00Z
Steffen Möller,Markus Lanz 04.06.2008,2008-06-04T00:00:00Z
Anka Krämer,Markus Lanz 05.06.2008,2008-06-05T00:00:00Z
Michael Schreckenberg,Markus Lanz 05.06.2008,2008-06-05T00:00:00Z
Ralf Möller,Markus Lanz 05.06.2008,2008-06-05T00:00:00Z
Rüdiger Nehberg,Markus Lanz 05.06.2008,2008-06-05T00:00:00Z
Bettina Martin,Markus Lanz 10.06.2008,2008-06-10T00:00:00Z
Daniela Edler,Markus Lanz 10.06.2008,2008-06-10T00:00:00Z
Hasso Spode,Markus Lanz 10.06.2008,2008-06-10T00:00:00Z
Jürgen Abraham,Markus Lanz 10.06.2008,2008-06-10T00:00:00Z
Jürgen Bauer,Markus Lanz 10.06.2008,2008-06-10T00:00:00Z
Michael Opoczynski,Markus Lanz 10.06.2008,2008-06-10T00:00:00Z
Michaela Van,Markus Lanz 10.06.2008,2008-06-10T00:00:00Z
Oliver Baumgart,Markus Lanz 10.06.2008,2008-06-10T00:00:00Z
Tanja Warkentin,Markus Lanz 10.06.2008,2008-06-10T00:00:00Z
Florian Schroeder,Markus Lanz 18.06.2008,2008-06-18T00:00:00Z
Ines Falk,Markus Lanz 18.06.2008,2008-06-18T00:00:00Z
Ingolf Lück,Markus Lanz 18.06.2008,2008-06-18T00:00:00Z
Johannes Ettmayer,Markus Lanz 18.06.2008,2008-06-18T00:00:00Z
Martin Thomas,Markus Lanz 18.06.2008,2008-06-18T00:00:00Z
Udo Röbel,Markus Lanz 18.06.2008,2008-06-18T00:00:00Z
Bernd Saur,Markus Lanz 19.06.2008,2008-06-19T00:00:00Z
Corny Littmann,Markus Lanz 19.06.2008,2008-06-19T00:00:00Z
Frederic Strohm,Markus Lanz 19.06.2008,2008-06-19T00:00:00Z
Irmgard Lafer,Markus Lanz 19.06.2008,2008-06-19T00:00:00Z
Jennifer Lafer,Markus Lanz 19.06.2008,2008-06-19T00:00:00Z
Johann Lafer,Markus Lanz 19.06.2008,2008-06-19T00:00:00Z
Manuel Weisbrod,Markus Lanz 19.06.2008,2008-06-19T00:00:00Z
Marcus Urban,Markus Lanz 19.06.2008,2008-06-19T00:00:00Z
Mario Basler,Markus Lanz 19.06.2008,2008-06-19T00:00:00Z
Baron Josef Kerckerinck,Markus Lanz 24.06.2008,2008-06-24T00:00:00Z
Eckart Laack,Markus Lanz 24.06.2008,2008-06-24T00:00:00Z
Folkart Schweizer,Markus Lanz 24.06.2008,2008-06-24T00:00:00Z
Lioba Baving,Markus Lanz 24.06.2008,2008-06-24T00:00:00Z
Lothar Binding,Markus Lanz 24.06.2008,2008-06-24T00:00:00Z
Patrik Fichte,Markus Lanz 24.06.2008,2008-06-24T00:00:00Z
Sabine Schmidt,Markus Lanz 24.06.2008,2008-06-24T00:00:00Z
Undine Schulz,Markus Lanz 24.06.2008,2008-06-24T00:00:00Z
Eric Gabriel,Markus Lanz 01.07.2008,2008-07-01T00:00:00Z
Frater Martin,Markus Lanz 01.07.2008,2008-07-01T00:00:00Z
Jörg Pilawa,Markus Lanz 01.07.2008,2008-07-01T00:00:00Z
Marion Gabriel,Markus Lanz 01.07.2008,2008-07-01T00:00:00Z
Matthias Spranger,Markus Lanz 01.07.2008,2008-07-01T00:00:00Z
Pater Karl,Markus Lanz 01.07.2008,2008-07-01T00:00:00Z
Alexander Herrmann,Markus Lanz 03.07.2008,2008-07-03T00:00:00Z
Felicitas Schirow,Markus Lanz 03.07.2008,2008-07-03T00:00:00Z
Giovanni Maio,Markus Lanz 03.07.2008,2008-07-03T00:00:00Z
Heribert Kentenich,Markus Lanz 03.07.2008,2008-07-03T00:00:00Z
Karin Müller,Markus Lanz 03.07.2008,2008-07-03T00:00:00Z
Kim Fisher,Markus Lanz 03.07.2008,2008-07-03T00:00:00Z
Barbara Schubert,Markus Lanz 08.07.2008,2008-07-08T00:00:00Z
Lothar Hintze,Markus Lanz 08.07.2008,2008-07-08T00:00:00Z
Nicola Bardola,Markus Lanz 08.07.2008,2008-07-08T00:00:00Z
Peter Hahne,Markus Lanz 08.07.2008,2008-07-08T00:00:00Z
Rosy Hintze,Markus Lanz 08.07.2008,2008-07-08T00:00:00Z
Dagmar Elsholz,Markus Lanz 10.07.2008,2008-07-10T00:00:00Z
Inge Wolff,Markus Lanz 10.07.2008,2008-07-10T00:00:00Z
Mario Barth,Markus Lanz 10.07.2008,2008-07-10T00:00:00Z
Paul Kuhn,Markus Lanz 10.07.2008,2008-07-10T00:00:00Z
Volker Steinkraus,Markus Lanz 10.07.2008,2008-07-10T00:00:00Z
Giti Rauch,Markus Lanz 15.07.2008,2008-07-15T00:00:00Z
Henning Scheich,Markus Lanz 15.07.2008,2008-07-15T00:00:00Z
Michael Epp,Markus Lanz 15.07.2008,2008-07-15T00:00:00Z
Oliver Geisselhart,Markus Lanz 15.07.2008,2008-07-15T00:00:00Z
Reinhold Messner,Markus Lanz 15.07.2008,2008-07-15T00:00:00Z
Alfons Schuhbeck,Markus Lanz 17.07.2008,2008-07-17T00:00:00Z
Jürgen Eiben,Markus Lanz 17.07.2008,2008-07-17T00:00:00Z
Michael Opoczynski,Markus Lanz 17.07.2008,2008-07-17T00:00:00Z
Michaela Eiben,Markus Lanz 17.07.2008,2008-07-17T00:00:00Z
Bernhard Stitz,Markus Lanz 22.07.2008,2008-07-22T00:00:00Z
Christian Häckl,Markus Lanz 22.07.2008,2008-07-22T00:00:00Z
Inge Niedek,Markus Lanz 22.07.2008,2008-07-22T00:00:00Z
Julia Rehberg,Markus Lanz 22.07.2008,2008-07-22T00:00:00Z
Karl Josef Wallner,Markus Lanz 22.07.2008,2008-07-22T00:00:00Z
Richard David Precht,Markus Lanz 22.07.2008,2008-07-22T00:00:00Z
Andreas Kieling,Markus Lanz 24.07.2008,2008-07-24T00:00:00Z
Dieter Kürten,Markus Lanz 24.07.2008,2008-07-24T00:00:00Z
Michael Bauer,Markus Lanz 24.07.2008,2008-07-24T00:00:00Z
Andreas C Studer,Markus Lanz 29.07.2008,2008-07-29T00:00:00Z
Birgit Rehlender,Markus Lanz 29.07.2008,2008-07-29T00:00:00Z
Boris Nikolai Konrad,Markus Lanz 29.07.2008,2008-07-29T00:00:00Z
Johannes Mallow,Markus Lanz 29.07.2008,2008-07-29T00:00:00Z
Lars Hentschel,Markus Lanz 29.07.2008,2008-07-29T00:00:00Z
Lars Reime,Markus Lanz 29.07.2008,2008-07-29T00:00:00Z
Petya Reime,Markus Lanz 29.07.2008,2008-07-29T00:00:00Z
Kay P Rodegra,Markus Lanz 31.07.2008,2008-07-31T00:00:00Z
Patrick Lindner,Markus Lanz 31.07.2008,2008-07-31T00:00:00Z
Petra Bröder,Markus Lanz 31.07.2008,2008-07-31T00:00:00Z
Ronny Ziesmer,Markus Lanz 31.07.2008,2008-07-31T00:00:00Z
Sybille Radt,Markus Lanz 31.07.2008,2008-07-31T00:00:00Z
Antonia Von,Markus Lanz 05.08.2008,2008-08-05T00:00:00Z
Christoph Höhnke,Markus Lanz 05.08.2008,2008-08-05T00:00:00Z
Florian Schroeder,Markus Lanz 05.08.2008,2008-08-05T00:00:00Z
Jörg Knör,Markus Lanz 05.08.2008,2008-08-05T00:00:00Z
Knut Möller,Markus Lanz 05.08.2008,2008-08-05T00:00:00Z
Liina Mariudottir,Markus Lanz 05.08.2008,2008-08-05T00:00:00Z
David Safier,Markus Lanz 18.03.2010,2010-03-18T00:00:00Z
Jörg Denfeld,Markus Lanz 18.03.2010,2010-03-18T00:00:00Z
Mario Barth,Markus Lanz 18.03.2010,2010-03-18T00:00:00Z
Stefan Gulas,Markus Lanz 18.03.2010,2010-03-18T00:00:00Z
Alexandra Kusitzky,Markus Lanz 23.03.2010,2010-03-23T00:00:00Z
Antonio Sommese,Markus Lanz 23.03.2010,2010-03-23T00:00:00Z
Bela Paradi,Markus Lanz 23.03.2010,2010-03-23T00:00:00Z
Dirk Müller,Markus Lanz 23.03.2010,2010-03-23T00:00:00Z
Elfriede Vavrik,Markus Lanz 23.03.2010,2010-03-23T00:00:00Z
Herbert Jütten,Markus Lanz 23.03.2010,2010-03-23T00:00:00Z
Ingrid Van,Markus Lanz 23.03.2010,2010-03-23T00:00:00Z
Kirsten Von,Markus Lanz 23.03.2010,2010-03-23T00:00:00Z
Andy Borg,Markus Lanz 24.03.2010,2010-03-24T00:00:00Z
Anna Loos,Markus Lanz 24.03.2010,2010-03-24T00:00:00Z
Bärbel Zernicke,Markus Lanz 24.03.2010,2010-03-24T00:00:00Z
Claudia Jung,Markus Lanz 24.03.2010,2010-03-24T00:00:00Z
Gerd Schönfelder,Markus Lanz 24.03.2010,2010-03-24T00:00:00Z
Martin Moritz,Markus Lanz 24.03.2010,2010-03-24T00:00:00Z
Stefan Mross,Markus Lanz 24.03.2010,2010-03-24T00:00:00Z
Anthony Scott,Markus Lanz 25.03.2010,2010-03-25T00:00:00Z
Claus Kleber,Markus Lanz 25.03.2010,2010-03-25T00:00:00Z
James Bain,Markus Lanz 25.03.2010,2010-03-25T00:00:00Z
Kim Adler,Markus Lanz 25.03.2010,2010-03-25T00:00:00Z
Petra Gerster,Markus Lanz 25.03.2010,2010-03-25T00:00:00Z
Andreas Biermann,Markus Lanz 30.03.2010,2010-03-30T00:00:00Z
Bernhard Hoecker,Markus Lanz 30.03.2010,2010-03-30T00:00:00Z
Eleonore Weisgerber,Markus Lanz 30.03.2010,2010-03-30T00:00:00Z
Helmut Pöschel,Markus Lanz 30.03.2010,2010-03-30T00:00:00Z
Manfred Lütz,Markus Lanz 30.03.2010,2010-03-30T00:00:00Z
Ralf Nowak,Markus Lanz 30.03.2010,2010-03-30T00:00:00Z
Tetje Mierendorf,Markus Lanz 30.03.2010,2010-03-30T00:00:00Z
Carola Kirchner,Markus Lanz 31.03.2010,2010-03-31T00:00:00Z
Clemens Gerckens,Markus Lanz 31.03.2010,2010-03-31T00:00:00Z
Markus Schlichting,Markus Lanz 31.03.2010,2010-03-31T00:00:00Z
Max Bonmann,Markus Lanz 31.03.2010,2010-03-31T00:00:00Z
Stephanie Pallasch,Markus Lanz 31.03.2010,2010-03-31T00:00:00Z
Sönke Nielsen,Markus Lanz 31.03.2010,2010-03-31T00:00:00Z
Thorsten Havener,Markus Lanz 31.03.2010,2010-03-31T00:00:00Z
Andrea Sawatzki,Markus Lanz 06.04.2010,2010-04-06T00:00:00Z
Katerina Jacob,Markus Lanz 06.04.2010,2010-04-06T00:00:00Z
Katrin Schaudig,Markus Lanz 06.04.2010,2010-04-06T00:00:00Z
Kester Schlenz,Markus Lanz 06.04.2010,2010-04-06T00:00:00Z
Maren Kroymann,Markus Lanz 06.04.2010,2010-04-06T00:00:00Z
Detlev Goj,Markus Lanz 07.04.2010,2010-04-07T00:00:00Z
Howard Carpendale,Markus Lanz 07.04.2010,2010-04-07T00:00:00Z
Jörg Blech,Markus Lanz 07.04.2010,2010-04-07T00:00:00Z
Katerina Jacob,Markus Lanz 07.04.2010,2010-04-07T00:00:00Z
Kester Schlenz,Markus Lanz 07.04.2010,2010-04-07T00:00:00Z
Alexandra Polzin,Markus Lanz 08.04.2010,2010-04-08T00:00:00Z
Angelika Kallwass,Markus Lanz 08.04.2010,2010-04-08T00:00:00Z
Christine Kaufmann,Markus Lanz 08.04.2010,2010-04-08T00:00:00Z
Gisela Pothin-Wulf,Markus Lanz 08.04.2010,2010-04-08T00:00:00Z
Katja Burkard,Markus Lanz 08.04.2010,2010-04-08T00:00:00Z
Detlef D,Markus Lanz 13.04.2010,2010-04-13T00:00:00Z
Maite Kelly,Markus Lanz 13.04.2010,2010-04-13T00:00:00Z
Ruth Moschner,Markus Lanz 13.04.2010,2010-04-13T00:00:00Z
Thomas Kurscheid,Markus Lanz 13.04.2010,2010-04-13T00:00:00Z
Udo Pollmer,Markus Lanz 13.04.2010,2010-04-13T00:00:00Z
Angelika Kallwass,Markus Lanz 14.04.2010,2010-04-14T00:00:00Z
Jürgen Domian,Markus Lanz 14.04.2010,2010-04-14T00:00:00Z
Rudi Assauer,Markus Lanz 14.04.2010,2010-04-14T00:00:00Z
Werner Hansch,Markus Lanz 14.04.2010,2010-04-14T00:00:00Z
Cosima Kiesner,Markus Lanz 15.04.2010,2010-04-15T00:00:00Z
Katie Piper,Markus Lanz 15.04.2010,2010-04-15T00:00:00Z
Micha Manuel Bues,Markus Lanz 15.04.2010,2010-04-15T00:00:00Z
Michel Friedman,Markus Lanz 15.04.2010,2010-04-15T00:00:00Z
Peter Seewald,Markus Lanz 15.04.2010,2010-04-15T00:00:00Z
Uta Ranke-Heinemann,Markus Lanz 15.04.2010,2010-04-15T00:00:00Z
Jörg Handwerg,Markus Lanz 20.04.2010,2010-04-20T00:00:00Z
Ralf Schumacher,Markus Lanz 20.04.2010,2010-04-20T00:00:00Z
Susanne Fröhlich,Markus Lanz 20.04.2010,2010-04-20T00:00:00Z
Tamme Hanken,Markus Lanz 20.04.2010,2010-04-20T00:00:00Z
David Hasselhoff,Markus Lanz 21.04.2010,2010-04-21T00:00:00Z
Doris Brötz,Markus Lanz 22.04.2010,2010-04-22T00:00:00Z
Elka Cleve,Markus Lanz 22.04.2010,2010-04-22T00:00:00Z
Gisela Augustinski,Markus Lanz 22.04.2010,2010-04-22T00:00:00Z
Margot Cleve,Markus Lanz 22.04.2010,2010-04-22T00:00:00Z
Peer Augustinski,Markus Lanz 22.04.2010,2010-04-22T00:00:00Z
Wilfried Handl,Markus Lanz 22.04.2010,2010-04-22T00:00:00Z
Corinna May,Markus Lanz 27.04.2010,2010-04-27T00:00:00Z
Eberhart Zrenner,Markus Lanz 27.04.2010,2010-04-27T00:00:00Z
Guido Hammesfahr,Markus Lanz 27.04.2010,2010-04-27T00:00:00Z
Helmut Krauss,Markus Lanz 27.04.2010,2010-04-27T00:00:00Z
Ingrid Del,Markus Lanz 27.04.2010,2010-04-27T00:00:00Z
Jan Sauermann,Markus Lanz 27.04.2010,2010-04-27T00:00:00Z
Martin Sommer,Markus Lanz 27.04.2010,2010-04-27T00:00:00Z
Miikka Terho,Markus Lanz 27.04.2010,2010-04-27T00:00:00Z
Peter Lustig,Markus Lanz 27.04.2010,2010-04-27T00:00:00Z
Simone Sauermann,Markus Lanz 27.04.2010,2010-04-27T00:00:00Z
Anne Markwardt,Markus Lanz 28.04.2010,2010-04-28T00:00:00Z
Annette Nehberg-Weber,Markus Lanz 28.04.2010,2010-04-28T00:00:00Z
Astrid Frohloff,Markus Lanz 28.04.2010,2010-04-28T00:00:00Z
Jürgen Schmieder,Markus Lanz 28.04.2010,2010-04-28T00:00:00Z
Martin Blach,Markus Lanz 28.04.2010,2010-04-28T00:00:00Z
Rüdiger Nehberg,Markus Lanz 28.04.2010,2010-04-28T00:00:00Z
Dirk Müller,Markus Lanz 29.04.2010,2010-04-29T00:00:00Z
Hans Eichel,Markus Lanz 29.04.2010,2010-04-29T00:00:00Z
Hans Olaf Henkel,Markus Lanz 29.04.2010,2010-04-29T00:00:00Z
Inge Steiner,Markus Lanz 29.04.2010,2010-04-29T00:00:00Z
Jean Pütz,Markus Lanz 29.04.2010,2010-04-29T00:00:00Z
Maria Solrun Sigurdadottir,Markus Lanz 05.08.2008,2008-08-05T00:00:00Z
Theo Kelz,Markus Lanz 05.08.2008,2008-08-05T00:00:00Z
Arved Fuchs,Markus Lanz 07.08.2008,2008-08-07T00:00:00Z
Dieter Wedel,Markus Lanz 07.08.2008,2008-08-07T00:00:00Z
Guido Cantz,Markus Lanz 07.08.2008,2008-08-07T00:00:00Z
Mojib Latif,Markus Lanz 07.08.2008,2008-08-07T00:00:00Z
Robert Wennekes,Markus Lanz 07.08.2008,2008-08-07T00:00:00Z
Walter Plathe,Markus Lanz 07.08.2008,2008-08-07T00:00:00Z
Andreas Englisch,Markus Lanz 12.08.2008,2008-08-12T00:00:00Z
Frank Plasberg,Markus Lanz 12.08.2008,2008-08-12T00:00:00Z
Hannes Jaenicke,Markus Lanz 12.08.2008,2008-08-12T00:00:00Z
Konstantin Wehnhard,Markus Lanz 12.08.2008,2008-08-12T00:00:00Z
Maik Schaffer,Markus Lanz 12.08.2008,2008-08-12T00:00:00Z
Phillip Wehnhard,Markus Lanz 12.08.2008,2008-08-12T00:00:00Z
Aytekin Yilmaz,Markus Lanz 14.08.2008,2008-08-14T00:00:00Z
Birgit Rehlender,Markus Lanz 14.08.2008,2008-08-14T00:00:00Z
Dieter Moor,Markus Lanz 14.08.2008,2008-08-14T00:00:00Z
Emre Yilmaz,Markus Lanz 14.08.2008,2008-08-14T00:00:00Z
Esther Schweins,Markus Lanz 14.08.2008,2008-08-14T00:00:00Z
Klaus Wilkens,Markus Lanz 14.08.2008,2008-08-14T00:00:00Z
Markus Bennemann,Markus Lanz 14.08.2008,2008-08-14T00:00:00Z
Rolf Lüke,Markus Lanz 14.08.2008,2008-08-14T00:00:00Z
Alexander Herrmann,Markus Lanz 19.08.2008,2008-08-19T00:00:00Z
Alfons Schuhbeck,Markus Lanz 19.08.2008,2008-08-19T00:00:00Z
Johann Lafer,Markus Lanz 19.08.2008,2008-08-19T00:00:00Z
Simon Kehrer,Markus Lanz 19.08.2008,2008-08-19T00:00:00Z
Steffen Henssler,Markus Lanz 19.08.2008,2008-08-19T00:00:00Z
Gunther Tiersch,Markus Lanz 21.08.2008,2008-08-21T00:00:00Z
Bastian Sick,Markus Lanz 26.08.2008,2008-08-26T00:00:00Z
Britta Steffen,Markus Lanz 26.08.2008,2008-08-26T00:00:00Z
Gayle Tufts,Markus Lanz 26.08.2008,2008-08-26T00:00:00Z
Hinrich Romeike,Markus Lanz 26.08.2008,2008-08-26T00:00:00Z
Kristin Schmoock,Markus Lanz 26.08.2008,2008-08-26T00:00:00Z
Maren Schmoock,Markus Lanz 26.08.2008,2008-08-26T00:00:00Z
Solvejg Schmoock,Markus Lanz 26.08.2008,2008-08-26T00:00:00Z
Sulaiman Masomi,Markus Lanz 26.08.2008,2008-08-26T00:00:00Z
Wolf Schneider,Markus Lanz 26.08.2008,2008-08-26T00:00:00Z
Andreas Korn,Markus Lanz 28.08.2008,2008-08-28T00:00:00Z
Angela Fensch,Markus Lanz 28.08.2008,2008-08-28T00:00:00Z
Bettina Böttinger,Markus Lanz 28.08.2008,2008-08-28T00:00:00Z
Birgit Lorenz,Markus Lanz 28.08.2008,2008-08-28T00:00:00Z
Björn Hoppmann,Markus Lanz 28.08.2008,2008-08-28T00:00:00Z
Iris Hoppmann,Markus Lanz 28.08.2008,2008-08-28T00:00:00Z
Kurt Starke,Markus Lanz 28.08.2008,2008-08-28T00:00:00Z
Martin Rütter,Markus Lanz 28.08.2008,2008-08-28T00:00:00Z
Oswalt Kolle,Markus Lanz 28.08.2008,2008-08-28T00:00:00Z
Ruth Gassmann,Markus Lanz 28.08.2008,2008-08-28T00:00:00Z
Taime Kuttig,Markus Lanz 28.08.2008,2008-08-28T00:00:00Z
Bernhard Hoecker,Markus Lanz 02.09.2008,2008-09-02T00:00:00Z
Eckart Von,Markus Lanz 02.09.2008,2008-09-02T00:00:00Z
Martina Hill,Markus Lanz 02.09.2008,2008-09-02T00:00:00Z
Peter Nottmeier,Markus Lanz 02.09.2008,2008-09-02T00:00:00Z
Robert Atzorn,Markus Lanz 02.09.2008,2008-09-02T00:00:00Z
Viktoria Tapp,Markus Lanz 02.09.2008,2008-09-02T00:00:00Z
Dieter Haarhaus,Markus Lanz 03.09.2008,2008-09-03T00:00:00Z
Peter Hong,Markus Lanz 03.09.2008,2008-09-03T00:00:00Z
Reinhold Beckmann,Markus Lanz 03.09.2008,2008-09-03T00:00:00Z
Renate Hong,Markus Lanz 03.09.2008,2008-09-03T00:00:00Z
Susanne Fröhlich,Markus Lanz 03.09.2008,2008-09-03T00:00:00Z
Uwe Hong,Markus Lanz 03.09.2008,2008-09-03T00:00:00Z
Jürgen Charchulla,Markus Lanz 04.09.2008,2008-09-04T00:00:00Z
Paul Potts,Markus Lanz 04.09.2008,2008-09-04T00:00:00Z
Tim Mälzer,Markus Lanz 04.09.2008,2008-09-04T00:00:00Z
Arnes Petrick,Markus Lanz 16.06.2009,2009-06-16T00:00:00Z
Bernhard Stitz,Markus Lanz 16.06.2009,2009-06-16T00:00:00Z
Julia Rehberg,Markus Lanz 16.06.2009,2009-06-16T00:00:00Z
Thomas Peh,Markus Lanz 16.06.2009,2009-06-16T00:00:00Z
Waltraud Zöllner,Markus Lanz 16.06.2009,2009-06-16T00:00:00Z
Antonia Krüger,Markus Lanz 17.06.2009,2009-06-17T00:00:00Z
Arnulf Pekrun,Markus Lanz 17.06.2009,2009-06-17T00:00:00Z
Claudia Rutt,Markus Lanz 17.06.2009,2009-06-17T00:00:00Z
Dennis Tams,Markus Lanz 17.06.2009,2009-06-17T00:00:00Z
Dirk Waasen,Markus Lanz 17.06.2009,2009-06-17T00:00:00Z
Fehmke Krüger,Markus Lanz 17.06.2009,2009-06-17T00:00:00Z
Magdalena Steinkemper,Markus Lanz 17.06.2009,2009-06-17T00:00:00Z
Miriam Bachmann,Markus Lanz 17.06.2009,2009-06-17T00:00:00Z
Nele Krüger,Markus Lanz 17.06.2009,2009-06-17T00:00:00Z
Sabine Krüger,Markus Lanz 17.06.2009,2009-06-17T00:00:00Z
Udo Vetter,Markus Lanz 17.06.2009,2009-06-17T00:00:00Z
Verona Pooth,Markus Lanz 17.06.2009,2009-06-17T00:00:00Z
Christoph Zimmermann,Markus Lanz 18.06.2009,2009-06-18T00:00:00Z
Hans Joachim Bubert,Markus Lanz 18.06.2009,2009-06-18T00:00:00Z
Klaus Sattler,Markus Lanz 18.06.2009,2009-06-18T00:00:00Z
Martin Sonneborn,Markus Lanz 18.06.2009,2009-06-18T00:00:00Z
Oliver Welke,Markus Lanz 18.06.2009,2009-06-18T00:00:00Z
Petra Bubert,Markus Lanz 18.06.2009,2009-06-18T00:00:00Z
Silke Schwartau,Markus Lanz 18.06.2009,2009-06-18T00:00:00Z
Steffen Henssler,Markus Lanz 18.06.2009,2009-06-18T00:00:00Z
Adelheid Gottwald,Markus Lanz 23.06.2009,2009-06-23T00:00:00Z
Amir Hallouane,Markus Lanz 23.06.2009,2009-06-23T00:00:00Z
Andre Stern,Markus Lanz 23.06.2009,2009-06-23T00:00:00Z
Angelika Hallouane,Markus Lanz 23.06.2009,2009-06-23T00:00:00Z
Christine Czermak,Markus Lanz 23.06.2009,2009-06-23T00:00:00Z
Jan Uwe Rogge,Markus Lanz 23.06.2009,2009-06-23T00:00:00Z
Jörg Knör,Markus Lanz 23.06.2009,2009-06-23T00:00:00Z
Katja Saalfrank,Markus Lanz 23.06.2009,2009-06-23T00:00:00Z
Kay Vorwerk,Markus Lanz 23.06.2009,2009-06-23T00:00:00Z
Martin Schneider,Markus Lanz 23.06.2009,2009-06-23T00:00:00Z
Nicole Geiger,Markus Lanz 23.06.2009,2009-06-23T00:00:00Z
Uschi Glas,Markus Lanz 23.06.2009,2009-06-23T00:00:00Z
Ben Tewaag,Markus Lanz 18.01.2012,2012-01-18T00:00:00Z
Horst Schroth,Markus Lanz 18.01.2012,2012-01-18T00:00:00Z
Ingrid Van,Markus Lanz 18.01.2012,2012-01-18T00:00:00Z
Ulla Kock,Markus Lanz 18.01.2012,2012-01-18T00:00:00Z
Anna Loos,Markus Lanz 19.01.2012,2012-01-19T00:00:00Z
Carolin Schneider,Markus Lanz 19.01.2012,2012-01-19T00:00:00Z
Jörg Knör,Markus Lanz 19.01.2012,2012-01-19T00:00:00Z
Rainer Langhans,Markus Lanz 19.01.2012,2012-01-19T00:00:00Z
Walter Momper,Markus Lanz 19.01.2012,2012-01-19T00:00:00Z
Geert Müller-Gerbes,Markus Lanz 24.01.2012,2012-01-24T00:00:00Z
Gesine Lötzsch,Markus Lanz 24.01.2012,2012-01-24T00:00:00Z
Klaus Kocks,Markus Lanz 24.01.2012,2012-01-24T00:00:00Z
Oliver Pocher,Markus Lanz 24.01.2012,2012-01-24T00:00:00Z
Thomas Hermanns,Markus Lanz 24.01.2012,2012-01-24T00:00:00Z
Adriana Altaras,Markus Lanz 25.01.2012,2012-01-25T00:00:00Z
Alec Völkel,Markus Lanz 25.01.2012,2012-01-25T00:00:00Z
Dirk Steffens,Markus Lanz 25.01.2012,2012-01-25T00:00:00Z
Eva Mozes-Kor,Markus Lanz 25.01.2012,2012-01-25T00:00:00Z
Peer Kusmagk,Markus Lanz 25.01.2012,2012-01-25T00:00:00Z
Sascha Vollmer,Markus Lanz 25.01.2012,2012-01-25T00:00:00Z
Gerhart Baum,Markus Lanz 26.01.2012,2012-01-26T00:00:00Z
Julia Schramm,Markus Lanz 26.01.2012,2012-01-26T00:00:00Z
Jörg Eschenbach,Markus Lanz 26.01.2012,2012-01-26T00:00:00Z
Konny Reimann,Markus Lanz 26.01.2012,2012-01-26T00:00:00Z
Olivia Jones,Markus Lanz 26.01.2012,2012-01-26T00:00:00Z
Willy Bogner,Markus Lanz 26.01.2012,2012-01-26T00:00:00Z
Bastian Bielendorfer,Markus Lanz 31.01.2012,2012-01-31T00:00:00Z
Hajo Schumacher,Markus Lanz 31.01.2012,2012-01-31T00:00:00Z
Jörg Schönbohm,Markus Lanz 31.01.2012,2012-01-31T00:00:00Z
Martin Rütter,Markus Lanz 31.01.2012,2012-01-31T00:00:00Z
Nina Ruge,Markus Lanz 31.01.2012,2012-01-31T00:00:00Z
Burkhard Driest,Markus Lanz 01.02.2012,2012-02-01T00:00:00Z
Dirk Stermann,Markus Lanz 01.02.2012,2012-02-01T00:00:00Z
Indira Weis,Markus Lanz 01.02.2012,2012-02-01T00:00:00Z
Marianne Koch,Markus Lanz 01.02.2012,2012-02-01T00:00:00Z
Micky Beisenherz,Markus Lanz 01.02.2012,2012-02-01T00:00:00Z
Bernd Siggelkow,Markus Lanz 02.02.2012,2012-02-02T00:00:00Z
Christine Scheible,Markus Lanz 02.02.2012,2012-02-02T00:00:00Z
Detlef Soost,Markus Lanz 02.02.2012,2012-02-02T00:00:00Z
Hans Dieter Scheible,Markus Lanz 02.02.2012,2012-02-02T00:00:00Z
Heinz Buschkowsky,Markus Lanz 02.02.2012,2012-02-02T00:00:00Z
Katrin Sass,Markus Lanz 02.02.2012,2012-02-02T00:00:00Z
Marc Bator,Markus Lanz 02.02.2012,2012-02-02T00:00:00Z
Helga Rohra,Markus Lanz 07.02.2012,2012-02-07T00:00:00Z
Markus Preiter,Markus Lanz 07.02.2012,2012-02-07T00:00:00Z
Peer Juhnke,Markus Lanz 07.02.2012,2012-02-07T00:00:00Z
Stephanie Schmidt,Markus Lanz 07.02.2012,2012-02-07T00:00:00Z
Werner Hansch,Markus Lanz 07.02.2012,2012-02-07T00:00:00Z
Bodo Bach,Markus Lanz 08.02.2012,2012-02-08T00:00:00Z
Eike Immel,Markus Lanz 08.02.2012,2012-02-08T00:00:00Z
Kate Abdo,Markus Lanz 08.02.2012,2012-02-08T00:00:00Z
Manfred Breuckmann,Markus Lanz 08.02.2012,2012-02-08T00:00:00Z
Monika Ivancan,Markus Lanz 08.02.2012,2012-02-08T00:00:00Z
Florian Schroeder,Markus Lanz 09.02.2012,2012-02-09T00:00:00Z
Gero Von,Markus Lanz 09.02.2012,2012-02-09T00:00:00Z
Marcus Hellwig,Markus Lanz 09.02.2012,2012-02-09T00:00:00Z
Marina Weisband,Markus Lanz 09.02.2012,2012-02-09T00:00:00Z
Michael Spreng,Markus Lanz 09.02.2012,2012-02-09T00:00:00Z
Frank Rosin,Markus Lanz 15.02.2012,2012-02-15T00:00:00Z
Nicole Dill,Markus Lanz 15.02.2012,2012-02-15T00:00:00Z
Peter Hahne,Markus Lanz 15.02.2012,2012-02-15T00:00:00Z
Reinhard Haller,Markus Lanz 15.02.2012,2012-02-15T00:00:00Z
Steffen Henssler,Markus Lanz 15.02.2012,2012-02-15T00:00:00Z
Bernd Siggelkow,Markus Lanz 16.02.2012,2012-02-16T00:00:00Z
Heinz Buschkowsky,Markus Lanz 16.02.2012,2012-02-16T00:00:00Z
Herbert Feuerstein,Markus Lanz 16.02.2012,2012-02-16T00:00:00Z
Melda Akbas,Markus Lanz 16.02.2012,2012-02-16T00:00:00Z
Murat Topal,Markus Lanz 16.02.2012,2012-02-16T00:00:00Z
Viviane Cismak,Markus Lanz 16.02.2012,2012-02-16T00:00:00Z
Anselm Grün,Markus Lanz 21.02.2012,2012-02-21T00:00:00Z
Hajo Schumacher,Markus Lanz 21.02.2012,2012-02-21T00:00:00Z
Oliver Kalkofe,Markus Lanz 21.02.2012,2012-02-21T00:00:00Z
Susanne Graf,Markus Lanz 21.02.2012,2012-02-21T00:00:00Z
Walter Kohl,Markus Lanz 21.02.2012,2012-02-21T00:00:00Z
Dieter Tappert,Markus Lanz 22.02.2012,2012-02-22T00:00:00Z
Eckart Von,Markus Lanz 22.02.2012,2012-02-22T00:00:00Z
Hellmuth Karasek,Markus Lanz 22.02.2012,2012-02-22T00:00:00Z
Jutta Ditfurth,Markus Lanz 22.02.2012,2012-02-22T00:00:00Z
Zuhal Soyhan,Markus Lanz 22.02.2012,2012-02-22T00:00:00Z
Howard Carpendale,Markus Lanz 23.02.2012,2012-02-23T00:00:00Z
Katharina Böhm,Markus Lanz 23.02.2012,2012-02-23T00:00:00Z
Philipp Rösler,Markus Lanz 23.02.2012,2012-02-23T00:00:00Z
Tine Wittler,Markus Lanz 23.02.2012,2012-02-23T00:00:00Z
Wayne Carpendale,Markus Lanz 23.02.2012,2012-02-23T00:00:00Z
Geert Müller-Gerbes,Markus Lanz 28.02.2012,2012-02-28T00:00:00Z
Jürgen Rüttgers,Markus Lanz 28.02.2012,2012-02-28T00:00:00Z
Kim Debkowski,Markus Lanz 28.02.2012,2012-02-28T00:00:00Z
Reyhan Sahin,Markus Lanz 28.02.2012,2012-02-28T00:00:00Z
Rocco Stark,Markus Lanz 28.02.2012,2012-02-28T00:00:00Z
Harald Schumacher,Markus Lanz 29.02.2012,2012-02-29T00:00:00Z
Hella Von,Markus Lanz 29.02.2012,2012-02-29T00:00:00Z
Matze Knop,Markus Lanz 29.02.2012,2012-02-29T00:00:00Z
Micaela S,Markus Lanz 29.02.2012,2012-02-29T00:00:00Z
Waldemar Hartmann,Markus Lanz 29.02.2012,2012-02-29T00:00:00Z
David Werker,Markus Lanz 01.03.2012,2012-03-01T00:00:00Z
Erika Pluhar,Markus Lanz 01.03.2012,2012-03-01T00:00:00Z
Heiner Bremer,Markus Lanz 01.03.2012,2012-03-01T00:00:00Z
Radost Bokel,Markus Lanz 01.03.2012,2012-03-01T00:00:00Z
Wolfgang Kubicki,Markus Lanz 01.03.2012,2012-03-01T00:00:00Z
Barbara Becker,Markus Lanz 06.03.2012,2012-03-06T00:00:00Z
Matthias Steiner,Markus Lanz 29.04.2010,2010-04-29T00:00:00Z
Michael Mittermeier,Markus Lanz 29.04.2010,2010-04-29T00:00:00Z
Pina Coluccia,Markus Lanz 29.04.2010,2010-04-29T00:00:00Z
Andrea Kiewel,Markus Lanz 04.05.2010,2010-05-04T00:00:00Z
Stefanie Märzheuser,Markus Lanz 04.05.2010,2010-05-04T00:00:00Z
Thomas Weinkauf,Markus Lanz 04.05.2010,2010-05-04T00:00:00Z
Torsten Heim,Markus Lanz 04.05.2010,2010-05-04T00:00:00Z
Bastian Heidhoff,Markus Lanz 05.05.2010,2010-05-05T00:00:00Z
Carola Ferstl,Markus Lanz 05.05.2010,2010-05-05T00:00:00Z
Joachim Llambi,Markus Lanz 05.05.2010,2010-05-05T00:00:00Z
Lilli Van,Markus Lanz 05.05.2010,2010-05-05T00:00:00Z
Markus Koch,Markus Lanz 05.05.2010,2010-05-05T00:00:00Z
Michaela Van,Markus Lanz 05.05.2010,2010-05-05T00:00:00Z
Reinhard Pregla,Markus Lanz 05.05.2010,2010-05-05T00:00:00Z
Gunter Gabriel,Markus Lanz 06.05.2010,2010-05-06T00:00:00Z
Hera Lind,Markus Lanz 06.05.2010,2010-05-06T00:00:00Z
Volker Lechtenbrink,Markus Lanz 06.05.2010,2010-05-06T00:00:00Z
Dieter Nuhr,Markus Lanz 11.05.2010,2010-05-11T00:00:00Z
Ingo Appelt,Markus Lanz 11.05.2010,2010-05-11T00:00:00Z
Julia Heilmann,Markus Lanz 11.05.2010,2010-05-11T00:00:00Z
Thomas Lindemann,Markus Lanz 11.05.2010,2010-05-11T00:00:00Z
Ulrich Wickert,Markus Lanz 11.05.2010,2010-05-11T00:00:00Z
Alfred Biolek,Markus Lanz 18.05.2010,2010-05-18T00:00:00Z
Atze Schröder,Markus Lanz 18.05.2010,2010-05-18T00:00:00Z
Desiree Nick,Markus Lanz 18.05.2010,2010-05-18T00:00:00Z
Micky Beisenherz,Markus Lanz 18.05.2010,2010-05-18T00:00:00Z
Anna Wagner,Markus Lanz 19.05.2010,2010-05-19T00:00:00Z
Carsten Uhr,Markus Lanz 19.05.2010,2010-05-19T00:00:00Z
Dieter Langendörfer,Markus Lanz 19.05.2010,2010-05-19T00:00:00Z
Michael Buback,Markus Lanz 19.05.2010,2010-05-19T00:00:00Z
Petra Thorn,Markus Lanz 19.05.2010,2010-05-19T00:00:00Z
Rudi Cerne,Markus Lanz 19.05.2010,2010-05-19T00:00:00Z
Rudolf Egg,Markus Lanz 19.05.2010,2010-05-19T00:00:00Z
Stefan Aust,Markus Lanz 19.05.2010,2010-05-19T00:00:00Z
Thomas Katzorke,Markus Lanz 19.05.2010,2010-05-19T00:00:00Z
Ulrich Endres,Markus Lanz 19.05.2010,2010-05-19T00:00:00Z
Hans Förstl,Markus Lanz 20.05.2010,2010-05-20T00:00:00Z
Helga Rohra,Markus Lanz 20.05.2010,2010-05-20T00:00:00Z
Jens Rohra,Markus Lanz 20.05.2010,2010-05-20T00:00:00Z
Jörg Knör,Markus Lanz 20.05.2010,2010-05-20T00:00:00Z
Marti Fischer,Markus Lanz 20.05.2010,2010-05-20T00:00:00Z
Matze Knop,Markus Lanz 20.05.2010,2010-05-20T00:00:00Z
Andrea Berg,Markus Lanz 25.05.2010,2010-05-25T00:00:00Z
Gisela Friedrichsen,Markus Lanz 25.05.2010,2010-05-25T00:00:00Z
Regina Kalthegener,Markus Lanz 25.05.2010,2010-05-25T00:00:00Z
Sabatina James,Markus Lanz 25.05.2010,2010-05-25T00:00:00Z
Vera Janzen,Markus Lanz 25.05.2010,2010-05-25T00:00:00Z
Werner Janzen,Markus Lanz 25.05.2010,2010-05-25T00:00:00Z
Benedict Eisenberg,Markus Lanz 26.05.2010,2010-05-26T00:00:00Z
Joachim Herrmann,Markus Lanz 26.05.2010,2010-05-26T00:00:00Z
Katja Ebstein,Markus Lanz 26.05.2010,2010-05-26T00:00:00Z
Kim Fisher,Markus Lanz 26.05.2010,2010-05-26T00:00:00Z
Michael Wigge,Markus Lanz 26.05.2010,2010-05-26T00:00:00Z
Ralph Morgenstern,Markus Lanz 26.05.2010,2010-05-26T00:00:00Z
Renate Eisenberg,Markus Lanz 26.05.2010,2010-05-26T00:00:00Z
Thomas M Stein,Markus Lanz 26.05.2010,2010-05-26T00:00:00Z
Thomas Tesseraux,Markus Lanz 26.05.2010,2010-05-26T00:00:00Z
Joachim Llambi,Markus Lanz 27.05.2010,2010-05-27T00:00:00Z
Kurt Westergaard,Markus Lanz 27.05.2010,2010-05-27T00:00:00Z
Peter Kraus,Markus Lanz 27.05.2010,2010-05-27T00:00:00Z
Sophia Thomalla,Markus Lanz 27.05.2010,2010-05-27T00:00:00Z
Carola Ferstl,Markus Lanz 01.06.2010,2010-06-01T00:00:00Z
Justus Haucap,Markus Lanz 01.06.2010,2010-06-01T00:00:00Z
Michael Jürgs,Markus Lanz 01.06.2010,2010-06-01T00:00:00Z
Wolfgang Grupp,Markus Lanz 01.06.2010,2010-06-01T00:00:00Z
Aisha Rokovsky,Markus Lanz 02.06.2010,2010-06-02T00:00:00Z
John Gordon,Markus Lanz 02.06.2010,2010-06-02T00:00:00Z
Judy Winter,Markus Lanz 02.06.2010,2010-06-02T00:00:00Z
Julie Frost,Markus Lanz 02.06.2010,2010-06-02T00:00:00Z
Kester Schlenz,Markus Lanz 02.06.2010,2010-06-02T00:00:00Z
Mary Roos,Markus Lanz 02.06.2010,2010-06-02T00:00:00Z
Monica Invancan,Markus Lanz 02.06.2010,2010-06-02T00:00:00Z
Peter Urban,Markus Lanz 02.06.2010,2010-06-02T00:00:00Z
Andreas Kieling,Markus Lanz 03.06.2010,2010-06-03T00:00:00Z
Heide Simonis,Markus Lanz 03.06.2010,2010-06-03T00:00:00Z
Peter Hahne,Markus Lanz 03.06.2010,2010-06-03T00:00:00Z
Wolfgang Bosbach,Markus Lanz 03.06.2010,2010-06-03T00:00:00Z
Gabi Decker,Markus Lanz 08.06.2010,2010-06-08T00:00:00Z
Gisela Friedrichsen,Markus Lanz 08.06.2010,2010-06-08T00:00:00Z
Hans Hermann Tiedje,Markus Lanz 08.06.2010,2010-06-08T00:00:00Z
Hans Ulrich Jörges,Markus Lanz 08.06.2010,2010-06-08T00:00:00Z
Dieter Kronzucker,Markus Lanz 09.06.2010,2010-06-09T00:00:00Z
Dirk Steffens,Markus Lanz 09.06.2010,2010-06-09T00:00:00Z
Erich Ritter,Markus Lanz 09.06.2010,2010-06-09T00:00:00Z
Michael Poliza,Markus Lanz 09.06.2010,2010-06-09T00:00:00Z
Ferdinand Von,Markus Lanz 04.08.2010,2010-08-04T00:00:00Z
Hellmuth Karasek,Markus Lanz 04.08.2010,2010-08-04T00:00:00Z
Michael Fröhlich,Markus Lanz 04.08.2010,2010-08-04T00:00:00Z
Schaltgespräch Lanz,Markus Lanz 04.08.2010,2010-08-04T00:00:00Z
Daniela Katzenberger,Markus Lanz 05.08.2010,2010-08-05T00:00:00Z
Elke Sommer,Markus Lanz 05.08.2010,2010-08-05T00:00:00Z
Jimmy Jump,Markus Lanz 05.08.2010,2010-08-05T00:00:00Z
Jürgen Drews,Markus Lanz 05.08.2010,2010-08-05T00:00:00Z
Theo Brenig,Markus Lanz 05.08.2010,2010-08-05T00:00:00Z
Lothar Matthäus,Markus Lanz 12.08.2010,2010-08-12T00:00:00Z
Sonja Zietlow,Markus Lanz 12.08.2010,2010-08-12T00:00:00Z
Steffen Henssler,Markus Lanz 12.08.2010,2010-08-12T00:00:00Z
Vera Int-Veen,Markus Lanz 12.08.2010,2010-08-12T00:00:00Z
Beate Merk,Markus Lanz 18.08.2010,2010-08-18T00:00:00Z
Bernd Behnke,Markus Lanz 18.08.2010,2010-08-18T00:00:00Z
Andrea Kiewel,Markus Lanz 03.05.2011,2011-05-03T00:00:00Z
Andreas Kieling,Markus Lanz 03.05.2011,2011-05-03T00:00:00Z
Kay Ray,Markus Lanz 03.05.2011,2011-05-03T00:00:00Z
Mathias Richling,Markus Lanz 03.05.2011,2011-05-03T00:00:00Z
Wolf Von,Markus Lanz 03.05.2011,2011-05-03T00:00:00Z
Andreas Englisch,Markus Lanz 05.05.2011,2011-05-05T00:00:00Z
Barbara Becker,Markus Lanz 05.05.2011,2011-05-05T00:00:00Z
Detlef D,Markus Lanz 05.05.2011,2011-05-05T00:00:00Z
Manfred Lütz,Markus Lanz 05.05.2011,2011-05-05T00:00:00Z
Werner Sonne,Markus Lanz 05.05.2011,2011-05-05T00:00:00Z
Heiner Geißler,Markus Lanz 10.05.2011,2011-05-10T00:00:00Z
Joachim Llambi,Markus Lanz 10.05.2011,2011-05-10T00:00:00Z
Motsi Mabuse,Markus Lanz 10.05.2011,2011-05-10T00:00:00Z
Sophie Rosentreter,Markus Lanz 10.05.2011,2011-05-10T00:00:00Z
Alfred Mignon,Markus Lanz 11.05.2011,2011-05-11T00:00:00Z
Ehepaar Konny Reimann,Markus Lanz 11.05.2011,2011-05-11T00:00:00Z
Hartmut Engler,Markus Lanz 11.05.2011,2011-05-11T00:00:00Z
Manuela Reimann,Markus Lanz 11.05.2011,2011-05-11T00:00:00Z
Uli Roth,Markus Lanz 11.05.2011,2011-05-11T00:00:00Z
Alida Gundlach,Markus Lanz 12.05.2011,2011-05-12T00:00:00Z
Gracia Baur,Markus Lanz 12.05.2011,2011-05-12T00:00:00Z
Katerina Jacob,Markus Lanz 12.05.2011,2011-05-12T00:00:00Z
Mathieu Carriere,Markus Lanz 12.05.2011,2011-05-12T00:00:00Z
Matthias Matussek,Markus Lanz 12.05.2011,2011-05-12T00:00:00Z
Oliver Pocher,Markus Lanz 12.05.2011,2011-05-12T00:00:00Z
Bettina Tietjen,Markus Lanz 17.05.2011,2011-05-17T00:00:00Z
Horst Schroth,Markus Lanz 17.05.2011,2011-05-17T00:00:00Z
Joachim Steinhöfel,Markus Lanz 17.05.2011,2011-05-17T00:00:00Z
Jorgo Chatzimarkakis,Markus Lanz 17.05.2011,2011-05-17T00:00:00Z
Marie Luise Marjan,Markus Lanz 17.05.2011,2011-05-17T00:00:00Z
Sam Jolig,Markus Lanz 17.05.2011,2011-05-17T00:00:00Z
Bernhard Töpper,Markus Lanz 18.05.2011,2011-05-18T00:00:00Z
Gisela Friedrichsen,Markus Lanz 18.05.2011,2011-05-18T00:00:00Z
Peter Anders,Markus Lanz 18.05.2011,2011-05-18T00:00:00Z
Franz Müntefering,Markus Lanz 19.05.2011,2011-05-19T00:00:00Z
Hannelore Elsner,Markus Lanz 19.05.2011,2011-05-19T00:00:00Z
Moritz A Sachs,Markus Lanz 19.05.2011,2011-05-19T00:00:00Z
Monica Ivancan,Markus Lanz 19.05.2011,2011-05-19T00:00:00Z
Alexander Gerhardinger,Markus Lanz 25.05.2011,2011-05-25T00:00:00Z
Christian Rach,Markus Lanz 25.05.2011,2011-05-25T00:00:00Z
Gisela Friedrichsen,Markus Lanz 25.05.2011,2011-05-25T00:00:00Z
Roman Maria Koidl,Markus Lanz 25.05.2011,2011-05-25T00:00:00Z
Silvia Jelincic,Markus Lanz 25.05.2011,2011-05-25T00:00:00Z
Gisela Friedrichsen,Markus Lanz 31.05.2011,2011-05-31T00:00:00Z
Johann Schwenn,Markus Lanz 31.05.2011,2011-05-31T00:00:00Z
Ralf Witte,Markus Lanz 31.05.2011,2011-05-31T00:00:00Z
Roswitha Müller-Piepenkötter,Markus Lanz 31.05.2011,2011-05-31T00:00:00Z
Udo Röbel,Markus Lanz 31.05.2011,2011-05-31T00:00:00Z
Alexander Hold,Markus Lanz 01.06.2011,2011-06-01T00:00:00Z
Dirk Steffens,Markus Lanz 01.06.2011,2011-06-01T00:00:00Z
Hans Hermann Tiedje,Markus Lanz 01.06.2011,2011-06-01T00:00:00Z
Irmingard Schewe-Gerigk,Markus Lanz 01.06.2011,2011-06-01T00:00:00Z
Jan Kielstein,Markus Lanz 01.06.2011,2011-06-01T00:00:00Z
Robert Kuhnt,Markus Lanz 01.06.2011,2011-06-01T00:00:00Z
Christoph Koch,Markus Lanz 02.06.2011,2011-06-02T00:00:00Z
Elisabeth Koch,Markus Lanz 02.06.2011,2011-06-02T00:00:00Z
Katharina Thalbach,Markus Lanz 02.06.2011,2011-06-02T00:00:00Z
Klaus Wowereit,Markus Lanz 02.06.2011,2011-06-02T00:00:00Z
Corinne Hofmann,Markus Lanz 07.06.2011,2011-06-07T00:00:00Z
Ingrid Van,Markus Lanz 07.06.2011,2011-06-07T00:00:00Z
Jan Kielstein,Markus Lanz 07.06.2011,2011-06-07T00:00:00Z
Joachim Berger,Markus Lanz 07.06.2011,2011-06-07T00:00:00Z
Sahra Wagenknecht,Markus Lanz 07.06.2011,2011-06-07T00:00:00Z
Udo Pollmer,Markus Lanz 07.06.2011,2011-06-07T00:00:00Z
Christiane Hagn,Markus Lanz 08.06.2011,2011-06-08T00:00:00Z
Ehefrau Claudia Wendler,Markus Lanz 08.06.2011,2011-06-08T00:00:00Z
Jürgen Charchulla,Markus Lanz 08.06.2011,2011-06-08T00:00:00Z
Leonard Lansink,Markus Lanz 08.06.2011,2011-06-08T00:00:00Z
Manfred Charchulla,Markus Lanz 08.06.2011,2011-06-08T00:00:00Z
Michael Wendler,Markus Lanz 08.06.2011,2011-06-08T00:00:00Z
Ehefrau Luzandra Strassburg,Markus Lanz 09.06.2011,2011-06-09T00:00:00Z
Jutta Speidel,Markus Lanz 09.06.2011,2011-06-09T00:00:00Z
Lebensgefährten Bruno Maccallini,Markus Lanz 09.06.2011,2011-06-09T00:00:00Z
Michael Kessler,Markus Lanz 09.06.2011,2011-06-09T00:00:00Z
Philip Siegel,Markus Lanz 09.06.2011,2011-06-09T00:00:00Z
Roberto Blanco,Markus Lanz 09.06.2011,2011-06-09T00:00:00Z
Axel Garthe,Markus Lanz 14.06.2011,2011-06-14T00:00:00Z
Ehefrau Nada Lichter,Markus Lanz 14.06.2011,2011-06-14T00:00:00Z
Eltern Sabine Garthe,Markus Lanz 14.06.2011,2011-06-14T00:00:00Z
Günther Beckstein,Markus Lanz 14.06.2011,2011-06-14T00:00:00Z
Heribert Schwan,Markus Lanz 14.06.2011,2011-06-14T00:00:00Z
Horst Lichter,Markus Lanz 14.06.2011,2011-06-14T00:00:00Z
Theo Garthe,Markus Lanz 14.06.2011,2011-06-14T00:00:00Z
Christine Bergmann,Markus Lanz 15.06.2011,2011-06-15T00:00:00Z
Kathrin Radke,Markus Lanz 15.06.2011,2011-06-15T00:00:00Z
Leo Busch,Markus Lanz 15.06.2011,2011-06-15T00:00:00Z
Mary Roos,Markus Lanz 15.06.2011,2011-06-15T00:00:00Z
Sohn Julian Böhm,Markus Lanz 15.06.2011,2011-06-15T00:00:00Z
Dieter Wedel,Markus Lanz 16.06.2011,2011-06-16T00:00:00Z
Gaby Schäfer,Markus Lanz 16.06.2011,2011-06-16T00:00:00Z
Jana Beller,Markus Lanz 16.06.2011,2011-06-16T00:00:00Z
Reyhan Sahin,Markus Lanz 16.06.2011,2011-06-16T00:00:00Z
Veronica Ferres,Markus Lanz 16.06.2011,2011-06-16T00:00:00Z
Günter Wallraff,Markus Lanz 22.06.2011,2011-06-22T00:00:00Z
Martin Wehrle,Markus Lanz 22.06.2011,2011-06-22T00:00:00Z
Rüdiger Knaup,Markus Lanz 22.06.2011,2011-06-22T00:00:00Z
Ulrike Schramm-De,Markus Lanz 22.06.2011,2011-06-22T00:00:00Z
Wolfgang Grupp,Markus Lanz 22.06.2011,2011-06-22T00:00:00Z
Carlo Pedersoli,Markus Lanz 23.06.2011,2011-06-23T00:00:00Z
Christian Lindner,Markus Lanz 23.06.2011,2011-06-23T00:00:00Z
Aktenzeichen Xy,Markus Lanz 24.06.2009,2009-06-24T00:00:00Z
Charlotte Gerlach,Markus Lanz 24.06.2009,2009-06-24T00:00:00Z
Christian Häckl,Markus Lanz 24.06.2009,2009-06-24T00:00:00Z
Frank Hemme,Markus Lanz 24.06.2009,2009-06-24T00:00:00Z
Guido Berens,Markus Lanz 24.06.2009,2009-06-24T00:00:00Z
Hans Boes,Markus Lanz 24.06.2009,2009-06-24T00:00:00Z
Martin Ploch,Markus Lanz 24.06.2009,2009-06-24T00:00:00Z
Michael Dietz,Markus Lanz 24.06.2009,2009-06-24T00:00:00Z
Rudi Cerne,Markus Lanz 24.06.2009,2009-06-24T00:00:00Z
Schaltgespräch Lanz,Markus Lanz 24.06.2009,2009-06-24T00:00:00Z
Sven Plöger,Markus Lanz 24.06.2009,2009-06-24T00:00:00Z
Vera Jaron,Markus Lanz 24.06.2009,2009-06-24T00:00:00Z
Inge Niedeck,Markus Lanz 24.06.2009,2009-06-24T00:00:00Z
Christoph Drösser,Markus Lanz 25.06.2009,2009-06-25T00:00:00Z
Götz Alsmann,Markus Lanz 25.06.2009,2009-06-25T00:00:00Z
Omid Moussavi-Amin,Markus Lanz 25.06.2009,2009-06-25T00:00:00Z
Peyman Amin,Markus Lanz 25.06.2009,2009-06-25T00:00:00Z
Sara Nuru,Markus Lanz 25.06.2009,2009-06-25T00:00:00Z
Arno Dopychai,Markus Lanz 30.06.2009,2009-06-30T00:00:00Z
Guido Cantz,Markus Lanz 30.06.2009,2009-06-30T00:00:00Z
Hella Hansen,Markus Lanz 30.06.2009,2009-06-30T00:00:00Z
Jürgen Charchulla,Markus Lanz 30.06.2009,2009-06-30T00:00:00Z
Jürgen Harksen,Markus Lanz 30.06.2009,2009-06-30T00:00:00Z
Manfred Charchulla,Markus Lanz 30.06.2009,2009-06-30T00:00:00Z
Matthias Wolfschmidt,Markus Lanz 30.06.2009,2009-06-30T00:00:00Z
Peter Hahne,Markus Lanz 30.06.2009,2009-06-30T00:00:00Z
Constanze Kleis,Markus Lanz 01.07.2009,2009-07-01T00:00:00Z
Liane Wiegelmann,Markus Lanz 01.07.2009,2009-07-01T00:00:00Z
Martin Schulz,Markus Lanz 01.07.2009,2009-07-01T00:00:00Z
Michael Kessler,Markus Lanz 01.07.2009,2009-07-01T00:00:00Z
Michael Schöttler,Markus Lanz 01.07.2009,2009-07-01T00:00:00Z
Amelie Fried,Markus Lanz 02.07.2009,2009-07-02T00:00:00Z
Klaus Wildbolz,Markus Lanz 02.07.2009,2009-07-02T00:00:00Z
Nadine Von,Markus Lanz 02.07.2009,2009-07-02T00:00:00Z
Ully Loop,Markus Lanz 02.07.2009,2009-07-02T00:00:00Z
Ulrich Wickert,Markus Lanz 02.07.2009,2009-07-02T00:00:00Z
Bernd Stein,Markus Lanz 07.07.2009,2009-07-07T00:00:00Z
Dirk Steffens,Markus Lanz 07.07.2009,2009-07-07T00:00:00Z
Hans Peter Brix,Markus Lanz 07.07.2009,2009-07-07T00:00:00Z
Ilse Ruth Holzfuss,Markus Lanz 07.07.2009,2009-07-07T00:00:00Z
Marianne Necke,Markus Lanz 07.07.2009,2009-07-07T00:00:00Z
Martin Geier,Markus Lanz 07.07.2009,2009-07-07T00:00:00Z
Michael Flügger,Markus Lanz 07.07.2009,2009-07-07T00:00:00Z
Cornelia Poletto,Markus Lanz 08.07.2009,2009-07-08T00:00:00Z
Franziska Van,Markus Lanz 08.07.2009,2009-07-08T00:00:00Z
Gert Bartmann,Markus Lanz 08.07.2009,2009-07-08T00:00:00Z
Janine Schmeil,Markus Lanz 08.07.2009,2009-07-08T00:00:00Z
Norbert Brackmann,Markus Lanz 08.07.2009,2009-07-08T00:00:00Z
Tanja Schmeil,Markus Lanz 08.07.2009,2009-07-08T00:00:00Z
Vince Ebert,Markus Lanz 08.07.2009,2009-07-08T00:00:00Z
Werner Gruber,Markus Lanz 08.07.2009,2009-07-08T00:00:00Z
Benedict Eisenberg,Markus Lanz 09.07.2009,2009-07-09T00:00:00Z
Familie Lecce,Markus Lanz 09.07.2009,2009-07-09T00:00:00Z
Florian Schroeder,Markus Lanz 09.07.2009,2009-07-09T00:00:00Z
Mustapha Celem,Markus Lanz 09.07.2009,2009-07-09T00:00:00Z
Thomas Tesseraux,Markus Lanz 09.07.2009,2009-07-09T00:00:00Z
Eckhart Pahlke,Markus Lanz 14.07.2009,2009-07-14T00:00:00Z
Hartwig Huland,Markus Lanz 14.07.2009,2009-07-14T00:00:00Z
Michael Prang,Markus Lanz 14.07.2009,2009-07-14T00:00:00Z
Michael Roth,Markus Lanz 14.07.2009,2009-07-14T00:00:00Z
Ranga Yogeshwar,Markus Lanz 14.07.2009,2009-07-14T00:00:00Z
Zwillingsbruder Ulrich Roth,Markus Lanz 14.07.2009,2009-07-14T00:00:00Z
Birgit Nipkau,Markus Lanz 15.07.2009,2009-07-15T00:00:00Z
Christian Rosskamp,Markus Lanz 15.07.2009,2009-07-15T00:00:00Z
Daniela Weinert,Markus Lanz 15.07.2009,2009-07-15T00:00:00Z
Juliane Lutz,Markus Lanz 15.07.2009,2009-07-15T00:00:00Z
Jürgen Zulley,Markus Lanz 15.07.2009,2009-07-15T00:00:00Z
Karin Kluge-Daki,Markus Lanz 15.07.2009,2009-07-15T00:00:00Z
Kathrin Kühn,Markus Lanz 15.07.2009,2009-07-15T00:00:00Z
Mary Roos,Markus Lanz 15.07.2009,2009-07-15T00:00:00Z
Dirk Müller,Markus Lanz 16.07.2009,2009-07-16T00:00:00Z
Elmar Mai,Markus Lanz 16.07.2009,2009-07-16T00:00:00Z
Ingeborg Mootz,Markus Lanz 16.07.2009,2009-07-16T00:00:00Z
Michael Opoczynski,Markus Lanz 16.07.2009,2009-07-16T00:00:00Z
Pirkko Peitz,Markus Lanz 16.07.2009,2009-07-16T00:00:00Z
Ralph Morgenstern,Markus Lanz 16.07.2009,2009-07-16T00:00:00Z
Thorsten Peitz,Markus Lanz 16.07.2009,2009-07-16T00:00:00Z
Filip Cvijic,Markus Lanz 21.07.2009,2009-07-21T00:00:00Z
Gerd Dieter B,Markus Lanz 21.07.2009,2009-07-21T00:00:00Z
Gorbana Cvijic,Markus Lanz 21.07.2009,2009-07-21T00:00:00Z
Heiko Schneitler,Markus Lanz 21.07.2009,2009-07-21T00:00:00Z
Marc Loose,Markus Lanz 21.07.2009,2009-07-21T00:00:00Z
Ralf Höcker,Markus Lanz 21.07.2009,2009-07-21T00:00:00Z
Sabine Loose,Markus Lanz 21.07.2009,2009-07-21T00:00:00Z
Hans Fraust,Markus Lanz 22.07.2009,2009-07-22T00:00:00Z
Hossein Tudeshki,Markus Lanz 22.07.2009,2009-07-22T00:00:00Z
Interview Markus Lanz,Markus Lanz 22.07.2009,2009-07-22T00:00:00Z
Michael Jürgs,Markus Lanz 22.07.2009,2009-07-22T00:00:00Z
Michael Spreng,Markus Lanz 22.07.2009,2009-07-22T00:00:00Z
Moni Fraust,Markus Lanz 22.07.2009,2009-07-22T00:00:00Z
Monika Matschnig,Markus Lanz 22.07.2009,2009-07-22T00:00:00Z
Peter Kranke,Markus Lanz 22.07.2009,2009-07-22T00:00:00Z
Sandra Ofer,Markus Lanz 22.07.2009,2009-07-22T00:00:00Z
Studiogästen Hans Fraust,Markus Lanz 22.07.2009,2009-07-22T00:00:00Z
Christian Rittel,Markus Lanz 23.07.2009,2009-07-23T00:00:00Z
Hans Ulrich Jörges,Markus Lanz 23.07.2009,2009-07-23T00:00:00Z
Klaus Reindl,Markus Lanz 23.07.2009,2009-07-23T00:00:00Z
Kolja Kleeberg,Markus Lanz 23.07.2009,2009-07-23T00:00:00Z
Manfred Weber,Markus Lanz 23.07.2009,2009-07-23T00:00:00Z
Michael Opoczynski,Markus Lanz 23.07.2009,2009-07-23T00:00:00Z
Bill Mockridge,Markus Lanz 06.03.2012,2012-03-06T00:00:00Z
Chin Meyer,Markus Lanz 06.03.2012,2012-03-06T00:00:00Z
Georg Cadeggianini,Markus Lanz 06.03.2012,2012-03-06T00:00:00Z
Ole Lehmann,Markus Lanz 06.03.2012,2012-03-06T00:00:00Z
Charlotte Roche,Markus Lanz 07.03.2012,2012-03-07T00:00:00Z
Cid Jonas Gutenrath,Markus Lanz 07.03.2012,2012-03-07T00:00:00Z
Claudia Kleinert,Markus Lanz 07.03.2012,2012-03-07T00:00:00Z
Jan Böhmermann,Markus Lanz 07.03.2012,2012-03-07T00:00:00Z
Judy Winter,Markus Lanz 07.03.2012,2012-03-07T00:00:00Z
Barbara Rütting,Markus Lanz 08.03.2012,2012-03-08T00:00:00Z
Hans Ulrich Grimm,Markus Lanz 08.03.2012,2012-03-08T00:00:00Z
Ingo Appelt,Markus Lanz 08.03.2012,2012-03-08T00:00:00Z
Kai Ebel,Markus Lanz 08.03.2012,2012-03-08T00:00:00Z
Karl Heinz Funke,Markus Lanz 08.03.2012,2012-03-08T00:00:00Z
Helge Schneider,Markus Lanz 13.03.2012,2012-03-13T00:00:00Z
Henryk M Broder,Markus Lanz 13.03.2012,2012-03-13T00:00:00Z
Silke Burmester,Markus Lanz 13.03.2012,2012-03-13T00:00:00Z
Tobias Mann,Markus Lanz 13.03.2012,2012-03-13T00:00:00Z
Wolfgang Bosbach,Markus Lanz 13.03.2012,2012-03-13T00:00:00Z
Heide Ecker-Rosendahl,Markus Lanz 14.03.2012,2012-03-14T00:00:00Z
Heino Ferch,Markus Lanz 14.03.2012,2012-03-14T00:00:00Z
Klaas Heufer-Umlauf,Markus Lanz 14.03.2012,2012-03-14T00:00:00Z
Mary Roos,Markus Lanz 14.03.2012,2012-03-14T00:00:00Z
Rolf Heidenberger,Markus Lanz 14.03.2012,2012-03-14T00:00:00Z
Walter Renner,Markus Lanz 14.03.2012,2012-03-14T00:00:00Z
Hanna Poddig,Markus Lanz 15.03.2012,2012-03-15T00:00:00Z
Markus Maria Profitlich,Markus Lanz 15.03.2012,2012-03-15T00:00:00Z
Philipp Missfelder,Markus Lanz 15.03.2012,2012-03-15T00:00:00Z
Werner Schneyder,Markus Lanz 15.03.2012,2012-03-15T00:00:00Z
Andrea Kaiser,Markus Lanz 20.03.2012,2012-03-20T00:00:00Z
Daniela Katzenberger,Markus Lanz 20.03.2012,2012-03-20T00:00:00Z
Dieter Kürten,Markus Lanz 20.03.2012,2012-03-20T00:00:00Z
Frank Goosen,Markus Lanz 20.03.2012,2012-03-20T00:00:00Z
Jens Bujar,Markus Lanz 20.03.2012,2012-03-20T00:00:00Z
Paul Breitner,Markus Lanz 20.03.2012,2012-03-20T00:00:00Z
Walter Riester,Markus Lanz 21.03.2012,2012-03-21T00:00:00Z
Antje Katrin Kühnemann,Markus Lanz 22.03.2012,2012-03-22T00:00:00Z
Claus Strunz,Markus Lanz 22.03.2012,2012-03-22T00:00:00Z
Hannelore Kraft,Markus Lanz 22.03.2012,2012-03-22T00:00:00Z
Heinz Strunk,Markus Lanz 22.03.2012,2012-03-22T00:00:00Z
Willy Astor,Markus Lanz 22.03.2012,2012-03-22T00:00:00Z
Andrea Fischer,Markus Lanz 27.03.2012,2012-03-27T00:00:00Z
Desiree Nick,Markus Lanz 27.03.2012,2012-03-27T00:00:00Z
Monika Hohlmeier,Markus Lanz 27.03.2012,2012-03-27T00:00:00Z
Eva Habermann,Markus Lanz 28.03.2012,2012-03-28T00:00:00Z
Ingo Lenßen,Markus Lanz 28.03.2012,2012-03-28T00:00:00Z
Jaecki Schwarz,Markus Lanz 28.03.2012,2012-03-28T00:00:00Z
Josef Wilfling,Markus Lanz 28.03.2012,2012-03-28T00:00:00Z
Wolfgang Eisenmenger,Markus Lanz 28.03.2012,2012-03-28T00:00:00Z
Andy Holzer,Markus Lanz 29.03.2012,2012-03-29T00:00:00Z
Elisabeth Aumeier,Markus Lanz 29.03.2012,2012-03-29T00:00:00Z
Heiner Geißler,Markus Lanz 29.03.2012,2012-03-29T00:00:00Z
Olli Schulz,Markus Lanz 29.03.2012,2012-03-29T00:00:00Z
Paul Janke,Markus Lanz 29.03.2012,2012-03-29T00:00:00Z
Christine Urspruch,Markus Lanz 03.04.2012,2012-04-03T00:00:00Z
Philipp Walulis,Markus Lanz 03.04.2012,2012-04-03T00:00:00Z
Piet Klocke,Markus Lanz 03.04.2012,2012-04-03T00:00:00Z
Vera Rohrdantz,Markus Lanz 03.04.2012,2012-04-03T00:00:00Z
Verona Pooth,Markus Lanz 03.04.2012,2012-04-03T00:00:00Z
Gayle Tufts,Markus Lanz 04.04.2012,2012-04-04T00:00:00Z
Günter Verheugen,Markus Lanz 04.04.2012,2012-04-04T00:00:00Z
Jessica Kastrop,Markus Lanz 04.04.2012,2012-04-04T00:00:00Z
Max Uthoff,Markus Lanz 04.04.2012,2012-04-04T00:00:00Z
Utz Claassen,Markus Lanz 04.04.2012,2012-04-04T00:00:00Z
Benjamin Von,Markus Lanz 05.04.2012,2012-04-05T00:00:00Z
Christopher Lauer,Markus Lanz 05.04.2012,2012-04-05T00:00:00Z
Inka Bause,Markus Lanz 05.04.2012,2012-04-05T00:00:00Z
Renate Schmidt,Markus Lanz 05.04.2012,2012-04-05T00:00:00Z
Jürgen Domian,Markus Lanz 10.04.2012,2012-04-10T00:00:00Z
Margie Kinsky,Markus Lanz 10.04.2012,2012-04-10T00:00:00Z
Natascha Sagorski,Markus Lanz 10.04.2012,2012-04-10T00:00:00Z
Rezzo Schlauch,Markus Lanz 10.04.2012,2012-04-10T00:00:00Z
Wolfgang Stumph,Markus Lanz 10.04.2012,2012-04-10T00:00:00Z
Jan Fleischhauer,Markus Lanz 11.04.2012,2012-04-11T00:00:00Z
Matthias Opdenhövel,Markus Lanz 11.04.2012,2012-04-11T00:00:00Z
Sophia Thomalla,Markus Lanz 11.04.2012,2012-04-11T00:00:00Z
Stephan Urbach,Markus Lanz 11.04.2012,2012-04-11T00:00:00Z
Volker Lechtenbrink,Markus Lanz 11.04.2012,2012-04-11T00:00:00Z
Annegret Kramp-Karrenbauer,Markus Lanz 12.04.2012,2012-04-12T00:00:00Z
Christian Rach,Markus Lanz 12.04.2012,2012-04-12T00:00:00Z
Hagen Stoll,Markus Lanz 12.04.2012,2012-04-12T00:00:00Z
Laurenz Meyer,Markus Lanz 12.04.2012,2012-04-12T00:00:00Z
Timo Wopp,Markus Lanz 12.04.2012,2012-04-12T00:00:00Z
Florian Schroeder,Markus Lanz 17.04.2012,2012-04-17T00:00:00Z
Harald Glööckler,Markus Lanz 17.04.2012,2012-04-17T00:00:00Z
Ilse Aigner,Markus Lanz 17.04.2012,2012-04-17T00:00:00Z
Katharina Saalfrank,Markus Lanz 17.04.2012,2012-04-17T00:00:00Z
Peter Maffay,Markus Lanz 17.04.2012,2012-04-17T00:00:00Z
Ingrid Steeger,Markus Lanz 18.04.2012,2012-04-18T00:00:00Z
Martin Wehrle,Markus Lanz 18.04.2012,2012-04-18T00:00:00Z
Matthias Lemke,Markus Lanz 18.04.2012,2012-04-18T00:00:00Z
Oliver Geissen,Markus Lanz 18.04.2012,2012-04-18T00:00:00Z
Ralf Schmitz,Markus Lanz 18.04.2012,2012-04-18T00:00:00Z
Abdel Sellou,Markus Lanz 24.04.2012,2012-04-24T00:00:00Z
Andre Heller,Markus Lanz 24.04.2012,2012-04-24T00:00:00Z
Andrea Sawatzki,Markus Lanz 24.04.2012,2012-04-24T00:00:00Z
Gerhart Baum,Markus Lanz 24.04.2012,2012-04-24T00:00:00Z
Pierre M Krause,Markus Lanz 24.04.2012,2012-04-24T00:00:00Z
Fadi Saad,Markus Lanz 25.04.2012,2012-04-25T00:00:00Z
Guido Cantz,Markus Lanz 25.04.2012,2012-04-25T00:00:00Z
Mojib Latif,Markus Lanz 23.07.2009,2009-07-23T00:00:00Z
Rainer Meidinger,Markus Lanz 23.07.2009,2009-07-23T00:00:00Z
Roland Rademacher,Markus Lanz 23.07.2009,2009-07-23T00:00:00Z
Anna Maria Zimmermann,Markus Lanz 28.07.2009,2009-07-28T00:00:00Z
Dirk Müller,Markus Lanz 28.07.2009,2009-07-28T00:00:00Z
Jürgen Drews,Markus Lanz 28.07.2009,2009-07-28T00:00:00Z
Klaus Reindl,Markus Lanz 28.07.2009,2009-07-28T00:00:00Z
Michael Wendler,Markus Lanz 28.07.2009,2009-07-28T00:00:00Z
Mickie Krause,Markus Lanz 28.07.2009,2009-07-28T00:00:00Z
Stephanie Pallasch,Markus Lanz 28.07.2009,2009-07-28T00:00:00Z
Thorsten Rudnik,Markus Lanz 28.07.2009,2009-07-28T00:00:00Z
Almuth Ismer,Markus Lanz 29.07.2009,2009-07-29T00:00:00Z
Axel Jockwer,Markus Lanz 29.07.2009,2009-07-29T00:00:00Z
Hans Ulrich Jörges,Markus Lanz 29.07.2009,2009-07-29T00:00:00Z
Klaus Kocks,Markus Lanz 29.07.2009,2009-07-29T00:00:00Z
Ralf Schmitz,Markus Lanz 29.07.2009,2009-07-29T00:00:00Z
Reiner Holznagel,Markus Lanz 29.07.2009,2009-07-29T00:00:00Z
Axel Hirth,Markus Lanz 30.07.2009,2009-07-30T00:00:00Z
Bastian Heidhoff,Markus Lanz 30.07.2009,2009-07-30T00:00:00Z
Herbert Schons,Markus Lanz 30.07.2009,2009-07-30T00:00:00Z
Jens Hammerich,Markus Lanz 30.07.2009,2009-07-30T00:00:00Z
Katja Wingenfeld,Markus Lanz 30.07.2009,2009-07-30T00:00:00Z
Marlou Hammerich,Markus Lanz 30.07.2009,2009-07-30T00:00:00Z
Martin Strüber,Markus Lanz 30.07.2009,2009-07-30T00:00:00Z
Seymour Kunigiskis,Markus Lanz 30.07.2009,2009-07-30T00:00:00Z
Axel Schulz,Markus Lanz 04.08.2009,2009-08-04T00:00:00Z
Bärbel Uphoff,Markus Lanz 04.08.2009,2009-08-04T00:00:00Z
Florian Schroeder,Markus Lanz 04.08.2009,2009-08-04T00:00:00Z
Heiko Wasser,Markus Lanz 04.08.2009,2009-08-04T00:00:00Z
Horst Lichter,Markus Lanz 04.08.2009,2009-08-04T00:00:00Z
Jörg Adler,Markus Lanz 04.08.2009,2009-08-04T00:00:00Z
Ralf Schumacher,Markus Lanz 04.08.2009,2009-08-04T00:00:00Z
Stefan Grüll,Markus Lanz 04.08.2009,2009-08-04T00:00:00Z
Ulrich Wickert,Markus Lanz 04.08.2009,2009-08-04T00:00:00Z
Willi Weber,Markus Lanz 04.08.2009,2009-08-04T00:00:00Z
Alexander Herrmann,Markus Lanz 05.08.2009,2009-08-05T00:00:00Z
Andreas Kessler,Markus Lanz 05.08.2009,2009-08-05T00:00:00Z
Daniela De,Markus Lanz 05.08.2009,2009-08-05T00:00:00Z
Eckard Pahlke,Markus Lanz 05.08.2009,2009-08-05T00:00:00Z
Jürgen Abraham,Markus Lanz 05.08.2009,2009-08-05T00:00:00Z
Nicole Stenzel,Markus Lanz 05.08.2009,2009-08-05T00:00:00Z
Thilo Bode,Markus Lanz 05.08.2009,2009-08-05T00:00:00Z
Ulrike Martini,Markus Lanz 05.08.2009,2009-08-05T00:00:00Z
Andreas Lindner,Markus Lanz 06.08.2009,2009-08-06T00:00:00Z
Christiane Busche,Markus Lanz 06.08.2009,2009-08-06T00:00:00Z
Linn Wölber,Markus Lanz 06.08.2009,2009-08-06T00:00:00Z
Marc Hachmann,Markus Lanz 06.08.2009,2009-08-06T00:00:00Z
Thomas Kurscheid,Markus Lanz 06.08.2009,2009-08-06T00:00:00Z
Andreas Hellmann,Markus Lanz 11.08.2009,2009-08-11T00:00:00Z
Anette Horch,Markus Lanz 11.08.2009,2009-08-11T00:00:00Z
Bruders Michael S,Markus Lanz 11.08.2009,2009-08-11T00:00:00Z
Elmar Theveßen,Markus Lanz 11.08.2009,2009-08-11T00:00:00Z
Heiko Wasser,Markus Lanz 11.08.2009,2009-08-11T00:00:00Z
Horst Lichter,Markus Lanz 11.08.2009,2009-08-11T00:00:00Z
Johannes Peil,Markus Lanz 11.08.2009,2009-08-11T00:00:00Z
Jürgen Drews,Markus Lanz 11.08.2009,2009-08-11T00:00:00Z
Karl Born,Markus Lanz 11.08.2009,2009-08-11T00:00:00Z
Klaudia Schultheis,Markus Lanz 11.08.2009,2009-08-11T00:00:00Z
Michael S,Markus Lanz 11.08.2009,2009-08-11T00:00:00Z
Ralf S,Markus Lanz 11.08.2009,2009-08-11T00:00:00Z
Roland Kaiser,Markus Lanz 11.08.2009,2009-08-11T00:00:00Z
Sabine K,Markus Lanz 11.08.2009,2009-08-11T00:00:00Z
Schaltgespräch Lanz,Markus Lanz 11.08.2009,2009-08-11T00:00:00Z
Thorsten Schaubrenner,Markus Lanz 11.08.2009,2009-08-11T00:00:00Z
Wolfgang Bergmann,Markus Lanz 11.08.2009,2009-08-11T00:00:00Z
Alfons Schuhbeck,Markus Lanz 12.08.2009,2009-08-12T00:00:00Z
Ester Jacobi,Markus Lanz 12.08.2009,2009-08-12T00:00:00Z
Helmut Gels,Markus Lanz 12.08.2009,2009-08-12T00:00:00Z
Monika Zgodda,Markus Lanz 12.08.2009,2009-08-12T00:00:00Z
Sven Gerling,Markus Lanz 12.08.2009,2009-08-12T00:00:00Z
Thomas Kurscheid,Markus Lanz 12.08.2009,2009-08-12T00:00:00Z
Thomas Oberst,Markus Lanz 12.08.2009,2009-08-12T00:00:00Z
Arnold Retzer,Markus Lanz 13.08.2009,2009-08-13T00:00:00Z
Christian Ulmen,Markus Lanz 13.08.2009,2009-08-13T00:00:00Z
Jan Weiler,Markus Lanz 13.08.2009,2009-08-13T00:00:00Z
Jochen Busse,Markus Lanz 13.08.2009,2009-08-13T00:00:00Z
Mary Roos,Markus Lanz 13.08.2009,2009-08-13T00:00:00Z
Reiner Calmund,Markus Lanz 13.08.2009,2009-08-13T00:00:00Z
Alexandra Kamp,Markus Lanz 18.08.2009,2009-08-18T00:00:00Z
Elisabeth Stenmans,Markus Lanz 18.08.2009,2009-08-18T00:00:00Z
Jürgen Zulley,Markus Lanz 18.08.2009,2009-08-18T00:00:00Z
Marcus Reichl,Markus Lanz 18.08.2009,2009-08-18T00:00:00Z
Nancy Stazzone,Markus Lanz 18.08.2009,2009-08-18T00:00:00Z
Werner Baldessarini,Markus Lanz 18.08.2009,2009-08-18T00:00:00Z
Alexandra Kamp,Markus Lanz 19.08.2009,2009-08-19T00:00:00Z
Bernd Heusinger,Markus Lanz 19.08.2009,2009-08-19T00:00:00Z
Hape Kerkeling,Markus Lanz 19.08.2009,2009-08-19T00:00:00Z
Horst Schlämmer,Markus Lanz 19.08.2009,2009-08-19T00:00:00Z
Marcel Loko,Markus Lanz 19.08.2009,2009-08-19T00:00:00Z
Michael Spreng,Markus Lanz 19.08.2009,2009-08-19T00:00:00Z
Ulf Polle,Markus Lanz 19.08.2009,2009-08-19T00:00:00Z
Werner Baldessarini,Markus Lanz 19.08.2009,2009-08-19T00:00:00Z
Horst Hack,Markus Lanz 20.08.2009,2009-08-20T00:00:00Z
Horst Lichter,Markus Lanz 20.08.2009,2009-08-20T00:00:00Z
Peter Maffay,Markus Lanz 20.08.2009,2009-08-20T00:00:00Z
Thomas Stein,Markus Lanz 20.08.2009,2009-08-20T00:00:00Z
Til Schweiger,Markus Lanz 20.08.2009,2009-08-20T00:00:00Z
Atze Schröder,Markus Lanz 25.08.2009,2009-08-25T00:00:00Z
Christoph Höhnke,Markus Lanz 25.08.2009,2009-08-25T00:00:00Z
Hannes Jaenicke,Markus Lanz 25.08.2009,2009-08-25T00:00:00Z
Christopher Posch,Markus Lanz 27.09.2012,2012-09-27T00:00:00Z
Fritz Roth,Markus Lanz 27.09.2012,2012-09-27T00:00:00Z
Markus Feldenkirchen,Markus Lanz 27.09.2012,2012-09-27T00:00:00Z
Mirja Du,Markus Lanz 27.09.2012,2012-09-27T00:00:00Z
Renate Künast,Markus Lanz 27.09.2012,2012-09-27T00:00:00Z
Sky Du,Markus Lanz 27.09.2012,2012-09-27T00:00:00Z
Aaron Troschke,Markus Lanz 02.10.2012,2012-10-02T00:00:00Z
Ben Becker,Markus Lanz 02.10.2012,2012-10-02T00:00:00Z
Reinhold Messner,Markus Lanz 02.10.2012,2012-10-02T00:00:00Z
Stefanie Heinzmann,Markus Lanz 02.10.2012,2012-10-02T00:00:00Z
Andrea Kaiser,Markus Lanz 03.10.2012,2012-10-03T00:00:00Z
Dominik Slievers,Markus Lanz 03.10.2012,2012-10-03T00:00:00Z
Lars Ricken,Markus Lanz 03.10.2012,2012-10-03T00:00:00Z
Lou Richter,Markus Lanz 03.10.2012,2012-10-03T00:00:00Z
Rolf Töpperwien,Markus Lanz 03.10.2012,2012-10-03T00:00:00Z
Thomas Berthold,Markus Lanz 03.10.2012,2012-10-03T00:00:00Z
Andrea Nahles,Markus Lanz 09.10.2012,2012-10-09T00:00:00Z
Dirk Roßmann,Markus Lanz 09.10.2012,2012-10-09T00:00:00Z
Sonya Kraus,Markus Lanz 09.10.2012,2012-10-09T00:00:00Z
Thomas Druyen,Markus Lanz 09.10.2012,2012-10-09T00:00:00Z
Detlev Buck,Markus Lanz 10.10.2012,2012-10-10T00:00:00Z
Lothar Matthäus,Markus Lanz 10.10.2012,2012-10-10T00:00:00Z
Sebastian Fitzek,Markus Lanz 10.10.2012,2012-10-10T00:00:00Z
Barbara Schönenberger,Markus Lanz 10.10.2012,2012-10-10T00:00:00Z
Michel Tsokos,Markus Lanz 10.10.2012,2012-10-10T00:00:00Z
Anna Engelke,Markus Lanz 11.10.2012,2012-10-11T00:00:00Z
Guido Westerwelle,Markus Lanz 11.10.2012,2012-10-11T00:00:00Z
Jörg Thadeusz,Markus Lanz 11.10.2012,2012-10-11T00:00:00Z
Martin Rütter,Markus Lanz 11.10.2012,2012-10-11T00:00:00Z
Mathias Richling,Markus Lanz 11.10.2012,2012-10-11T00:00:00Z
Salman Rushdie,Markus Lanz 11.10.2012,2012-10-11T00:00:00Z
Bastian Pastewka,Markus Lanz 17.10.2012,2012-10-17T00:00:00Z
Böser W,Markus Lanz 17.10.2012,2012-10-17T00:00:00Z
Nele Neuhaus,Markus Lanz 17.10.2012,2012-10-17T00:00:00Z
Ulrich Hans Walter,Markus Lanz 17.10.2012,2012-10-17T00:00:00Z
Ulrich Wickert,Markus Lanz 17.10.2012,2012-10-17T00:00:00Z
Benjamin Von,Markus Lanz 18.10.2012,2012-10-18T00:00:00Z
Edmund Stoiber,Markus Lanz 18.10.2012,2012-10-18T00:00:00Z
Gertrud Höhler,Markus Lanz 18.10.2012,2012-10-18T00:00:00Z
Thomas Hermanns,Markus Lanz 18.10.2012,2012-10-18T00:00:00Z
Titus Eberhard Dittmann,Markus Lanz 18.10.2012,2012-10-18T00:00:00Z
David Garrett,Markus Lanz 23.10.2012,2012-10-23T00:00:00Z
Hubertus Meyer-Burckhardt,Markus Lanz 23.10.2012,2012-10-23T00:00:00Z
Kaya Yanar,Markus Lanz 23.10.2012,2012-10-23T00:00:00Z
Maren Kroymann,Markus Lanz 23.10.2012,2012-10-23T00:00:00Z
Fiona Erdmann,Markus Lanz 24.10.2012,2012-10-24T00:00:00Z
Frank Mill,Markus Lanz 24.10.2012,2012-10-24T00:00:00Z
Hans J,Markus Lanz 24.10.2012,2012-10-24T00:00:00Z
Heribert Faßbender,Markus Lanz 24.10.2012,2012-10-24T00:00:00Z
Oliver Bierhoff,Markus Lanz 24.10.2012,2012-10-24T00:00:00Z
Cristina Surer,Markus Lanz 25.10.2012,2012-10-25T00:00:00Z
Mario Barth,Markus Lanz 25.10.2012,2012-10-25T00:00:00Z
Peter Scholl-Latour,Markus Lanz 25.10.2012,2012-10-25T00:00:00Z
Sebastian Nerz,Markus Lanz 25.10.2012,2012-10-25T00:00:00Z
Wolfgang Niedecken,Markus Lanz 25.10.2012,2012-10-25T00:00:00Z
Eike Immel,Markus Lanz 30.10.2012,2012-10-30T00:00:00Z
Luke Mockridge,Markus Lanz 30.10.2012,2012-10-30T00:00:00Z
Maria Grazia Alice E,Markus Lanz 30.10.2012,2012-10-30T00:00:00Z
Michael Schanze,Markus Lanz 30.10.2012,2012-10-30T00:00:00Z
Olli Schulz,Markus Lanz 30.10.2012,2012-10-30T00:00:00Z
Fritz Kuhn,Markus Lanz 31.10.2012,2012-10-31T00:00:00Z
Helmut Berger,Markus Lanz 31.10.2012,2012-10-31T00:00:00Z
Jasmin Wagner,Markus Lanz 31.10.2012,2012-10-31T00:00:00Z
Jörg Knör,Markus Lanz 31.10.2012,2012-10-31T00:00:00Z
Ute Freudenberg,Markus Lanz 31.10.2012,2012-10-31T00:00:00Z
Gerhart Baum,Markus Lanz 01.11.2012,2012-11-01T00:00:00Z
Hans Zippert,Markus Lanz 01.11.2012,2012-11-01T00:00:00Z
Tim Mälzer,Markus Lanz 01.11.2012,2012-11-01T00:00:00Z
Andrea Kaiser,Markus Lanz 07.11.2012,2012-11-07T00:00:00Z
Gerd Rubenbauer,Markus Lanz 07.11.2012,2012-11-07T00:00:00Z
Marie Pfaff,Markus Lanz 07.11.2012,2012-11-07T00:00:00Z
Mario Basler,Markus Lanz 07.11.2012,2012-11-07T00:00:00Z
Theo Zwanziger,Markus Lanz 07.11.2012,2012-11-07T00:00:00Z
Cem Özdemir,Markus Lanz 08.11.2012,2012-11-08T00:00:00Z
Christina Plate,Markus Lanz 08.11.2012,2012-11-08T00:00:00Z
Christine Neubauer,Markus Lanz 08.11.2012,2012-11-08T00:00:00Z
Matthias Matussek,Markus Lanz 08.11.2012,2012-11-08T00:00:00Z
Sarah Kuttner,Markus Lanz 08.11.2012,2012-11-08T00:00:00Z
Frank Elstner,Markus Lanz 13.11.2012,2012-11-13T00:00:00Z
Joey K,Markus Lanz 13.11.2012,2012-11-13T00:00:00Z
Manfred Lütz,Markus Lanz 13.11.2012,2012-11-13T00:00:00Z
Oliver Kalkofe,Markus Lanz 13.11.2012,2012-11-13T00:00:00Z
Patricia Kelly,Markus Lanz 13.11.2012,2012-11-13T00:00:00Z
Patty Kelly,Markus Lanz 13.11.2012,2012-11-13T00:00:00Z
Hansi Müller,Markus Lanz 14.11.2012,2012-11-14T00:00:00Z
Nina Pauer,Markus Lanz 14.11.2012,2012-11-14T00:00:00Z
Oliver Pocher,Markus Lanz 14.11.2012,2012-11-14T00:00:00Z
Rolf Töpperwien,Markus Lanz 14.11.2012,2012-11-14T00:00:00Z
Anne Gesthuysen,Markus Lanz 15.11.2012,2012-11-15T00:00:00Z
Bernhard Hoecker,Markus Lanz 15.11.2012,2012-11-15T00:00:00Z
Jochen Busse,Markus Lanz 15.11.2012,2012-11-15T00:00:00Z
Martin Lindner,Markus Lanz 15.11.2012,2012-11-15T00:00:00Z
Eros Ramazzotti,Markus Lanz 20.11.2012,2012-11-20T00:00:00Z
Horst Evers,Markus Lanz 20.11.2012,2012-11-20T00:00:00Z
Martin Suter,Markus Lanz 20.11.2012,2012-11-20T00:00:00Z
Michaela May,Markus Lanz 20.11.2012,2012-11-20T00:00:00Z
Palina Rojinski,Markus Lanz 20.11.2012,2012-11-20T00:00:00Z
Frank Buschmann,Markus Lanz 21.11.2012,2012-11-21T00:00:00Z
Kate Abdo,Markus Lanz 21.11.2012,2012-11-21T00:00:00Z
Markus Babbel,Markus Lanz 21.11.2012,2012-11-21T00:00:00Z
Karlheinz Gaertner,Markus Lanz 25.04.2012,2012-04-25T00:00:00Z
Michael Spreng,Markus Lanz 25.04.2012,2012-04-25T00:00:00Z
Sabine Leutheusser-Schnarrenberger,Markus Lanz 25.04.2012,2012-04-25T00:00:00Z
Alexander Dobrindt,Markus Lanz 26.04.2012,2012-04-26T00:00:00Z
Jasmin Tabatabai,Markus Lanz 26.04.2012,2012-04-26T00:00:00Z
Jenke Von,Markus Lanz 26.04.2012,2012-04-26T00:00:00Z
Robert Griess,Markus Lanz 26.04.2012,2012-04-26T00:00:00Z
Uschi Glas,Markus Lanz 26.04.2012,2012-04-26T00:00:00Z
Armin Rohde,Markus Lanz 01.05.2012,2012-05-01T00:00:00Z
Dagmar Berghoff,Markus Lanz 01.05.2012,2012-05-01T00:00:00Z
Klaus Brinkbäumer,Markus Lanz 01.05.2012,2012-05-01T00:00:00Z
Klaus Florian Vogt,Markus Lanz 01.05.2012,2012-05-01T00:00:00Z
Marina Weisband,Markus Lanz 01.05.2012,2012-05-01T00:00:00Z
Andrea Ypsilanti,Markus Lanz 02.05.2012,2012-05-02T00:00:00Z
Nino Haase,Markus Lanz 02.05.2012,2012-05-02T00:00:00Z
Roman Maria Koidl,Markus Lanz 02.05.2012,2012-05-02T00:00:00Z
Uwe Ochsenknecht,Markus Lanz 02.05.2012,2012-05-02T00:00:00Z
Wolf Von,Markus Lanz 02.05.2012,2012-05-02T00:00:00Z
Andrea Kiewel,Markus Lanz 03.05.2012,2012-05-03T00:00:00Z
Antje Schendel,Markus Lanz 03.05.2012,2012-05-03T00:00:00Z
Joachim Krol,Markus Lanz 03.05.2012,2012-05-03T00:00:00Z
Matthias Matussek,Markus Lanz 03.05.2012,2012-05-03T00:00:00Z
Sahra Wagenknecht,Markus Lanz 03.05.2012,2012-05-03T00:00:00Z
Annette Marberth-Kubicki,Markus Lanz 08.05.2012,2012-05-08T00:00:00Z
Claus Strunz,Markus Lanz 08.05.2012,2012-05-08T00:00:00Z
Dagmar Koller,Markus Lanz 08.05.2012,2012-05-08T00:00:00Z
Olivia Jones,Markus Lanz 08.05.2012,2012-05-08T00:00:00Z
Rüdiger Hoffmann,Markus Lanz 08.05.2012,2012-05-08T00:00:00Z
Wolfgang Kubicki,Markus Lanz 08.05.2012,2012-05-08T00:00:00Z
Dagmar Frederic,Markus Lanz 09.05.2012,2012-05-09T00:00:00Z
Michael Jürgs,Markus Lanz 09.05.2012,2012-05-09T00:00:00Z
Oliver Polak,Markus Lanz 09.05.2012,2012-05-09T00:00:00Z
Ottfried Fischer,Markus Lanz 09.05.2012,2012-05-09T00:00:00Z
Torge Schmidt,Markus Lanz 09.05.2012,2012-05-09T00:00:00Z
Ande Werner,Markus Lanz 10.05.2012,2012-05-10T00:00:00Z
Annette Meisl,Markus Lanz 10.05.2012,2012-05-10T00:00:00Z
Heide Simonis,Markus Lanz 10.05.2012,2012-05-10T00:00:00Z
Kai Pflaume,Markus Lanz 10.05.2012,2012-05-10T00:00:00Z
Lars Niedereichholz,Markus Lanz 10.05.2012,2012-05-10T00:00:00Z
Stefanie Kloß,Markus Lanz 10.05.2012,2012-05-10T00:00:00Z
Daniel Bahr,Markus Lanz 15.05.2012,2012-05-15T00:00:00Z
Gloria Von,Markus Lanz 15.05.2012,2012-05-15T00:00:00Z
Moses Pelham,Markus Lanz 15.05.2012,2012-05-15T00:00:00Z
Nikolaus Blome,Markus Lanz 15.05.2012,2012-05-15T00:00:00Z
Rainer Langhans,Markus Lanz 15.05.2012,2012-05-15T00:00:00Z
Jon Flemming Olsen,Markus Lanz 16.05.2012,2012-05-16T00:00:00Z
Laura Dornheim,Markus Lanz 16.05.2012,2012-05-16T00:00:00Z
Mathias Richling,Markus Lanz 16.05.2012,2012-05-16T00:00:00Z
Norbert Blüm,Markus Lanz 16.05.2012,2012-05-16T00:00:00Z
Suzanne Von,Markus Lanz 16.05.2012,2012-05-16T00:00:00Z
Hajo Schumacher,Markus Lanz 17.05.2012,2012-05-17T00:00:00Z
Johannes Ponader,Markus Lanz 17.05.2012,2012-05-17T00:00:00Z
Marianne Hartl,Markus Lanz 17.05.2012,2012-05-17T00:00:00Z
Michael Hartl,Markus Lanz 17.05.2012,2012-05-17T00:00:00Z
Ross Antony,Markus Lanz 17.05.2012,2012-05-17T00:00:00Z
Caroline Bosbach,Markus Lanz 22.05.2012,2012-05-22T00:00:00Z
Kai Havaii,Markus Lanz 22.05.2012,2012-05-22T00:00:00Z
Katharina Thalbach,Markus Lanz 22.05.2012,2012-05-22T00:00:00Z
Michael Spreng,Markus Lanz 22.05.2012,2012-05-22T00:00:00Z
Rolf Seelmann-Eggebert,Markus Lanz 22.05.2012,2012-05-22T00:00:00Z
Wolfgang Bosbach,Markus Lanz 22.05.2012,2012-05-22T00:00:00Z
Alexander Dobrindt,Markus Lanz 23.05.2012,2012-05-23T00:00:00Z
Peter Hahne,Markus Lanz 23.05.2012,2012-05-23T00:00:00Z
Tim Mälzer,Markus Lanz 23.05.2012,2012-05-23T00:00:00Z
Ulrike Kriener,Markus Lanz 23.05.2012,2012-05-23T00:00:00Z
Wolfgang Gerhardt,Markus Lanz 23.05.2012,2012-05-23T00:00:00Z
Franz Josef Jung,Markus Lanz 24.05.2012,2012-05-24T00:00:00Z
Lisa Fitz,Markus Lanz 24.05.2012,2012-05-24T00:00:00Z
Mathias Rust,Markus Lanz 24.05.2012,2012-05-24T00:00:00Z
Michelle Müntefering,Markus Lanz 24.05.2012,2012-05-24T00:00:00Z
Thomas Osterkorn,Markus Lanz 24.05.2012,2012-05-24T00:00:00Z
Andreas Lukoschik,Markus Lanz 29.05.2012,2012-05-29T00:00:00Z
Joachim Llambi,Markus Lanz 29.05.2012,2012-05-29T00:00:00Z
Katrin Sass,Markus Lanz 29.05.2012,2012-05-29T00:00:00Z
Magdalena Brzeska,Markus Lanz 29.05.2012,2012-05-29T00:00:00Z
Thomas Rath,Markus Lanz 29.05.2012,2012-05-29T00:00:00Z
Hans Dietrich Genscher,Markus Lanz 30.05.2012,2012-05-30T00:00:00Z
Dirk Müller,Markus Lanz 31.05.2012,2012-05-31T00:00:00Z
Hans Werner Olm,Markus Lanz 31.05.2012,2012-05-31T00:00:00Z
Klaus Wowereit,Markus Lanz 31.05.2012,2012-05-31T00:00:00Z
Neda Soltani,Markus Lanz 31.05.2012,2012-05-31T00:00:00Z
Timo Wopp,Markus Lanz 31.05.2012,2012-05-31T00:00:00Z
Andreas Stock,Markus Lanz 05.06.2012,2012-06-05T00:00:00Z
Ann Marlene Henning,Markus Lanz 05.06.2012,2012-06-05T00:00:00Z
Lizzy Aumeier,Markus Lanz 05.06.2012,2012-06-05T00:00:00Z
Margot Hellwig,Markus Lanz 05.06.2012,2012-06-05T00:00:00Z
Theo Waigel,Markus Lanz 05.06.2012,2012-06-05T00:00:00Z
Jürgen Milski,Markus Lanz 06.06.2012,2012-06-06T00:00:00Z
Karl Heinz Funke,Markus Lanz 06.06.2012,2012-06-06T00:00:00Z
Sabine Stamer,Markus Lanz 06.06.2012,2012-06-06T00:00:00Z
Tom Buhrow,Markus Lanz 06.06.2012,2012-06-06T00:00:00Z
Arnulf Baring,Markus Lanz 07.06.2012,2012-06-07T00:00:00Z
Fiona Erdmann,Markus Lanz 07.06.2012,2012-06-07T00:00:00Z
Klaus Ernst,Markus Lanz 07.06.2012,2012-06-07T00:00:00Z
Steffen Möller,Markus Lanz 07.06.2012,2012-06-07T00:00:00Z
Ernst Prost,Markus Lanz 12.06.2012,2012-06-12T00:00:00Z
Kate Abdo,Markus Lanz 12.06.2012,2012-06-12T00:00:00Z
Marek Fis,Markus Lanz 12.06.2012,2012-06-12T00:00:00Z
Thomas Strunz,Markus Lanz 12.06.2012,2012-06-12T00:00:00Z
Werner Hansch,Markus Lanz 12.06.2012,2012-06-12T00:00:00Z
Andrea Kaiser,Markus Lanz 13.06.2012,2012-06-13T00:00:00Z
Eike Immel,Markus Lanz 13.06.2012,2012-06-13T00:00:00Z
Harry Wijnvoord,Markus Lanz 13.06.2012,2012-06-13T00:00:00Z
Heribert Faßbender,Markus Lanz 13.06.2012,2012-06-13T00:00:00Z
Oliver Pocher,Markus Lanz 13.06.2012,2012-06-13T00:00:00Z
Wolfgang Niedecken,Markus Lanz 13.06.2012,2012-06-13T00:00:00Z
Jessica Kastrop,Markus Lanz 14.06.2012,2012-06-14T00:00:00Z
Jörg Wontorra,Markus Lanz 14.06.2012,2012-06-14T00:00:00Z
Manfred Kaltz,Markus Lanz 14.06.2012,2012-06-14T00:00:00Z
Michael Schulz,Markus Lanz 14.06.2012,2012-06-14T00:00:00Z
Mickie Krause,Markus Lanz 14.06.2012,2012-06-14T00:00:00Z
Wolfgang Bosbach,Markus Lanz 14.06.2012,2012-06-14T00:00:00Z
Andrea Kaiser,Markus Lanz 19.06.2012,2012-06-19T00:00:00Z
Frank Goosen,Markus Lanz 19.06.2012,2012-06-19T00:00:00Z
Hella Von,Markus Lanz 19.06.2012,2012-06-19T00:00:00Z
Karlheinz Riedle,Markus Lanz 19.06.2012,2012-06-19T00:00:00Z
Sebastian Hellmann,Markus Lanz 19.06.2012,2012-06-19T00:00:00Z
Sepp Maier,Markus Lanz 19.06.2012,2012-06-19T00:00:00Z
Bernd Stelter,Markus Lanz 20.06.2012,2012-06-20T00:00:00Z
Esther Sedlaczek,Markus Lanz 20.06.2012,2012-06-20T00:00:00Z
Michael Schulz,Markus Lanz 20.06.2012,2012-06-20T00:00:00Z
Patrick Wasserziehr,Markus Lanz 20.06.2012,2012-06-20T00:00:00Z
Uschi Glas,Markus Lanz 20.06.2012,2012-06-20T00:00:00Z
Gerd Rubenbauer,Markus Lanz 21.06.2012,2012-06-21T00:00:00Z
Guido Buchwald,Markus Lanz 21.06.2012,2012-06-21T00:00:00Z
Jorgo Chatzimarkakis,Markus Lanz 21.06.2012,2012-06-21T00:00:00Z
Kate Abdo,Markus Lanz 21.06.2012,2012-06-21T00:00:00Z
Reiner Calmund,Markus Lanz 21.06.2012,2012-06-21T00:00:00Z
Ulrich Stein,Markus Lanz 21.06.2012,2012-06-21T00:00:00Z
Arnd Zeigler,Markus Lanz 22.06.2012,2012-06-22T00:00:00Z
Hella Von,Markus Lanz 22.06.2012,2012-06-22T00:00:00Z
Lothar Matthäus,Markus Lanz 22.06.2012,2012-06-22T00:00:00Z
Rolf Töpperwien,Markus Lanz 22.06.2012,2012-06-22T00:00:00Z
Thomas Strunz,Markus Lanz 22.06.2012,2012-06-22T00:00:00Z
Valeska Homburg,Markus Lanz 22.06.2012,2012-06-22T00:00:00Z
Alida Kurras,Markus Lanz 26.06.2012,2012-06-26T00:00:00Z
Eckart Von,Markus Lanz 26.06.2012,2012-06-26T00:00:00Z
Frank Elstner,Markus Lanz 26.06.2012,2012-06-26T00:00:00Z
Maximilian Schell,Markus Lanz 26.06.2012,2012-06-26T00:00:00Z
Vince Ebert,Markus Lanz 26.06.2012,2012-06-26T00:00:00Z
Claus Strunz,Markus Lanz 27.06.2012,2012-06-27T00:00:00Z
Giovanni Zarrella,Markus Lanz 27.06.2012,2012-06-27T00:00:00Z
Heribert Faßbender,Markus Lanz 27.06.2012,2012-06-27T00:00:00Z
Jens Nowotny,Markus Lanz 27.06.2012,2012-06-27T00:00:00Z
Lothar Matthäus,Markus Lanz 27.06.2012,2012-06-27T00:00:00Z
Ulrike Von,Markus Lanz 27.06.2012,2012-06-27T00:00:00Z
Andrea Kaiser,Markus Lanz 01.07.2012,2012-07-01T00:00:00Z
Bodo Illgner,Markus Lanz 01.07.2012,2012-07-01T00:00:00Z
Gerd Rubenbauer,Markus Lanz 01.07.2012,2012-07-01T00:00:00Z
Giovanni Zarrella,Markus Lanz 01.07.2012,2012-07-01T00:00:00Z
Hans Peter Briegel,Markus Lanz 01.07.2012,2012-07-01T00:00:00Z
Interview Markus Lanz,Markus Lanz 01.07.2012,2012-07-01T00:00:00Z
Rolf Töpperwien,Markus Lanz 01.07.2012,2012-07-01T00:00:00Z
Florian Schroeder,Markus Lanz 03.07.2012,2012-07-03T00:00:00Z
Volker Bouffier,Markus Lanz 03.07.2012,2012-07-03T00:00:00Z
Alexander Herrmann,Markus Lanz 05.07.2012,2012-07-05T00:00:00Z
Auwa Thiemann,Markus Lanz 05.07.2012,2012-07-05T00:00:00Z
Ilse Aigner,Markus Lanz 05.07.2012,2012-07-05T00:00:00Z
Jennifer Weist,Markus Lanz 05.07.2012,2012-07-05T00:00:00Z
Ursula Caberta,Markus Lanz 05.07.2012,2012-07-05T00:00:00Z
Joe Bausch,Markus Lanz 10.07.2012,2012-07-10T00:00:00Z
Michel Friedman,Markus Lanz 10.07.2012,2012-07-10T00:00:00Z
Patrick Döring,Markus Lanz 10.07.2012,2012-07-10T00:00:00Z
Paul Hille,Markus Lanz 10.07.2012,2012-07-10T00:00:00Z
Sabine Lisicki,Markus Lanz 10.07.2012,2012-07-10T00:00:00Z
Norbert Lammert,Markus Lanz 11.07.2012,2012-07-11T00:00:00Z
Adriana Altaras,Markus Lanz 12.07.2012,2012-07-12T00:00:00Z
Bodo Bach,Markus Lanz 12.07.2012,2012-07-12T00:00:00Z
Franz Meurer,Markus Lanz 12.07.2012,2012-07-12T00:00:00Z
Tim Bendzko,Markus Lanz 12.07.2012,2012-07-12T00:00:00Z
Ursula Von,Markus Lanz 12.07.2012,2012-07-12T00:00:00Z
Andreas C Studer,Markus Lanz 17.07.2012,2012-07-17T00:00:00Z
Christopher Lang,Markus Lanz 17.07.2012,2012-07-17T00:00:00Z
Gregor Gysi,Markus Lanz 17.07.2012,2012-07-17T00:00:00Z
Johannes Ponader,Markus Lanz 17.07.2012,2012-07-17T00:00:00Z
Ralf Husmann,Markus Lanz 17.07.2012,2012-07-17T00:00:00Z
Sonja Schönemann,Markus Lanz 17.07.2012,2012-07-17T00:00:00Z
Carlo Pedersoli,Markus Lanz 18.07.2012,2012-07-18T00:00:00Z
Cornelia Pieper,Markus Lanz 18.07.2012,2012-07-18T00:00:00Z
Lucy Diakovska,Markus Lanz 18.07.2012,2012-07-18T00:00:00Z
Matthias Matussek,Markus Lanz 18.07.2012,2012-07-18T00:00:00Z
Oliver Kalkofe,Markus Lanz 18.07.2012,2012-07-18T00:00:00Z
Jenke Von,Markus Lanz 19.07.2012,2012-07-19T00:00:00Z
Jochen Busse,Markus Lanz 19.07.2012,2012-07-19T00:00:00Z
Manuela Schwesig,Markus Lanz 19.07.2012,2012-07-19T00:00:00Z
Mark Medlock,Markus Lanz 19.07.2012,2012-07-19T00:00:00Z
Eveline Hall,Markus Lanz 24.07.2012,2012-07-24T00:00:00Z
Guido Maria Kretschmer,Markus Lanz 24.07.2012,2012-07-24T00:00:00Z
Jorge Gonzalez,Markus Lanz 24.07.2012,2012-07-24T00:00:00Z
Mario Galla,Markus Lanz 24.07.2012,2012-07-24T00:00:00Z
Roland Kaiser,Markus Lanz 24.07.2012,2012-07-24T00:00:00Z
Frank Busemann,Markus Lanz 25.07.2012,2012-07-25T00:00:00Z
Rita Süssmuth,Markus Lanz 25.07.2012,2012-07-25T00:00:00Z
Sandy Mölling,Markus Lanz 25.07.2012,2012-07-25T00:00:00Z
Wolfgang Rademann,Markus Lanz 25.07.2012,2012-07-25T00:00:00Z
Detlef Soost,Markus Lanz 26.07.2012,2012-07-26T00:00:00Z
Jumbo Schreiner,Markus Lanz 26.07.2012,2012-07-26T00:00:00Z
Jutta Ditfurth,Markus Lanz 26.07.2012,2012-07-26T00:00:00Z
Karl Dall,Markus Lanz 26.07.2012,2012-07-26T00:00:00Z
Kate Hall,Markus Lanz 26.07.2012,2012-07-26T00:00:00Z
Dietrich Grönemeyer,Markus Lanz 02.11.2010,2010-11-02T00:00:00Z
Harald Glööckler,Markus Lanz 02.11.2010,2010-11-02T00:00:00Z
Klaus Kocks,Markus Lanz 02.11.2010,2010-11-02T00:00:00Z
Sabine Czerny,Markus Lanz 02.11.2010,2010-11-02T00:00:00Z
Herbert Schons,Markus Lanz 03.11.2010,2010-11-03T00:00:00Z
Immanuel Dzatkowski,Markus Lanz 03.11.2010,2010-11-03T00:00:00Z
Jörg Handwerg,Markus Lanz 03.11.2010,2010-11-03T00:00:00Z
Thomas Salme,Markus Lanz 03.11.2010,2010-11-03T00:00:00Z
Josef Wilfing,Markus Lanz 03.11.2010,2010-11-03T00:00:00Z
Jürg Stettler,Markus Lanz 04.11.2010,2010-11-04T00:00:00Z
Tanja Wedhorn,Markus Lanz 04.11.2010,2010-11-04T00:00:00Z
Tony Blair,Markus Lanz 04.11.2010,2010-11-04T00:00:00Z
Wilfried Handl,Markus Lanz 04.11.2010,2010-11-04T00:00:00Z
Patrick Fichte,Markus Lanz 04.11.2010,2010-11-04T00:00:00Z
Claudia Roth,Markus Lanz 09.11.2010,2010-11-09T00:00:00Z
Günther Beckstein,Markus Lanz 09.11.2010,2010-11-09T00:00:00Z
Hans Jochen Jaschke,Markus Lanz 09.11.2010,2010-11-09T00:00:00Z
Michel Friedman,Markus Lanz 09.11.2010,2010-11-09T00:00:00Z
Uschi G,Markus Lanz 09.11.2010,2010-11-09T00:00:00Z
Thomas Rätsch,Markus Lanz 10.11.2010,2010-11-10T00:00:00Z
Nina Ruge,Markus Lanz 11.11.2010,2010-11-11T00:00:00Z
Ottfried Fischer,Markus Lanz 11.11.2010,2010-11-11T00:00:00Z
Roland Koch,Markus Lanz 11.11.2010,2010-11-11T00:00:00Z
Balian Buschbaum,Markus Lanz 18.11.2010,2010-11-18T00:00:00Z
Bärbel Schäfer,Markus Lanz 18.11.2010,2010-11-18T00:00:00Z
Isabel Varell,Markus Lanz 18.11.2010,2010-11-18T00:00:00Z
Kai Ebel,Markus Lanz 18.11.2010,2010-11-18T00:00:00Z
Atze Schröder,Markus Lanz 23.11.2010,2010-11-23T00:00:00Z
Camilla Henemark,Markus Lanz 23.11.2010,2010-11-23T00:00:00Z
Heiner Lauterbach,Markus Lanz 23.11.2010,2010-11-23T00:00:00Z
Norbert Lehmann,Markus Lanz 23.11.2010,2010-11-23T00:00:00Z
Thomas Sjöberg,Markus Lanz 23.11.2010,2010-11-23T00:00:00Z
Bülent Ceylan,Markus Lanz 25.11.2010,2010-11-25T00:00:00Z
Guido Knopp,Markus Lanz 25.11.2010,2010-11-25T00:00:00Z
Peter Ahrens,Markus Lanz 25.11.2010,2010-11-25T00:00:00Z
Till Brönner,Markus Lanz 25.11.2010,2010-11-25T00:00:00Z
Ulla Kock,Markus Lanz 25.11.2010,2010-11-25T00:00:00Z
Frank Elstner,Markus Lanz 30.11.2010,2010-11-30T00:00:00Z
Gayle Tufts,Markus Lanz 30.11.2010,2010-11-30T00:00:00Z
Gunther Emmerlich,Markus Lanz 30.11.2010,2010-11-30T00:00:00Z
Jürgen Todenhöfer,Markus Lanz 30.11.2010,2010-11-30T00:00:00Z
Sarah Kuttner,Markus Lanz 30.11.2010,2010-11-30T00:00:00Z
Christoph Lütgert,Markus Lanz 01.12.2010,2010-12-01T00:00:00Z
Florian Hambüchen,Markus Lanz 01.12.2010,2010-12-01T00:00:00Z
Jessmin Begum,Markus Lanz 01.12.2010,2010-12-01T00:00:00Z
Khorshed Alam,Markus Lanz 01.12.2010,2010-12-01T00:00:00Z
Michael Stich,Markus Lanz 01.12.2010,2010-12-01T00:00:00Z
Rosi Gollmann,Markus Lanz 01.12.2010,2010-12-01T00:00:00Z
Peter Struck,Markus Lanz 02.12.2010,2010-12-02T00:00:00Z
Peter Weck,Markus Lanz 02.12.2010,2010-12-02T00:00:00Z
Sara Nuru,Markus Lanz 02.12.2010,2010-12-02T00:00:00Z
Dieter Nuhr,Markus Lanz 07.12.2010,2010-12-07T00:00:00Z
Dirk Bergmann,Markus Lanz 07.12.2010,2010-12-07T00:00:00Z
Rainer Langhans,Markus Lanz 07.12.2010,2010-12-07T00:00:00Z
Ralf Schnoor,Markus Lanz 07.12.2010,2010-12-07T00:00:00Z
Wolfgang Stumph,Markus Lanz 07.12.2010,2010-12-07T00:00:00Z
Manfred Lütz,Markus Lanz 08.12.2010,2010-12-08T00:00:00Z
Michael Tsokos,Markus Lanz 08.12.2010,2010-12-08T00:00:00Z
Ralph Morgenstern,Markus Lanz 08.12.2010,2010-12-08T00:00:00Z
Yvonne Ford,Markus Lanz 08.12.2010,2010-12-08T00:00:00Z
Bernd Stelter,Markus Lanz 09.12.2010,2010-12-09T00:00:00Z
Eckart Witzigmann,Markus Lanz 09.12.2010,2010-12-09T00:00:00Z
Ranga Yogeshwar,Markus Lanz 09.12.2010,2010-12-09T00:00:00Z
Tim Mälzer,Markus Lanz 09.12.2010,2010-12-09T00:00:00Z
Ehemann Christian Nürnberger,Markus Lanz 14.12.2010,2010-12-14T00:00:00Z
Mario Adorf,Markus Lanz 14.12.2010,2010-12-14T00:00:00Z
Petra Gerster,Markus Lanz 14.12.2010,2010-12-14T00:00:00Z
Gitte Haenning,Markus Lanz 15.12.2010,2010-12-15T00:00:00Z
Martin Rütter,Markus Lanz 15.12.2010,2010-12-15T00:00:00Z
Paul Panzer,Markus Lanz 15.12.2010,2010-12-15T00:00:00Z
Theo Brenig,Markus Lanz 15.12.2010,2010-12-15T00:00:00Z
Anna Maria Zimmermann,Markus Lanz 12.01.2011,2011-01-12T00:00:00Z
Gisela Friedrichsen,Markus Lanz 12.01.2011,2011-01-12T00:00:00Z
Günther Kaufmann,Markus Lanz 12.01.2011,2011-01-12T00:00:00Z
Joe Bausch,Markus Lanz 12.01.2011,2011-01-12T00:00:00Z
Michael Tsokos,Markus Lanz 12.01.2011,2011-01-12T00:00:00Z
Kaya Yanar,Markus Lanz 13.01.2011,2011-01-13T00:00:00Z
Notker Wolf,Markus Lanz 13.01.2011,2011-01-13T00:00:00Z
Siegfried Rauch,Markus Lanz 13.01.2011,2011-01-13T00:00:00Z
Sonya Kraus,Markus Lanz 13.01.2011,2011-01-13T00:00:00Z
Andrea Mohr,Markus Lanz 18.01.2011,2011-01-18T00:00:00Z
Carlo Von,Markus Lanz 18.01.2011,2011-01-18T00:00:00Z
Ingrid Van,Markus Lanz 18.01.2011,2011-01-18T00:00:00Z
Peter Bartels,Markus Lanz 18.01.2011,2011-01-18T00:00:00Z
Christian Lüdke,Markus Lanz 19.01.2011,2011-01-19T00:00:00Z
Costa Cordalis,Markus Lanz 19.01.2011,2011-01-19T00:00:00Z
Frank Rosin,Markus Lanz 19.01.2011,2011-01-19T00:00:00Z
Harry Wijnvoord,Markus Lanz 19.01.2011,2011-01-19T00:00:00Z
Maite Kelly,Markus Lanz 19.01.2011,2011-01-19T00:00:00Z
Stefan Schmidt,Markus Lanz 19.01.2011,2011-01-19T00:00:00Z
Hans Meiser,Markus Lanz 20.01.2011,2011-01-20T00:00:00Z
Jörg Knör,Markus Lanz 20.01.2011,2011-01-20T00:00:00Z
Michael Kneissler,Markus Lanz 20.01.2011,2011-01-20T00:00:00Z
Ross Antony,Markus Lanz 20.01.2011,2011-01-20T00:00:00Z
Anka Zink,Markus Lanz 25.01.2011,2011-01-25T00:00:00Z
Arnulf Rating,Markus Lanz 25.01.2011,2011-01-25T00:00:00Z
Hans Werner Olm,Markus Lanz 25.01.2011,2011-01-25T00:00:00Z
Ingo Appelt,Markus Lanz 25.01.2011,2011-01-25T00:00:00Z
Kay Ray,Markus Lanz 25.01.2011,2011-01-25T00:00:00Z
Christine Lugner,Markus Lanz 25.01.2011,2011-01-25T00:00:00Z
Anita Kupsch,Markus Lanz 08.03.2011,2011-03-08T00:00:00Z
Dietmar Bär,Markus Lanz 08.03.2011,2011-03-08T00:00:00Z
Jörg Nießen,Markus Lanz 08.03.2011,2011-03-08T00:00:00Z
Katy Karrenbauer,Markus Lanz 08.03.2011,2011-03-08T00:00:00Z
Kester Schlenz,Markus Lanz 08.03.2011,2011-03-08T00:00:00Z
Dennis Gastmann,Markus Lanz 09.03.2011,2011-03-09T00:00:00Z
Erika Berger,Markus Lanz 09.03.2011,2011-03-09T00:00:00Z
Karl Moik,Markus Lanz 09.03.2011,2011-03-09T00:00:00Z
Kurt Molzer,Markus Lanz 09.03.2011,2011-03-09T00:00:00Z
Roger Willemsen,Markus Lanz 09.03.2011,2011-03-09T00:00:00Z
Jochen Busse,Markus Lanz 10.03.2011,2011-03-10T00:00:00Z
Michael Jürgs,Markus Lanz 10.03.2011,2011-03-10T00:00:00Z
Olivia Jones,Markus Lanz 10.03.2011,2011-03-10T00:00:00Z
Tatjana Strobel,Markus Lanz 10.03.2011,2011-03-10T00:00:00Z
Bruno Thomauske,Markus Lanz 15.03.2011,2011-03-15T00:00:00Z
Dirk Steffens,Markus Lanz 15.03.2011,2011-03-15T00:00:00Z
Hiltrud Schwetje,Markus Lanz 15.03.2011,2011-03-15T00:00:00Z
Nadeschda Lazko,Markus Lanz 15.03.2011,2011-03-15T00:00:00Z
Rita Süssmuth,Markus Lanz 15.03.2011,2011-03-15T00:00:00Z
Ulrich Walter,Markus Lanz 15.03.2011,2011-03-15T00:00:00Z
Bernd Stelter,Markus Lanz 16.03.2011,2011-03-16T00:00:00Z
Joe Bausch,Markus Lanz 16.03.2011,2011-03-16T00:00:00Z
Maren Kroymann,Markus Lanz 16.03.2011,2011-03-16T00:00:00Z
Rainer Erlinger,Markus Lanz 16.03.2011,2011-03-16T00:00:00Z
Til Schweiger,Markus Lanz 16.03.2011,2011-03-16T00:00:00Z
Karl Lagerfeld,Markus Lanz 17.03.2011,2011-03-17T00:00:00Z
Horst Evers,Markus Lanz 22.03.2011,2011-03-22T00:00:00Z
Mike Krüger,Markus Lanz 22.03.2011,2011-03-22T00:00:00Z
Renate Schmidt,Markus Lanz 22.03.2011,2011-03-22T00:00:00Z
Steffen Henssler,Markus Lanz 22.03.2011,2011-03-22T00:00:00Z
Utz Claassen,Markus Lanz 22.03.2011,2011-03-22T00:00:00Z
Werner Schneyder,Markus Lanz 22.03.2011,2011-03-22T00:00:00Z
Beate Jankowiak,Markus Lanz 23.03.2011,2011-03-23T00:00:00Z
Gianna Nannini,Markus Lanz 23.03.2011,2011-03-23T00:00:00Z
Jürgen Todenhöfer,Markus Lanz 23.03.2011,2011-03-23T00:00:00Z
Mario Barth,Markus Lanz 23.03.2011,2011-03-23T00:00:00Z
Soraya Lewe-Tack,Markus Lanz 23.03.2011,2011-03-23T00:00:00Z
Ulrich Kienzle,Markus Lanz 23.03.2011,2011-03-23T00:00:00Z
Dirk Müller,Markus Lanz 24.03.2011,2011-03-24T00:00:00Z
Gülcan Kamps,Markus Lanz 24.03.2011,2011-03-24T00:00:00Z
Hans Olaf Henkel,Markus Lanz 24.03.2011,2011-03-24T00:00:00Z
Norbert Blüm,Markus Lanz 24.03.2011,2011-03-24T00:00:00Z
Wolfgang Lippert,Markus Lanz 24.03.2011,2011-03-24T00:00:00Z
Dagmar Funke,Markus Lanz 30.03.2011,2011-03-30T00:00:00Z
Hannes Jaenicke,Markus Lanz 30.03.2011,2011-03-30T00:00:00Z
Olli Dittrich,Markus Lanz 30.03.2011,2011-03-30T00:00:00Z
Sabine Postel,Markus Lanz 30.03.2011,2011-03-30T00:00:00Z
Thomas Müller,Markus Lanz 30.03.2011,2011-03-30T00:00:00Z
Caroline Beil,Markus Lanz 31.03.2011,2011-03-31T00:00:00Z
Jochen Wolff,Markus Lanz 31.03.2011,2011-03-31T00:00:00Z
Manon Strache,Markus Lanz 31.03.2011,2011-03-31T00:00:00Z
Walter Kohl,Markus Lanz 31.03.2011,2011-03-31T00:00:00Z
Wolfgang Stumph,Markus Lanz 31.03.2011,2011-03-31T00:00:00Z
Ingo Appelt,Markus Lanz 05.04.2011,2011-04-05T00:00:00Z
Jörg Knör,Markus Lanz 05.04.2011,2011-04-05T00:00:00Z
Klaus Brinkbäumer,Markus Lanz 05.04.2011,2011-04-05T00:00:00Z
Nina Wortmann,Markus Lanz 05.04.2011,2011-04-05T00:00:00Z
Rolf Zacher,Markus Lanz 05.04.2011,2011-04-05T00:00:00Z
Silvana Koch-Mehrin,Markus Lanz 05.04.2011,2011-04-05T00:00:00Z
Ingrid Müller,Markus Lanz 06.04.2011,2011-04-06T00:00:00Z
Michaela May,Markus Lanz 06.04.2011,2011-04-06T00:00:00Z
Mirja Boes,Markus Lanz 06.04.2011,2011-04-06T00:00:00Z
Renate Müller,Markus Lanz 06.04.2011,2011-04-06T00:00:00Z
Tamme Hanken,Markus Lanz 06.04.2011,2011-04-06T00:00:00Z
Claude Oliver Rudolph,Markus Lanz 07.04.2011,2011-04-07T00:00:00Z
Ehepaar Ulrich Meyer,Markus Lanz 07.04.2011,2011-04-07T00:00:00Z
Georgia Tornow,Markus Lanz 07.04.2011,2011-04-07T00:00:00Z
Hannelore Kraft,Markus Lanz 07.04.2011,2011-04-07T00:00:00Z
Jörg Pilawa,Markus Lanz 07.04.2011,2011-04-07T00:00:00Z
Eleonore Weisgerber,Markus Lanz 13.04.2011,2011-04-13T00:00:00Z
Jörg Thadeusz,Markus Lanz 13.04.2011,2011-04-13T00:00:00Z
Marylou Selo,Markus Lanz 13.04.2011,2011-04-13T00:00:00Z
Thomas Weinkauf,Markus Lanz 13.04.2011,2011-04-13T00:00:00Z
Torsten Heim,Markus Lanz 13.04.2011,2011-04-13T00:00:00Z
Ehefrau Viktoria Lauterbach,Markus Lanz 14.04.2011,2011-04-14T00:00:00Z
Heiner Lauterbach,Markus Lanz 14.04.2011,2011-04-14T00:00:00Z
Herbert Feuerstein,Markus Lanz 14.04.2011,2011-04-14T00:00:00Z
Katja Kessler,Markus Lanz 14.04.2011,2011-04-14T00:00:00Z
Maximilian Pütz,Markus Lanz 14.04.2011,2011-04-14T00:00:00Z
Barbara Rütting,Markus Lanz 19.04.2011,2011-04-19T00:00:00Z
Mia Ming,Markus Lanz 19.04.2011,2011-04-19T00:00:00Z
Olivia Jones,Markus Lanz 19.04.2011,2011-04-19T00:00:00Z
Stephanie Gräfin Von,Markus Lanz 19.04.2011,2011-04-19T00:00:00Z
Vera Int-Veen,Markus Lanz 19.04.2011,2011-04-19T00:00:00Z
Heinz Buschkowsky,Markus Lanz 26.04.2011,2011-04-26T00:00:00Z
Howard Carpendale,Markus Lanz 26.04.2011,2011-04-26T00:00:00Z
Jürgen Drews,Markus Lanz 26.04.2011,2011-04-26T00:00:00Z
Sohn Wayne Carpendale,Markus Lanz 26.04.2011,2011-04-26T00:00:00Z
Tochter Joelina Drews,Markus Lanz 26.04.2011,2011-04-26T00:00:00Z
Hermann Ricker,Markus Lanz 27.04.2011,2011-04-27T00:00:00Z
Hubertus Meyer-Burckhardt,Markus Lanz 27.04.2011,2011-04-27T00:00:00Z
Meister Han Shan,Markus Lanz 27.04.2011,2011-04-27T00:00:00Z
Nina Wortmann,Markus Lanz 27.04.2011,2011-04-27T00:00:00Z
Rainhard Fendrich,Markus Lanz 27.04.2011,2011-04-27T00:00:00Z
Georg Baur,Markus Lanz 28.04.2011,2011-04-28T00:00:00Z
Marion Kracht,Markus Lanz 28.04.2011,2011-04-28T00:00:00Z
Matthias R Lemke,Markus Lanz 28.04.2011,2011-04-28T00:00:00Z
Michael Kneissler,Markus Lanz 28.04.2011,2011-04-28T00:00:00Z
Ralph Morgenstern,Markus Lanz 28.04.2011,2011-04-28T00:00:00Z
Tim Raue,Markus Lanz 28.04.2011,2011-04-28T00:00:00Z
Mario Barth,Markus Lanz 08.09.2011,2011-09-08T00:00:00Z
Ursula Caberta,Markus Lanz 08.09.2011,2011-09-08T00:00:00Z
Anke Helle,Markus Lanz 13.09.2011,2011-09-13T00:00:00Z
Caroline Wendt,Markus Lanz 13.09.2011,2011-09-13T00:00:00Z
Chris Mellas,Markus Lanz 13.09.2011,2011-09-13T00:00:00Z
Christian Lüdke,Markus Lanz 13.09.2011,2011-09-13T00:00:00Z
Dorothee Nair,Markus Lanz 13.09.2011,2011-09-13T00:00:00Z
Ehefrau Annik Wecker,Markus Lanz 13.09.2011,2011-09-13T00:00:00Z
Konstantin Wecker,Markus Lanz 13.09.2011,2011-09-13T00:00:00Z
Wigald Boning,Markus Lanz 13.09.2011,2011-09-13T00:00:00Z
Harro Füllgrabe,Markus Lanz 14.09.2011,2011-09-14T00:00:00Z
Maite Kelly,Markus Lanz 14.09.2011,2011-09-14T00:00:00Z
Michael Winterhoff,Markus Lanz 14.09.2011,2011-09-14T00:00:00Z
Rüdiger Nehberg,Markus Lanz 14.09.2011,2011-09-14T00:00:00Z
Susanne Preusker,Markus Lanz 14.09.2011,2011-09-14T00:00:00Z
Detlef Vetten,Markus Lanz 15.09.2011,2011-09-15T00:00:00Z
Ernst Prost,Markus Lanz 15.09.2011,2011-09-15T00:00:00Z
Howard Carpendale,Markus Lanz 15.09.2011,2011-09-15T00:00:00Z
Katja Suding,Markus Lanz 15.09.2011,2011-09-15T00:00:00Z
Klaus Barski,Markus Lanz 15.09.2011,2011-09-15T00:00:00Z
Wotan Wilke Möhring,Markus Lanz 15.09.2011,2011-09-15T00:00:00Z
Berliner A,Markus Lanz 20.09.2011,2011-09-20T00:00:00Z
Bernd Stelter,Markus Lanz 20.09.2011,2011-09-20T00:00:00Z
Gerwald Claus-Brunner,Markus Lanz 20.09.2011,2011-09-20T00:00:00Z
Gustav Peter Wöhler,Markus Lanz 20.09.2011,2011-09-20T00:00:00Z
Hans Ulrich Jörges,Markus Lanz 20.09.2011,2011-09-20T00:00:00Z
Lisa Fitz,Markus Lanz 20.09.2011,2011-09-20T00:00:00Z
Manfred Lütz,Markus Lanz 20.09.2011,2011-09-20T00:00:00Z
Eric Gabriel,Markus Lanz 21.09.2011,2011-09-21T00:00:00Z
Kinder L,Markus Lanz 21.09.2011,2011-09-21T00:00:00Z
Liz Mohn,Markus Lanz 21.09.2011,2011-09-21T00:00:00Z
Marion Gabriel,Markus Lanz 21.09.2011,2011-09-21T00:00:00Z
Ralf Schmitz,Markus Lanz 21.09.2011,2011-09-21T00:00:00Z
Ronald Sträter,Markus Lanz 21.09.2011,2011-09-21T00:00:00Z
Tobias Ritter,Markus Lanz 21.09.2011,2011-09-21T00:00:00Z
Ann Kathrin Kramer,Markus Lanz 22.09.2011,2011-09-22T00:00:00Z
Hajo Schumacher,Markus Lanz 22.09.2011,2011-09-22T00:00:00Z
Susanne Leinemann,Markus Lanz 22.09.2011,2011-09-22T00:00:00Z
Ursula Von,Markus Lanz 22.09.2011,2011-09-22T00:00:00Z
Andrea Berg,Markus Lanz 27.09.2011,2011-09-27T00:00:00Z
Dirk Müller,Markus Lanz 27.09.2011,2011-09-27T00:00:00Z
Ernst Prost,Markus Lanz 27.09.2011,2011-09-27T00:00:00Z
Joey Kelly,Markus Lanz 27.09.2011,2011-09-27T00:00:00Z
Sigrid Eichner,Markus Lanz 27.09.2011,2011-09-27T00:00:00Z
Alexander Hold,Markus Lanz 28.09.2011,2011-09-28T00:00:00Z
Dagmar Berghoff,Markus Lanz 28.09.2011,2011-09-28T00:00:00Z
Sven Kuntze,Markus Lanz 28.09.2011,2011-09-28T00:00:00Z
Uta Eisenhardt,Markus Lanz 28.09.2011,2011-09-28T00:00:00Z
Adriana Altaras,Markus Lanz 29.09.2011,2011-09-29T00:00:00Z
Barbara Wussow,Markus Lanz 29.09.2011,2011-09-29T00:00:00Z
Christa Müller,Markus Lanz 29.09.2011,2011-09-29T00:00:00Z
Christina Lugner,Markus Lanz 29.09.2011,2011-09-29T00:00:00Z
Eveline Hall,Markus Lanz 29.09.2011,2011-09-29T00:00:00Z
Atze Schröder,Markus Lanz 04.10.2011,2011-10-04T00:00:00Z
Gaby Köster,Markus Lanz 04.10.2011,2011-10-04T00:00:00Z
Michaela Zukunft,Markus Lanz 04.10.2011,2011-10-04T00:00:00Z
Mike Krüger,Markus Lanz 04.10.2011,2011-10-04T00:00:00Z
Thomas Stein,Markus Lanz 04.10.2011,2011-10-04T00:00:00Z
Andreas Priesterath,Markus Lanz 05.10.2011,2011-10-05T00:00:00Z
Ingo Naujoks,Markus Lanz 05.10.2011,2011-10-05T00:00:00Z
Jutta Speidel,Markus Lanz 05.10.2011,2011-10-05T00:00:00Z
Peter Rapp,Markus Lanz 05.10.2011,2011-10-05T00:00:00Z
Sabrina Tophofen,Markus Lanz 05.10.2011,2011-10-05T00:00:00Z
Wolfgang Kaminski,Markus Lanz 05.10.2011,2011-10-05T00:00:00Z
Christian Neureuther,Markus Lanz 06.10.2011,2011-10-06T00:00:00Z
Gregor Gysi,Markus Lanz 06.10.2011,2011-10-06T00:00:00Z
Judith Luig,Markus Lanz 06.10.2011,2011-10-06T00:00:00Z
Mathias Richling,Markus Lanz 06.10.2011,2011-10-06T00:00:00Z
Rosi Mittermaier,Markus Lanz 06.10.2011,2011-10-06T00:00:00Z
Doris Gutsche,Markus Lanz 11.10.2011,2011-10-11T00:00:00Z
Elmar Wepper,Markus Lanz 11.10.2011,2011-10-11T00:00:00Z
Hagen Brüggemann,Markus Lanz 11.10.2011,2011-10-11T00:00:00Z
Helga Rohra,Markus Lanz 11.10.2011,2011-10-11T00:00:00Z
Inga Wessling,Markus Lanz 11.10.2011,2011-10-11T00:00:00Z
Jens Rohra,Markus Lanz 11.10.2011,2011-10-11T00:00:00Z
Mathieu Carriere,Markus Lanz 11.10.2011,2011-10-11T00:00:00Z
Carolin Kebekus,Markus Lanz 12.10.2011,2011-10-12T00:00:00Z
Petra Jahr,Markus Lanz 12.10.2011,2011-10-12T00:00:00Z
Reiner Calmund,Markus Lanz 12.10.2011,2011-10-12T00:00:00Z
Stefan Kreutzberger,Markus Lanz 12.10.2011,2011-10-12T00:00:00Z
Tim Mälzer,Markus Lanz 12.10.2011,2011-10-12T00:00:00Z
Ulrich Jahr,Markus Lanz 12.10.2011,2011-10-12T00:00:00Z
Bernhard Hoecker,Markus Lanz 13.10.2011,2011-10-13T00:00:00Z
Fritz Roth,Markus Lanz 13.10.2011,2011-10-13T00:00:00Z
Gertrud Höhler,Markus Lanz 13.10.2011,2011-10-13T00:00:00Z
Hans Jürgen Bäumler,Markus Lanz 13.10.2011,2011-10-13T00:00:00Z
Marina Bäumler,Markus Lanz 13.10.2011,2011-10-13T00:00:00Z
Wolfgang Bosbach,Markus Lanz 13.10.2011,2011-10-13T00:00:00Z
Andreas Englisch,Markus Lanz 18.10.2011,2011-10-18T00:00:00Z
Constanze Behrends,Markus Lanz 18.10.2011,2011-10-18T00:00:00Z
Elke Sommer,Markus Lanz 18.10.2011,2011-10-18T00:00:00Z
Nelson Müller,Markus Lanz 18.10.2011,2011-10-18T00:00:00Z
Piet Klocke,Markus Lanz 18.10.2011,2011-10-18T00:00:00Z
Christoph Maria Herbst,Markus Lanz 19.10.2011,2011-10-19T00:00:00Z
Hape Kerkeling,Markus Lanz 19.10.2011,2011-10-19T00:00:00Z
Niki Lauda,Markus Lanz 19.10.2011,2011-10-19T00:00:00Z
Ben Becker,Markus Lanz 20.10.2011,2011-10-20T00:00:00Z
Claudia Roth,Markus Lanz 20.10.2011,2011-10-20T00:00:00Z
Gisela Schneeberger,Markus Lanz 20.10.2011,2011-10-20T00:00:00Z
Markus Söder,Markus Lanz 20.10.2011,2011-10-20T00:00:00Z
Joachim Steinhöfel,Markus Lanz 18.08.2010,2010-08-18T00:00:00Z
Jorgo Chatzimarkakis,Markus Lanz 18.08.2010,2010-08-18T00:00:00Z
Karl Ruhstorfer,Markus Lanz 18.08.2010,2010-08-18T00:00:00Z
Peter Hahne,Markus Lanz 18.08.2010,2010-08-18T00:00:00Z
Sabine Nowara,Markus Lanz 18.08.2010,2010-08-18T00:00:00Z
Jack White,Markus Lanz 19.08.2010,2010-08-19T00:00:00Z
Katrin Müller-Hohenstein,Markus Lanz 19.08.2010,2010-08-19T00:00:00Z
Tony Marshall,Markus Lanz 19.08.2010,2010-08-19T00:00:00Z
Ulrich Walter,Markus Lanz 19.08.2010,2010-08-19T00:00:00Z
Jürgen Kuhl,Markus Lanz 25.08.2010,2010-08-25T00:00:00Z
Nina Hagen,Markus Lanz 25.08.2010,2010-08-25T00:00:00Z
Peter Zwegat,Markus Lanz 25.08.2010,2010-08-25T00:00:00Z
Andreas Laun,Markus Lanz 26.08.2010,2010-08-26T00:00:00Z
Katharina Saalfrank,Markus Lanz 26.08.2010,2010-08-26T00:00:00Z
Gerlinde Kaltenbrunner,Markus Lanz 01.09.2010,2010-09-01T00:00:00Z
Harald Lesch,Markus Lanz 01.09.2010,2010-09-01T00:00:00Z
Helmut Berger,Markus Lanz 01.09.2010,2010-09-01T00:00:00Z
Ralf Dujmovits,Markus Lanz 01.09.2010,2010-09-01T00:00:00Z
Ulrich Walter,Markus Lanz 01.09.2010,2010-09-01T00:00:00Z
Barbara Kopp,Markus Lanz 02.09.2010,2010-09-02T00:00:00Z
Fadi Saad,Markus Lanz 02.09.2010,2010-09-02T00:00:00Z
Melda Akbas,Markus Lanz 02.09.2010,2010-09-02T00:00:00Z
Ulrich Wickert,Markus Lanz 02.09.2010,2010-09-02T00:00:00Z
Wilfried Block,Markus Lanz 02.09.2010,2010-09-02T00:00:00Z
Claudia Kotter,Markus Lanz 08.09.2010,2010-09-08T00:00:00Z
Gudrun Mittermeier,Markus Lanz 08.09.2010,2010-09-08T00:00:00Z
Ildiko Von,Markus Lanz 08.09.2010,2010-09-08T00:00:00Z
Jürgen Von,Markus Lanz 08.09.2010,2010-09-08T00:00:00Z
Michael Mittermeier,Markus Lanz 08.09.2010,2010-09-08T00:00:00Z
Guido Cantz,Markus Lanz 09.09.2010,2010-09-09T00:00:00Z
Hannes Jaenicke,Markus Lanz 09.09.2010,2010-09-09T00:00:00Z
Heinz Buschkowsky,Markus Lanz 09.09.2010,2010-09-09T00:00:00Z
Roger Willemsen,Markus Lanz 09.09.2010,2010-09-09T00:00:00Z
Edmund Stoiber,Markus Lanz 15.09.2010,2010-09-15T00:00:00Z
Ina Müller,Markus Lanz 15.09.2010,2010-09-15T00:00:00Z
Rolf Töpperwien,Markus Lanz 15.09.2010,2010-09-15T00:00:00Z
Bernd Siggelkow,Markus Lanz 16.09.2010,2010-09-16T00:00:00Z
Mario Barth,Markus Lanz 16.09.2010,2010-09-16T00:00:00Z
Tom Buhrow,Markus Lanz 16.09.2010,2010-09-16T00:00:00Z
Verona Pooth,Markus Lanz 16.09.2010,2010-09-16T00:00:00Z
Andreas Müller,Markus Lanz 21.09.2010,2010-09-21T00:00:00Z
Cem Özdemir,Markus Lanz 21.09.2010,2010-09-21T00:00:00Z
Heinz Buschkowsky,Markus Lanz 21.09.2010,2010-09-21T00:00:00Z
Melda Akbas,Markus Lanz 21.09.2010,2010-09-21T00:00:00Z
Rita Schlegel,Markus Lanz 21.09.2010,2010-09-21T00:00:00Z
Özlem Nas,Markus Lanz 21.09.2010,2010-09-21T00:00:00Z
Bernhard Hoecker,Markus Lanz 22.09.2010,2010-09-22T00:00:00Z
Max Giermann,Markus Lanz 22.09.2010,2010-09-22T00:00:00Z
Michael Kessler,Markus Lanz 22.09.2010,2010-09-22T00:00:00Z
Sissi Perlinger,Markus Lanz 22.09.2010,2010-09-22T00:00:00Z
Thorsten Havener,Markus Lanz 22.09.2010,2010-09-22T00:00:00Z
Horst Lichter,Markus Lanz 23.09.2010,2010-09-23T00:00:00Z
Johann Lafer,Markus Lanz 23.09.2010,2010-09-23T00:00:00Z
Moritz Bleibtreu,Markus Lanz 23.09.2010,2010-09-23T00:00:00Z
Reinhold Messner,Markus Lanz 23.09.2010,2010-09-23T00:00:00Z
Renate Künast,Markus Lanz 23.09.2010,2010-09-23T00:00:00Z
David Garrett,Markus Lanz 28.09.2010,2010-09-28T00:00:00Z
Judith Rakers,Markus Lanz 28.09.2010,2010-09-28T00:00:00Z
Ralf Husmann,Markus Lanz 28.09.2010,2010-09-28T00:00:00Z
Wayne Carpendale,Markus Lanz 28.09.2010,2010-09-28T00:00:00Z
Giovanni Di,Markus Lanz 29.09.2010,2010-09-29T00:00:00Z
Jaecki Schwarz,Markus Lanz 29.09.2010,2010-09-29T00:00:00Z
Manon Strache,Markus Lanz 29.09.2010,2010-09-29T00:00:00Z
Frank Rosin,Markus Lanz 30.09.2010,2010-09-30T00:00:00Z
Frank Schätzing,Markus Lanz 30.09.2010,2010-09-30T00:00:00Z
Udo Pollmer,Markus Lanz 30.09.2010,2010-09-30T00:00:00Z
Adelheid Kastner,Markus Lanz 05.10.2010,2010-10-05T00:00:00Z
Dagmar Eichhorn,Markus Lanz 05.10.2010,2010-10-05T00:00:00Z
Josef Wilfling,Markus Lanz 05.10.2010,2010-10-05T00:00:00Z
Mark Benecke,Markus Lanz 05.10.2010,2010-10-05T00:00:00Z
Rudi Cerne,Markus Lanz 05.10.2010,2010-10-05T00:00:00Z
Cordula Stratmann,Markus Lanz 06.10.2010,2010-10-06T00:00:00Z
Franz Bayrhof,Markus Lanz 06.10.2010,2010-10-06T00:00:00Z
Manuel Jokisch,Markus Lanz 06.10.2010,2010-10-06T00:00:00Z
Patrick Lindner,Markus Lanz 06.10.2010,2010-10-06T00:00:00Z
Rosi Gollmann,Markus Lanz 06.10.2010,2010-10-06T00:00:00Z
Jörg Pilawa,Markus Lanz 07.10.2010,2010-10-07T00:00:00Z
Manuela Reimann,Markus Lanz 07.10.2010,2010-10-07T00:00:00Z
Mike Krüger,Markus Lanz 07.10.2010,2010-10-07T00:00:00Z
Konny Reinmann,Markus Lanz 07.10.2010,2010-10-07T00:00:00Z
Aygül Özkan,Markus Lanz 13.10.2010,2010-10-13T00:00:00Z
Düzen Tekkal,Markus Lanz 13.10.2010,2010-10-13T00:00:00Z
Nazan Eckes,Markus Lanz 13.10.2010,2010-10-13T00:00:00Z
Ulrike Kriener,Markus Lanz 13.10.2010,2010-10-13T00:00:00Z
Interview Markus Lanz,Markus Lanz 14.10.2010,2010-10-14T00:00:00Z
Jochen Busse,Markus Lanz 14.10.2010,2010-10-14T00:00:00Z
Jose Augusto Fuentes,Markus Lanz 14.10.2010,2010-10-14T00:00:00Z
Studiengästen Ruth Westheimer,Markus Lanz 14.10.2010,2010-10-14T00:00:00Z
Walter Sittler,Markus Lanz 19.10.2010,2010-10-19T00:00:00Z
Carola Ferstl,Markus Lanz 20.10.2010,2010-10-20T00:00:00Z
Interview Markus Lanz,Markus Lanz 20.10.2010,2010-10-20T00:00:00Z
Matthias Reim,Markus Lanz 20.10.2010,2010-10-20T00:00:00Z
Michael Schanze,Markus Lanz 20.10.2010,2010-10-20T00:00:00Z
Wolfgang Rademann,Markus Lanz 21.10.2010,2010-10-21T00:00:00Z
Ben Becker,Markus Lanz 26.10.2010,2010-10-26T00:00:00Z
Vicky Leandros,Markus Lanz 26.10.2010,2010-10-26T00:00:00Z
Adolf Herbst,Markus Lanz 28.10.2010,2010-10-28T00:00:00Z
Lebensgefährtin A,Markus Lanz 28.10.2010,2010-10-28T00:00:00Z
Manfred Lütz,Markus Lanz 28.10.2010,2010-10-28T00:00:00Z
Osman Araya,Markus Lanz 28.10.2010,2010-10-28T00:00:00Z
Barbara Pachl-Eberhart,Markus Lanz 26.01.2011,2011-01-26T00:00:00Z
Bastian Sick,Markus Lanz 26.01.2011,2011-01-26T00:00:00Z
Giulia Siegel,Markus Lanz 26.01.2011,2011-01-26T00:00:00Z
Maximilian Schell,Markus Lanz 26.01.2011,2011-01-26T00:00:00Z
Eveline Hall,Markus Lanz 27.01.2011,2011-01-27T00:00:00Z
Franz Josef Wagner,Markus Lanz 27.01.2011,2011-01-27T00:00:00Z
Gundis Zambo,Markus Lanz 27.01.2011,2011-01-27T00:00:00Z
Joachim Fuchsberger,Markus Lanz 27.01.2011,2011-01-27T00:00:00Z
Anja Wille,Markus Lanz 01.02.2011,2011-02-01T00:00:00Z
Armin Rohde,Markus Lanz 01.02.2011,2011-02-01T00:00:00Z
Christian Lüdke,Markus Lanz 01.02.2011,2011-02-01T00:00:00Z
Immo Von,Markus Lanz 01.02.2011,2011-02-01T00:00:00Z
Jasmin Gerat,Markus Lanz 01.02.2011,2011-02-01T00:00:00Z
Til Schweiger,Markus Lanz 01.02.2011,2011-02-01T00:00:00Z
Achim Mentzel,Markus Lanz 02.02.2011,2011-02-02T00:00:00Z
Atze Schröder,Markus Lanz 02.02.2011,2011-02-02T00:00:00Z
Jens Westerbeck,Markus Lanz 02.02.2011,2011-02-02T00:00:00Z
Michael Böer,Markus Lanz 02.02.2011,2011-02-02T00:00:00Z
Oliver Kalkofe,Markus Lanz 02.02.2011,2011-02-02T00:00:00Z
Regina Hamza,Markus Lanz 02.02.2011,2011-02-02T00:00:00Z
Christoph Maria Herbst,Markus Lanz 03.02.2011,2011-02-03T00:00:00Z
Edgar Selge,Markus Lanz 03.02.2011,2011-02-03T00:00:00Z
Indira Weis,Markus Lanz 03.02.2011,2011-02-03T00:00:00Z
Ruth Maria Kubitschek,Markus Lanz 03.02.2011,2011-02-03T00:00:00Z
Anne Sophie Briest,Markus Lanz 08.02.2011,2011-02-08T00:00:00Z
Bernhard Bueb,Markus Lanz 08.02.2011,2011-02-08T00:00:00Z
Matthias Alessandro Strauss,Markus Lanz 08.02.2011,2011-02-08T00:00:00Z
Tobias Ritter,Markus Lanz 08.02.2011,2011-02-08T00:00:00Z
Rangha Yogeshwar,Markus Lanz 08.02.2011,2011-02-08T00:00:00Z
Cleo Kretschmer,Markus Lanz 09.02.2011,2011-02-09T00:00:00Z
Laetitia Hahn,Markus Lanz 09.02.2011,2011-02-09T00:00:00Z
Manfred Späth,Markus Lanz 09.02.2011,2011-02-09T00:00:00Z
Ruth Moschner,Markus Lanz 09.02.2011,2011-02-09T00:00:00Z
Sabine Asgodom,Markus Lanz 09.02.2011,2011-02-09T00:00:00Z
Karen Duve,Markus Lanz 10.02.2011,2011-02-10T00:00:00Z
Marietta Slomka,Markus Lanz 10.02.2011,2011-02-10T00:00:00Z
Michael Gwisdek,Markus Lanz 10.02.2011,2011-02-10T00:00:00Z
Uwe Karsten Heye,Markus Lanz 10.02.2011,2011-02-10T00:00:00Z
Bastian Pastewka,Markus Lanz 15.02.2011,2011-02-15T00:00:00Z
Dagmar Koller,Markus Lanz 15.02.2011,2011-02-15T00:00:00Z
Paula Lambert,Markus Lanz 15.02.2011,2011-02-15T00:00:00Z
Sven Flohr,Markus Lanz 15.02.2011,2011-02-15T00:00:00Z
Volker Rippmann,Markus Lanz 15.02.2011,2011-02-15T00:00:00Z
Josephine Opitz,Markus Lanz 16.02.2011,2011-02-16T00:00:00Z
Katarina Witt,Markus Lanz 16.02.2011,2011-02-16T00:00:00Z
Mutter Martina Opitz,Markus Lanz 16.02.2011,2011-02-16T00:00:00Z
Nadja Auermann,Markus Lanz 16.02.2011,2011-02-16T00:00:00Z
Peer Kusmagk,Markus Lanz 16.02.2011,2011-02-16T00:00:00Z
Christa Ritter,Markus Lanz 17.02.2011,2011-02-17T00:00:00Z
David Berger,Markus Lanz 17.02.2011,2011-02-17T00:00:00Z
Desiree Nick,Markus Lanz 17.02.2011,2011-02-17T00:00:00Z
Gabriele Kuby,Markus Lanz 17.02.2011,2011-02-17T00:00:00Z
Karl Dall,Markus Lanz 17.02.2011,2011-02-17T00:00:00Z
Rainer Langhans,Markus Lanz 17.02.2011,2011-02-17T00:00:00Z
Hans Hermann Tiedje,Markus Lanz 23.02.2011,2011-02-23T00:00:00Z
Hans Jürgen Bäumler,Markus Lanz 23.02.2011,2011-02-23T00:00:00Z
Michael Spreng,Markus Lanz 23.02.2011,2011-02-23T00:00:00Z
Michaela Schaffrath,Markus Lanz 23.02.2011,2011-02-23T00:00:00Z
Thomas Müller,Markus Lanz 23.02.2011,2011-02-23T00:00:00Z
Hellmuth Karasek,Markus Lanz 24.02.2011,2011-02-24T00:00:00Z
Howard Carpendale,Markus Lanz 24.02.2011,2011-02-24T00:00:00Z
Indira Weis,Markus Lanz 24.02.2011,2011-02-24T00:00:00Z
Mutter Manju Weis,Markus Lanz 24.02.2011,2011-02-24T00:00:00Z
Thilo Sarrazin,Markus Lanz 24.02.2011,2011-02-24T00:00:00Z
Alexandra Von,Markus Lanz 01.03.2011,2011-03-01T00:00:00Z
Arved Fuchs,Markus Lanz 01.03.2011,2011-03-01T00:00:00Z
Christian Berkel,Markus Lanz 01.03.2011,2011-03-01T00:00:00Z
Gertrud Höhler,Markus Lanz 01.03.2011,2011-03-01T00:00:00Z
Joey Kelly,Markus Lanz 01.03.2011,2011-03-01T00:00:00Z
Ulla Kock,Markus Lanz 01.03.2011,2011-03-01T00:00:00Z
Claus Strunz,Markus Lanz 02.03.2011,2011-03-02T00:00:00Z
Hans Jochen Jaschke,Markus Lanz 02.03.2011,2011-03-02T00:00:00Z
Heide Simonis,Markus Lanz 02.03.2011,2011-03-02T00:00:00Z
Jutta Ditfurth,Markus Lanz 02.03.2011,2011-03-02T00:00:00Z
Sky Du,Markus Lanz 02.03.2011,2011-03-02T00:00:00Z
Tobias Huch,Markus Lanz 02.03.2011,2011-03-02T00:00:00Z
Wolf Von,Markus Lanz 02.03.2011,2011-03-02T00:00:00Z
Willi Lippens,Markus Lanz 21.11.2012,2012-11-21T00:00:00Z
Manfred Breukmann,Markus Lanz 21.11.2012,2012-11-21T00:00:00Z
Anja Kersten,Markus Lanz 22.11.2012,2012-11-22T00:00:00Z
Michael Kessler,Markus Lanz 22.11.2012,2012-11-22T00:00:00Z
Walter Sittler,Markus Lanz 22.11.2012,2012-11-22T00:00:00Z
Michael Gwisdek,Markus Lanz 27.11.2012,2012-11-27T00:00:00Z
Bettina Böttinger,Markus Lanz 28.11.2012,2012-11-28T00:00:00Z
Doris Schröder-Köpf,Markus Lanz 28.11.2012,2012-11-28T00:00:00Z
Philip Simon,Markus Lanz 28.11.2012,2012-11-28T00:00:00Z
Radost Bokel,Markus Lanz 28.11.2012,2012-11-28T00:00:00Z
Rosemarie Fendel,Markus Lanz 28.11.2012,2012-11-28T00:00:00Z
Thomas Gottschalk,Markus Lanz 29.11.2012,2012-11-29T00:00:00Z
Reinhold Messner,Markus Lanz 04.12.2012,2012-12-04T00:00:00Z
Jan Fleischhauer,Markus Lanz 06.12.2012,2012-12-06T00:00:00Z
Joja Wendt,Markus Lanz 06.12.2012,2012-12-06T00:00:00Z
Katrin Göring-Eckardt,Markus Lanz 06.12.2012,2012-12-06T00:00:00Z
Kester Schlenz,Markus Lanz 06.12.2012,2012-12-06T00:00:00Z
Paul Panzer,Markus Lanz 06.12.2012,2012-12-06T00:00:00Z
Bernd Siggelkow,Markus Lanz 11.12.2012,2012-12-11T00:00:00Z
Frank Zander,Markus Lanz 11.12.2012,2012-12-11T00:00:00Z
Graciano Rocchigiani,Markus Lanz 11.12.2012,2012-12-11T00:00:00Z
