index,episode_name,date,description,factcheck,length,name,role,message,talkshow,party,media,group
0,maischberger am 20.11.2024,2024-11-20,"Sexualisierte Gewalt gegen Frauen: Direkt nach dem ARD-Film “Bis zur Wahrheit”: Im Gespräch die Schauspielerin Maria Furtwängler und die Rechtsanwältin für Familienrecht Christina Clemm. Trump besetzt sein Kabinett: Im Gespräch der US-amerikanische Journalist und Autor Bob Woodward. CDU-Pläne nach Ampel-Aus: Im Studio der ehemalige CDU-Kanzlerkandidat und frühere Ministerpräsident von Nordrhein-Westfalen Armin Laschet. Es kommentieren der Schauspieler Walter Sittler, die Autorin der Neuen Zürcher Zeitung Susanne Gaschke, der Redaktionsleiter des WDR-Politmagazins „Monitor“ Georg Restle.",,75,Christina Clemm,,,maischberger,,,
1,maischberger am 20.11.2024,2024-11-20,"Sexualisierte Gewalt gegen Frauen: Direkt nach dem ARD-Film “Bis zur Wahrheit”: Im Gespräch die Schauspielerin Maria Furtwängler und die Rechtsanwältin für Familienrecht Christina Clemm. Trump besetzt sein Kabinett: Im Gespräch der US-amerikanische Journalist und Autor Bob Woodward. CDU-Pläne nach Ampel-Aus: Im Studio der ehemalige CDU-Kanzlerkandidat und frühere Ministerpräsident von Nordrhein-Westfalen Armin Laschet. Es kommentieren der Schauspieler Walter Sittler, die Autorin der Neuen Zürcher Zeitung Susanne Gaschke, der Redaktionsleiter des WDR-Politmagazins „Monitor“ Georg Restle.",,75,Susanne Gaschke,,,maischberger,,NZZ,Journalismus
2,maischberger am 20.11.2024,2024-11-20,"Sexualisierte Gewalt gegen Frauen: Direkt nach dem ARD-Film “Bis zur Wahrheit”: Im Gespräch die Schauspielerin Maria Furtwängler und die Rechtsanwältin für Familienrecht Christina Clemm. Trump besetzt sein Kabinett: Im Gespräch der US-amerikanische Journalist und Autor Bob Woodward. CDU-Pläne nach Ampel-Aus: Im Studio der ehemalige CDU-Kanzlerkandidat und frühere Ministerpräsident von Nordrhein-Westfalen Armin Laschet. Es kommentieren der Schauspieler Walter Sittler, die Autorin der Neuen Zürcher Zeitung Susanne Gaschke, der Redaktionsleiter des WDR-Politmagazins „Monitor“ Georg Restle.",,75,Georg Restle,,,maischberger,,,
3,maischberger am 20.11.2024,2024-11-20,"Sexualisierte Gewalt gegen Frauen: Direkt nach dem ARD-Film “Bis zur Wahrheit”: Im Gespräch die Schauspielerin Maria Furtwängler und die Rechtsanwältin für Familienrecht Christina Clemm. Trump besetzt sein Kabinett: Im Gespräch der US-amerikanische Journalist und Autor Bob Woodward. CDU-Pläne nach Ampel-Aus: Im Studio der ehemalige CDU-Kanzlerkandidat und frühere Ministerpräsident von Nordrhein-Westfalen Armin Laschet. Es kommentieren der Schauspieler Walter Sittler, die Autorin der Neuen Zürcher Zeitung Susanne Gaschke, der Redaktionsleiter des WDR-Politmagazins „Monitor“ Georg Restle.",,75,Maria Furtwängler,,,maischberger,,,
4,maischberger am 20.11.2024,2024-11-20,"Sexualisierte Gewalt gegen Frauen: Direkt nach dem ARD-Film “Bis zur Wahrheit”: Im Gespräch die Schauspielerin Maria Furtwängler und die Rechtsanwältin für Familienrecht Christina Clemm. Trump besetzt sein Kabinett: Im Gespräch der US-amerikanische Journalist und Autor Bob Woodward. CDU-Pläne nach Ampel-Aus: Im Studio der ehemalige CDU-Kanzlerkandidat und frühere Ministerpräsident von Nordrhein-Westfalen Armin Laschet. Es kommentieren der Schauspieler Walter Sittler, die Autorin der Neuen Zürcher Zeitung Susanne Gaschke, der Redaktionsleiter des WDR-Politmagazins „Monitor“ Georg Restle.",,75,Bob Woodward,,,maischberger,,,
5,maischberger am 20.11.2024,2024-11-20,"Sexualisierte Gewalt gegen Frauen: Direkt nach dem ARD-Film “Bis zur Wahrheit”: Im Gespräch die Schauspielerin Maria Furtwängler und die Rechtsanwältin für Familienrecht Christina Clemm. Trump besetzt sein Kabinett: Im Gespräch der US-amerikanische Journalist und Autor Bob Woodward. CDU-Pläne nach Ampel-Aus: Im Studio der ehemalige CDU-Kanzlerkandidat und frühere Ministerpräsident von Nordrhein-Westfalen Armin Laschet. Es kommentieren der Schauspieler Walter Sittler, die Autorin der Neuen Zürcher Zeitung Susanne Gaschke, der Redaktionsleiter des WDR-Politmagazins „Monitor“ Georg Restle.",,75,Armin Laschet,,,maischberger,CDU,,Politik
6,maischberger am 20.11.2024,2024-11-20,"Sexualisierte Gewalt gegen Frauen: Direkt nach dem ARD-Film “Bis zur Wahrheit”: Im Gespräch die Schauspielerin Maria Furtwängler und die Rechtsanwältin für Familienrecht Christina Clemm. Trump besetzt sein Kabinett: Im Gespräch der US-amerikanische Journalist und Autor Bob Woodward. CDU-Pläne nach Ampel-Aus: Im Studio der ehemalige CDU-Kanzlerkandidat und frühere Ministerpräsident von Nordrhein-Westfalen Armin Laschet. Es kommentieren der Schauspieler Walter Sittler, die Autorin der Neuen Zürcher Zeitung Susanne Gaschke, der Redaktionsleiter des WDR-Politmagazins „Monitor“ Georg Restle.",,75,Walter Sittler,,,maischberger,,,
7,maischberger am 30.04.2024,2024-04-30,"FDP provoziert Koalitionspartner: Wollen die Liberalen das Ampel-Aus? Im Gespräch die ehemalige Bundesjustizministerin (FDP). Russland meldet Militärerfolge: Kann die Ukraine standhalten? Im Gespräch die Forschungsgruppenleiterin der Stiftung Wissenschaft und Politik und der Ukraine-Korrespondent der ARD . Es kommentieren: Der Tagesschau-Sprecher , die stellvertretende Leiterin des Hauptstadtbüros des Redaktionsnetzwerks Deutschland und der Journalist und Podcaster .",,75,Kristina Dunz,,,maischberger,,RND,Journalismus
8,maischberger am 30.04.2024,2024-04-30,"FDP provoziert Koalitionspartner: Wollen die Liberalen das Ampel-Aus? Im Gespräch die ehemalige Bundesjustizministerin (FDP). Russland meldet Militärerfolge: Kann die Ukraine standhalten? Im Gespräch die Forschungsgruppenleiterin der Stiftung Wissenschaft und Politik und der Ukraine-Korrespondent der ARD . Es kommentieren: Der Tagesschau-Sprecher , die stellvertretende Leiterin des Hauptstadtbüros des Redaktionsnetzwerks Deutschland und der Journalist und Podcaster .",,75,Vassili Golod,,,maischberger,,ARD,Journalismus
9,maischberger am 30.04.2024,2024-04-30,"FDP provoziert Koalitionspartner: Wollen die Liberalen das Ampel-Aus? Im Gespräch die ehemalige Bundesjustizministerin (FDP). Russland meldet Militärerfolge: Kann die Ukraine standhalten? Im Gespräch die Forschungsgruppenleiterin der Stiftung Wissenschaft und Politik und der Ukraine-Korrespondent der ARD . Es kommentieren: Der Tagesschau-Sprecher , die stellvertretende Leiterin des Hauptstadtbüros des Redaktionsnetzwerks Deutschland und der Journalist und Podcaster .",,75,Sabine Leutheusser Schnarrenberger,,,maischberger,FDP,,Politik
10,maischberger am 30.04.2024,2024-04-30,"FDP provoziert Koalitionspartner: Wollen die Liberalen das Ampel-Aus? Im Gespräch die ehemalige Bundesjustizministerin (FDP). Russland meldet Militärerfolge: Kann die Ukraine standhalten? Im Gespräch die Forschungsgruppenleiterin der Stiftung Wissenschaft und Politik und der Ukraine-Korrespondent der ARD . Es kommentieren: Der Tagesschau-Sprecher , die stellvertretende Leiterin des Hauptstadtbüros des Redaktionsnetzwerks Deutschland und der Journalist und Podcaster .",,75,Tilo Jung,,,maischberger,,,Journalismus
11,maischberger am 30.04.2024,2024-04-30,"FDP provoziert Koalitionspartner: Wollen die Liberalen das Ampel-Aus? Im Gespräch die ehemalige Bundesjustizministerin (FDP). Russland meldet Militärerfolge: Kann die Ukraine standhalten? Im Gespräch die Forschungsgruppenleiterin der Stiftung Wissenschaft und Politik und der Ukraine-Korrespondent der ARD . Es kommentieren: Der Tagesschau-Sprecher , die stellvertretende Leiterin des Hauptstadtbüros des Redaktionsnetzwerks Deutschland und der Journalist und Podcaster .",,75,Claudia Major,,,maischberger,,,Militär
12,maischberger am 30.04.2024,2024-04-30,"FDP provoziert Koalitionspartner: Wollen die Liberalen das Ampel-Aus? Im Gespräch die ehemalige Bundesjustizministerin (FDP). Russland meldet Militärerfolge: Kann die Ukraine standhalten? Im Gespräch die Forschungsgruppenleiterin der Stiftung Wissenschaft und Politik und der Ukraine-Korrespondent der ARD . Es kommentieren: Der Tagesschau-Sprecher , die stellvertretende Leiterin des Hauptstadtbüros des Redaktionsnetzwerks Deutschland und der Journalist und Podcaster .",,75,Constantin Schreiber,,,maischberger,,,
13,maischberger am 20.03.2024,2024-03-20,"Ist der Sozialstaat in Gefahr? Darüber diskutieren der Generalsekretär der SPD und der stellvertretende Fraktionsvorsitzende der CDU Deutschland im Krisenmodus? Im Gespräch der Kabarettist und Satiriker . Es kommentieren die Autorin und Journalistin , die Leiterin des ARD-Studios in Washington und die politische Korrespondentin der „Zeit“ .",,75,Gudrun Engel,,,maischberger,,ARD,Journalismus
14,maischberger am 20.03.2024,2024-03-20,"Ist der Sozialstaat in Gefahr? Darüber diskutieren der Generalsekretär der SPD und der stellvertretende Fraktionsvorsitzende der CDU Deutschland im Krisenmodus? Im Gespräch der Kabarettist und Satiriker . Es kommentieren die Autorin und Journalistin , die Leiterin des ARD-Studios in Washington und die politische Korrespondentin der „Zeit“ .",,75,Amelie Fried,,,maischberger,,,Journalismus
15,maischberger am 20.03.2024,2024-03-20,"Ist der Sozialstaat in Gefahr? Darüber diskutieren der Generalsekretär der SPD und der stellvertretende Fraktionsvorsitzende der CDU Deutschland im Krisenmodus? Im Gespräch der Kabarettist und Satiriker . Es kommentieren die Autorin und Journalistin , die Leiterin des ARD-Studios in Washington und die politische Korrespondentin der „Zeit“ .",,75,Jens Spahn,,,maischberger,CDU,,Politik
16,maischberger am 20.03.2024,2024-03-20,"Ist der Sozialstaat in Gefahr? Darüber diskutieren der Generalsekretär der SPD und der stellvertretende Fraktionsvorsitzende der CDU Deutschland im Krisenmodus? Im Gespräch der Kabarettist und Satiriker . Es kommentieren die Autorin und Journalistin , die Leiterin des ARD-Studios in Washington und die politische Korrespondentin der „Zeit“ .",,75,Dieter Nuhr,,,maischberger,,,Kultur
17,maischberger am 20.03.2024,2024-03-20,"Ist der Sozialstaat in Gefahr? Darüber diskutieren der Generalsekretär der SPD und der stellvertretende Fraktionsvorsitzende der CDU Deutschland im Krisenmodus? Im Gespräch der Kabarettist und Satiriker . Es kommentieren die Autorin und Journalistin , die Leiterin des ARD-Studios in Washington und die politische Korrespondentin der „Zeit“ .",,75,Kevin Kühnert,,,maischberger,SPD,,Politik
18,maischberger am 20.03.2024,2024-03-20,"Ist der Sozialstaat in Gefahr? Darüber diskutieren der Generalsekretär der SPD und der stellvertretende Fraktionsvorsitzende der CDU Deutschland im Krisenmodus? Im Gespräch der Kabarettist und Satiriker . Es kommentieren die Autorin und Journalistin , die Leiterin des ARD-Studios in Washington und die politische Korrespondentin der „Zeit“ .",,75,Mariam Lau,,,maischberger,,Zeit,Journalismus
19,maischberger am 18.02.2025,2025-02-18,"Ukraine-Krieg: Welcher Weg führt zum Frieden? Im Gespräch der Präsident der Ukraine Wolodymyr Selenskyj. Wirtschaft, Soziales und Migration: Wer hat die besseren Lösungen? Darüber streiten die Parteivorsitzenden Saskia Esken (SPD) und Christian Lindner (FDP). Es kommentieren: Die Moderatorin Bettina Böttinger, der Verleger von „The European“ Wolfram Weimer und der Ukrainekorrespondent der ARD Vassili Golod.",,75,Saskia Esken,,,maischberger,SPD,,Politik
20,maischberger am 18.02.2025,2025-02-18,"Ukraine-Krieg: Welcher Weg führt zum Frieden? Im Gespräch der Präsident der Ukraine Wolodymyr Selenskyj. Wirtschaft, Soziales und Migration: Wer hat die besseren Lösungen? Darüber streiten die Parteivorsitzenden Saskia Esken (SPD) und Christian Lindner (FDP). Es kommentieren: Die Moderatorin Bettina Böttinger, der Verleger von „The European“ Wolfram Weimer und der Ukrainekorrespondent der ARD Vassili Golod.",,75,Vassili Golod,,,maischberger,,ARD,Journalismus
21,maischberger am 18.02.2025,2025-02-18,"Ukraine-Krieg: Welcher Weg führt zum Frieden? Im Gespräch der Präsident der Ukraine Wolodymyr Selenskyj. Wirtschaft, Soziales und Migration: Wer hat die besseren Lösungen? Darüber streiten die Parteivorsitzenden Saskia Esken (SPD) und Christian Lindner (FDP). Es kommentieren: Die Moderatorin Bettina Böttinger, der Verleger von „The European“ Wolfram Weimer und der Ukrainekorrespondent der ARD Vassili Golod.",,75,Wolfram Weimer,,,maischberger,,The European,Journalismus
22,maischberger am 18.02.2025,2025-02-18,"Ukraine-Krieg: Welcher Weg führt zum Frieden? Im Gespräch der Präsident der Ukraine Wolodymyr Selenskyj. Wirtschaft, Soziales und Migration: Wer hat die besseren Lösungen? Darüber streiten die Parteivorsitzenden Saskia Esken (SPD) und Christian Lindner (FDP). Es kommentieren: Die Moderatorin Bettina Böttinger, der Verleger von „The European“ Wolfram Weimer und der Ukrainekorrespondent der ARD Vassili Golod.",,75,Bettina Böttinger,,,maischberger,,,Kultur
23,maischberger am 18.02.2025,2025-02-18,"Ukraine-Krieg: Welcher Weg führt zum Frieden? Im Gespräch der Präsident der Ukraine Wolodymyr Selenskyj. Wirtschaft, Soziales und Migration: Wer hat die besseren Lösungen? Darüber streiten die Parteivorsitzenden Saskia Esken (SPD) und Christian Lindner (FDP). Es kommentieren: Die Moderatorin Bettina Böttinger, der Verleger von „The European“ Wolfram Weimer und der Ukrainekorrespondent der ARD Vassili Golod.",,75,Christian Lindner,,,maischberger,FDP,,Politik
24,maischberger am 18.02.2025,2025-02-18,"Ukraine-Krieg: Welcher Weg führt zum Frieden? Im Gespräch der Präsident der Ukraine Wolodymyr Selenskyj. Wirtschaft, Soziales und Migration: Wer hat die besseren Lösungen? Darüber streiten die Parteivorsitzenden Saskia Esken (SPD) und Christian Lindner (FDP). Es kommentieren: Die Moderatorin Bettina Böttinger, der Verleger von „The European“ Wolfram Weimer und der Ukrainekorrespondent der ARD Vassili Golod.",,75,Wolodymyr Selenskyj,,,maischberger,,,
25,maischberger am 04.06.2024,2024-06-04,"Schwindet die Akzeptanz für grüne Politik? Im Studio die Staatsministerin für Kultur und Medien Claudia Roth (B‘90/Grüne). Welche Folgen hat der Schuldspruch gegen Trump für die US-Wahl? Zu Gast im Studio der ehemalige USA-Korrespondent und Moderator Claus Kleber. Es kommentieren: der langjährige Leiter des ZDF-Hauptstadtstudios Theo Koll, die Korrespondentin im ARD-Hauptstadtstudio Iris Sayram und der Politik-Redakteur der Neuen Zürcher Zeitung Alexander Kissler.",,75,Theo Koll,,,maischberger,,ZDF,Journalismus
26,maischberger am 04.06.2024,2024-06-04,"Schwindet die Akzeptanz für grüne Politik? Im Studio die Staatsministerin für Kultur und Medien Claudia Roth (B‘90/Grüne). Welche Folgen hat der Schuldspruch gegen Trump für die US-Wahl? Zu Gast im Studio der ehemalige USA-Korrespondent und Moderator Claus Kleber. Es kommentieren: der langjährige Leiter des ZDF-Hauptstadtstudios Theo Koll, die Korrespondentin im ARD-Hauptstadtstudio Iris Sayram und der Politik-Redakteur der Neuen Zürcher Zeitung Alexander Kissler.",,75,Iris Sayram,,,maischberger,,ARD,Journalismus
27,maischberger am 04.06.2024,2024-06-04,"Schwindet die Akzeptanz für grüne Politik? Im Studio die Staatsministerin für Kultur und Medien Claudia Roth (B‘90/Grüne). Welche Folgen hat der Schuldspruch gegen Trump für die US-Wahl? Zu Gast im Studio der ehemalige USA-Korrespondent und Moderator Claus Kleber. Es kommentieren: der langjährige Leiter des ZDF-Hauptstadtstudios Theo Koll, die Korrespondentin im ARD-Hauptstadtstudio Iris Sayram und der Politik-Redakteur der Neuen Zürcher Zeitung Alexander Kissler.",,75,Alexander Kissler,,,maischberger,,,
28,maischberger am 04.06.2024,2024-06-04,"Schwindet die Akzeptanz für grüne Politik? Im Studio die Staatsministerin für Kultur und Medien Claudia Roth (B‘90/Grüne). Welche Folgen hat der Schuldspruch gegen Trump für die US-Wahl? Zu Gast im Studio der ehemalige USA-Korrespondent und Moderator Claus Kleber. Es kommentieren: der langjährige Leiter des ZDF-Hauptstadtstudios Theo Koll, die Korrespondentin im ARD-Hauptstadtstudio Iris Sayram und der Politik-Redakteur der Neuen Zürcher Zeitung Alexander Kissler.",,75,Claudia Roth,,,maischberger,,,
29,maischberger am 16.10.2024,2024-10-16,"Streit um den richtigen Migrationskurs: Es diskutieren die Fraktionsvorsitzende der Grünen Katharina Dröge und der CDU-Politiker Jens Spahn. Deutsche Unterstützung für die Ukraine: Im Studio der Militärhistoriker Sönke Neitzel. Es kommentieren: Der langjährige Leiter des ZDF-Hauptstadtstudios Theo Koll, die stellvertretende Chefredakteurin von The Pioneer Alev Doğan und der Spiegel-Autor Markus Feldenkirchen.",,75,Theo Koll,,,maischberger,,ZDF,Journalismus
30,maischberger am 16.10.2024,2024-10-16,"Streit um den richtigen Migrationskurs: Es diskutieren die Fraktionsvorsitzende der Grünen Katharina Dröge und der CDU-Politiker Jens Spahn. Deutsche Unterstützung für die Ukraine: Im Studio der Militärhistoriker Sönke Neitzel. Es kommentieren: Der langjährige Leiter des ZDF-Hauptstadtstudios Theo Koll, die stellvertretende Chefredakteurin von The Pioneer Alev Doğan und der Spiegel-Autor Markus Feldenkirchen.",,75,Markus Feldenkirchen,,,maischberger,,Spiegel,Journalismus
31,maischberger am 16.10.2024,2024-10-16,"Streit um den richtigen Migrationskurs: Es diskutieren die Fraktionsvorsitzende der Grünen Katharina Dröge und der CDU-Politiker Jens Spahn. Deutsche Unterstützung für die Ukraine: Im Studio der Militärhistoriker Sönke Neitzel. Es kommentieren: Der langjährige Leiter des ZDF-Hauptstadtstudios Theo Koll, die stellvertretende Chefredakteurin von The Pioneer Alev Doğan und der Spiegel-Autor Markus Feldenkirchen.",,75,Sönke Neitzel,,,maischberger,,,Militär
32,maischberger am 16.10.2024,2024-10-16,"Streit um den richtigen Migrationskurs: Es diskutieren die Fraktionsvorsitzende der Grünen Katharina Dröge und der CDU-Politiker Jens Spahn. Deutsche Unterstützung für die Ukraine: Im Studio der Militärhistoriker Sönke Neitzel. Es kommentieren: Der langjährige Leiter des ZDF-Hauptstadtstudios Theo Koll, die stellvertretende Chefredakteurin von The Pioneer Alev Doğan und der Spiegel-Autor Markus Feldenkirchen.",,75,Jens Spahn,,,maischberger,CDU,,Politik
33,maischberger am 16.10.2024,2024-10-16,"Streit um den richtigen Migrationskurs: Es diskutieren die Fraktionsvorsitzende der Grünen Katharina Dröge und der CDU-Politiker Jens Spahn. Deutsche Unterstützung für die Ukraine: Im Studio der Militärhistoriker Sönke Neitzel. Es kommentieren: Der langjährige Leiter des ZDF-Hauptstadtstudios Theo Koll, die stellvertretende Chefredakteurin von The Pioneer Alev Doğan und der Spiegel-Autor Markus Feldenkirchen.",,75,Alev Doğan,,,maischberger,,The Pioneer,Journalismus
34,maischberger am 16.10.2024,2024-10-16,"Streit um den richtigen Migrationskurs: Es diskutieren die Fraktionsvorsitzende der Grünen Katharina Dröge und der CDU-Politiker Jens Spahn. Deutsche Unterstützung für die Ukraine: Im Studio der Militärhistoriker Sönke Neitzel. Es kommentieren: Der langjährige Leiter des ZDF-Hauptstadtstudios Theo Koll, die stellvertretende Chefredakteurin von The Pioneer Alev Doğan und der Spiegel-Autor Markus Feldenkirchen.",,75,Katharina Dröge,,,maischberger,B90G,,Politik
35,maischberger am 28.08.2024,2024-08-28,"Sicherheit, Haushalt, Ost-Wahlen: Ist die Ampel zukunftsfähig? Im Studio der Bundesfinanzminister und FDP-Parteivorsitzende Christian Lindner. Attentat von Solingen: Wie sicher ist Deutschland? Einschätzungen und Erkenntnisse des Terrorismusexperten und Autors Peter Neumann. Harris gegen Trump: Wer hat die besseren Chancen auf das Weiße Haus? Im Gespräch der „Senior International Correspondent“ des US-Nachrichtensenders CNN Frederik Pleitgen. Es kommentieren: Der Journalist und Moderator Cherno Jobatey, die Korrespondentin im ARD-Hauptstadtstudio Kerstin Palzer und die stellvertretende Chefredakteurin von Table.Briefings Helene Bubrowski.",,75,Helene Bubrowski,,,maischberger,,Table.Media,Journalismus
36,maischberger am 28.08.2024,2024-08-28,"Sicherheit, Haushalt, Ost-Wahlen: Ist die Ampel zukunftsfähig? Im Studio der Bundesfinanzminister und FDP-Parteivorsitzende Christian Lindner. Attentat von Solingen: Wie sicher ist Deutschland? Einschätzungen und Erkenntnisse des Terrorismusexperten und Autors Peter Neumann. Harris gegen Trump: Wer hat die besseren Chancen auf das Weiße Haus? Im Gespräch der „Senior International Correspondent“ des US-Nachrichtensenders CNN Frederik Pleitgen. Es kommentieren: Der Journalist und Moderator Cherno Jobatey, die Korrespondentin im ARD-Hauptstadtstudio Kerstin Palzer und die stellvertretende Chefredakteurin von Table.Briefings Helene Bubrowski.",,75,Peter Neumann,,,maischberger,,,Geisteswissenschaft
37,maischberger am 28.08.2024,2024-08-28,"Sicherheit, Haushalt, Ost-Wahlen: Ist die Ampel zukunftsfähig? Im Studio der Bundesfinanzminister und FDP-Parteivorsitzende Christian Lindner. Attentat von Solingen: Wie sicher ist Deutschland? Einschätzungen und Erkenntnisse des Terrorismusexperten und Autors Peter Neumann. Harris gegen Trump: Wer hat die besseren Chancen auf das Weiße Haus? Im Gespräch der „Senior International Correspondent“ des US-Nachrichtensenders CNN Frederik Pleitgen. Es kommentieren: Der Journalist und Moderator Cherno Jobatey, die Korrespondentin im ARD-Hauptstadtstudio Kerstin Palzer und die stellvertretende Chefredakteurin von Table.Briefings Helene Bubrowski.",,75,Kerstin Palzer,,,maischberger,,ARD,Journalismus
38,maischberger am 28.08.2024,2024-08-28,"Sicherheit, Haushalt, Ost-Wahlen: Ist die Ampel zukunftsfähig? Im Studio der Bundesfinanzminister und FDP-Parteivorsitzende Christian Lindner. Attentat von Solingen: Wie sicher ist Deutschland? Einschätzungen und Erkenntnisse des Terrorismusexperten und Autors Peter Neumann. Harris gegen Trump: Wer hat die besseren Chancen auf das Weiße Haus? Im Gespräch der „Senior International Correspondent“ des US-Nachrichtensenders CNN Frederik Pleitgen. Es kommentieren: Der Journalist und Moderator Cherno Jobatey, die Korrespondentin im ARD-Hauptstadtstudio Kerstin Palzer und die stellvertretende Chefredakteurin von Table.Briefings Helene Bubrowski.",,75,Frederik Pleitgen,,,maischberger,,CNN,Journalismus
39,maischberger am 28.08.2024,2024-08-28,"Sicherheit, Haushalt, Ost-Wahlen: Ist die Ampel zukunftsfähig? Im Studio der Bundesfinanzminister und FDP-Parteivorsitzende Christian Lindner. Attentat von Solingen: Wie sicher ist Deutschland? Einschätzungen und Erkenntnisse des Terrorismusexperten und Autors Peter Neumann. Harris gegen Trump: Wer hat die besseren Chancen auf das Weiße Haus? Im Gespräch der „Senior International Correspondent“ des US-Nachrichtensenders CNN Frederik Pleitgen. Es kommentieren: Der Journalist und Moderator Cherno Jobatey, die Korrespondentin im ARD-Hauptstadtstudio Kerstin Palzer und die stellvertretende Chefredakteurin von Table.Briefings Helene Bubrowski.",,75,Christian Lindner,,,maischberger,FDP,,Politik
40,maischberger am 28.08.2024,2024-08-28,"Sicherheit, Haushalt, Ost-Wahlen: Ist die Ampel zukunftsfähig? Im Studio der Bundesfinanzminister und FDP-Parteivorsitzende Christian Lindner. Attentat von Solingen: Wie sicher ist Deutschland? Einschätzungen und Erkenntnisse des Terrorismusexperten und Autors Peter Neumann. Harris gegen Trump: Wer hat die besseren Chancen auf das Weiße Haus? Im Gespräch der „Senior International Correspondent“ des US-Nachrichtensenders CNN Frederik Pleitgen. Es kommentieren: Der Journalist und Moderator Cherno Jobatey, die Korrespondentin im ARD-Hauptstadtstudio Kerstin Palzer und die stellvertretende Chefredakteurin von Table.Briefings Helene Bubrowski.",,75,Cherno Jobatey,,,maischberger,,,Journalismus
41,maischberger am 08.05.2024,2024-05-08,"Radikalisierung in Deutschland und Unterstützung für die Ukraine: Im Gespräch Bundesinnenminister a.D. (FDP). Wirtschaftsflaute und Energiewende in Deutschland: Es diskutieren der bayerische Wirtschaftsminister und Vorsitzende der Freien Wähler und Hessens ehemaliger Wirtschaftsminister (Bündnis 90/Die Grünen). Es kommentieren: Der Sportjournalist , die Journalistin der Welt am Sonntag und die Redakteurin von Zeit Online",,75,Béla Réthy,,,maischberger,,,Journalismus
42,maischberger am 08.05.2024,2024-05-08,"Radikalisierung in Deutschland und Unterstützung für die Ukraine: Im Gespräch Bundesinnenminister a.D. (FDP). Wirtschaftsflaute und Energiewende in Deutschland: Es diskutieren der bayerische Wirtschaftsminister und Vorsitzende der Freien Wähler und Hessens ehemaliger Wirtschaftsminister (Bündnis 90/Die Grünen). Es kommentieren: Der Sportjournalist , die Journalistin der Welt am Sonntag und die Redakteurin von Zeit Online",,75,Yasmine M'Barek,,,maischberger,,T-Online,Journalismus
43,maischberger am 08.05.2024,2024-05-08,"Radikalisierung in Deutschland und Unterstützung für die Ukraine: Im Gespräch Bundesinnenminister a.D. (FDP). Wirtschaftsflaute und Energiewende in Deutschland: Es diskutieren der bayerische Wirtschaftsminister und Vorsitzende der Freien Wähler und Hessens ehemaliger Wirtschaftsminister (Bündnis 90/Die Grünen). Es kommentieren: Der Sportjournalist , die Journalistin der Welt am Sonntag und die Redakteurin von Zeit Online",,75,Tarek Al Wazir,,,maischberger,,,
44,maischberger am 08.05.2024,2024-05-08,"Radikalisierung in Deutschland und Unterstützung für die Ukraine: Im Gespräch Bundesinnenminister a.D. (FDP). Wirtschaftsflaute und Energiewende in Deutschland: Es diskutieren der bayerische Wirtschaftsminister und Vorsitzende der Freien Wähler und Hessens ehemaliger Wirtschaftsminister (Bündnis 90/Die Grünen). Es kommentieren: Der Sportjournalist , die Journalistin der Welt am Sonntag und die Redakteurin von Zeit Online",,75,Hubert Aiwanger,,,maischberger,Freie Wähler,,Politik
45,maischberger am 08.05.2024,2024-05-08,"Radikalisierung in Deutschland und Unterstützung für die Ukraine: Im Gespräch Bundesinnenminister a.D. (FDP). Wirtschaftsflaute und Energiewende in Deutschland: Es diskutieren der bayerische Wirtschaftsminister und Vorsitzende der Freien Wähler und Hessens ehemaliger Wirtschaftsminister (Bündnis 90/Die Grünen). Es kommentieren: Der Sportjournalist , die Journalistin der Welt am Sonntag und die Redakteurin von Zeit Online",,75,Gerhart Baum,,,maischberger,FDP,,Politik
46,maischberger am 08.05.2024,2024-05-08,"Radikalisierung in Deutschland und Unterstützung für die Ukraine: Im Gespräch Bundesinnenminister a.D. (FDP). Wirtschaftsflaute und Energiewende in Deutschland: Es diskutieren der bayerische Wirtschaftsminister und Vorsitzende der Freien Wähler und Hessens ehemaliger Wirtschaftsminister (Bündnis 90/Die Grünen). Es kommentieren: Der Sportjournalist , die Journalistin der Welt am Sonntag und die Redakteurin von Zeit Online",,75,Dagmar Rosenfeld,,,maischberger,,The Pioneer,Journalismus
47,maischberger am 12.02.2025,2025-02-12,"Parteien im Wahlkampfendspurt: Was trennt CDU und AfD? Es diskutieren der Generalsekretär der CDU Mecklenburg-Vorpommern Philipp Amthor und der Parlamentarische Geschäftsführer der AfD-Fraktion im Bundestag Bernd Baumann. Wirtschaftskrise in Deutschland: Wie kommt die Konjunktur wieder in Schwung? Im Gespräch der Chef der Reisekonzerns TUI Sebastian Ebel. Es kommentieren: Der langjährige Leiter des ZDF-Hauptstadtstudios Theo Koll, die Politikredakteurin der Zeit Mariam Lau und die Wirtschaftskorrespondentin der taz Ulrike Herrmann.",,75,Mariam Lau,,,maischberger,,Zeit,Journalismus
48,maischberger am 12.02.2025,2025-02-12,"Parteien im Wahlkampfendspurt: Was trennt CDU und AfD? Es diskutieren der Generalsekretär der CDU Mecklenburg-Vorpommern Philipp Amthor und der Parlamentarische Geschäftsführer der AfD-Fraktion im Bundestag Bernd Baumann. Wirtschaftskrise in Deutschland: Wie kommt die Konjunktur wieder in Schwung? Im Gespräch der Chef der Reisekonzerns TUI Sebastian Ebel. Es kommentieren: Der langjährige Leiter des ZDF-Hauptstadtstudios Theo Koll, die Politikredakteurin der Zeit Mariam Lau und die Wirtschaftskorrespondentin der taz Ulrike Herrmann.",,75,Ulrike Herrmann,,,maischberger,,TAZ,Journalismus
49,maischberger am 12.02.2025,2025-02-12,"Parteien im Wahlkampfendspurt: Was trennt CDU und AfD? Es diskutieren der Generalsekretär der CDU Mecklenburg-Vorpommern Philipp Amthor und der Parlamentarische Geschäftsführer der AfD-Fraktion im Bundestag Bernd Baumann. Wirtschaftskrise in Deutschland: Wie kommt die Konjunktur wieder in Schwung? Im Gespräch der Chef der Reisekonzerns TUI Sebastian Ebel. Es kommentieren: Der langjährige Leiter des ZDF-Hauptstadtstudios Theo Koll, die Politikredakteurin der Zeit Mariam Lau und die Wirtschaftskorrespondentin der taz Ulrike Herrmann.",,75,Theo Koll,,,maischberger,,ZDF,Journalismus
50,maischberger am 12.02.2025,2025-02-12,"Parteien im Wahlkampfendspurt: Was trennt CDU und AfD? Es diskutieren der Generalsekretär der CDU Mecklenburg-Vorpommern Philipp Amthor und der Parlamentarische Geschäftsführer der AfD-Fraktion im Bundestag Bernd Baumann. Wirtschaftskrise in Deutschland: Wie kommt die Konjunktur wieder in Schwung? Im Gespräch der Chef der Reisekonzerns TUI Sebastian Ebel. Es kommentieren: Der langjährige Leiter des ZDF-Hauptstadtstudios Theo Koll, die Politikredakteurin der Zeit Mariam Lau und die Wirtschaftskorrespondentin der taz Ulrike Herrmann.",,75,Sebastian Ebel,,,maischberger,,,
51,maischberger am 12.03.2024,2024-03-12,"Kürzungen im Sozialbereich? Im Duell der stellvertretende Fraktionsvorsitzende der FDP und der Linken-Abgeordnete . Wirtschaft in der Krise: Im Gespräch der langjährige Vorstandsvorsitzende der Deutschen Bank Es kommentieren der ehemalige CDU-Innenpolitiker und Autor , die Korrespondentin im ARD-Hauptstadtstudio und die stellvertretende Leiterin des Spiegel-Hauptstadtbüros .",,75,Konstantin Kuhle,,,maischberger,FDP,,Politik
52,maischberger am 12.03.2024,2024-03-12,"Kürzungen im Sozialbereich? Im Duell der stellvertretende Fraktionsvorsitzende der FDP und der Linken-Abgeordnete . Wirtschaft in der Krise: Im Gespräch der langjährige Vorstandsvorsitzende der Deutschen Bank Es kommentieren der ehemalige CDU-Innenpolitiker und Autor , die Korrespondentin im ARD-Hauptstadtstudio und die stellvertretende Leiterin des Spiegel-Hauptstadtbüros .",,75,Maria Fiedler,,,maischberger,,,
53,maischberger am 12.03.2024,2024-03-12,"Kürzungen im Sozialbereich? Im Duell der stellvertretende Fraktionsvorsitzende der FDP und der Linken-Abgeordnete . Wirtschaft in der Krise: Im Gespräch der langjährige Vorstandsvorsitzende der Deutschen Bank Es kommentieren der ehemalige CDU-Innenpolitiker und Autor , die Korrespondentin im ARD-Hauptstadtstudio und die stellvertretende Leiterin des Spiegel-Hauptstadtbüros .",,75,Kerstin Palzer,,,maischberger,,ARD,Journalismus
54,maischberger am 12.03.2024,2024-03-12,"Kürzungen im Sozialbereich? Im Duell der stellvertretende Fraktionsvorsitzende der FDP und der Linken-Abgeordnete . Wirtschaft in der Krise: Im Gespräch der langjährige Vorstandsvorsitzende der Deutschen Bank Es kommentieren der ehemalige CDU-Innenpolitiker und Autor , die Korrespondentin im ARD-Hauptstadtstudio und die stellvertretende Leiterin des Spiegel-Hauptstadtbüros .",,75,Wolfgang Bosbach,,,maischberger,CDU,,Politik
55,maischberger am 12.03.2024,2024-03-12,"Kürzungen im Sozialbereich? Im Duell der stellvertretende Fraktionsvorsitzende der FDP und der Linken-Abgeordnete . Wirtschaft in der Krise: Im Gespräch der langjährige Vorstandsvorsitzende der Deutschen Bank Es kommentieren der ehemalige CDU-Innenpolitiker und Autor , die Korrespondentin im ARD-Hauptstadtstudio und die stellvertretende Leiterin des Spiegel-Hauptstadtbüros .",,75,Dietmar Bartsch,,,maischberger,LINKE,,Politik
56,maischberger am 12.03.2024,2024-03-12,"Kürzungen im Sozialbereich? Im Duell der stellvertretende Fraktionsvorsitzende der FDP und der Linken-Abgeordnete . Wirtschaft in der Krise: Im Gespräch der langjährige Vorstandsvorsitzende der Deutschen Bank Es kommentieren der ehemalige CDU-Innenpolitiker und Autor , die Korrespondentin im ARD-Hauptstadtstudio und die stellvertretende Leiterin des Spiegel-Hauptstadtbüros .",,75,Josef Ackermann,,,maischberger,,,
57,maischberger am 26.11.2024,2024-11-26,"SPD setzt auf Scholz als Kanzlerkandidat: Im Gespräch der ehemalige Bundesfinanzminister und Ex-Kanzlerkandidat Peer Steinbrück (SPD). Zeitenwende bei der Bundeswehr: Darüber diskutieren der Generalinspekteur der Bundeswehr Carsten Breuer und die Expertin für Sicherheitspolitik Claudia Major. Es kommentieren: die Autorin und Journalistin Amelie Fried, der Focus-Kolumnist Jan Fleischhauer und die Wirtschaftskorrespondentin der taz Ulrike Herrmann.",,75,Amelie Fried,,,maischberger,,,Journalismus
58,maischberger am 26.11.2024,2024-11-26,"SPD setzt auf Scholz als Kanzlerkandidat: Im Gespräch der ehemalige Bundesfinanzminister und Ex-Kanzlerkandidat Peer Steinbrück (SPD). Zeitenwende bei der Bundeswehr: Darüber diskutieren der Generalinspekteur der Bundeswehr Carsten Breuer und die Expertin für Sicherheitspolitik Claudia Major. Es kommentieren: die Autorin und Journalistin Amelie Fried, der Focus-Kolumnist Jan Fleischhauer und die Wirtschaftskorrespondentin der taz Ulrike Herrmann.",,75,Ulrike Herrmann,,,maischberger,,TAZ,Journalismus
59,maischberger am 26.11.2024,2024-11-26,"SPD setzt auf Scholz als Kanzlerkandidat: Im Gespräch der ehemalige Bundesfinanzminister und Ex-Kanzlerkandidat Peer Steinbrück (SPD). Zeitenwende bei der Bundeswehr: Darüber diskutieren der Generalinspekteur der Bundeswehr Carsten Breuer und die Expertin für Sicherheitspolitik Claudia Major. Es kommentieren: die Autorin und Journalistin Amelie Fried, der Focus-Kolumnist Jan Fleischhauer und die Wirtschaftskorrespondentin der taz Ulrike Herrmann.",,75,Carsten Breuer,,,maischberger,,,Militär
60,maischberger am 26.11.2024,2024-11-26,"SPD setzt auf Scholz als Kanzlerkandidat: Im Gespräch der ehemalige Bundesfinanzminister und Ex-Kanzlerkandidat Peer Steinbrück (SPD). Zeitenwende bei der Bundeswehr: Darüber diskutieren der Generalinspekteur der Bundeswehr Carsten Breuer und die Expertin für Sicherheitspolitik Claudia Major. Es kommentieren: die Autorin und Journalistin Amelie Fried, der Focus-Kolumnist Jan Fleischhauer und die Wirtschaftskorrespondentin der taz Ulrike Herrmann.",,75,Jan Fleischhauer,,,maischberger,,,Journalismus
61,maischberger am 26.11.2024,2024-11-26,"SPD setzt auf Scholz als Kanzlerkandidat: Im Gespräch der ehemalige Bundesfinanzminister und Ex-Kanzlerkandidat Peer Steinbrück (SPD). Zeitenwende bei der Bundeswehr: Darüber diskutieren der Generalinspekteur der Bundeswehr Carsten Breuer und die Expertin für Sicherheitspolitik Claudia Major. Es kommentieren: die Autorin und Journalistin Amelie Fried, der Focus-Kolumnist Jan Fleischhauer und die Wirtschaftskorrespondentin der taz Ulrike Herrmann.",,75,Peer Steinbrück,,,maischberger,SPD,,Politik
62,maischberger am 26.11.2024,2024-11-26,"SPD setzt auf Scholz als Kanzlerkandidat: Im Gespräch der ehemalige Bundesfinanzminister und Ex-Kanzlerkandidat Peer Steinbrück (SPD). Zeitenwende bei der Bundeswehr: Darüber diskutieren der Generalinspekteur der Bundeswehr Carsten Breuer und die Expertin für Sicherheitspolitik Claudia Major. Es kommentieren: die Autorin und Journalistin Amelie Fried, der Focus-Kolumnist Jan Fleischhauer und die Wirtschaftskorrespondentin der taz Ulrike Herrmann.",,75,Claudia Major,,,maischberger,,,Militär
63,maischberger am 12.11.2024,2024-11-12,"Vertrauensfrage und Neuwahlen: Darüber diskutieren Bundesarbeitsminister Hubertus Heil (SPD) und die wirtschaftspolitische Sprecherin der CDU/CSU-Bundestagsfraktion Julia Klöckner. Außenpolitische Folgen nach Trumps Wahlsieg: Im Studio der ehemalige Botschafter Deutschlands in den USA Wolfgang Ischinger. Es kommentieren: Die ARD-Wirtschafts- und Finanzexpertin Anja Kohl, die Journalistin Kristina Dunz und der Herausgeber des Pioneer Briefing Gabor Steingart.",,75,Anja Kohl,,,maischberger,,ARD,Journalismus
64,maischberger am 12.11.2024,2024-11-12,"Vertrauensfrage und Neuwahlen: Darüber diskutieren Bundesarbeitsminister Hubertus Heil (SPD) und die wirtschaftspolitische Sprecherin der CDU/CSU-Bundestagsfraktion Julia Klöckner. Außenpolitische Folgen nach Trumps Wahlsieg: Im Studio der ehemalige Botschafter Deutschlands in den USA Wolfgang Ischinger. Es kommentieren: Die ARD-Wirtschafts- und Finanzexpertin Anja Kohl, die Journalistin Kristina Dunz und der Herausgeber des Pioneer Briefing Gabor Steingart.",,75,Hubertus Heil,,,maischberger,SPD,,Politik
65,maischberger am 12.11.2024,2024-11-12,"Vertrauensfrage und Neuwahlen: Darüber diskutieren Bundesarbeitsminister Hubertus Heil (SPD) und die wirtschaftspolitische Sprecherin der CDU/CSU-Bundestagsfraktion Julia Klöckner. Außenpolitische Folgen nach Trumps Wahlsieg: Im Studio der ehemalige Botschafter Deutschlands in den USA Wolfgang Ischinger. Es kommentieren: Die ARD-Wirtschafts- und Finanzexpertin Anja Kohl, die Journalistin Kristina Dunz und der Herausgeber des Pioneer Briefing Gabor Steingart.",,75,Julia Klöckner,,,maischberger,CDU,,Politik
66,maischberger am 12.11.2024,2024-11-12,"Vertrauensfrage und Neuwahlen: Darüber diskutieren Bundesarbeitsminister Hubertus Heil (SPD) und die wirtschaftspolitische Sprecherin der CDU/CSU-Bundestagsfraktion Julia Klöckner. Außenpolitische Folgen nach Trumps Wahlsieg: Im Studio der ehemalige Botschafter Deutschlands in den USA Wolfgang Ischinger. Es kommentieren: Die ARD-Wirtschafts- und Finanzexpertin Anja Kohl, die Journalistin Kristina Dunz und der Herausgeber des Pioneer Briefing Gabor Steingart.",,75,Kristina Dunz,,,maischberger,,RND,Journalismus
67,maischberger am 12.11.2024,2024-11-12,"Vertrauensfrage und Neuwahlen: Darüber diskutieren Bundesarbeitsminister Hubertus Heil (SPD) und die wirtschaftspolitische Sprecherin der CDU/CSU-Bundestagsfraktion Julia Klöckner. Außenpolitische Folgen nach Trumps Wahlsieg: Im Studio der ehemalige Botschafter Deutschlands in den USA Wolfgang Ischinger. Es kommentieren: Die ARD-Wirtschafts- und Finanzexpertin Anja Kohl, die Journalistin Kristina Dunz und der Herausgeber des Pioneer Briefing Gabor Steingart.",,75,Gabor Steingart,,,maischberger,,The Pioneer,Journalismus
68,maischberger am 12.11.2024,2024-11-12,"Vertrauensfrage und Neuwahlen: Darüber diskutieren Bundesarbeitsminister Hubertus Heil (SPD) und die wirtschaftspolitische Sprecherin der CDU/CSU-Bundestagsfraktion Julia Klöckner. Außenpolitische Folgen nach Trumps Wahlsieg: Im Studio der ehemalige Botschafter Deutschlands in den USA Wolfgang Ischinger. Es kommentieren: Die ARD-Wirtschafts- und Finanzexpertin Anja Kohl, die Journalistin Kristina Dunz und der Herausgeber des Pioneer Briefing Gabor Steingart.",,75,Wolfgang Ischinger,,,maischberger,,,Internationales
69,maischberger am 05.06.2024,2024-06-05,"Streit um den Haushalt 2025: Im Studio Bundesfinanzminister Christian Lindner (FDP). Europa vor der Wahl: Im Gespräch der ehemalige grüne Europa-Abgeordnete Daniel Cohn-Bendit und der Leiter des ARD-Hauptstadtstudios Markus Preiß. Es kommentieren: der Moderator und TV-Produzent Hubertus Meyer-Burckhardt, die F.A.Z.-Wirtschaftskorrespondentin Julia Löhr und die Wirtschaftskorrespondentin der taz Ulrike Herrmann.",,75,Julia Löhr,,,maischberger,,FAZ,Journalismus
70,maischberger am 05.06.2024,2024-06-05,"Streit um den Haushalt 2025: Im Studio Bundesfinanzminister Christian Lindner (FDP). Europa vor der Wahl: Im Gespräch der ehemalige grüne Europa-Abgeordnete Daniel Cohn-Bendit und der Leiter des ARD-Hauptstadtstudios Markus Preiß. Es kommentieren: der Moderator und TV-Produzent Hubertus Meyer-Burckhardt, die F.A.Z.-Wirtschaftskorrespondentin Julia Löhr und die Wirtschaftskorrespondentin der taz Ulrike Herrmann.",,75,Ulrike Herrmann,,,maischberger,,TAZ,Journalismus
71,maischberger am 05.06.2024,2024-06-05,"Streit um den Haushalt 2025: Im Studio Bundesfinanzminister Christian Lindner (FDP). Europa vor der Wahl: Im Gespräch der ehemalige grüne Europa-Abgeordnete Daniel Cohn-Bendit und der Leiter des ARD-Hauptstadtstudios Markus Preiß. Es kommentieren: der Moderator und TV-Produzent Hubertus Meyer-Burckhardt, die F.A.Z.-Wirtschaftskorrespondentin Julia Löhr und die Wirtschaftskorrespondentin der taz Ulrike Herrmann.",,75,Markus Preiß,,,maischberger,,,
72,maischberger am 05.06.2024,2024-06-05,"Streit um den Haushalt 2025: Im Studio Bundesfinanzminister Christian Lindner (FDP). Europa vor der Wahl: Im Gespräch der ehemalige grüne Europa-Abgeordnete Daniel Cohn-Bendit und der Leiter des ARD-Hauptstadtstudios Markus Preiß. Es kommentieren: der Moderator und TV-Produzent Hubertus Meyer-Burckhardt, die F.A.Z.-Wirtschaftskorrespondentin Julia Löhr und die Wirtschaftskorrespondentin der taz Ulrike Herrmann.",,75,Christian Lindner,,,maischberger,FDP,,Politik
73,maischberger am 05.06.2024,2024-06-05,"Streit um den Haushalt 2025: Im Studio Bundesfinanzminister Christian Lindner (FDP). Europa vor der Wahl: Im Gespräch der ehemalige grüne Europa-Abgeordnete Daniel Cohn-Bendit und der Leiter des ARD-Hauptstadtstudios Markus Preiß. Es kommentieren: der Moderator und TV-Produzent Hubertus Meyer-Burckhardt, die F.A.Z.-Wirtschaftskorrespondentin Julia Löhr und die Wirtschaftskorrespondentin der taz Ulrike Herrmann.",,75,Daniel Cohn Bendit,,,maischberger,,,Kultur
74,maischberger am 05.06.2024,2024-06-05,"Streit um den Haushalt 2025: Im Studio Bundesfinanzminister Christian Lindner (FDP). Europa vor der Wahl: Im Gespräch der ehemalige grüne Europa-Abgeordnete Daniel Cohn-Bendit und der Leiter des ARD-Hauptstadtstudios Markus Preiß. Es kommentieren: der Moderator und TV-Produzent Hubertus Meyer-Burckhardt, die F.A.Z.-Wirtschaftskorrespondentin Julia Löhr und die Wirtschaftskorrespondentin der taz Ulrike Herrmann.",,75,Hubertus Meyer Burckhardt,,,maischberger,,,Kultur
75,maischberger am 13.11.2024,2024-11-13,"Bruch der Ampelkoalition und Lage der Wirtschaft: Im Gespräch der ehemalige Finanzminister und Parteivorsitzende Christian Lindner (FDP). Regierungskrise in Deutschland und Folgen der US-Wahl: Darüber diskutiert das Podcast-Duo Jakob Augstein, Verleger „Der Freitag“, und Nikolaus Blome Leiter des Politikressorts von RTL/n-tv. Es kommentieren: der Comedian Michael Mittermeier, der langjährige Leiter des ZDF-Hauptstadtstudios Theo Koll und die Korrespondentin im ARD-Hauptstadtstudio Kerstin Palzer.",,75,Theo Koll,,,maischberger,,ZDF,Journalismus
76,maischberger am 13.11.2024,2024-11-13,"Bruch der Ampelkoalition und Lage der Wirtschaft: Im Gespräch der ehemalige Finanzminister und Parteivorsitzende Christian Lindner (FDP). Regierungskrise in Deutschland und Folgen der US-Wahl: Darüber diskutiert das Podcast-Duo Jakob Augstein, Verleger „Der Freitag“, und Nikolaus Blome Leiter des Politikressorts von RTL/n-tv. Es kommentieren: der Comedian Michael Mittermeier, der langjährige Leiter des ZDF-Hauptstadtstudios Theo Koll und die Korrespondentin im ARD-Hauptstadtstudio Kerstin Palzer.",,75,Nikolaus Blome,,,maischberger,,RTL,Journalismus
77,maischberger am 13.11.2024,2024-11-13,"Bruch der Ampelkoalition und Lage der Wirtschaft: Im Gespräch der ehemalige Finanzminister und Parteivorsitzende Christian Lindner (FDP). Regierungskrise in Deutschland und Folgen der US-Wahl: Darüber diskutiert das Podcast-Duo Jakob Augstein, Verleger „Der Freitag“, und Nikolaus Blome Leiter des Politikressorts von RTL/n-tv. Es kommentieren: der Comedian Michael Mittermeier, der langjährige Leiter des ZDF-Hauptstadtstudios Theo Koll und die Korrespondentin im ARD-Hauptstadtstudio Kerstin Palzer.",,75,Kerstin Palzer,,,maischberger,,ARD,Journalismus
78,maischberger am 13.11.2024,2024-11-13,"Bruch der Ampelkoalition und Lage der Wirtschaft: Im Gespräch der ehemalige Finanzminister und Parteivorsitzende Christian Lindner (FDP). Regierungskrise in Deutschland und Folgen der US-Wahl: Darüber diskutiert das Podcast-Duo Jakob Augstein, Verleger „Der Freitag“, und Nikolaus Blome Leiter des Politikressorts von RTL/n-tv. Es kommentieren: der Comedian Michael Mittermeier, der langjährige Leiter des ZDF-Hauptstadtstudios Theo Koll und die Korrespondentin im ARD-Hauptstadtstudio Kerstin Palzer.",,75,Christian Lindner,,,maischberger,FDP,,Politik
79,maischberger am 13.11.2024,2024-11-13,"Bruch der Ampelkoalition und Lage der Wirtschaft: Im Gespräch der ehemalige Finanzminister und Parteivorsitzende Christian Lindner (FDP). Regierungskrise in Deutschland und Folgen der US-Wahl: Darüber diskutiert das Podcast-Duo Jakob Augstein, Verleger „Der Freitag“, und Nikolaus Blome Leiter des Politikressorts von RTL/n-tv. Es kommentieren: der Comedian Michael Mittermeier, der langjährige Leiter des ZDF-Hauptstadtstudios Theo Koll und die Korrespondentin im ARD-Hauptstadtstudio Kerstin Palzer.",,75,Jakob Augstein,,,maischberger,,,Journalismus
80,maischberger am 13.11.2024,2024-11-13,"Bruch der Ampelkoalition und Lage der Wirtschaft: Im Gespräch der ehemalige Finanzminister und Parteivorsitzende Christian Lindner (FDP). Regierungskrise in Deutschland und Folgen der US-Wahl: Darüber diskutiert das Podcast-Duo Jakob Augstein, Verleger „Der Freitag“, und Nikolaus Blome Leiter des Politikressorts von RTL/n-tv. Es kommentieren: der Comedian Michael Mittermeier, der langjährige Leiter des ZDF-Hauptstadtstudios Theo Koll und die Korrespondentin im ARD-Hauptstadtstudio Kerstin Palzer.",,75,Michael Mittermeier,,,maischberger,,,
81,maischberger am 20.02.2024,2024-02-20,"Tod des russischen Oppositionellen Alexej Nawalny: Im Gespräch , Mitgründerin der mit dem Friedensnobelpreis ausgezeichneten russischen Bürgerrechtsorganisation Memorial und der ehemalige Leiter des ARD-Studios in Moskau Scholz wirbt um mehr Militär-Unterstützung für die Ukraine: Im Studio die FDP-Verteidigungspolitikerin und die Co-Vorsitzende des Bündnis Sahra Wagenknecht . Es kommentieren: Der Spitzenkoch und TV-Moderator , die Korrespondentin im ARD-Hauptstadtstudio Iris Sayram und der stellvertretende Bild-Chefredakteur und Kriegsreporter",,75,Marie Agnes Strack Zimmermann,,,maischberger,FDP,,Politik
82,maischberger am 20.02.2024,2024-02-20,"Tod des russischen Oppositionellen Alexej Nawalny: Im Gespräch , Mitgründerin der mit dem Friedensnobelpreis ausgezeichneten russischen Bürgerrechtsorganisation Memorial und der ehemalige Leiter des ARD-Studios in Moskau Scholz wirbt um mehr Militär-Unterstützung für die Ukraine: Im Studio die FDP-Verteidigungspolitikerin und die Co-Vorsitzende des Bündnis Sahra Wagenknecht . Es kommentieren: Der Spitzenkoch und TV-Moderator , die Korrespondentin im ARD-Hauptstadtstudio Iris Sayram und der stellvertretende Bild-Chefredakteur und Kriegsreporter",,75,Amira Mohamed Ali,,,maischberger,BSW,,Politik
83,maischberger am 20.02.2024,2024-02-20,"Tod des russischen Oppositionellen Alexej Nawalny: Im Gespräch , Mitgründerin der mit dem Friedensnobelpreis ausgezeichneten russischen Bürgerrechtsorganisation Memorial und der ehemalige Leiter des ARD-Studios in Moskau Scholz wirbt um mehr Militär-Unterstützung für die Ukraine: Im Studio die FDP-Verteidigungspolitikerin und die Co-Vorsitzende des Bündnis Sahra Wagenknecht . Es kommentieren: Der Spitzenkoch und TV-Moderator , die Korrespondentin im ARD-Hauptstadtstudio Iris Sayram und der stellvertretende Bild-Chefredakteur und Kriegsreporter",,75,Christian Rach,,,maischberger,,,Kultur
84,maischberger am 20.02.2024,2024-02-20,"Tod des russischen Oppositionellen Alexej Nawalny: Im Gespräch , Mitgründerin der mit dem Friedensnobelpreis ausgezeichneten russischen Bürgerrechtsorganisation Memorial und der ehemalige Leiter des ARD-Studios in Moskau Scholz wirbt um mehr Militär-Unterstützung für die Ukraine: Im Studio die FDP-Verteidigungspolitikerin und die Co-Vorsitzende des Bündnis Sahra Wagenknecht . Es kommentieren: Der Spitzenkoch und TV-Moderator , die Korrespondentin im ARD-Hauptstadtstudio Iris Sayram und der stellvertretende Bild-Chefredakteur und Kriegsreporter",,75,Iris Sayram,,,maischberger,,ARD,Journalismus
85,maischberger am 20.02.2024,2024-02-20,"Tod des russischen Oppositionellen Alexej Nawalny: Im Gespräch , Mitgründerin der mit dem Friedensnobelpreis ausgezeichneten russischen Bürgerrechtsorganisation Memorial und der ehemalige Leiter des ARD-Studios in Moskau Scholz wirbt um mehr Militär-Unterstützung für die Ukraine: Im Studio die FDP-Verteidigungspolitikerin und die Co-Vorsitzende des Bündnis Sahra Wagenknecht . Es kommentieren: Der Spitzenkoch und TV-Moderator , die Korrespondentin im ARD-Hauptstadtstudio Iris Sayram und der stellvertretende Bild-Chefredakteur und Kriegsreporter",,75,Paul Ronzheimer,,,maischberger,,Bild,Journalismus
86,maischberger am 20.02.2024,2024-02-20,"Tod des russischen Oppositionellen Alexej Nawalny: Im Gespräch , Mitgründerin der mit dem Friedensnobelpreis ausgezeichneten russischen Bürgerrechtsorganisation Memorial und der ehemalige Leiter des ARD-Studios in Moskau Scholz wirbt um mehr Militär-Unterstützung für die Ukraine: Im Studio die FDP-Verteidigungspolitikerin und die Co-Vorsitzende des Bündnis Sahra Wagenknecht . Es kommentieren: Der Spitzenkoch und TV-Moderator , die Korrespondentin im ARD-Hauptstadtstudio Iris Sayram und der stellvertretende Bild-Chefredakteur und Kriegsreporter",,75,Thomas Roth,,,maischberger,,,
87,maischberger am 20.02.2024,2024-02-20,"Tod des russischen Oppositionellen Alexej Nawalny: Im Gespräch , Mitgründerin der mit dem Friedensnobelpreis ausgezeichneten russischen Bürgerrechtsorganisation Memorial und der ehemalige Leiter des ARD-Studios in Moskau Scholz wirbt um mehr Militär-Unterstützung für die Ukraine: Im Studio die FDP-Verteidigungspolitikerin und die Co-Vorsitzende des Bündnis Sahra Wagenknecht . Es kommentieren: Der Spitzenkoch und TV-Moderator , die Korrespondentin im ARD-Hauptstadtstudio Iris Sayram und der stellvertretende Bild-Chefredakteur und Kriegsreporter",,75,Irina Scherbakowa,,,maischberger,,,Recht
88,maischberger am 14.02.2024,2024-02-14,"Streit um Klinikreform: Im Studio Bundesgesundheitsminister (SPD) und zugeschaltet der Intensivmediziner und Chefarzt . Krieg in der Ukraine und Putin-Interview: Im Gespräch der CNN-Kriegsreporter und der ehemalige russische UN-Diplomat Es kommentieren: Der Kabarettist , die stellvertretende Chefredakteurin von Table.Media und der Leiter des Politikressorts von RTL/n-tv .",,75,Helene Bubrowski,,,maischberger,,Table.Media,Journalismus
89,maischberger am 14.02.2024,2024-02-14,"Streit um Klinikreform: Im Studio Bundesgesundheitsminister (SPD) und zugeschaltet der Intensivmediziner und Chefarzt . Krieg in der Ukraine und Putin-Interview: Im Gespräch der CNN-Kriegsreporter und der ehemalige russische UN-Diplomat Es kommentieren: Der Kabarettist , die stellvertretende Chefredakteurin von Table.Media und der Leiter des Politikressorts von RTL/n-tv .",,75,Nikolaus Blome,,,maischberger,,RTL,Journalismus
90,maischberger am 14.02.2024,2024-02-14,"Streit um Klinikreform: Im Studio Bundesgesundheitsminister (SPD) und zugeschaltet der Intensivmediziner und Chefarzt . Krieg in der Ukraine und Putin-Interview: Im Gespräch der CNN-Kriegsreporter und der ehemalige russische UN-Diplomat Es kommentieren: Der Kabarettist , die stellvertretende Chefredakteurin von Table.Media und der Leiter des Politikressorts von RTL/n-tv .",,75,Frederik Pleitgen,,,maischberger,,CNN,Journalismus
91,maischberger am 14.02.2024,2024-02-14,"Streit um Klinikreform: Im Studio Bundesgesundheitsminister (SPD) und zugeschaltet der Intensivmediziner und Chefarzt . Krieg in der Ukraine und Putin-Interview: Im Gespräch der CNN-Kriegsreporter und der ehemalige russische UN-Diplomat Es kommentieren: Der Kabarettist , die stellvertretende Chefredakteurin von Table.Media und der Leiter des Politikressorts von RTL/n-tv .",,75,Uwe Janssens,,,maischberger,,,
92,maischberger am 14.02.2024,2024-02-14,"Streit um Klinikreform: Im Studio Bundesgesundheitsminister (SPD) und zugeschaltet der Intensivmediziner und Chefarzt . Krieg in der Ukraine und Putin-Interview: Im Gespräch der CNN-Kriegsreporter und der ehemalige russische UN-Diplomat Es kommentieren: Der Kabarettist , die stellvertretende Chefredakteurin von Table.Media und der Leiter des Politikressorts von RTL/n-tv .",,75,Urban Priol,,,maischberger,,,Kultur
93,maischberger am 14.02.2024,2024-02-14,"Streit um Klinikreform: Im Studio Bundesgesundheitsminister (SPD) und zugeschaltet der Intensivmediziner und Chefarzt . Krieg in der Ukraine und Putin-Interview: Im Gespräch der CNN-Kriegsreporter und der ehemalige russische UN-Diplomat Es kommentieren: Der Kabarettist , die stellvertretende Chefredakteurin von Table.Media und der Leiter des Politikressorts von RTL/n-tv .",,75,Karl Lauterbach,,,maischberger,SPD,,Politik
94,maischberger am 14.02.2024,2024-02-14,"Streit um Klinikreform: Im Studio Bundesgesundheitsminister (SPD) und zugeschaltet der Intensivmediziner und Chefarzt . Krieg in der Ukraine und Putin-Interview: Im Gespräch der CNN-Kriegsreporter und der ehemalige russische UN-Diplomat Es kommentieren: Der Kabarettist , die stellvertretende Chefredakteurin von Table.Media und der Leiter des Politikressorts von RTL/n-tv .",,75,Boris Bondarew,,,maischberger,,,Internationales
95,maischberger am 28.02.2024,2024-02-28,"Streit um die Wirtschaftspolitik: Es diskutieren die Ministerpräsidentin von Rheinland-Pfalz (SPD) und der bayerische Staatsminister für Wissenschaft (CSU). Folgen eines Trump-Sieges: Im Gespräch Donald Trumps ehemaliger Nationaler Sicherheitsberater und die deutsch-US-amerikanische Expertin für transatlantische Beziehungen Es kommentieren der Moderator und TV-Produzent , die stellvertretende Chefredakteurin von The Pioneer und der Leiter des ARD-Studios in Brüssel",,75,Markus Blume,,,maischberger,,,
96,maischberger am 28.02.2024,2024-02-28,"Streit um die Wirtschaftspolitik: Es diskutieren die Ministerpräsidentin von Rheinland-Pfalz (SPD) und der bayerische Staatsminister für Wissenschaft (CSU). Folgen eines Trump-Sieges: Im Gespräch Donald Trumps ehemaliger Nationaler Sicherheitsberater und die deutsch-US-amerikanische Expertin für transatlantische Beziehungen Es kommentieren der Moderator und TV-Produzent , die stellvertretende Chefredakteurin von The Pioneer und der Leiter des ARD-Studios in Brüssel",,75,Malu Dreyer,,,maischberger,SPD,,Politik
97,maischberger am 28.02.2024,2024-02-28,"Streit um die Wirtschaftspolitik: Es diskutieren die Ministerpräsidentin von Rheinland-Pfalz (SPD) und der bayerische Staatsminister für Wissenschaft (CSU). Folgen eines Trump-Sieges: Im Gespräch Donald Trumps ehemaliger Nationaler Sicherheitsberater und die deutsch-US-amerikanische Expertin für transatlantische Beziehungen Es kommentieren der Moderator und TV-Produzent , die stellvertretende Chefredakteurin von The Pioneer und der Leiter des ARD-Studios in Brüssel",,75,Markus Preiß,,,maischberger,,,
98,maischberger am 28.02.2024,2024-02-28,"Streit um die Wirtschaftspolitik: Es diskutieren die Ministerpräsidentin von Rheinland-Pfalz (SPD) und der bayerische Staatsminister für Wissenschaft (CSU). Folgen eines Trump-Sieges: Im Gespräch Donald Trumps ehemaliger Nationaler Sicherheitsberater und die deutsch-US-amerikanische Expertin für transatlantische Beziehungen Es kommentieren der Moderator und TV-Produzent , die stellvertretende Chefredakteurin von The Pioneer und der Leiter des ARD-Studios in Brüssel",,75,John Bolton,,,maischberger,,,Internationales
99,maischberger am 28.02.2024,2024-02-28,"Streit um die Wirtschaftspolitik: Es diskutieren die Ministerpräsidentin von Rheinland-Pfalz (SPD) und der bayerische Staatsminister für Wissenschaft (CSU). Folgen eines Trump-Sieges: Im Gespräch Donald Trumps ehemaliger Nationaler Sicherheitsberater und die deutsch-US-amerikanische Expertin für transatlantische Beziehungen Es kommentieren der Moderator und TV-Produzent , die stellvertretende Chefredakteurin von The Pioneer und der Leiter des ARD-Studios in Brüssel",,75,Hubertus Meyer Burckhardt,,,maischberger,,,Kultur
100,maischberger am 28.02.2024,2024-02-28,"Streit um die Wirtschaftspolitik: Es diskutieren die Ministerpräsidentin von Rheinland-Pfalz (SPD) und der bayerische Staatsminister für Wissenschaft (CSU). Folgen eines Trump-Sieges: Im Gespräch Donald Trumps ehemaliger Nationaler Sicherheitsberater und die deutsch-US-amerikanische Expertin für transatlantische Beziehungen Es kommentieren der Moderator und TV-Produzent , die stellvertretende Chefredakteurin von The Pioneer und der Leiter des ARD-Studios in Brüssel",,75,Alev Doğan,,,maischberger,,The Pioneer,Journalismus
101,maischberger am 28.02.2024,2024-02-28,"Streit um die Wirtschaftspolitik: Es diskutieren die Ministerpräsidentin von Rheinland-Pfalz (SPD) und der bayerische Staatsminister für Wissenschaft (CSU). Folgen eines Trump-Sieges: Im Gespräch Donald Trumps ehemaliger Nationaler Sicherheitsberater und die deutsch-US-amerikanische Expertin für transatlantische Beziehungen Es kommentieren der Moderator und TV-Produzent , die stellvertretende Chefredakteurin von The Pioneer und der Leiter des ARD-Studios in Brüssel",,75,Cathryn Clüver Ashbrook,,,maischberger,,,Geisteswissenschaft
102,maischberger vom 7. Juni 2022 vom 07.06.2022,2022-06-07,"Rekord-Neuverschuldung und gleichzeitig steigende Inflation. Kommen die Entlastungen der Bundesregierung bei den Bürgern an? Wie kann die Inflation gestoppt werden? Dazu im Gespräch der Bundesfinanzminister (FDP). Wladimir Putin droht dem Westen: Der russische Präsident kündigt Angriffe auf neue Ziele an, falls Raketensysteme mit größerer Reichweite an die Ukraine geliefert werden. Wie gefährlich ist die Lage? Im Gespräch der Militärexperte und der ukrainische Gouverneur Sollten die Mineralölkonzerne, die kriegsbedingt hohe Gewinne machen, stärker besteuert werden? Darüber und andere Themen diskutieren die „ARD“-Moderatorin , die Hauptstadtkorrespondentin des „Deutschlandfunks“ und der politische Redakteur der „Neuen Zürcher Zeitung“",,75,Katharina Hamberger,,,maischberger,,,
103,maischberger vom 7. Juni 2022 vom 07.06.2022,2022-06-07,"Rekord-Neuverschuldung und gleichzeitig steigende Inflation. Kommen die Entlastungen der Bundesregierung bei den Bürgern an? Wie kann die Inflation gestoppt werden? Dazu im Gespräch der Bundesfinanzminister (FDP). Wladimir Putin droht dem Westen: Der russische Präsident kündigt Angriffe auf neue Ziele an, falls Raketensysteme mit größerer Reichweite an die Ukraine geliefert werden. Wie gefährlich ist die Lage? Im Gespräch der Militärexperte und der ukrainische Gouverneur Sollten die Mineralölkonzerne, die kriegsbedingt hohe Gewinne machen, stärker besteuert werden? Darüber und andere Themen diskutieren die „ARD“-Moderatorin , die Hauptstadtkorrespondentin des „Deutschlandfunks“ und der politische Redakteur der „Neuen Zürcher Zeitung“",,75,Anna Planken,,,maischberger,,,
104,maischberger vom 7. Juni 2022 vom 07.06.2022,2022-06-07,"Rekord-Neuverschuldung und gleichzeitig steigende Inflation. Kommen die Entlastungen der Bundesregierung bei den Bürgern an? Wie kann die Inflation gestoppt werden? Dazu im Gespräch der Bundesfinanzminister (FDP). Wladimir Putin droht dem Westen: Der russische Präsident kündigt Angriffe auf neue Ziele an, falls Raketensysteme mit größerer Reichweite an die Ukraine geliefert werden. Wie gefährlich ist die Lage? Im Gespräch der Militärexperte und der ukrainische Gouverneur Sollten die Mineralölkonzerne, die kriegsbedingt hohe Gewinne machen, stärker besteuert werden? Darüber und andere Themen diskutieren die „ARD“-Moderatorin , die Hauptstadtkorrespondentin des „Deutschlandfunks“ und der politische Redakteur der „Neuen Zürcher Zeitung“",,75,Carlo Masala,,,maischberger,,,Militär
105,maischberger vom 7. Juni 2022 vom 07.06.2022,2022-06-07,"Rekord-Neuverschuldung und gleichzeitig steigende Inflation. Kommen die Entlastungen der Bundesregierung bei den Bürgern an? Wie kann die Inflation gestoppt werden? Dazu im Gespräch der Bundesfinanzminister (FDP). Wladimir Putin droht dem Westen: Der russische Präsident kündigt Angriffe auf neue Ziele an, falls Raketensysteme mit größerer Reichweite an die Ukraine geliefert werden. Wie gefährlich ist die Lage? Im Gespräch der Militärexperte und der ukrainische Gouverneur Sollten die Mineralölkonzerne, die kriegsbedingt hohe Gewinne machen, stärker besteuert werden? Darüber und andere Themen diskutieren die „ARD“-Moderatorin , die Hauptstadtkorrespondentin des „Deutschlandfunks“ und der politische Redakteur der „Neuen Zürcher Zeitung“",,75,Sergiy Osachuk,,,maischberger,,,
106,maischberger vom 7. Juni 2022 vom 07.06.2022,2022-06-07,"Rekord-Neuverschuldung und gleichzeitig steigende Inflation. Kommen die Entlastungen der Bundesregierung bei den Bürgern an? Wie kann die Inflation gestoppt werden? Dazu im Gespräch der Bundesfinanzminister (FDP). Wladimir Putin droht dem Westen: Der russische Präsident kündigt Angriffe auf neue Ziele an, falls Raketensysteme mit größerer Reichweite an die Ukraine geliefert werden. Wie gefährlich ist die Lage? Im Gespräch der Militärexperte und der ukrainische Gouverneur Sollten die Mineralölkonzerne, die kriegsbedingt hohe Gewinne machen, stärker besteuert werden? Darüber und andere Themen diskutieren die „ARD“-Moderatorin , die Hauptstadtkorrespondentin des „Deutschlandfunks“ und der politische Redakteur der „Neuen Zürcher Zeitung“",,75,Alexander Kissler,,,maischberger,,,
107,maischberger am 27.02.2024,2024-02-27,Zwei Jahre russischer Angriffskrieg auf die Ukraine: Im Studio der ehemalige Box-Weltmeister Streit in der Ampel und Kritik in der EU wegen FDP-Blockade: Im Studio der Bundesminister für Justiz (FDP). Es kommentieren der langjährige Leiter des ZDF-Hauptstadtstudios die Chefredakteurin der Welt am Sonntag und die ARD-Korrespondentin im Hauptstadtstudio,,75,Theo Koll,,,maischberger,,ZDF,Journalismus
108,maischberger am 27.02.2024,2024-02-27,Zwei Jahre russischer Angriffskrieg auf die Ukraine: Im Studio der ehemalige Box-Weltmeister Streit in der Ampel und Kritik in der EU wegen FDP-Blockade: Im Studio der Bundesminister für Justiz (FDP). Es kommentieren der langjährige Leiter des ZDF-Hauptstadtstudios die Chefredakteurin der Welt am Sonntag und die ARD-Korrespondentin im Hauptstadtstudio,,75,Wladimir Klitschko,,,maischberger,,,Sport
109,maischberger am 27.02.2024,2024-02-27,Zwei Jahre russischer Angriffskrieg auf die Ukraine: Im Studio der ehemalige Box-Weltmeister Streit in der Ampel und Kritik in der EU wegen FDP-Blockade: Im Studio der Bundesminister für Justiz (FDP). Es kommentieren der langjährige Leiter des ZDF-Hauptstadtstudios die Chefredakteurin der Welt am Sonntag und die ARD-Korrespondentin im Hauptstadtstudio,,75,Marco Buschmann,,,maischberger,FDP,,Politik
110,maischberger am 27.02.2024,2024-02-27,Zwei Jahre russischer Angriffskrieg auf die Ukraine: Im Studio der ehemalige Box-Weltmeister Streit in der Ampel und Kritik in der EU wegen FDP-Blockade: Im Studio der Bundesminister für Justiz (FDP). Es kommentieren der langjährige Leiter des ZDF-Hauptstadtstudios die Chefredakteurin der Welt am Sonntag und die ARD-Korrespondentin im Hauptstadtstudio,,75,Dagmar Rosenfeld,,,maischberger,,The Pioneer,Journalismus
111,maischberger am 27.02.2024,2024-02-27,Zwei Jahre russischer Angriffskrieg auf die Ukraine: Im Studio der ehemalige Box-Weltmeister Streit in der Ampel und Kritik in der EU wegen FDP-Blockade: Im Studio der Bundesminister für Justiz (FDP). Es kommentieren der langjährige Leiter des ZDF-Hauptstadtstudios die Chefredakteurin der Welt am Sonntag und die ARD-Korrespondentin im Hauptstadtstudio,,75,Julie Kurz,,,maischberger,,,
112,maischberger am 02.10.2024,2024-10-02,"Überraschende Ahnenforschung und Sorge um Demokratie: Im Gespräch der Entertainer und Bestsellerautor Hape Kerkeling. Ukrainischer „Siegesplan“ und Forderungen nach Diplomatie: Es diskutieren die Vorsitzende des EU-Verteidigungsausschusses Marie-Agnes Strack-Zimmermann (FDP) und der ehemalige SPD- und Linken-Parteichef Oskar Lafontaine (BSW). Es kommentieren die Moderatorin von RTL Aktuell und RTL Direkt Pinar Atalay, die Herausgeberin von Media Pioneer Dagmar Rosenfeld und die Zeit-Journalistin Valerie Schönian.",,75,Oskar Lafontaine,,,maischberger,BSW,,Politik
113,maischberger am 02.10.2024,2024-10-02,"Überraschende Ahnenforschung und Sorge um Demokratie: Im Gespräch der Entertainer und Bestsellerautor Hape Kerkeling. Ukrainischer „Siegesplan“ und Forderungen nach Diplomatie: Es diskutieren die Vorsitzende des EU-Verteidigungsausschusses Marie-Agnes Strack-Zimmermann (FDP) und der ehemalige SPD- und Linken-Parteichef Oskar Lafontaine (BSW). Es kommentieren die Moderatorin von RTL Aktuell und RTL Direkt Pinar Atalay, die Herausgeberin von Media Pioneer Dagmar Rosenfeld und die Zeit-Journalistin Valerie Schönian.",,75,Marie Agnes Strack Zimmermann,,,maischberger,FDP,,Politik
114,maischberger am 02.10.2024,2024-10-02,"Überraschende Ahnenforschung und Sorge um Demokratie: Im Gespräch der Entertainer und Bestsellerautor Hape Kerkeling. Ukrainischer „Siegesplan“ und Forderungen nach Diplomatie: Es diskutieren die Vorsitzende des EU-Verteidigungsausschusses Marie-Agnes Strack-Zimmermann (FDP) und der ehemalige SPD- und Linken-Parteichef Oskar Lafontaine (BSW). Es kommentieren die Moderatorin von RTL Aktuell und RTL Direkt Pinar Atalay, die Herausgeberin von Media Pioneer Dagmar Rosenfeld und die Zeit-Journalistin Valerie Schönian.",,75,Dagmar Rosenfeld,,,maischberger,,The Pioneer,Journalismus
115,maischberger am 02.10.2024,2024-10-02,"Überraschende Ahnenforschung und Sorge um Demokratie: Im Gespräch der Entertainer und Bestsellerautor Hape Kerkeling. Ukrainischer „Siegesplan“ und Forderungen nach Diplomatie: Es diskutieren die Vorsitzende des EU-Verteidigungsausschusses Marie-Agnes Strack-Zimmermann (FDP) und der ehemalige SPD- und Linken-Parteichef Oskar Lafontaine (BSW). Es kommentieren die Moderatorin von RTL Aktuell und RTL Direkt Pinar Atalay, die Herausgeberin von Media Pioneer Dagmar Rosenfeld und die Zeit-Journalistin Valerie Schönian.",,75,Pinar Atalay,,,maischberger,,RTL,Journalismus
116,maischberger am 02.10.2024,2024-10-02,"Überraschende Ahnenforschung und Sorge um Demokratie: Im Gespräch der Entertainer und Bestsellerautor Hape Kerkeling. Ukrainischer „Siegesplan“ und Forderungen nach Diplomatie: Es diskutieren die Vorsitzende des EU-Verteidigungsausschusses Marie-Agnes Strack-Zimmermann (FDP) und der ehemalige SPD- und Linken-Parteichef Oskar Lafontaine (BSW). Es kommentieren die Moderatorin von RTL Aktuell und RTL Direkt Pinar Atalay, die Herausgeberin von Media Pioneer Dagmar Rosenfeld und die Zeit-Journalistin Valerie Schönian.",,75,Hape Kerkeling,,,maischberger,,,
117,maischberger am 02.10.2024,2024-10-02,"Überraschende Ahnenforschung und Sorge um Demokratie: Im Gespräch der Entertainer und Bestsellerautor Hape Kerkeling. Ukrainischer „Siegesplan“ und Forderungen nach Diplomatie: Es diskutieren die Vorsitzende des EU-Verteidigungsausschusses Marie-Agnes Strack-Zimmermann (FDP) und der ehemalige SPD- und Linken-Parteichef Oskar Lafontaine (BSW). Es kommentieren die Moderatorin von RTL Aktuell und RTL Direkt Pinar Atalay, die Herausgeberin von Media Pioneer Dagmar Rosenfeld und die Zeit-Journalistin Valerie Schönian.",,75,Valerie Schönian,,,maischberger,,,
118,maischberger am 24.09.2024,2024-09-24,"Mögliche Koalitionen von CDU und BSW: Es diskutieren der Erste Parlamentarische Geschäftsführer der Unionsfraktion Thorsten Frei (CDU) und die außenpolitische Sprecherin der BSW-Gruppe im Bundestag Sevim Dağdelen. Wahl in Brandenburg: SPD knapp vor AfD: Im Gespräch der langjährige Ministerpräsident von Brandenburg Matthias Platzeck (SPD). Es kommentieren der Frontmann der Band „Die Prinzen“ Sebastian Krumbiegel, der stellvertretende „Welt“-Chefredakteur Robin Alexander und die ARD-Korrespondentin im Hauptstadtstudio Julie Kurz.",,75,Robin Alexander,,,maischberger,,Welt,Journalismus
119,maischberger am 24.09.2024,2024-09-24,"Mögliche Koalitionen von CDU und BSW: Es diskutieren der Erste Parlamentarische Geschäftsführer der Unionsfraktion Thorsten Frei (CDU) und die außenpolitische Sprecherin der BSW-Gruppe im Bundestag Sevim Dağdelen. Wahl in Brandenburg: SPD knapp vor AfD: Im Gespräch der langjährige Ministerpräsident von Brandenburg Matthias Platzeck (SPD). Es kommentieren der Frontmann der Band „Die Prinzen“ Sebastian Krumbiegel, der stellvertretende „Welt“-Chefredakteur Robin Alexander und die ARD-Korrespondentin im Hauptstadtstudio Julie Kurz.",,75,Sevim Dağdelen,,,maischberger,,,
120,maischberger am 24.09.2024,2024-09-24,"Mögliche Koalitionen von CDU und BSW: Es diskutieren der Erste Parlamentarische Geschäftsführer der Unionsfraktion Thorsten Frei (CDU) und die außenpolitische Sprecherin der BSW-Gruppe im Bundestag Sevim Dağdelen. Wahl in Brandenburg: SPD knapp vor AfD: Im Gespräch der langjährige Ministerpräsident von Brandenburg Matthias Platzeck (SPD). Es kommentieren der Frontmann der Band „Die Prinzen“ Sebastian Krumbiegel, der stellvertretende „Welt“-Chefredakteur Robin Alexander und die ARD-Korrespondentin im Hauptstadtstudio Julie Kurz.",,75,Thorsten Frei,,,maischberger,CDU,,Politik
121,maischberger am 24.09.2024,2024-09-24,"Mögliche Koalitionen von CDU und BSW: Es diskutieren der Erste Parlamentarische Geschäftsführer der Unionsfraktion Thorsten Frei (CDU) und die außenpolitische Sprecherin der BSW-Gruppe im Bundestag Sevim Dağdelen. Wahl in Brandenburg: SPD knapp vor AfD: Im Gespräch der langjährige Ministerpräsident von Brandenburg Matthias Platzeck (SPD). Es kommentieren der Frontmann der Band „Die Prinzen“ Sebastian Krumbiegel, der stellvertretende „Welt“-Chefredakteur Robin Alexander und die ARD-Korrespondentin im Hauptstadtstudio Julie Kurz.",,75,Sebastian Krumbiegel,,,maischberger,,,Kultur
122,maischberger am 24.09.2024,2024-09-24,"Mögliche Koalitionen von CDU und BSW: Es diskutieren der Erste Parlamentarische Geschäftsführer der Unionsfraktion Thorsten Frei (CDU) und die außenpolitische Sprecherin der BSW-Gruppe im Bundestag Sevim Dağdelen. Wahl in Brandenburg: SPD knapp vor AfD: Im Gespräch der langjährige Ministerpräsident von Brandenburg Matthias Platzeck (SPD). Es kommentieren der Frontmann der Band „Die Prinzen“ Sebastian Krumbiegel, der stellvertretende „Welt“-Chefredakteur Robin Alexander und die ARD-Korrespondentin im Hauptstadtstudio Julie Kurz.",,75,Julie Kurz,,,maischberger,,,
123,maischberger am 24.09.2024,2024-09-24,"Mögliche Koalitionen von CDU und BSW: Es diskutieren der Erste Parlamentarische Geschäftsführer der Unionsfraktion Thorsten Frei (CDU) und die außenpolitische Sprecherin der BSW-Gruppe im Bundestag Sevim Dağdelen. Wahl in Brandenburg: SPD knapp vor AfD: Im Gespräch der langjährige Ministerpräsident von Brandenburg Matthias Platzeck (SPD). Es kommentieren der Frontmann der Band „Die Prinzen“ Sebastian Krumbiegel, der stellvertretende „Welt“-Chefredakteur Robin Alexander und die ARD-Korrespondentin im Hauptstadtstudio Julie Kurz.",,75,Matthias Platzeck,,,maischberger,,,
124,maischberger am 25.09.2024,2024-09-25,"Internationale Krisen und Deutschlands Rolle: Im Gespräch Bundesaußenministerin Annalena Baerbock (Bündnis 90/Die Grünen). Deutschlands schwache Wirtschaft und Europas Verteidigungsfähigkeit: Im Gespräch der Verwaltungsratschef von Airbus und ehemalige Telekom-Chef René Obermann. Es kommentieren: Die TV-Moderatorin Bettina Tietjen, der Verleger von The European Wolfram Weimer und die stellvertretende Leiterin des Hauptstadtbüros des Redaktionsnetzwerks Deutschland Kristina Dunz.",,75,Bettina Tietjen,,,maischberger,,,
125,maischberger am 25.09.2024,2024-09-25,"Internationale Krisen und Deutschlands Rolle: Im Gespräch Bundesaußenministerin Annalena Baerbock (Bündnis 90/Die Grünen). Deutschlands schwache Wirtschaft und Europas Verteidigungsfähigkeit: Im Gespräch der Verwaltungsratschef von Airbus und ehemalige Telekom-Chef René Obermann. Es kommentieren: Die TV-Moderatorin Bettina Tietjen, der Verleger von The European Wolfram Weimer und die stellvertretende Leiterin des Hauptstadtbüros des Redaktionsnetzwerks Deutschland Kristina Dunz.",,75,Kristina Dunz,,,maischberger,,RND,Journalismus
126,maischberger am 25.09.2024,2024-09-25,"Internationale Krisen und Deutschlands Rolle: Im Gespräch Bundesaußenministerin Annalena Baerbock (Bündnis 90/Die Grünen). Deutschlands schwache Wirtschaft und Europas Verteidigungsfähigkeit: Im Gespräch der Verwaltungsratschef von Airbus und ehemalige Telekom-Chef René Obermann. Es kommentieren: Die TV-Moderatorin Bettina Tietjen, der Verleger von The European Wolfram Weimer und die stellvertretende Leiterin des Hauptstadtbüros des Redaktionsnetzwerks Deutschland Kristina Dunz.",,75,Wolfram Weimer,,,maischberger,,The European,Journalismus
127,maischberger am 25.09.2024,2024-09-25,"Internationale Krisen und Deutschlands Rolle: Im Gespräch Bundesaußenministerin Annalena Baerbock (Bündnis 90/Die Grünen). Deutschlands schwache Wirtschaft und Europas Verteidigungsfähigkeit: Im Gespräch der Verwaltungsratschef von Airbus und ehemalige Telekom-Chef René Obermann. Es kommentieren: Die TV-Moderatorin Bettina Tietjen, der Verleger von The European Wolfram Weimer und die stellvertretende Leiterin des Hauptstadtbüros des Redaktionsnetzwerks Deutschland Kristina Dunz.",,75,René Obermann,,,maischberger,,,
128,maischberger am 25.09.2024,2024-09-25,"Internationale Krisen und Deutschlands Rolle: Im Gespräch Bundesaußenministerin Annalena Baerbock (Bündnis 90/Die Grünen). Deutschlands schwache Wirtschaft und Europas Verteidigungsfähigkeit: Im Gespräch der Verwaltungsratschef von Airbus und ehemalige Telekom-Chef René Obermann. Es kommentieren: Die TV-Moderatorin Bettina Tietjen, der Verleger von The European Wolfram Weimer und die stellvertretende Leiterin des Hauptstadtbüros des Redaktionsnetzwerks Deutschland Kristina Dunz.",,75,Annalena Baerbock,,,maischberger,B90G,,Politik
129,maischberger am 11.01.2023,2023-01-11,"Marode Schienen, baufällige Brücken, überlastete Flughäfen – der Verkehr in Deutschland fließt schon lange nicht mehr. Wie will die Ampel die Verkehrswende schaffen? Kann Deutschland seine Klimaziele erreichen?Müssen die Atomkraftwerke länger am Netz bleiben? Im Studio Bundesverkehrsminister Volker Wissing (FDP).  Das Dorf Lützerath in Nordrhein-Westfalen ist zum Symbol für die deutsche Klimapolitik geworden. Aktivisten haben das Dorf besetzt, um den Abriss zu verhindern. Der Energiekonzern RWE will dort Braunkohle abbauen. Ein fatales Signal, findet der ARD-Moderator und Klimaschützer Eckart von Hirschhausen.  Es erklären, kommentieren und diskutieren die langjährige Moderatorin der ZDF-„heute“-Nachrichten Petra Gerster, der ARD-Moderator und Autor Jörg Thadeusz und die Wirtschaftskorrespondentin der taz Ulrike Herrmann.",,75,Jörg Thadeusz,,,maischberger,,,
130,maischberger am 11.01.2023,2023-01-11,"Marode Schienen, baufällige Brücken, überlastete Flughäfen – der Verkehr in Deutschland fließt schon lange nicht mehr. Wie will die Ampel die Verkehrswende schaffen? Kann Deutschland seine Klimaziele erreichen?Müssen die Atomkraftwerke länger am Netz bleiben? Im Studio Bundesverkehrsminister Volker Wissing (FDP).  Das Dorf Lützerath in Nordrhein-Westfalen ist zum Symbol für die deutsche Klimapolitik geworden. Aktivisten haben das Dorf besetzt, um den Abriss zu verhindern. Der Energiekonzern RWE will dort Braunkohle abbauen. Ein fatales Signal, findet der ARD-Moderator und Klimaschützer Eckart von Hirschhausen.  Es erklären, kommentieren und diskutieren die langjährige Moderatorin der ZDF-„heute“-Nachrichten Petra Gerster, der ARD-Moderator und Autor Jörg Thadeusz und die Wirtschaftskorrespondentin der taz Ulrike Herrmann.",,75,Eckart von Hirschhausen,,,maischberger,,,Gesundheit
131,maischberger am 11.01.2023,2023-01-11,"Marode Schienen, baufällige Brücken, überlastete Flughäfen – der Verkehr in Deutschland fließt schon lange nicht mehr. Wie will die Ampel die Verkehrswende schaffen? Kann Deutschland seine Klimaziele erreichen?Müssen die Atomkraftwerke länger am Netz bleiben? Im Studio Bundesverkehrsminister Volker Wissing (FDP).  Das Dorf Lützerath in Nordrhein-Westfalen ist zum Symbol für die deutsche Klimapolitik geworden. Aktivisten haben das Dorf besetzt, um den Abriss zu verhindern. Der Energiekonzern RWE will dort Braunkohle abbauen. Ein fatales Signal, findet der ARD-Moderator und Klimaschützer Eckart von Hirschhausen.  Es erklären, kommentieren und diskutieren die langjährige Moderatorin der ZDF-„heute“-Nachrichten Petra Gerster, der ARD-Moderator und Autor Jörg Thadeusz und die Wirtschaftskorrespondentin der taz Ulrike Herrmann.",,75,Petra Gerster,,,maischberger,,ZDF,Journalismus
132,maischberger am 11.01.2023,2023-01-11,"Marode Schienen, baufällige Brücken, überlastete Flughäfen – der Verkehr in Deutschland fließt schon lange nicht mehr. Wie will die Ampel die Verkehrswende schaffen? Kann Deutschland seine Klimaziele erreichen?Müssen die Atomkraftwerke länger am Netz bleiben? Im Studio Bundesverkehrsminister Volker Wissing (FDP).  Das Dorf Lützerath in Nordrhein-Westfalen ist zum Symbol für die deutsche Klimapolitik geworden. Aktivisten haben das Dorf besetzt, um den Abriss zu verhindern. Der Energiekonzern RWE will dort Braunkohle abbauen. Ein fatales Signal, findet der ARD-Moderator und Klimaschützer Eckart von Hirschhausen.  Es erklären, kommentieren und diskutieren die langjährige Moderatorin der ZDF-„heute“-Nachrichten Petra Gerster, der ARD-Moderator und Autor Jörg Thadeusz und die Wirtschaftskorrespondentin der taz Ulrike Herrmann.",,75,Ulrike Herrmann,,,maischberger,,TAZ,Journalismus
133,maischberger am 29.01.2025,2025-01-29,"Migrationsdebatte, Ukrainehilfe, Wirtschaft – wo steht die SPD? Im Gespräch Bundeskanzler Olaf Scholz (SPD). Populismus, Trump, Krieg in Europa – wie umgehen mit den Herausforderungen unserer Zeit? Zu Gast der ehemalige britische Premierminister Tony Blair.",,75,Olaf Scholz,,,maischberger,SPD,,Politik
134,maischberger am 29.01.2025,2025-01-29,"Migrationsdebatte, Ukrainehilfe, Wirtschaft – wo steht die SPD? Im Gespräch Bundeskanzler Olaf Scholz (SPD). Populismus, Trump, Krieg in Europa – wie umgehen mit den Herausforderungen unserer Zeit? Zu Gast der ehemalige britische Premierminister Tony Blair.",,75,Tony Blair,,,maischberger,,,
135,maischberger am 10.04.2024,2024-04-10,Wie wehrhaft ist unsere Demokratie? Im Studio die Bundestagspräsidentin (SPD). Streit über Bürgergeld und Kindergrundsicherung: Es diskutieren die wirtschaftspolitische Sprecherin der Unions-Fraktion im Deutschen Bundestag (CDU) und der Vizefraktionsvorsitzende von B‘90/Die Grünen . Es kommentieren der TV-Moderator die Leiterin des ARD-Hauptstadtstudios und der Verleger von The European .,,75,Micky Beisenherz,,,maischberger,,,Kultur
136,maischberger am 10.04.2024,2024-04-10,Wie wehrhaft ist unsere Demokratie? Im Studio die Bundestagspräsidentin (SPD). Streit über Bürgergeld und Kindergrundsicherung: Es diskutieren die wirtschaftspolitische Sprecherin der Unions-Fraktion im Deutschen Bundestag (CDU) und der Vizefraktionsvorsitzende von B‘90/Die Grünen . Es kommentieren der TV-Moderator die Leiterin des ARD-Hauptstadtstudios und der Verleger von The European .,,75,Andreas Audretsch,,,maischberger,B90G,,Politik
137,maischberger am 10.04.2024,2024-04-10,Wie wehrhaft ist unsere Demokratie? Im Studio die Bundestagspräsidentin (SPD). Streit über Bürgergeld und Kindergrundsicherung: Es diskutieren die wirtschaftspolitische Sprecherin der Unions-Fraktion im Deutschen Bundestag (CDU) und der Vizefraktionsvorsitzende von B‘90/Die Grünen . Es kommentieren der TV-Moderator die Leiterin des ARD-Hauptstadtstudios und der Verleger von The European .,,75,Julia Klöckner,,,maischberger,CDU,,Politik
138,maischberger am 10.04.2024,2024-04-10,Wie wehrhaft ist unsere Demokratie? Im Studio die Bundestagspräsidentin (SPD). Streit über Bürgergeld und Kindergrundsicherung: Es diskutieren die wirtschaftspolitische Sprecherin der Unions-Fraktion im Deutschen Bundestag (CDU) und der Vizefraktionsvorsitzende von B‘90/Die Grünen . Es kommentieren der TV-Moderator die Leiterin des ARD-Hauptstadtstudios und der Verleger von The European .,,75,Wolfram Weimer,,,maischberger,,The European,Journalismus
139,maischberger am 10.04.2024,2024-04-10,Wie wehrhaft ist unsere Demokratie? Im Studio die Bundestagspräsidentin (SPD). Streit über Bürgergeld und Kindergrundsicherung: Es diskutieren die wirtschaftspolitische Sprecherin der Unions-Fraktion im Deutschen Bundestag (CDU) und der Vizefraktionsvorsitzende von B‘90/Die Grünen . Es kommentieren der TV-Moderator die Leiterin des ARD-Hauptstadtstudios und der Verleger von The European .,,75,Bärbel Bas,,,maischberger,SPD,,Politik
140,maischberger am 10.04.2024,2024-04-10,Wie wehrhaft ist unsere Demokratie? Im Studio die Bundestagspräsidentin (SPD). Streit über Bürgergeld und Kindergrundsicherung: Es diskutieren die wirtschaftspolitische Sprecherin der Unions-Fraktion im Deutschen Bundestag (CDU) und der Vizefraktionsvorsitzende von B‘90/Die Grünen . Es kommentieren der TV-Moderator die Leiterin des ARD-Hauptstadtstudios und der Verleger von The European .,,75,Tina Hassel,,,maischberger,,,
141,maischberger am 17.04.2024,2024-04-17,Welche Rolle spielt Deutschland bei der Verteidigung der Ukraine? Im Studio die Vorsitzende der SPD-Grundwertekommission und der Außenpolitiker (CDU). Wie abhängig ist die deutsche Wirtschaft von China? Im Gespräch der ehemalige Spitzenmanager Es kommentieren: Der Schauspieler die Welt-Journalistin und der stellvertretene Leiter des ARD-Hauptstadtstudios,,75,Roderich Kiesewetter,,,maischberger,CDU,,Politik
142,maischberger am 17.04.2024,2024-04-17,Welche Rolle spielt Deutschland bei der Verteidigung der Ukraine? Im Studio die Vorsitzende der SPD-Grundwertekommission und der Außenpolitiker (CDU). Wie abhängig ist die deutsche Wirtschaft von China? Im Gespräch der ehemalige Spitzenmanager Es kommentieren: Der Schauspieler die Welt-Journalistin und der stellvertretene Leiter des ARD-Hauptstadtstudios,,75,Hannah Bethke,,,maischberger,,Welt,Journalismus
143,maischberger am 17.04.2024,2024-04-17,Welche Rolle spielt Deutschland bei der Verteidigung der Ukraine? Im Studio die Vorsitzende der SPD-Grundwertekommission und der Außenpolitiker (CDU). Wie abhängig ist die deutsche Wirtschaft von China? Im Gespräch der ehemalige Spitzenmanager Es kommentieren: Der Schauspieler die Welt-Journalistin und der stellvertretene Leiter des ARD-Hauptstadtstudios,,75,Heinrich von Pierer,,,maischberger,,,Wirtschaft
144,maischberger am 17.04.2024,2024-04-17,Welche Rolle spielt Deutschland bei der Verteidigung der Ukraine? Im Studio die Vorsitzende der SPD-Grundwertekommission und der Außenpolitiker (CDU). Wie abhängig ist die deutsche Wirtschaft von China? Im Gespräch der ehemalige Spitzenmanager Es kommentieren: Der Schauspieler die Welt-Journalistin und der stellvertretene Leiter des ARD-Hauptstadtstudios,,75,Gesine Schwan,,,maischberger,,,
145,maischberger am 17.04.2024,2024-04-17,Welche Rolle spielt Deutschland bei der Verteidigung der Ukraine? Im Studio die Vorsitzende der SPD-Grundwertekommission und der Außenpolitiker (CDU). Wie abhängig ist die deutsche Wirtschaft von China? Im Gespräch der ehemalige Spitzenmanager Es kommentieren: Der Schauspieler die Welt-Journalistin und der stellvertretene Leiter des ARD-Hauptstadtstudios,,75,Hannes Jaenicke,,,maischberger,,,Kultur
146,maischberger am 17.04.2024,2024-04-17,Welche Rolle spielt Deutschland bei der Verteidigung der Ukraine? Im Studio die Vorsitzende der SPD-Grundwertekommission und der Außenpolitiker (CDU). Wie abhängig ist die deutsche Wirtschaft von China? Im Gespräch der ehemalige Spitzenmanager Es kommentieren: Der Schauspieler die Welt-Journalistin und der stellvertretene Leiter des ARD-Hauptstadtstudios,,75,Matthias Deiß,,,maischberger,,,
147,maischberger am 10.12.2024,2024-12-10,"Parteien im Wahlkampf: Worin unterscheiden sich CDU und AfD? Es diskutieren der Generalsekretär der CDU Mecklenburg-Vorpommern Philipp Amthor und die stellvertretende Fraktionsvorsitzende der AfD-Bundestagsfraktion Beatrix von Storch. Umsturz in Syrien: Welche Folgen hat das Ende der Assad-Diktatur? Im Gespräch die Nahost-Expertin Kristin Helberg. 50 Jahre auf der Bühne: Wie blickt er auf das politische Personal? Im Studio der Kabarettist und Autor Mathias Richling. Es diskutieren der ehemalige Tagesthemen-Moderator und Autor Ulrich Wickert, die Hauptstadtkorrespondentin des Deutschlandfunks Katharina Hamberger und der Verleger von The European Wolfram Weimer.",,75,Mathias Richling,,,maischberger,,,
148,maischberger am 10.12.2024,2024-12-10,"Parteien im Wahlkampf: Worin unterscheiden sich CDU und AfD? Es diskutieren der Generalsekretär der CDU Mecklenburg-Vorpommern Philipp Amthor und die stellvertretende Fraktionsvorsitzende der AfD-Bundestagsfraktion Beatrix von Storch. Umsturz in Syrien: Welche Folgen hat das Ende der Assad-Diktatur? Im Gespräch die Nahost-Expertin Kristin Helberg. 50 Jahre auf der Bühne: Wie blickt er auf das politische Personal? Im Studio der Kabarettist und Autor Mathias Richling. Es diskutieren der ehemalige Tagesthemen-Moderator und Autor Ulrich Wickert, die Hauptstadtkorrespondentin des Deutschlandfunks Katharina Hamberger und der Verleger von The European Wolfram Weimer.",,75,Kristin Helberg,,,maischberger,,,Internationales
149,maischberger am 10.12.2024,2024-12-10,"Parteien im Wahlkampf: Worin unterscheiden sich CDU und AfD? Es diskutieren der Generalsekretär der CDU Mecklenburg-Vorpommern Philipp Amthor und die stellvertretende Fraktionsvorsitzende der AfD-Bundestagsfraktion Beatrix von Storch. Umsturz in Syrien: Welche Folgen hat das Ende der Assad-Diktatur? Im Gespräch die Nahost-Expertin Kristin Helberg. 50 Jahre auf der Bühne: Wie blickt er auf das politische Personal? Im Studio der Kabarettist und Autor Mathias Richling. Es diskutieren der ehemalige Tagesthemen-Moderator und Autor Ulrich Wickert, die Hauptstadtkorrespondentin des Deutschlandfunks Katharina Hamberger und der Verleger von The European Wolfram Weimer.",,75,Katharina Hamberger,,,maischberger,,,
150,maischberger am 10.12.2024,2024-12-10,"Parteien im Wahlkampf: Worin unterscheiden sich CDU und AfD? Es diskutieren der Generalsekretär der CDU Mecklenburg-Vorpommern Philipp Amthor und die stellvertretende Fraktionsvorsitzende der AfD-Bundestagsfraktion Beatrix von Storch. Umsturz in Syrien: Welche Folgen hat das Ende der Assad-Diktatur? Im Gespräch die Nahost-Expertin Kristin Helberg. 50 Jahre auf der Bühne: Wie blickt er auf das politische Personal? Im Studio der Kabarettist und Autor Mathias Richling. Es diskutieren der ehemalige Tagesthemen-Moderator und Autor Ulrich Wickert, die Hauptstadtkorrespondentin des Deutschlandfunks Katharina Hamberger und der Verleger von The European Wolfram Weimer.",,75,Philipp Amthor,,,maischberger,CDU,,Politik
151,maischberger am 10.12.2024,2024-12-10,"Parteien im Wahlkampf: Worin unterscheiden sich CDU und AfD? Es diskutieren der Generalsekretär der CDU Mecklenburg-Vorpommern Philipp Amthor und die stellvertretende Fraktionsvorsitzende der AfD-Bundestagsfraktion Beatrix von Storch. Umsturz in Syrien: Welche Folgen hat das Ende der Assad-Diktatur? Im Gespräch die Nahost-Expertin Kristin Helberg. 50 Jahre auf der Bühne: Wie blickt er auf das politische Personal? Im Studio der Kabarettist und Autor Mathias Richling. Es diskutieren der ehemalige Tagesthemen-Moderator und Autor Ulrich Wickert, die Hauptstadtkorrespondentin des Deutschlandfunks Katharina Hamberger und der Verleger von The European Wolfram Weimer.",,75,Wolfram Weimer,,,maischberger,,The European,Journalismus
152,maischberger am 10.12.2024,2024-12-10,"Parteien im Wahlkampf: Worin unterscheiden sich CDU und AfD? Es diskutieren der Generalsekretär der CDU Mecklenburg-Vorpommern Philipp Amthor und die stellvertretende Fraktionsvorsitzende der AfD-Bundestagsfraktion Beatrix von Storch. Umsturz in Syrien: Welche Folgen hat das Ende der Assad-Diktatur? Im Gespräch die Nahost-Expertin Kristin Helberg. 50 Jahre auf der Bühne: Wie blickt er auf das politische Personal? Im Studio der Kabarettist und Autor Mathias Richling. Es diskutieren der ehemalige Tagesthemen-Moderator und Autor Ulrich Wickert, die Hauptstadtkorrespondentin des Deutschlandfunks Katharina Hamberger und der Verleger von The European Wolfram Weimer.",,75,Ulrich Wickert,,,maischberger,,,
153,maischberger am 10.12.2024,2024-12-10,"Parteien im Wahlkampf: Worin unterscheiden sich CDU und AfD? Es diskutieren der Generalsekretär der CDU Mecklenburg-Vorpommern Philipp Amthor und die stellvertretende Fraktionsvorsitzende der AfD-Bundestagsfraktion Beatrix von Storch. Umsturz in Syrien: Welche Folgen hat das Ende der Assad-Diktatur? Im Gespräch die Nahost-Expertin Kristin Helberg. 50 Jahre auf der Bühne: Wie blickt er auf das politische Personal? Im Studio der Kabarettist und Autor Mathias Richling. Es diskutieren der ehemalige Tagesthemen-Moderator und Autor Ulrich Wickert, die Hauptstadtkorrespondentin des Deutschlandfunks Katharina Hamberger und der Verleger von The European Wolfram Weimer.",,75,Beatrix von Storch,,,maischberger,AfD,,Politik
154,maischberger am 28.05.2024,2024-05-28,"Wann fährt die Bahn wieder pünktlich? Wie gelingt die Verkehrswende? Im Studio der Bundesminister für Digitales und Verkehr Volker Wissing (FDP). Russlands Offensive in der Ukraine und die Rolle Deutschlands in Europa: Im Gespräch der ehemalige Bundesaußenminister und SPD-Parteivorsitzende Sigmar Gabriel und – zugeschaltet – der Bürgermeister von Kiew Vitali Klitschko. Es kommentieren: Die Leiterin des ARD-Hauptstadtstudios Tina Hassel, der Chefredakteur des Stern Gregor Peter Schmitz und die Autorin der Neuen Zürcher Zeitung Susanne Gaschke. „maischberger“ ist eine Gemeinschaftsproduktion der ARD, hergestellt vom WDR in Zusammenarbeit mit Vincent productions GmbH.",,75,Volker Wissing,,,maischberger,FDP,,Politik
155,maischberger am 28.05.2024,2024-05-28,"Wann fährt die Bahn wieder pünktlich? Wie gelingt die Verkehrswende? Im Studio der Bundesminister für Digitales und Verkehr Volker Wissing (FDP). Russlands Offensive in der Ukraine und die Rolle Deutschlands in Europa: Im Gespräch der ehemalige Bundesaußenminister und SPD-Parteivorsitzende Sigmar Gabriel und – zugeschaltet – der Bürgermeister von Kiew Vitali Klitschko. Es kommentieren: Die Leiterin des ARD-Hauptstadtstudios Tina Hassel, der Chefredakteur des Stern Gregor Peter Schmitz und die Autorin der Neuen Zürcher Zeitung Susanne Gaschke. „maischberger“ ist eine Gemeinschaftsproduktion der ARD, hergestellt vom WDR in Zusammenarbeit mit Vincent productions GmbH.",,75,Susanne Gaschke,,,maischberger,,NZZ,Journalismus
156,maischberger am 28.05.2024,2024-05-28,"Wann fährt die Bahn wieder pünktlich? Wie gelingt die Verkehrswende? Im Studio der Bundesminister für Digitales und Verkehr Volker Wissing (FDP). Russlands Offensive in der Ukraine und die Rolle Deutschlands in Europa: Im Gespräch der ehemalige Bundesaußenminister und SPD-Parteivorsitzende Sigmar Gabriel und – zugeschaltet – der Bürgermeister von Kiew Vitali Klitschko. Es kommentieren: Die Leiterin des ARD-Hauptstadtstudios Tina Hassel, der Chefredakteur des Stern Gregor Peter Schmitz und die Autorin der Neuen Zürcher Zeitung Susanne Gaschke. „maischberger“ ist eine Gemeinschaftsproduktion der ARD, hergestellt vom WDR in Zusammenarbeit mit Vincent productions GmbH.",,75,Sigmar Gabriel,,,maischberger,SPD,,Politik
157,maischberger am 28.05.2024,2024-05-28,"Wann fährt die Bahn wieder pünktlich? Wie gelingt die Verkehrswende? Im Studio der Bundesminister für Digitales und Verkehr Volker Wissing (FDP). Russlands Offensive in der Ukraine und die Rolle Deutschlands in Europa: Im Gespräch der ehemalige Bundesaußenminister und SPD-Parteivorsitzende Sigmar Gabriel und – zugeschaltet – der Bürgermeister von Kiew Vitali Klitschko. Es kommentieren: Die Leiterin des ARD-Hauptstadtstudios Tina Hassel, der Chefredakteur des Stern Gregor Peter Schmitz und die Autorin der Neuen Zürcher Zeitung Susanne Gaschke. „maischberger“ ist eine Gemeinschaftsproduktion der ARD, hergestellt vom WDR in Zusammenarbeit mit Vincent productions GmbH.",,75,Gregor Peter Schmitz,,,maischberger,,Stern,Journalismus
158,maischberger am 28.05.2024,2024-05-28,"Wann fährt die Bahn wieder pünktlich? Wie gelingt die Verkehrswende? Im Studio der Bundesminister für Digitales und Verkehr Volker Wissing (FDP). Russlands Offensive in der Ukraine und die Rolle Deutschlands in Europa: Im Gespräch der ehemalige Bundesaußenminister und SPD-Parteivorsitzende Sigmar Gabriel und – zugeschaltet – der Bürgermeister von Kiew Vitali Klitschko. Es kommentieren: Die Leiterin des ARD-Hauptstadtstudios Tina Hassel, der Chefredakteur des Stern Gregor Peter Schmitz und die Autorin der Neuen Zürcher Zeitung Susanne Gaschke. „maischberger“ ist eine Gemeinschaftsproduktion der ARD, hergestellt vom WDR in Zusammenarbeit mit Vincent productions GmbH.",,75,Vitali Klitschko,,,maischberger,,,Internationales
159,maischberger am 28.05.2024,2024-05-28,"Wann fährt die Bahn wieder pünktlich? Wie gelingt die Verkehrswende? Im Studio der Bundesminister für Digitales und Verkehr Volker Wissing (FDP). Russlands Offensive in der Ukraine und die Rolle Deutschlands in Europa: Im Gespräch der ehemalige Bundesaußenminister und SPD-Parteivorsitzende Sigmar Gabriel und – zugeschaltet – der Bürgermeister von Kiew Vitali Klitschko. Es kommentieren: Die Leiterin des ARD-Hauptstadtstudios Tina Hassel, der Chefredakteur des Stern Gregor Peter Schmitz und die Autorin der Neuen Zürcher Zeitung Susanne Gaschke. „maischberger“ ist eine Gemeinschaftsproduktion der ARD, hergestellt vom WDR in Zusammenarbeit mit Vincent productions GmbH.",,75,Tina Hassel,,,maischberger,,,
160,maischberger am 12.10.2022,2022-10-12,"Sie ist die Ikone der weltweiten Klimabewegung. Mit 15 Jahren begann sie in Stockholm für mehr Klimaschutz zu streiken. Nun plädiert sie dafür, dass Deutschland seine Atomkraftwerke länger laufen lässt: ""Wenn sie schon laufen, glaube ich, dass es ein Fehler wäre, sie abzuschalten und sich der Kohle zuzuwenden"", sagt die mittlerweile 19-jährige im persönlichen Interview. ""Das Klima-Buch"" von Greta Thunberg erscheint am 27. Oktober 2022. Seit die FDP in der Ampel mitregiert, hat die Partei vier Wahlschlappen eingesteckt. Zuletzt verpasste sie in Niedersachsen den Einzug ins Parlament. Von ehemaligen Stammwählern verschmäht und in der Ampel unter Druck: Wie sehr schadet das Mitregieren im Bund den Liberalen? Fragen an den stellvertretenden Parteivorsitzenden . Es erklären, kommentieren und diskutieren der Leiter des ZDF-Hauptstadtstudios die funk-Moderatorin und Journalistin und der Berlin-Korrespondent der Neuen Zürcher Zeitung",,75,Wolfgang Kubicki,,,maischberger,FDP,,Politik
161,maischberger am 12.10.2022,2022-10-12,"Sie ist die Ikone der weltweiten Klimabewegung. Mit 15 Jahren begann sie in Stockholm für mehr Klimaschutz zu streiken. Nun plädiert sie dafür, dass Deutschland seine Atomkraftwerke länger laufen lässt: ""Wenn sie schon laufen, glaube ich, dass es ein Fehler wäre, sie abzuschalten und sich der Kohle zuzuwenden"", sagt die mittlerweile 19-jährige im persönlichen Interview. ""Das Klima-Buch"" von Greta Thunberg erscheint am 27. Oktober 2022. Seit die FDP in der Ampel mitregiert, hat die Partei vier Wahlschlappen eingesteckt. Zuletzt verpasste sie in Niedersachsen den Einzug ins Parlament. Von ehemaligen Stammwählern verschmäht und in der Ampel unter Druck: Wie sehr schadet das Mitregieren im Bund den Liberalen? Fragen an den stellvertretenden Parteivorsitzenden . Es erklären, kommentieren und diskutieren der Leiter des ZDF-Hauptstadtstudios die funk-Moderatorin und Journalistin und der Berlin-Korrespondent der Neuen Zürcher Zeitung",,75,Alexander Kissler,,,maischberger,,,
162,maischberger am 12.10.2022,2022-10-12,"Sie ist die Ikone der weltweiten Klimabewegung. Mit 15 Jahren begann sie in Stockholm für mehr Klimaschutz zu streiken. Nun plädiert sie dafür, dass Deutschland seine Atomkraftwerke länger laufen lässt: ""Wenn sie schon laufen, glaube ich, dass es ein Fehler wäre, sie abzuschalten und sich der Kohle zuzuwenden"", sagt die mittlerweile 19-jährige im persönlichen Interview. ""Das Klima-Buch"" von Greta Thunberg erscheint am 27. Oktober 2022. Seit die FDP in der Ampel mitregiert, hat die Partei vier Wahlschlappen eingesteckt. Zuletzt verpasste sie in Niedersachsen den Einzug ins Parlament. Von ehemaligen Stammwählern verschmäht und in der Ampel unter Druck: Wie sehr schadet das Mitregieren im Bund den Liberalen? Fragen an den stellvertretenden Parteivorsitzenden . Es erklären, kommentieren und diskutieren der Leiter des ZDF-Hauptstadtstudios die funk-Moderatorin und Journalistin und der Berlin-Korrespondent der Neuen Zürcher Zeitung",,75,Theo Koll,,,maischberger,,ZDF,Journalismus
163,maischberger am 12.10.2022,2022-10-12,"Sie ist die Ikone der weltweiten Klimabewegung. Mit 15 Jahren begann sie in Stockholm für mehr Klimaschutz zu streiken. Nun plädiert sie dafür, dass Deutschland seine Atomkraftwerke länger laufen lässt: ""Wenn sie schon laufen, glaube ich, dass es ein Fehler wäre, sie abzuschalten und sich der Kohle zuzuwenden"", sagt die mittlerweile 19-jährige im persönlichen Interview. ""Das Klima-Buch"" von Greta Thunberg erscheint am 27. Oktober 2022. Seit die FDP in der Ampel mitregiert, hat die Partei vier Wahlschlappen eingesteckt. Zuletzt verpasste sie in Niedersachsen den Einzug ins Parlament. Von ehemaligen Stammwählern verschmäht und in der Ampel unter Druck: Wie sehr schadet das Mitregieren im Bund den Liberalen? Fragen an den stellvertretenden Parteivorsitzenden . Es erklären, kommentieren und diskutieren der Leiter des ZDF-Hauptstadtstudios die funk-Moderatorin und Journalistin und der Berlin-Korrespondent der Neuen Zürcher Zeitung",,75,Eva Schulz,,,maischberger,,,
164,maischberger am 29.05.2024,2024-05-29,"Debatte um Einsatz westlicher Waffen in Russland: Darüber diskutieren der CDU-Außenpolitiker Norbert Röttgen und Amira Mohamed Ali, Vorsitzende des Bündnis Sahra Wagenknecht (BSW). Schwächelnde Wirtschaft und Umgang mit der AfD: Im Gespräch der langjährige BDI-Präsident und frühere Vize-Chef der AfD Hans-Olaf Henkel. Es kommentieren: Der Journalist und Moderator Cherno Jobatey, die Autorin und Stern-Kolumnistin Jagoda Marinić und der Chefredakteur von Table.Briefings Michael Bröcker. „maischberger“ ist eine Gemeinschaftsproduktion der ARD, hergestellt vom WDR in Zusammenarbeit mit Vincent productions GmbH.",,75,Amira Mohamed Ali,,,maischberger,BSW,,Politik
165,maischberger am 29.05.2024,2024-05-29,"Debatte um Einsatz westlicher Waffen in Russland: Darüber diskutieren der CDU-Außenpolitiker Norbert Röttgen und Amira Mohamed Ali, Vorsitzende des Bündnis Sahra Wagenknecht (BSW). Schwächelnde Wirtschaft und Umgang mit der AfD: Im Gespräch der langjährige BDI-Präsident und frühere Vize-Chef der AfD Hans-Olaf Henkel. Es kommentieren: Der Journalist und Moderator Cherno Jobatey, die Autorin und Stern-Kolumnistin Jagoda Marinić und der Chefredakteur von Table.Briefings Michael Bröcker. „maischberger“ ist eine Gemeinschaftsproduktion der ARD, hergestellt vom WDR in Zusammenarbeit mit Vincent productions GmbH.",,75,Jagoda Marinić,,,maischberger,,,
166,maischberger am 29.05.2024,2024-05-29,"Debatte um Einsatz westlicher Waffen in Russland: Darüber diskutieren der CDU-Außenpolitiker Norbert Röttgen und Amira Mohamed Ali, Vorsitzende des Bündnis Sahra Wagenknecht (BSW). Schwächelnde Wirtschaft und Umgang mit der AfD: Im Gespräch der langjährige BDI-Präsident und frühere Vize-Chef der AfD Hans-Olaf Henkel. Es kommentieren: Der Journalist und Moderator Cherno Jobatey, die Autorin und Stern-Kolumnistin Jagoda Marinić und der Chefredakteur von Table.Briefings Michael Bröcker. „maischberger“ ist eine Gemeinschaftsproduktion der ARD, hergestellt vom WDR in Zusammenarbeit mit Vincent productions GmbH.",,75,Michael Bröcker,,,maischberger,,Table.Media,Journalismus
